job_field_id,title,company,description
5,NATURAL RESOURCES PROGRAM TECHNICIAN,Arkansas Game & Fish Commission,"Knowledge of agricultural methods and basic land laws. Conducts agricultural and forest management activities on wildlife management areas, including preparing..."
15,Lobby Concierge,Beach Activities of Maui,"The Concierge is knowledgeable about the local area and is the expert on the attractions, tours and activities that we sell.Must be flexible with scheduling and..."
7,Administrative Law Judge,New Mexico State Personnel Office,"Administrative Law Judge, Adjudicator Advanced. This position will conduct administrative hearings on behalf of the State Personnel Board concerning..."
19,Drywall Hanger/Installer,EncoreHR Staffing,"Includes lathers who fasten wooden, metal, or rockboard lath to walls, ceilings or partitions of buildings to provide support base for plaster, fire-proofing,..."
23,"Analyst, Operations",General Dynamics Information Technology,Extended Air Defense Simulation (EADSIM). Battle Command Sustainment Support System (BCS3). Air and Missile Defense Work Station (AMDWS)....
4,Mid-Level Ground Control Station Engineer,GENERAL ATOMICS,Job ID# 6452BR Company General Atomics Aeronautical Systems Title Mid-Level Ground Control Station Engineer Job Category Engineering City San Diego State...
2,Cost Accountant III,Weatherford,JOB DESCRIPTION JOB SCOPE: This position will be responsible for the day to day understanding of the plant’s financial performance. The position will also be
12,Transportation Security Officer (TSO),Trinity Technology Group,TSOs must take the computerized Screener Assessment Battery. Repeatedly lift and carry baggage weighing up to 70 pounds…
17,Telephone Operator,The Broadmoor,"Monitors 911 Alert System. Operates the switchboard to relay incoming, outgoing, and interoffice calls by performing the following duties:...."
9,Graphic Artist,IGT,"Maya, Autodesk 3D Studio Max). This position is the development and timely delivery of high quality 2D and 3D game...."
6,Senior Addiction Counselor,NYC Health + Hospitals,The Senior Addiction Counselor will be responsible for assisting the consumer with activities relevant to an individual's rehabilitation goals....
21,Production Operator - 2nd shift,Bostik Inc.,About Bostik - Smart Adhesives. As a production operator at Bostik you will be in a batch making/mixer operator position for a competitive manufacturing...
8,Tutor or Teacher - Elementary Math,,"We are looking for math tutoring for our 4th grader. Improve grades, get ahead and increase confidence. Elementary math Tutoring &amp; Teaching opportunities..."
11,2 Med/Peds Certified Nursing Assistant,Riverside Medical Center,Reports changes in patients' condition to the professional nurse. The 2 Med/Peds Certified Nursing Assitant (CNA) assists with the care of patients ranging from...
20,HVAC Installer/Technician,Express Air Sytems,Basic knowledge of standard code requirements of air conditioning systems. \*\*\*\*\*Minimum requirements for Installers\*\*\*\*\*....
3,Data Scientist,Humana,"Bachelor’s Degree in Mathematics, Computer Science, Actuarial Science or related field. Collaborate with other professionals including Actuaries, Mathematicians..."
10,Anesthesiologist,"UF, Department of Anesthesiology","Department anesthesiologists practice at UF Health hospitals in Gainesville, FL at the University of Florida alongside 62 faculty anesthesiologists, 78..."
1,Regional Marketing Manager,Vishay,Develops a formal marketing plan outlining an appropriate marketing strategy for selling to key accounts. Coordinates the marketing efforts for a product group....
22,Air Traffic Control Operator,National Guard,The skills you learn as an Air Traffic Control Operator will qualify you to work in civilian air traffic control towers and centers at airports and airfields....
16,Digital Sales Account Executive,The Morning Call Media Group,"Manages advertising sales revenue and account management targets. Our digital sales account executives are responsible for selling advertising banners, programs..."
13,Kitchen Cook,SMG World - Tucson Convention Center,Banquet facility preparing meals for large events:. Fulfilling the service per each Banquet Event Orders (BEO)....
14,Janitor - Cleaning Technician - FULL TIME - 84095,Wingfoot Services,"Janitorial, janitor, cleaning specialist, carpet cleaning, floor care technician, buffing, part time, supplemental income, laborers, landscaping, supervisor,..."
18,Agricultural & Standards Inspector - I,Placer County,"Recruitments for Agricultural and Standards Inspector I, Agricultural and Standards Inspector II, and Agricultural and Standards Inspector, Senior are being..."
13,Bartender - Toms River Chili's,Chili's,"You know how to manage the back bar. Providing an enjoyable bar experience for every Guest. A duck walks into a bar and – oh, wait...."
15,Funeral Attendant,Service Corporation International,"The Funeral Attendant will set-up and assist with viewings, funeral services, memorial services, etc. Performs a variety of tasks during funerals and..."
12,AIRPORT SECURITY SCREENER,Covenant Services Worldwide,Security Screeners are responsible for day-to-day security screening of airport employees and other individuals passing through Screening Locations....
2,Seasonal Tax Preparer,Jackson Hewitt,"Jackson Hewitt is seeking a seasonal Tax Preparer to perform a variety of activities related to income tax preparation, sales and the delivery of excellent..."
5,Environmental Specialist I,PeopleFirst Florida HR,"ENVIRONMENTAL SCIENTISTS AND SPECIALISTS, INCLUDING HEALTH. Knowledge of plant and animal living tissue, cells, organisms, and entities, including their..."
21,Product Manager,"Specialty Resources, Inc.","(SRI) is a global sourcing and inventory management company for precision components &amp; specialty products such as precision machined components, stampings,..."
14,Greenskeeper,Heritage Palms Golf Club,*Summary* Assists in a general range of activities involved in golf course maintenance and construction. The individual should be able to perform semi-skilled
23,Flight Support,U.S. Navy,"Operate and maintain hydraulic and steam catapults to launch aircraft. As an Officer, you can expect to:. Instead, she refuels fighter jets on aircraft carriers..."
4,RET Engineer,Intel,"Scanning Electron Microscopy, Atomic Force Microscopy, etc.). The RET Design Engineer will deliver test masks, test patterns, sampling strategies, process..."
5,Chemistry Technician - Life Sciences,Xylem,"Xylem’s analytics businesses are leading manufacturers of premium field, portable, laboratory and online analytical instruments used in water and wastewater,..."
21,Sewing Machine Operator,"DI, LLC","This individual will operate machines that are either single or double needle, perform blind stitch, serge, or other specialized operations...."
10,Cardiology Test Nurse,Lifespan,Conforms to the Code of Professional Nurses. Graduate from an accredited School of Nursing with current license to practice as a Registered Nurse in the State...
22,Transportation Helper,United Airlines,"Now taking off: Your career Where do you want your career to take you? Chances are you can get there with United Airlines. Our environment is open, honest,..."
11,Physical Therapist or Physical Therapy Assistant,Accelerated Rehabilitation Centers,Athletico is looking for a dedicated and compassionate Physical Therapist Assistant to provide a hands-on approach to rehabilitation....
14,Housekeeping/Laundry Aide,Safire Care,"Description Position: Housekeeping/Laundry Aide Hours: FT, PT Available Shift: Day and Evening Shifts Sheridan Manor provides a range of services,"
10,Staff Nurse,South Shore Medical Center,Provide quality care to South Shore Medical Center patients. Administer prescribed medications and treatments. Prepare patient for office visit. Respond to
19,Construction Laborer,Austin Materials,Summary/Objective The construction laborer performs tasks involving physical labor at highway and heavy construction projects....
22,Flight Attendant,Compass Airlines,Flight Attendant - LAX. One year previous flight attendant experience preferred The Flight Attendant will demonstrate the Compass Airlines' core values and…
14,Residential Lawn Specialist 100889,TruGreen,As a Lawn Specialist with the #1 lawn care company you will be providing regularly scheduled landscape services within your route on a daily basis....
16,Sales Representative,Cantium Sports,ADVERTISING SALES - Connect Golf Courses &amp Local Businesses*. NO Florida state sales tax!*. Manage ad space &amp cost to meet sales goal*.…
18,Lead Fish Technician,Hubbs-SeaWorld Research Institute,Hatchery building is a damp environment. Stay current with latest technologies related to fish rearing. Assist in all other aspects of fish husbandry as needed....
20,Service Technician (Mechanic),"Franklin Equipment, LLC","The individual will maintain and repair equipment offered by Franklin Equipment to include Construction and Agricultural (small equipment, aerial, dirt, farm,..."
21,Shop Assembly and Fabrication,Western Window Systems,*Western Window Systems* is one of the fastest growing and most successful Window Manufacturing Companies in the nation. *Overview* The Warehouse Shop
13,Food Service Worker,TrustHouse Service Group,"Such as tray line, dish room, cafeteria and storeroom. The Food Service Worker is responsible for routine food service tasks in the kitchen, cafeteria, dining..."
4,Architectural Drafter,Glen & Co Architecture,We are a dynamic architectural and design group working on hotels and restaurants looking for an architect who can prepare construction documents and...
8,Basic Skills/Learning Center Non-Credit Instructor,North Orange County Community College District,"Teach pre-college courses in class and lab settings including, but not limited to, adult basic education (ABE), career technical education, adult secondary..."
7,Legal Liaison,"Maricopa County, AZ",High School diploma or GED and two (2) years of clerical experience in a legal and/or law enforcement setting with knowledge in legal preparations and legal...
10,Medical Reviewer LPN,"Blue Cross Blue Shield of IL, MT, NM, OK & TX","3 years clinical experience in physician office, hospital or surgical setting. This position is responsible for pre-authorization reviews in accordance with the..."
19,Heavy Equipment Operator,,"Must operate loaders, trucks, rollers, backhoes, mowers, graders, and other. Loads and unloads sand, dirt, asphalt, rock, and other materials as needed;..."
6,Resident Camp Counselor,Busch Gardens Tampa,Provide guidance to campers keeping them on task and behaving appropriately. Must be at least 21 years old in order to drive camp rental vehicles....
23,Senior Analyst - Ground,Scientific Research Corporation,USA Warrant Officer MOS 140E - Air and Missile Defense Tactician / Technician. USA MOS Air Defense Artillery Officer with air operations center experience or....
4,Agricultural Engineer,Department Of Agriculture,"Or equivalent doctoral degree in Agricultural Engineering, Biological Engineering, or Agricultural and Biological Engineering...."
18,Farm Worker,Meadowview Farms,We are looking for an independent employee with leadership and problem solving skills for our grain and cattle operation....
2,Claims Auditor,Broadpath,Medical Claims Auditors perform routine and complex audits to identify inaccurate claims adjudication. Knowledge of claims and the ability to recognize patterns...
11,Personal Care Aide,Archangel Personal Home Care,Immediate needs for LIVE-IN aides located in Lackawanna County. Please call 570-507-9420 to schedule interviews....
7,Attorney Advisor (General),Department of the Air Force,"Constitutional, civil, criminal, labor law; Provides SME authoritative advisory, consultation, and collaboration in the areas of ethics, medical and physical..."
13,House Cook/Chef,Delta Zeta at Univ. of Northern Colorado,"Cook, Prep Cook, Chef, Line Cook, Nutritional Services, Cafeteria:. Responsible for preparing meals taking into consideration nutrition, food availability and..."
20,Auto Glass Installer,Luther Automotive,"At least 1 year of mobile auto glass experience required. Install windshields in shop and mobile, perform rock chip repairs and pull and reinstall glass for the..."
20,MAINTENANCE MECHANIC,United States Postal Service,"United States Postal Service External Publication for Job Posting 94976393 If this job requires qualification on an examination, the number of applicants who"
4,Project Engineer,"Vanir Construction Management, Inc.","Or, non-degree holders must possess 4+ years of experience in a construction, engineering or architectural related position...."
7,District Court Clerk II - O'ahu,Hawaii State Judiciary,Authors the official court record in a court of limited jurisdiction for District Court trial proceedings  Prepares documents ordered by the court
