job_field_id,title,company,description
8,Tutor or Teacher - Elementary Math,,"We are looking for math tutoring for our 4th grader. Improve grades, get ahead and increase confidence. Elementary math Tutoring &amp; Teaching opportunities..."
14,Janitor - Cleaning Technician - FULL TIME - 84095,Wingfoot Services,"Janitorial, janitor, cleaning specialist, carpet cleaning, floor care technician, buffing, part time, supplemental income, laborers, landscaping, supervisor,..."
19,Drywall Hanger/Installer,EncoreHR Staffing,"Includes lathers who fasten wooden, metal, or rockboard lath to walls, ceilings or partitions of buildings to provide support base for plaster, fire-proofing,..."
2,Cost Accountant III,Weatherford,JOB DESCRIPTION JOB SCOPE: This position will be responsible for the day to day understanding of the plant’s financial performance. The position will also be
12,Transportation Security Officer (TSO),Trinity Technology Group,TSOs must take the computerized Screener Assessment Battery. Repeatedly lift and carry baggage weighing up to 70 pounds…
7,Administrative Law Judge,New Mexico State Personnel Office,"Administrative Law Judge, Adjudicator Advanced. This position will conduct administrative hearings on behalf of the State Personnel Board concerning..."
22,Air Traffic Control Operator,National Guard,The skills you learn as an Air Traffic Control Operator will qualify you to work in civilian air traffic control towers and centers at airports and airfields....
5,NATURAL RESOURCES PROGRAM TECHNICIAN,Arkansas Game & Fish Commission,"Knowledge of agricultural methods and basic land laws. Conducts agricultural and forest management activities on wildlife management areas, including preparing..."
9,Graphic Artist,IGT,"Maya, Autodesk 3D Studio Max). This position is the development and timely delivery of high quality 2D and 3D game...."
10,Anesthesiologist,"UF, Department of Anesthesiology","Department anesthesiologists practice at UF Health hospitals in Gainesville, FL at the University of Florida alongside 62 faculty anesthesiologists, 78..."
3,Data Scientist,Humana,"Bachelor’s Degree in Mathematics, Computer Science, Actuarial Science or related field. Collaborate with other professionals including Actuaries, Mathematicians..."
23,"Analyst, Operations",General Dynamics Information Technology,Extended Air Defense Simulation (EADSIM). Battle Command Sustainment Support System (BCS3). Air and Missile Defense Work Station (AMDWS)....
1,Regional Marketing Manager,Vishay,Develops a formal marketing plan outlining an appropriate marketing strategy for selling to key accounts. Coordinates the marketing efforts for a product group....
16,Digital Sales Account Executive,The Morning Call Media Group,"Manages advertising sales revenue and account management targets. Our digital sales account executives are responsible for selling advertising banners, programs..."
11,2 Med/Peds Certified Nursing Assistant,Riverside Medical Center,Reports changes in patients' condition to the professional nurse. The 2 Med/Peds Certified Nursing Assitant (CNA) assists with the care of patients ranging from...
4,Mid-Level Ground Control Station Engineer,GENERAL ATOMICS,Job ID# 6452BR Company General Atomics Aeronautical Systems Title Mid-Level Ground Control Station Engineer Job Category Engineering City San Diego State...
17,Telephone Operator,The Broadmoor,"Monitors 911 Alert System. Operates the switchboard to relay incoming, outgoing, and interoffice calls by performing the following duties:...."
13,Kitchen Cook,SMG World - Tucson Convention Center,Banquet facility preparing meals for large events:. Fulfilling the service per each Banquet Event Orders (BEO)....
15,Lobby Concierge,Beach Activities of Maui,"The Concierge is knowledgeable about the local area and is the expert on the attractions, tours and activities that we sell.Must be flexible with scheduling and..."
6,Senior Addiction Counselor,NYC Health + Hospitals,The Senior Addiction Counselor will be responsible for assisting the consumer with activities relevant to an individual's rehabilitation goals....
18,Agricultural & Standards Inspector - I,Placer County,"Recruitments for Agricultural and Standards Inspector I, Agricultural and Standards Inspector II, and Agricultural and Standards Inspector, Senior are being..."
20,HVAC Installer/Technician,Express Air Sytems,Basic knowledge of standard code requirements of air conditioning systems. \*\*\*\*\*Minimum requirements for Installers\*\*\*\*\*....
21,Production Operator - 2nd shift,Bostik Inc.,About Bostik - Smart Adhesives. As a production operator at Bostik you will be in a batch making/mixer operator position for a competitive manufacturing...
4,Agricultural Engineer,Department Of Agriculture,"Or equivalent doctoral degree in Agricultural Engineering, Biological Engineering, or Agricultural and Biological Engineering...."
1,Marketing Science@Scale – Project Manager,Facebook,"The Marketing Science team is seeking a Project Manager who is passionate about making business operations, tools, and processes more efficient and effective...."
19,Construction Laborer,Austin Materials,Summary/Objective The construction laborer performs tasks involving physical labor at highway and heavy construction projects....
19,Industrial Electrician,Novelis,"Novelis Corporation, the global leader in rolled aluminum and can recycling, has an opportunity at its Fairmont, WV plant for an experienced Industrial..."
15,Valet Attendant: PT & FT- Lisle, Downers Grove,"HealthPark ValetEnjoy working in a social environment? A leader in parking services, HealthPark Hospitality provides its healthcare partners comprehensive parking solutions"
21,Shop Assembly and Fabrication,Western Window Systems,*Western Window Systems* is one of the fastest growing and most successful Window Manufacturing Companies in the nation. *Overview* The Warehouse Shop
1,University Gallery Events Manager,Rochester Institute of Technology,"Coordinate the University Gallery space for events and exhibits including the hours of operation, maintenance of University Gallery policies, supplies, and..."
18,Animal Agriculture Management Associate 2016,Cargill,"The Animal Agriculture Management Associate role enables the individual to become familiar with the workflow of animal agriculture operations, and to develop..."
1,General Manager - Chesapeake Energy Arena -SMG,SMG,"Manages subordinate Directors and Managers who supervise employees in the Finance, Marketing, Operations, Food &amp; Beverage Departments or other facility..."
21,Manufacturing Assembler,Manufacturing Supplier,Ideal candidates will have some mechanical aptitude for assembling plastic or metal parts by hand. Advantage Resourcing is currently seeking Manufacturing...
2,Claim Specialist,CCMSI,The Claim Representative is accountable for the quality of claim services as perceived by CCMSI clients and within our corporate claim standards....
8,Assistant Teaching Professor,Worcester Polytechnic Institute,"The Mathematical Sciences Department currently has 28 tenured/tenure-track faculty members, 9 postdoctoral scholars, 5 teaching professors and features a..."
21,Processing Operator I - 3rd Shift,"SOFTPATH SYSTEM LLC in Sturgis, MI",Processing Operator I - 3rd Shift. Production or manufacturing and machine or forklift experience:. Primary responsibility will be to support the Dry blending...
5,Veterinary Medical Officer,Department Of Agriculture,"Masters degree in an area of specialization, including but not limited to, animal science, avian medicine, food safety, infectious diseases, veterinary clinical..."
6,"Staff Therapist, Addictions Program",Chase Brexton Health Care,"Must have the ability to provide services that are relevant to the culture of the patient and their family. Provides a range of brief and longer-term, treatment..."
15,Dog Trainer / Apprentice,Petco,Our Dog Trainer Apprenticeship is a comprehensive training program to prepare you for the role of Dog Trainer in your store....
6,Elementary Counselor 846 (2016-2017),"Kansas City, MO School District","The elementary counselor is a member of the district’s guidance function, charged with providing a comprehensive guidance program for students in grades K-6...."
9,Play-by-Play Announcer,Pittsburgh Pirates,"This position is for a play-by-play announcer for the Pittsburgh Pirates. Plan, prepare, present and perform as a play-by-play announcer on Pirates television..."
23,Surface Warfare Officer (Nuclear Aircraft Carriers),U.S. Navy,"Managing shipboard vertical launch systems. For those going the Surface Warfare Officer (Nuclear) route, the first step is Officer Candidate School (OCS) – a 12..."
12,Firefighter-2016,City of Mesquite,"Possession of or ability to obtain certification/licensing as an Arson Investigator and Peace Officer, as assigned...."
15,Central Baggage Agent,Virgin America,O Perform Baggage. O Following proper guiding principles in order to compensate guests for any misplaced baggage....
7,Legal Liaison,"Maricopa County, AZ",High School diploma or GED and two (2) years of clerical experience in a legal and/or law enforcement setting with knowledge in legal preparations and legal...
15,Companion Care / Personal Care - Waukesha,"FirstLight Home Care, Brookfield, WI","Companion Care/ Home Health Aide*. In addition to providing a flexible schedule, we offer potential for advancement, award programs, and opportunity for..."
13,Food Service Attendant,Riverside Health System,"Formal training as a cook preferred. Performs duties related to therapeutic diets and meal services to include, aides in the preparation of preparation of hot..."
7,Attorney Advisor (General),Department of the Air Force,"Constitutional, civil, criminal, labor law; Provides SME authoritative advisory, consultation, and collaboration in the areas of ethics, medical and physical..."
8,7th & 8th Grade Social Studies Long Term Substitute Teacher,Willamette Leadership Academy,"We are looking for a dynamic and passionate social studies teacher to teach two periods of 8th grade US History, 2 periods of 7th grade Intro to Western..."
5,Animal Care Supervisor,University of Colorado,"Animal Facility, implementing the animal care procedures and policies. Care for a variety of species of small laboratory animals used by scientists...."
14,Maintenance Worker II - PUBLIC WORKS,City of Port Orange,Clean grounds and remove litter. Experience in operating automotive or maintenance equipment. Provide routine and basic maintenance and repair to small...
6,Staff Development Coordinator,Sayre Christain Village,"Conductscertification or training programs for Nursing Assistants. Frequentlycommunicates with employees, residents, family members, physicians etc...."
17,Front Desk Agent,Holiday Inn & Suites - Tulsa,At *Holiday Inn® Hotels* our job is to bring the joy of travel to everyone. That’s where you come in. When you’re part of the Holiday Inn Hotels brand you’re
18,Wood Mill Operator 2,The AMES Companies,"The Wood Mill Operator 2 works under supervision of foreman encompassing the skills of Equalizer, Paint Line Operator, Stacker and Inspector...."
19,Painter/Blaster,CTR Group,"CTR is currently seeking 1st class Painters Location - Pascagoula, MS Industry - Marine Responsibilities: • Perform blasting and painting utilizing marine"
3,"Network Deployment and Operations (NDO) Lead, Google Fiber, Midwest",Google,"Familiarity with other network transmission protocols and in-home network architecture. Ensure the best local network is designed, built, and maintained with..."
19,Fabricator/Welder Helper,Kooks Custom Headers Inc,Pass off parts to helper for grinding and straightening flanges. Receive parts back from helper for final assembly and inspection for quality control....
14,Greenskeeper,Heritage Palms Golf Club,*Summary* Assists in a general range of activities involved in golf course maintenance and construction. The individual should be able to perform semi-skilled
10,Staff Nurse,South Shore Medical Center,Provide quality care to South Shore Medical Center patients. Administer prescribed medications and treatments. Prepare patient for office visit. Respond to
19,Carpenter,Chicago Bridge & Iron Company,"Fits and nails sheathing on outer walls and roofs of buildings. Erects scaffolding for buildings and other structures and installs ladders, handrails, walkways,..."
6,Counselor (K-8),Grambling State University,Teach school developmental guidance curriculum to students. Plan school guidance and counseling programs to ensure that they meet identified needs....
18,Forestry Technician (Lookout),Department Of Agriculture,Workers Compensation Separation:. A career with the Forest Service will challenge you to manage and care for more than 193 million acres of our nation's most...
22,Freight Broker,Sunbreak Logistics,Supply Chain / Freight Brokerage:. A new logistics company is looking for a motivated and experienced freight broker to join and to grow in a great team....
1,"Senior Marketing Campaigns Manager, North America Hardware Marketing",Oracle,"Senior Marketing Campaigns Manager, North America Hardware Marketing. This will include demand generation, brand awareness, events, field marketing, web/online..."
