job_field_id,title,company,description
13,Kitchen Cook,SMG World - Tucson Convention Center,Banquet facility preparing meals for large events:. Fulfilling the service per each Banquet Event Orders (BEO)....
4,Mid-Level Ground Control Station Engineer,GENERAL ATOMICS,Job ID# 6452BR Company General Atomics Aeronautical Systems Title Mid-Level Ground Control Station Engineer Job Category Engineering City San Diego State...
11,2 Med/Peds Certified Nursing Assistant,Riverside Medical Center,Reports changes in patients' condition to the professional nurse. The 2 Med/Peds Certified Nursing Assitant (CNA) assists with the care of patients ranging from...
16,Digital Sales Account Executive,The Morning Call Media Group,"Manages advertising sales revenue and account management targets. Our digital sales account executives are responsible for selling advertising banners, programs..."
8,Tutor or Teacher - Elementary Math,,"We are looking for math tutoring for our 4th grader. Improve grades, get ahead and increase confidence. Elementary math Tutoring &amp; Teaching opportunities..."
20,HVAC Installer/Technician,Express Air Sytems,Basic knowledge of standard code requirements of air conditioning systems. \*\*\*\*\*Minimum requirements for Installers\*\*\*\*\*....
6,Senior Addiction Counselor,NYC Health + Hospitals,The Senior Addiction Counselor will be responsible for assisting the consumer with activities relevant to an individual's rehabilitation goals....
1,Regional Marketing Manager,Vishay,Develops a formal marketing plan outlining an appropriate marketing strategy for selling to key accounts. Coordinates the marketing efforts for a product group....
9,Graphic Artist,IGT,"Maya, Autodesk 3D Studio Max). This position is the development and timely delivery of high quality 2D and 3D game...."
10,Anesthesiologist,"UF, Department of Anesthesiology","Department anesthesiologists practice at UF Health hospitals in Gainesville, FL at the University of Florida alongside 62 faculty anesthesiologists, 78..."
15,Lobby Concierge,Beach Activities of Maui,"The Concierge is knowledgeable about the local area and is the expert on the attractions, tours and activities that we sell.Must be flexible with scheduling and..."
5,NATURAL RESOURCES PROGRAM TECHNICIAN,Arkansas Game & Fish Commission,"Knowledge of agricultural methods and basic land laws. Conducts agricultural and forest management activities on wildlife management areas, including preparing..."
18,Agricultural & Standards Inspector - I,Placer County,"Recruitments for Agricultural and Standards Inspector I, Agricultural and Standards Inspector II, and Agricultural and Standards Inspector, Senior are being..."
2,Cost Accountant III,Weatherford,JOB DESCRIPTION JOB SCOPE: This position will be responsible for the day to day understanding of the plant’s financial performance. The position will also be
19,Drywall Hanger/Installer,EncoreHR Staffing,"Includes lathers who fasten wooden, metal, or rockboard lath to walls, ceilings or partitions of buildings to provide support base for plaster, fire-proofing,..."
14,Janitor - Cleaning Technician - FULL TIME - 84095,Wingfoot Services,"Janitorial, janitor, cleaning specialist, carpet cleaning, floor care technician, buffing, part time, supplemental income, laborers, landscaping, supervisor,..."
17,Telephone Operator,The Broadmoor,"Monitors 911 Alert System. Operates the switchboard to relay incoming, outgoing, and interoffice calls by performing the following duties:...."
21,Production Operator - 2nd shift,Bostik Inc.,About Bostik - Smart Adhesives. As a production operator at Bostik you will be in a batch making/mixer operator position for a competitive manufacturing...
3,Data Scientist,Humana,"Bachelor’s Degree in Mathematics, Computer Science, Actuarial Science or related field. Collaborate with other professionals including Actuaries, Mathematicians..."
22,Air Traffic Control Operator,National Guard,The skills you learn as an Air Traffic Control Operator will qualify you to work in civilian air traffic control towers and centers at airports and airfields....
23,"Analyst, Operations",General Dynamics Information Technology,Extended Air Defense Simulation (EADSIM). Battle Command Sustainment Support System (BCS3). Air and Missile Defense Work Station (AMDWS)....
7,Administrative Law Judge,New Mexico State Personnel Office,"Administrative Law Judge, Adjudicator Advanced. This position will conduct administrative hearings on behalf of the State Personnel Board concerning..."
12,Transportation Security Officer (TSO),Trinity Technology Group,TSOs must take the computerized Screener Assessment Battery. Repeatedly lift and carry baggage weighing up to 70 pounds…
9,TV Line Producer,zulily,"This will include partnering with various production companies to create new scripts, select footage and music and hire freela nce voice over artists...."
9,Animator,National Center for Missing & Exploited Children (NCMEC),"The Animator is responsible for designing and developing 2D and 3D content for web, television, interactive and print projects...."
20,Mechanic Helper,Pace Bus,Qualified candidate must possess at least one (1) years previous diesel/gas experience and/or technical training and meet the criteria of Pace's Mechanic...
15,Fitness Instructors,Woodlake Swim and Racquet Club,"Woodlake Swim and Racquet Club is currently looking to hire certified Water aerobics, Pilates, Meditation, Tai Chi, and Les Mills instructors...."
6,Staff Development Coordinator,Sayre Christain Village,"Conductscertification or training programs for Nursing Assistants. Frequentlycommunicates with employees, residents, family members, physicians etc...."
2,Seasonal Tax Preparer,Jackson Hewitt,"Jackson Hewitt is seeking a seasonal Tax Preparer to perform a variety of activities related to income tax preparation, sales and the delivery of excellent..."
13,Banquet Chef/Line Cook,Golf Course North Houston,"Preferred Banquet experience but not required. All kitchen staff must be able to cook high-quality balanced meals, cook from scratch and maintain proper food..."
21,Shop Assembly and Fabrication,Western Window Systems,*Western Window Systems* is one of the fastest growing and most successful Window Manufacturing Companies in the nation. *Overview* The Warehouse Shop
18,Wood Mill Operator 2,The AMES Companies,"The Wood Mill Operator 2 works under supervision of foreman encompassing the skills of Equalizer, Paint Line Operator, Stacker and Inspector...."
22,Hiring CDL-A Drivers for L/P,Network 1,"No commercial transportation related felony, theft or larceny conviction. LEASE OPERATORS NEEDED NOW!!*...."
12,Security Operations Manager,Google,You believe that providing effective security doesn't come at the expense of customer service - you will be our bodyguard (and our long lost pal)....
21,Plastics Mold Maker,TERMAX CORPORATION,"Craft precision tools by studying specifications, engineering blueprints, tool orders, and shop data to make, alter, or repair tools, jigs, fixtures, molds, or..."
13,Bartender - Toms River Chili's,Chili's,"You know how to manage the back bar. Providing an enjoyable bar experience for every Guest. A duck walks into a bar and – oh, wait...."
13,Food Service Attendant,Riverside Health System,"Formal training as a cook preferred. Performs duties related to therapeutic diets and meal services to include, aides in the preparation of preparation of hot..."
17,Retail Banker/ Teller - Center,Woodforest National Bank,"WOODFOREST NATIONAL BANK. Performs opening, closing, and other branch servicing duties such as cash and vault balancing;..."
20,Service Technician (Mechanic),"Franklin Equipment, LLC","The individual will maintain and repair equipment offered by Franklin Equipment to include Construction and Agricultural (small equipment, aerial, dirt, farm,..."
20,MAINTENANCE MECHANIC,United States Postal Service,"United States Postal Service External Publication for Job Posting 94976393 If this job requires qualification on an examination, the number of applicants who"
20,"Automotive Body Repairer, Fiberglass/Welder",The Logistics Company,The Repairer applies and spreads body filler manually to reestablish surface. Two years related experience. The Automobile Body Repairer mixes polyester resin...
16,Sales Representative,Cantium Sports,ADVERTISING SALES - Connect Golf Courses &amp Local Businesses*. NO Florida state sales tax!*. Manage ad space &amp cost to meet sales goal*.…
11,Physical Therapy Aide,All Star Physical Therapy,Responsibilities include: setting up treatment areas cleaning up following treatment sessions aiding physical therapist during patient sessions Job Type:
8,Library Para Educator,Blue Valley School District,Attachment(s): job description Hourly Rate: $10.25 (PA/Col 3/01) Hours per Day: 7.5 (Monday - Friday) Days per Year: 200 (less than 12-month position)
16,Sales Associate/Cashier (part-time),Bed Bath & Beyond,Currently hiring part time sales / cashiers / stock associates and bridal consultants. All shifts available....
19,Industrial Electrician,Novelis,"Novelis Corporation, the global leader in rolled aluminum and can recycling, has an opportunity at its Fairmont, WV plant for an experienced Industrial..."
6,"Staff Therapist, Addictions Program",Chase Brexton Health Care,"Must have the ability to provide services that are relevant to the culture of the patient and their family. Provides a range of brief and longer-term, treatment..."
8,Assistant Teaching Professor,Worcester Polytechnic Institute,"The Mathematical Sciences Department currently has 28 tenured/tenure-track faculty members, 9 postdoctoral scholars, 5 teaching professors and features a..."
23,Field Artillery Officer (13A),U.S. Army,Job training for a field artillery officer requires completion of Basic Officer Leaders Course I &amp II and the Field Artillery Officer Basic Course.…
22,School Bus Driver -aftercare program,Lake Forest Park Montessori,"Part time aftercare/ bus driver:. If CDL required for vehicle driver, driver is subject to NLCI and state/federal policies, procedures and requirements..."
14,Maintenance Worker II - PUBLIC WORKS,City of Port Orange,Clean grounds and remove litter. Experience in operating automotive or maintenance equipment. Provide routine and basic maintenance and repair to small...
1,Program Manager of Operations,"Amazon Fulfillment Svcs, Inc","Advanced degree (MS,MBA) from an accredited university with focus on Industrial Engineering, Operations, Management, Economics, or related areas...."
2,Entry Level Quality Assurance Analyst,National Software Management,"*Entry Level Quality Assurance Analyst* Under direct supervision, the Quality Assurance Analyst verifies that software changes submitted by developers"
14,Housekeeping Tech,Brentwood Behavioral Health of Louisiana,"Patients, staff and visitors. The Housekeeping Tech will ensure. The maintenance of a clean, healthy, pleasant environment for...."
20,Master Mechanic / Technician Auto Repair,YourMechanic,Excellent customer service skills. Complete set of basic automotive tools. Earn up to $55/hr as a mobile mechanic*....
2,Claim Specialist,CCMSI,The Claim Representative is accountable for the quality of claim services as perceived by CCMSI clients and within our corporate claim standards....
12,AIRPORT SECURITY SCREENER,Covenant Services Worldwide,Security Screeners are responsible for day-to-day security screening of airport employees and other individuals passing through Screening Locations....
16,Rental Sales Agent,Sixt Rent a Car LLC,"The Rental Sales Agent is responsible for optimizing the rental experience by selling extras based on the customer’s needs, drafting rental agreements, and..."
9,Actor/Actress,Nine30 Media,"We are looking for actors to become a member of our marketing team. Our ideal candidates would have a strong portfolio, a heavy social media presence, and a..."
19,Plumber,Los Angeles Unified School District,A Los Angeles City Journeyman Plumber License OR a Los Angeles County Certificate of Registration as a Journeyman Plumber....
22,Flight Attendant,Compass Airlines,Flight Attendant - LAX. One year previous flight attendant experience preferred The Flight Attendant will demonstrate the Compass Airlines' core values and…
9,Audio/Video Installer,Wilshire Media Systems Inc,"Wilshire Media System’s is Southern California’s premier source for home theater, high performance audio, home automation and lighting control...."
19,Fabricator/Welder Helper,Kooks Custom Headers Inc,Pass off parts to helper for grinding and straightening flanges. Receive parts back from helper for final assembly and inspection for quality control....
11,DENTAL ASSISTANT,Department of Veterans Affairs,Dental Assistant/ Functional Statement. Sets up operatory for planned dental procedure and cleans dental unit for timely turnover....
