job_field_id,title,company,description
16,Customer Relations Representative,AmeriGas,"Make credit calls to delinquent customers and perform credit checks on new customers. Answers phone calls and responds to all customer inquiries including, but..."
20,Aquatic Scientist/Customer Service Manager,"Virginia Waters and Wetlands, Inc.",Required license or certification:. Valid driver’s license required. Commercial Herbicide Applicator License – Category 5A preferred• Arborist certificate - a...
13,Full Time Saute Cook,Claire's at the Depot Restaurant,"Must be able to execute recipes with consistency and accuracy in a busy kitchen. Claire's at the Depot, a fine dining restaurant located in Old Town Warrenton..."
16,Sales Representative,Cantium Sports,ADVERTISING SALES - Connect Golf Courses &amp Local Businesses*. NO Florida state sales tax!*. Manage ad space &amp cost to meet sales goal*.…
10,Medical Reviewer LPN,"Blue Cross Blue Shield of IL, MT, NM, OK & TX","3 years clinical experience in physician office, hospital or surgical setting. This position is responsible for pre-authorization reviews in accordance with the..."
22,"Traffic Control Specialist - Flagger - Warrenton, VA",Area Wide Protective,Must possess a valid driver's license and maintain an acceptable driving record by complying with standards established by AWP policy....
13,Full Time Cake Decorator-Northrock Shopping Center,Harris Teeter,"Technical Skills - Assesses own strengths and weaknesses; Answer telephones by saying &quot;Harris Teeter [store name], this is [name], may I help you?&quot;...."
23,Cavalry Scout,National Guard,"Cavalry Scout training never really stops, though. This enables the officer to make informed decisions. As a Cavalry Scout, you are the eyes and ears of the..."
13,"Host - 7982 - West Lee Highway - Warrenton, VA (Warrenton, VA)",Applebee's,Our Hosts greet and seat all arriving guests and acknowledge all departing guests in a friendly manner and assist in maintaining the overall guest flow of the...
4,Civil Engineer EI (Entry Level),Banning Engineering,"BS in Civil or Agricultural Engineering is required. Located in Plainfield, Indiana, Banning Engineering is a Civil Engineering and Surveying firm that offers a..."
5,Chemistry Technician - Life Sciences,Xylem,"Xylem’s analytics businesses are leading manufacturers of premium field, portable, laboratory and online analytical instruments used in water and wastewater,..."
3,Technology Support Specialist,City of Durham,"Database management experience; Maintains, administers, monitors, and supervises departmental software database and application; Monday-Friday 8 am - 4:30 pm;..."
20,Plant Maintenance Mechanic - Night Shift,Vulcan Materials Company," Diagnose problems and perform mechanical repair. Assists plant personnel with repair and maintenance. Mechanical repairs to various types of crushers, screens..."
