job_field_id,title,company,description
23,"Analyst, Operations",General Dynamics Information Technology,Extended Air Defense Simulation (EADSIM). Battle Command Sustainment Support System (BCS3). Air and Missile Defense Work Station (AMDWS)....
3,Data Scientist,Humana,"Bachelor’s Degree in Mathematics, Computer Science, Actuarial Science or related field. Collaborate with other professionals including Actuaries, Mathematicians..."
20,HVAC Installer/Technician,Express Air Sytems,Basic knowledge of standard code requirements of air conditioning systems. \*\*\*\*\*Minimum requirements for Installers\*\*\*\*\*....
11,2 Med/Peds Certified Nursing Assistant,Riverside Medical Center,Reports changes in patients' condition to the professional nurse. The 2 Med/Peds Certified Nursing Assitant (CNA) assists with the care of patients ranging from...
18,Agricultural & Standards Inspector - I,Placer County,"Recruitments for Agricultural and Standards Inspector I, Agricultural and Standards Inspector II, and Agricultural and Standards Inspector, Senior are being..."
14,Janitor - Cleaning Technician - FULL TIME - 84095,Wingfoot Services,"Janitorial, janitor, cleaning specialist, carpet cleaning, floor care technician, buffing, part time, supplemental income, laborers, landscaping, supervisor,..."
16,Digital Sales Account Executive,The Morning Call Media Group,"Manages advertising sales revenue and account management targets. Our digital sales account executives are responsible for selling advertising banners, programs..."
21,Production Operator - 2nd shift,Bostik Inc.,About Bostik - Smart Adhesives. As a production operator at Bostik you will be in a batch making/mixer operator position for a competitive manufacturing...
17,Telephone Operator,The Broadmoor,"Monitors 911 Alert System. Operates the switchboard to relay incoming, outgoing, and interoffice calls by performing the following duties:...."
9,Graphic Artist,IGT,"Maya, Autodesk 3D Studio Max). This position is the development and timely delivery of high quality 2D and 3D game...."
22,Air Traffic Control Operator,National Guard,The skills you learn as an Air Traffic Control Operator will qualify you to work in civilian air traffic control towers and centers at airports and airfields....
13,Kitchen Cook,SMG World - Tucson Convention Center,Banquet facility preparing meals for large events:. Fulfilling the service per each Banquet Event Orders (BEO)....
12,Transportation Security Officer (TSO),Trinity Technology Group,TSOs must take the computerized Screener Assessment Battery. Repeatedly lift and carry baggage weighing up to 70 pounds…
19,Drywall Hanger/Installer,EncoreHR Staffing,"Includes lathers who fasten wooden, metal, or rockboard lath to walls, ceilings or partitions of buildings to provide support base for plaster, fire-proofing,..."
7,Administrative Law Judge,New Mexico State Personnel Office,"Administrative Law Judge, Adjudicator Advanced. This position will conduct administrative hearings on behalf of the State Personnel Board concerning..."
15,Lobby Concierge,Beach Activities of Maui,"The Concierge is knowledgeable about the local area and is the expert on the attractions, tours and activities that we sell.Must be flexible with scheduling and..."
10,Anesthesiologist,"UF, Department of Anesthesiology","Department anesthesiologists practice at UF Health hospitals in Gainesville, FL at the University of Florida alongside 62 faculty anesthesiologists, 78..."
5,NATURAL RESOURCES PROGRAM TECHNICIAN,Arkansas Game & Fish Commission,"Knowledge of agricultural methods and basic land laws. Conducts agricultural and forest management activities on wildlife management areas, including preparing..."
6,Senior Addiction Counselor,NYC Health + Hospitals,The Senior Addiction Counselor will be responsible for assisting the consumer with activities relevant to an individual's rehabilitation goals....
2,Cost Accountant III,Weatherford,JOB DESCRIPTION JOB SCOPE: This position will be responsible for the day to day understanding of the plant’s financial performance. The position will also be
8,Tutor or Teacher - Elementary Math,,"We are looking for math tutoring for our 4th grader. Improve grades, get ahead and increase confidence. Elementary math Tutoring &amp; Teaching opportunities..."
4,Mid-Level Ground Control Station Engineer,GENERAL ATOMICS,Job ID# 6452BR Company General Atomics Aeronautical Systems Title Mid-Level Ground Control Station Engineer Job Category Engineering City San Diego State...
1,Regional Marketing Manager,Vishay,Develops a formal marketing plan outlining an appropriate marketing strategy for selling to key accounts. Coordinates the marketing efforts for a product group....
19,Painter/Blaster,CTR Group,"CTR is currently seeking 1st class Painters Location - Pascagoula, MS Industry - Marine Responsibilities: • Perform blasting and painting utilizing marine"
4,CAD Drafter,Raytheon,"Architectural, mechanical, civil, security, structural, and electrical engineering. This drafter position is that of a contributor and will be in direct support..."
5,Physical Science Technician,Department Of Agriculture,The Functional Foods Research Unit creates new processing technologies to enhance the performance of agricultural materials in existing applications and...
15,Central Baggage Agent,Virgin America,O Perform Baggage. O Following proper guiding principles in order to compensate guests for any misplaced baggage....
23,Intelligence Operations Specialist,Department of the Air Force,"Trains, educates, and tests aircrew on worldwide threats, to include surface-to-air missile (SAM), air-to-air missile (AAM), anti-aircraft artillery (AAA), and..."
8,Substitute Instructional Aide,San Mateo Union High School District,"Assist the classroom teacher to set up materials or education lessons; Under general supervision, reinforce lessons presented by the classroom teacher by..."
3,"Database Specialist, Master",OBXtek,"Performs database programming and supports systems design. (h) Includes maintenance of database dictionaries, overall monitoring of standards and procedures,..."
5,Physical Therapy Aide,All Star Physical Therapy,Responsibilities include: setting up treatment areas cleaning up following treatment session aiding physical therapist during patient sessions Job Type:
12,Surveillance Officer Full Time,Harrah's Ak-Chin,"The Surveillance Officer assures the overall safety of guests, employees and the property as a whole. Conducts surveillance observation on designated areas both..."
8,Talent and Workforce Skills Trainer,Shangri-La,Ø Education and Experience. Requires a basic understanding of alpha numeric filing. 1.3.2 Utilize multiple adult learning styles for maximum information...
17,Administrative Associate Round Rock TX,Dell,The Administrative Sr. Coordinates office functions with other departments. We are currently seeking an Administrative Sr....
7,Court Clerk IV - Pos. #292,St. Louis County Circuit Court,"Work is performed under the general supervision of a judge, circuit clerk, higher level court clerk and unit manager...."
19,Plumber,Los Angeles Unified School District,A Los Angeles City Journeyman Plumber License OR a Los Angeles County Certificate of Registration as a Journeyman Plumber....
16,Customer Service Representative,We Insure Group,Our agents have access to over 100 Top Partner Companies and one of the best service and support personnel in the business....
20,Auto Body Painter,DriveTime,What Drives You? Making your mark with a company known for excellence? A Chance for real work/life balance? Collaborating and thriving as part of a team?
10,Health Technician,Department of Veterans Affairs,Assists the audiologist in various procedures of the program including:. Utilizes electro-acoustical diagnostic equipment to assess the electronic functioning...
16,Sales Representative,Cantium Sports,ADVERTISING SALES - Connect Golf Courses &amp Local Businesses*. NO Florida state sales tax!*. Manage ad space &amp cost to meet sales goal*.…
18,Wood Mill Operator 2,The AMES Companies,"The Wood Mill Operator 2 works under supervision of foreman encompassing the skills of Equalizer, Paint Line Operator, Stacker and Inspector...."
23,Air Defense Artillery Officer (14A),U.S. Army,Job training for an air defense artillery officer includes completion of the Air Defense Artillery Officer Basic Course....
11,Rehab Aide,Accelerated Rehabilitation Centers,Previous Clinical Aide experience preferred. The Rehabilitation Aide will assist the Office Coordinator and clinician by performing requested administrative and...
22,Freight Broker,Sunbreak Logistics,Supply Chain / Freight Brokerage:. A new logistics company is looking for a motivated and experienced freight broker to join and to grow in a great team....
16,Sales Representative - Worcester,Commonwealth of Massachusetts,Instruct Sales Agents on the use of successful marketing and sales techniques. Provide motivation to Sales Agents and recommends incentive plans intended to...
17,Banking Services Representative - Bakersfield,Rabobank,Knowledgeable regarding all bank products. Assists with reception and vault/merchant attendant duties. Ability to comprehend and interpret Bank policies and...
6,Juvenile Probation Officer - Court,Williamson County,Constant contact with juvenile offenders and their families. Performs complex social service work in interviewing and counseling....
18,FORESTRY TECHNICIAN (TIMBER STAND IMPROVEMENT),Department Of Agriculture,USDA Forest Service. Forest Service Day Care facilities are not available. A career with the Forest Service will challenge you to manage and care for more than...
21,Product Manager,"Specialty Resources, Inc.","(SRI) is a global sourcing and inventory management company for precision components &amp; specialty products such as precision machined components, stampings,..."
18,Log Yard Scaler,Church & Church Lumber Company,Must be experienced with running equipment such as a log loader. Good people person with management and communication skills....
10,Medical Reviewer LPN,"Blue Cross Blue Shield of IL, MT, NM, OK & TX","3 years clinical experience in physician office, hospital or surgical setting. This position is responsible for pre-authorization reviews in accordance with the..."
5,Environmental Specialist I,PeopleFirst Florida HR,"ENVIRONMENTAL SCIENTISTS AND SPECIALISTS, INCLUDING HEALTH. Knowledge of plant and animal living tissue, cells, organisms, and entities, including their..."
5,Biologist,Department Of Agriculture,"Participates as a team member, while also training, mentoring, and setting work priorities for a fluctuating team of Biological Science Technicians, students,..."
7,Legal Consultant,Softpath System LLC,Understanding and researching complex international legal and/or regulatory issues. Looking for an energetic and talented professional to join the International...
6,Resident Camp Counselor,Busch Gardens Tampa,Provide guidance to campers keeping them on task and behaving appropriately. Must be at least 21 years old in order to drive camp rental vehicles....
9,Actor/Actress,Nine30 Media,"We are looking for actors to become a member of our marketing team. Our ideal candidates would have a strong portfolio, a heavy social media presence, and a..."
14,Landscape and garden maintenance worker,Lawn Love,\*You must have at least one year of professional lawn care experience. \*You must have all the equipment needed to perform a full lawn care service....
15,Fitness Instructors,Woodlake Swim and Racquet Club,"Woodlake Swim and Racquet Club is currently looking to hire certified Water aerobics, Pilates, Meditation, Tai Chi, and Les Mills instructors...."
14,Exterminator,University City Housing Company,University City Housing (UCH) is a Philadelphia-based property management company with significant real estate holdings in and around the Philadelphia
9,TV Line Producer,zulily,"This will include partnering with various production companies to create new scripts, select footage and music and hire freela nce voice over artists...."
4,RET Engineer,Intel,"Scanning Electron Microscopy, Atomic Force Microscopy, etc.). The RET Design Engineer will deliver test masks, test patterns, sampling strategies, process..."
11,Physical Therapy Aide,All Star Physical Therapy,Responsibilities include: setting up treatment areas cleaning up following treatment sessions aiding physical therapist during patient sessions Job Type:
17,Administrative Assistant to the Provost/Vice President of Academic Affairs,East Central University,"The Administrative Assistant coordinates the Provost’s appointments and travel arrangements. East Central University invites applications for a twelve-month,..."
20,MAINTENANCE MECHANIC,United States Postal Service,"United States Postal Service External Publication for Job Posting 94976393 If this job requires qualification on an examination, the number of applicants who"
19,Metal Mechanic,Spencer-Ogden Energy,"Distribute insulating materials evenly into small spaces within floors, ceilings, or walls, using blowers and hose attachments or cement mortar...."
13,Bartender / Barman / Mixologist,Ristorante Capellini,"Bartender, barman, barkeep, barmaid, and mixologist please apply. Bartenders are responsible for positive guest interaction while accurately mixing and serving..."
7,District Court Clerk II - O'ahu,Hawaii State Judiciary,Authors the official court record in a court of limited jurisdiction for District Court trial proceedings  Prepares documents ordered by the court
15,Valet Attendant: PT & FT- Lisle, Downers Grove,"HealthPark ValetEnjoy working in a social environment? A leader in parking services, HealthPark Hospitality provides its healthcare partners comprehensive parking solutions"
8,Assistant Teaching Professor,Worcester Polytechnic Institute,"The Mathematical Sciences Department currently has 28 tenured/tenure-track faculty members, 9 postdoctoral scholars, 5 teaching professors and features a..."
19,Maintenance Worker - Road Maintenance,"Collier County, FL","Performs light construction projects; Operates a variety of machinery, equipment, and tools associated with division projects, which may include a utility truck..."
18,Mine Safety and Health Inspector (Coal),Department Of Labor,This position has promotion potential to GS-12 for Underground and Electrical Inspectors and the GS-11 for Surface Inspectors....
5,Veterinary Medical Officer,Department Of Agriculture,"Masters degree in an area of specialization, including but not limited to, animal science, avian medicine, food safety, infectious diseases, veterinary clinical..."
21,Sewing Machine Operator,"DI, LLC","This individual will operate machines that are either single or double needle, perform blind stitch, serge, or other specialized operations...."
16,Cashier / Server Immediate Openings Available,Louis Pappas Fresh Greek,"Here are some keys to being a successful Cashier with us:. McMullen Booth Rd Clearwater, FL 33761, Monday through Friday from 3pm - 5pm...."
14,Greenskeeper,Heritage Palms Golf Club,*Summary* Assists in a general range of activities involved in golf course maintenance and construction. The individual should be able to perform semi-skilled
13,House Cook/Chef,Delta Zeta at Univ. of Northern Colorado,"Cook, Prep Cook, Chef, Line Cook, Nutritional Services, Cafeteria:. Responsible for preparing meals taking into consideration nutrition, food availability and..."
11,Residential Care Aide,Westminster Village.Spanish Fort AL,RESIDENTIAL CARE AIDE*. Must be registered and in good standing with the Alabama Nurse Aide Registry or currently enlisted in an approved nursing assistant...
7,Senior Appellate Law Stenographer,NYS Unified Court System,"Acting as liaison with Justices, court attorneys and administrative personnel with regard to assignments; Responsible for training and supervising Appellate Law..."
9,Audio/Video Installer,Wilshire Media Systems Inc,"Wilshire Media System’s is Southern California’s premier source for home theater, high performance audio, home automation and lighting control...."
4,ARCHITECT/ENGINEER EAS,United States Postal Service,"Knowledge of architecture, engineering, and building construction sufficient to review and inspect repair and alteration...."
19,Fabricator/Welder Helper,Kooks Custom Headers Inc,Pass off parts to helper for grinding and straightening flanges. Receive parts back from helper for final assembly and inspection for quality control....
1,Advertising Project Manager,Innocean USA,Project Manager may support projects for Innocean projects across all U.S. The Project Manager may also lead process improvement initiatives assigned by the...
5,Public Health Specialist III,State of Oklahoma,"A bachelor’s degree with a major in public health, environmental health, environmental science, physical science, natural science, biological science,..."
7,Legal Liaison,"Maricopa County, AZ",High School diploma or GED and two (2) years of clerical experience in a legal and/or law enforcement setting with knowledge in legal preparations and legal...
22,Hiring CDL-A Drivers for L/P,Network 1,"No commercial transportation related felony, theft or larceny conviction. LEASE OPERATORS NEEDED NOW!!*...."
20,Truck/Trailer Mechanic,Snider Fleet Solutions,Truck/Trailer mechanic skills:. Perform valve and injector overhead adjustments according to OEM procedures. We have an immediate opening for a *Tractor Trailer...
2,Business Operations Associate/Sr. Associate,Lending Club,"You’re both comfortable conversing with our front-line agents to truly understand how our operations work, as well as making a convincing case to our executive..."
3,"Quality Assurance Automation Tester at Phoenix ,AZ, Local Preferred",West Coast Consulting LLC,"Hello, Kindly go through the requirement and let me know if you are comfortable with this requirement mentioned below. Job Title : Quality Assurance"
8,Basic Skills/Learning Center Non-Credit Instructor,North Orange County Community College District,"Teach pre-college courses in class and lab settings including, but not limited to, adult basic education (ABE), career technical education, adult secondary..."
22,School Bus Driver -aftercare program,Lake Forest Park Montessori,"Part time aftercare/ bus driver:. If CDL required for vehicle driver, driver is subject to NLCI and state/federal policies, procedures and requirements..."
1,"Senior Marketing Campaigns Manager, North America Hardware Marketing",Oracle,"Senior Marketing Campaigns Manager, North America Hardware Marketing. This will include demand generation, brand awareness, events, field marketing, web/online..."
17,Bookkeeping Clerk,John Q. Hammons Hotels & Resorts,"Must have 1-2 years in accounting , customer service and/or bookkeeping experience or equivalent. Perform any combination of routine calculating, posting, and..."
2,Senior Staff Accountant,MFA Oil Co.,Summary of Responsibilities: Job Responsibilities include but are not limited to: Ensuring the integrity of the general ledger and financial statements
10,Staff Nurse,South Shore Medical Center,Provide quality care to South Shore Medical Center patients. Administer prescribed medications and treatments. Prepare patient for office visit. Respond to
8,Assistant Professor,Oklahoma State University,"Applicants must have an appropriate earned doctorate in accounting, demonstrate instructional excellence, and be committed to active engagement in the life of..."
20,Master Mechanic / Technician Auto Repair,YourMechanic,Excellent customer service skills. Complete set of basic automotive tools. Earn up to $55/hr as a mobile mechanic*....
8,7th & 8th Grade Social Studies Long Term Substitute Teacher,Willamette Leadership Academy,"We are looking for a dynamic and passionate social studies teacher to teach two periods of 8th grade US History, 2 periods of 7th grade Intro to Western..."
4,Architectural Drafter,Glen & Co Architecture,We are a dynamic architectural and design group working on hotels and restaurants looking for an architect who can prepare construction documents and...
13,Banquet Chef/Line Cook,Golf Course North Houston,"Preferred Banquet experience but not required. All kitchen staff must be able to cook high-quality balanced meals, cook from scratch and maintain proper food..."
16,PT Grocery Associate,Food Lion,Provide quality customer service to our customers through the Grocery Department. Engage and interact with customers to create a positive shopping experience....
14,Housekeeping Tech,Brentwood Behavioral Health of Louisiana,"Patients, staff and visitors. The Housekeeping Tech will ensure. The maintenance of a clean, healthy, pleasant environment for...."
6,"Staff Therapist, Addictions Program",Chase Brexton Health Care,"Must have the ability to provide services that are relevant to the culture of the patient and their family. Provides a range of brief and longer-term, treatment..."
10,Cardiology Test Nurse,Lifespan,Conforms to the Code of Professional Nurses. Graduate from an accredited School of Nursing with current license to practice as a Registered Nurse in the State...
21,"Lead, Upholstery",StandardAero,"The Senior Tech Upholsterer is technically competent in aircraft upholstery, and is technically competent to accomplish all of his/her duties with little or no..."
5,Animal Care Supervisor,University of Colorado,"Animal Facility, implementing the animal care procedures and policies. Care for a variety of species of small laboratory animals used by scientists...."
17,Retail Banker/ Teller - Center,Woodforest National Bank,"WOODFOREST NATIONAL BANK. Performs opening, closing, and other branch servicing duties such as cash and vault balancing;..."
17,Human Resources and Payroll Clerk,Tennessee Performing Arts Center,Reconcile monthly billing. Facilitate job posting as necessary. The Tennessee Performing Arts Center is looking for a full time HR/Payroll Clerk....
18,Animal Agriculture Management Associate 2016,Cargill,"The Animal Agriculture Management Associate role enables the individual to become familiar with the workflow of animal agriculture operations, and to develop..."
14,Maintenance Worker II - PUBLIC WORKS,City of Port Orange,Clean grounds and remove litter. Experience in operating automotive or maintenance equipment. Provide routine and basic maintenance and repair to small...
2,Marketing Internship Latin America,Cosmetics of France,Provide customer service to the agent zone in terms of material &amp information needed for events trough com. Consolidate and update the Local Makeup Experts &amp
12,Security Guard,Bannerman,"Bannerman is looking for professional security guards, and bouncers. Must be self disciplined with a high level of customer service and professionalism...."
23,Range Operations Specialist (PD D1134000),Department of the Army,"Officer, Not to Exceed O-3/ CPT, Warrant, Enlisted. Small arms, mortars and field artillery rockets or cannons...."
15,Beauty Artist,Benefit Cosmetics,Essential Duties and Responsibilities -Customer Service- · Customer is the number one focus · Greet customers in 30 seconds or less · Follow the 8 Step
1,University Gallery Events Manager,Rochester Institute of Technology,"Coordinate the University Gallery space for events and exhibits including the hours of operation, maintenance of University Gallery policies, supplies, and..."
13,Food Service Attendant,Riverside Health System,"Formal training as a cook preferred. Performs duties related to therapeutic diets and meal services to include, aides in the preparation of preparation of hot..."
15,Barber,GoodBuddyz BarberShop,Chairs available for registered and apprentice barbers at 3-chain barbershop. Build your own clientele or bring your own....
23,Cavalry Scout,National Guard,"Cavalry Scout training never really stops, though. This enables the officer to make informed decisions. As a Cavalry Scout, you are the eyes and ears of the..."
2,Fraud Risk Agent,Best Buy,Fraud Risk Agent. The Fraud Agent will support the efforts of BestBuy.com to provide timely service to our customers while controlling risk associated with...
7,Legal Analyst,CP Homes,"The role of the Legal Analyst is to support, manage and administer the day-to-day functions of a corporate legal department...."
9,Freelance Production Coordinator,"JPL Integrated Communications, Inc.","You will interact with talented Project Managers, Event Producers, Production Managers, Creative Directors, Graphic Artists, Editors, and so many others!..."
14,Housekeeping/Laundry Aide,Safire Care,"Description Position: Housekeeping/Laundry Aide Hours: FT, PT Available Shift: Day and Evening Shifts Sheridan Manor provides a range of services,"
11,DENTAL ASSISTANT,Department of Veterans Affairs,Dental Assistant/ Functional Statement. Sets up operatory for planned dental procedure and cleans dental unit for timely turnover....
20,Auto Glass Installer,Luther Automotive,"At least 1 year of mobile auto glass experience required. Install windshields in shop and mobile, perform rock chip repairs and pull and reinstall glass for the..."
21,Processing Operator I - 3rd Shift,"SOFTPATH SYSTEM LLC in Sturgis, MI",Processing Operator I - 3rd Shift. Production or manufacturing and machine or forklift experience:. Primary responsibility will be to support the Dry blending...
6,FAMILY COURT COUNSELOR,"Dallas County, TX","Must be independently licensed in the State of Texas as a Licensed Professional Counselor (LPC), Licensed Marriage and Family Therapist (LMFT), Licensed Master..."
10,EXERCISE PHYSIOLOGIST,Duke University and Duke University Health System,Master's degree in Exercise Physiology or Exercise Science. Clinical oversight regarding exercise for all patients at all risk levels....
