job_field_id,title,company,description
13,$10.00 Hr Dishwasher,Ruby Tuesday,As soon as you join the team you'll notice the friendly working environment and the variety of experience that comes with working at Ruby Tuesday.Apply at:....
20,Service Technician (Mechanic),"Franklin Equipment, LLC","The individual will maintain and repair equipment offered by Franklin Equipment to include Construction and Agricultural (small equipment, aerial, dirt, farm,..."
21,"Machine Operator-Remington, Virginia",U.S. Pipe,Must have at least one to three years of previous fabrication or manufacturing assembly or production work experience in a fast paced manufacturing or...
22,Flatbed Company Driver - CDL-A,P & S Transportation,"Drivers must also have a current CDL-A license. Life Insurance/$10,000 policy at no charge to the driver. P&amp;S drivers must be at least 23 years old with at..."
8,Assistant Professor,Oklahoma State University,"Applicants must have an appropriate earned doctorate in accounting, demonstrate instructional excellence, and be committed to active engagement in the life of..."
13,Catering Coordinator,Panera Bread Franchise (Blue Ridge Bread),Our bakery-cafes are focused on taking care of our guests. Must Have Own Vehicle. Perfect Driving Record. Please apply online and a Manager may be in touch if...
1,Marketing Science@Scale – Project Manager,Facebook,"The Marketing Science team is seeking a Project Manager who is passionate about making business operations, tools, and processes more efficient and effective...."
20,Master Mechanic / Technician Auto Repair,YourMechanic,Excellent customer service skills. Complete set of basic automotive tools. Earn up to $55/hr as a mobile mechanic*....
10,Cardiology Test Nurse,Lifespan,Conforms to the Code of Professional Nurses. Graduate from an accredited School of Nursing with current license to practice as a Registered Nurse in the State...
16,Cashier,The Home Depot,"They provide first level escalation for customer issues and assist in the supervision, coaching and training of other Front End Associates by participating in..."
16,Keyholder - Commissioned - Northrock Shopping Center,Jos. A Bank,"Understanding merchandise features, marking and fitting techniques and fashion trends to determine what type of garments are desired and advise customers about..."
3,Data Management Support w/TS/SCI w/Polygraph,"TekStream Solutions, LLC","Performs a variety of general administrative tasks, such as preparing reports and correspondence, coordinating travel and meeting arrangements, answering phones..."
16,AP Clerk,Sheehy Auto Stores,"All applicants must have the ability to pass pre-employment testing to include background checks, MVR, drug test, and valid driver's license...."
13,Evening Server,Denny's,"Looking for an individual with a positive attitude to provide friendly, fast, accurate service to guests dining in our restaurant...."
22,Experienced CDL-A Company Truck Driver - Teams,Celadon Trucking Services,Must hold a valid CDL Class A license issued by the applicant’s state of residence. Team Driver Jobs are Available for Experienced Company Drivers and Owner...
2,Senior Accountant (Tax),"PBMares, LLP",150 hours required by the Virginia Board of Accountancy to acquire a CPA license. Our Firm’s policy is to provide equal opportunity for employment to all...
17,SCHEDULING/REGISTRATION REPRESENTATIVE II,Inova Fairfax Hospital,"Medical terminology class; Bachelors Degree = 2 years). Obtains medical case information including diagnosis(es), ICD-9 and CPT codes, anesthesia type, ordering..."
23,Intelligence Operations Specialist,Department of the Air Force,"Trains, educates, and tests aircrew on worldwide threats, to include surface-to-air missile (SAM), air-to-air missile (AAM), anti-aircraft artillery (AAA), and..."
10,Hospitalist- NP/PA,Virginia Emergency Medicine Associates,A minimum of one year of post-grad clinical experience in hospital medicine• Valid Virginia license • Current ACLS/BLS certificates through AHA• Ability to...
3,Network Controller with TS + Clearance,ManTech International Corporation,"Requires Bachelor’s degree (in Computer Science, Math or Engineering) or equivalent, and zero to two years of related experience...."
13,Bartender - Toms River Chili's,Chili's,"You know how to manage the back bar. Providing an enjoyable bar experience for every Guest. A duck walks into a bar and – oh, wait...."
17,"Executive Administrator, Sr. (TS/SCI w/ Polygraph) Job",CACI International Inc,"Answers large volume of incoming phone calls, often from other senior leaders and customers; Ability to generate independent decisions and has excellent..."
14,Residential Lawn Specialist 100889,TruGreen,As a Lawn Specialist with the #1 lawn care company you will be providing regularly scheduled landscape services within your route on a daily basis....
13,Experienced Culinary Professionals,The Orlean Market,Local Market/Restaurant is rapidly changing! We are in search of experienced and responsible culinary professionals who want to be a part of our unique and
17,Help Desk / Support Specialist,Raytheon,Provide on-demand and scheduled training to individuals and groups in the use of Maximo and other technical support tools....
16,Sales Associate/Cashier (part-time),Bed Bath & Beyond,Currently hiring part time sales / cashiers / stock associates and bridal consultants. All shifts available....
8,Summer Technology Camp Staff - Lead & Assistant Instructors,Black Rocket Productions,"We have multiple locations in over 30 state states! Are you passionate about Video Games, App Design, Digital Movies, Robotics, or STEM?..."
18,Plant Health Care Specialist,Bartlett Tree Experts,Certified Pesticide Applicator License is preferred. The ideal candidates will have 1+ yrs experience working in Plant Health Care OR a 2/4 year degree in...
1,Store Manager,Stage Stores,"Work with district manager to develop and execute plans for store to improve profitability, greater productivity and efficiency...."
22,Hiring CDL-A Drivers for L/P,Network 1,"No commercial transportation related felony, theft or larceny conviction. LEASE OPERATORS NEEDED NOW!!*...."
19,Maintenance Worker - Road Maintenance,"Collier County, FL","Performs light construction projects; Operates a variety of machinery, equipment, and tools associated with division projects, which may include a utility truck..."
10,Ophthalmic Technician,The Virginia Retina Center,Busy ophthalmic practice has an immediate opening for a full time Ophthalmic Technician. Applicant should have strong communication and interpersonal skills and...
6,Police Officer,Virginia Association of Chiefs of Police (VACP),"Applicants must be at least 21 years old, in good physical health, possess a high school diploma or G.E.D, valid Virginia driver’s license, and be able to deal..."
19,Industrial Electrician,Novelis,"Novelis Corporation, the global leader in rolled aluminum and can recycling, has an opportunity at its Fairmont, WV plant for an experienced Industrial..."
5,Veterinary Medical Officer,Department Of Agriculture,"Masters degree in an area of specialization, including but not limited to, animal science, avian medicine, food safety, infectious diseases, veterinary clinical..."
10,EXERCISE PHYSIOLOGIST,Duke University and Duke University Health System,Master's degree in Exercise Physiology or Exercise Science. Clinical oversight regarding exercise for all patients at all risk levels....
22,Hiring Company Truck Drivers,Transport America,Company Truck Driver Benefits:. Transport America's fleet of company truck drivers is the best and most experienced on the road....
19,Project Manager - Residential & Commercial Painting,Five Star Painting - Manassas,"Experience in the painting industry, construction, or building maintenance industry with knowledge of paint and material application...."
16,Sales Representative,Cantium Sports,ADVERTISING SALES - Connect Golf Courses &amp Local Businesses*. NO Florida state sales tax!*. Manage ad space &amp cost to meet sales goal*.…
8,7th & 8th Grade Social Studies Long Term Substitute Teacher,Willamette Leadership Academy,"We are looking for a dynamic and passionate social studies teacher to teach two periods of 8th grade US History, 2 periods of 7th grade Intro to Western..."
16,Clerk\Cashier,CVS Health,"Answer the telephone using the appropriate greeting. Operate a cash register including cash transactions, checks, charges...."
18,Arborist Climber Trainee,Bartlett Tree Experts,The ideal candidate will have experience working on a tree crew as a Ground Man OR a 2/4 year degree in Forestry or a related field....
3,Mid-Level Cyber Security Consultant ( IRS Clearance),Seneca Resources,"Level Cyber Security Consultant to support Cyber Security Program based in Reston, VA. Knowledge of security principles, best practices, conducting security..."
13,Food Service Attendant,Riverside Health System,"Formal training as a cook preferred. Performs duties related to therapeutic diets and meal services to include, aides in the preparation of preparation of hot..."
6,Staff Development Coordinator,Sayre Christain Village,"Conductscertification or training programs for Nursing Assistants. Frequentlycommunicates with employees, residents, family members, physicians etc...."
10,Medical Reviewer LPN,"Blue Cross Blue Shield of IL, MT, NM, OK & TX","3 years clinical experience in physician office, hospital or surgical setting. This position is responsible for pre-authorization reviews in accordance with the..."
16,Cashier,Stores - Kmart Hourly,"Responsible for providing excellent customer service, efficiently and accurately completing sales and service transactions at the cash wraps, as well as handle..."
23,Logistics Management Specialist,Department of the Air Force,"Determines type &amp; number of aircraft required for mission deployment/redeployment. Identifies problems/discrepancies to Logistics Officer, unit, &amp; higher..."
13,Restaurant Team Member,RubyTuesday,"Whether its part-time or an entire career, we want to make sure you get everything you want out of your Ruby Tuesday experience...."
19,Plumber,Los Angeles Unified School District,A Los Angeles City Journeyman Plumber License OR a Los Angeles County Certificate of Registration as a Journeyman Plumber....
22,CDL-A Company Truck Drivers,Purdy Brothers Trucking,We offer a better driving career by asking YOU what you need and then doing whatever we can to meet those needs....
2,Controller/Accounting Manager,Poplar Springs Inn and Spa,Advanced Degree or CPA license preferred. Design and maintain detailed financial analysis spreadsheets/tools to measure operational performance and aid with...
17,Human Resources and Payroll Clerk,Tennessee Performing Arts Center,Reconcile monthly billing. Facilitate job posting as necessary. The Tennessee Performing Arts Center is looking for a full time HR/Payroll Clerk....
20,"Automotive Body Repairer, Fiberglass/Welder",The Logistics Company,The Repairer applies and spreads body filler manually to reestablish surface. Two years related experience. The Automobile Body Repairer mixes polyester resin...
4,CAD Drafter,Raytheon,"Architectural, mechanical, civil, security, structural, and electrical engineering. This drafter position is that of a contributor and will be in direct support..."
10,Surgical Tech,trustaff,Must have valid BLS certification. This assignment is for an immediate start with a reputable facility seeking an experienced Surgical Technician to fill a 13...
9,Head JV Boys Basketball Coach,Highland School,"A VISAA Division 2 Private High School, competing in the Delaney Athletic Conference (DAC). Lead the JV Boys Basketball Program at Highland School in Warrenton,..."
13,Restaurant Manager,Denny's-Little Apple Properties,"Must have the ability to work a flexible and-or irregular schedule. Individual will manage a sit-down restaurant wit daily operations including recruiting,..."
8,"Dean, Fauquier Campus",Lord Fairfax Community College,"Strategic academic program design and development, including outreach with relevant local Fauquier and Rappahannock County stakeholders to assess need and..."
2,Claims Auditor,Broadpath,Medical Claims Auditors perform routine and complex audits to identify inaccurate claims adjudication. Knowledge of claims and the ability to recognize patterns...
2,"Commercial Account Manager - Bealeton, VA",Advance Auto Parts,"Valid Drivers License and ability to meet our MVR Requirements. State of the Art Technology- laptop, CRM software, BlackBerry...."
16,Customer Service Representative,We Insure Group,Our agents have access to over 100 Top Partner Companies and one of the best service and support personnel in the business....
17,Front Desk Agent,Holiday Inn & Suites - Tulsa,At *Holiday Inn® Hotels* our job is to bring the joy of travel to everyone. That’s where you come in. When you’re part of the Holiday Inn Hotels brand you’re
22,Hiring Company Drivers & Contracting Owner Operators,Prime Inc.,We are hiring Class A CDL Company Drivers and Contracting Owner Operators. Find the Lifestyle You're Looking for as a Prime Truck Driver....
2,Entry Level Quality Assurance Analyst,National Software Management,"*Entry Level Quality Assurance Analyst* Under direct supervision, the Quality Assurance Analyst verifies that software changes submitted by developers"
16,Retail Merchandiser- Part Time,TNG Retail Services,"Or person’s looking for permanent part time work. Clients' products, developing strong relationships with store personnel, accurately reporting time worked,..."
16,Technology Sales Associate,Staples,"All qualified applicants will receive consideration for employment without regard to race, color, religion, sex, national origin, protected veteran status,..."
16,Brand Ambassador Sales Part Time,Advantage Sales and Marketing,Participate in mandatory on-line training and conference calls (paid). Field of Study/Area of Experience:....
11,Certified Nursing Assistant,"Quadrant, Inc.",Must have a valid License. Certified Nursing Assistant. Cleaning resident's rooms. Has an immediate need for a CNA for a Major Medical Facility located in...
16,Consultative Sales Associate – Home Appliances,Stores - Sears Hourly,The Consultative Sales Associate is responsible for enhancing the experience of members and driving profitable sales of Home Appliance area by providing...
22,CDL-A Truck Driver - Dedicated Runs,Marten Transport,"Our dedicated truck driving opportunities are open to drivers at least 22 years old with a current CDL-A, at least 1 year of recent OTR experience...."
22,"Traffic Control Specialist - Flagger - Warrenton, VA",Area Wide Protective,Must possess a valid driver's license and maintain an acceptable driving record by complying with standards established by AWP policy....
1,University Gallery Events Manager,Rochester Institute of Technology,"Coordinate the University Gallery space for events and exhibits including the hours of operation, maintenance of University Gallery policies, supplies, and..."
8,Adjunct Faculty-Communications,Lord Fairfax Community College,"Certain developmental or technical courses may be taught by instructors with a Bachelor's degree, a special certification, and/or work experience...."
19,Lead Remodeler/Construction Technician,Gibson Home Services LLC,Must have a valid driver's license with a clean driving history and successfully pass a background check and drug screening....
10,Rehabilitation Technician,Blue Ridge Orthopaedic & Spine Center,"Blue Ridge Orthopaedic and Spine Center in Warrenton, VA, is looking for a FT Rehabilitation Specialist/ Physical Therapy Technician in our state of the art..."
12,Chief of Police,City of Andrews,"The department consists of 19 sworn peace officers, 9 full-time paramedics, an Animal Warden and Executive Assistant, with combined budgets totaling over $3M...."
3,IT Support Specialist,"Greystone & Co., Inc.",This role is responsible for answering incoming calls and monitoring incoming email for internal users in an IT help desk environment through a ticket tracking...
12,Police Officer,Lord Fairfax Community College,Applicants must be able to successfully qualify with the service weapon (initially and annually) and possess a valid Virginia driver's license with an...
10,Cardiologist,U.S. Navy Reserve,*Cardiologist NEEDED* for part-time in Navy Reserve! Currently *1 position* open Nationwide! Your Benefits: * $75K Sign-on Bonus * All pay and allowances of
21,Processing Operator I - 3rd Shift,"SOFTPATH SYSTEM LLC in Sturgis, MI",Processing Operator I - 3rd Shift. Production or manufacturing and machine or forklift experience:. Primary responsibility will be to support the Dry blending...
22,Part Time 3rd Shift Stocker North Rock,Harris Teeter,"While performing the duties of this job, the associate is frequently exposed to wet, hot, or cold conditions and moving mechanical parts...."
2,Account Manager / Estimator,Five Star Painting - Manassas,Be available to answer any questions regarding the job while the project is in progress. Use the proper tools to estimate the job accurately....
23,Flight Support,U.S. Navy,"Operate and maintain hydraulic and steam catapults to launch aircraft. As an Officer, you can expect to:. Instead, she refuels fighter jets on aircraft carriers..."
17,Reimbursement Specialist,WRB Communications,Complete accurate entry of billing information to ensure timely payment and avoid delay in patient therapy....
10,Pharmacy Technician,Family Care Pharmacy Remington,Required license or certification:. This is a family owned business that is looking for a full time pharmacy technician who can perform data entry as well as...
1,Assistant Restaurant Manager,Dunkin' Donuts,Holds the guest as their highest priority and role models exceptional guest service. Manages cash over/short through effective cash control procedures....
22,Delivery Driver,Domino's,"Valid Driver's license. So if you're looking for casual work or maybe something more permanent, our Delivery Driver position is the perfect way in...."
5,Physical Science Technician,Department Of Agriculture,The Functional Foods Research Unit creates new processing technologies to enhance the performance of agricultural materials in existing applications and...
10,"Optometrist needed in Fauquier County, VA",ETS Vision,Licensed in VA. Beautiful region less than an hour from the DC area- lower cost of living and far less traffic hassles....
22,School Bus Driver -aftercare program,Lake Forest Park Montessori,"Part time aftercare/ bus driver:. If CDL required for vehicle driver, driver is subject to NLCI and state/federal policies, procedures and requirements..."
23,Intelligence Analyst - Junior,"Streamline Defense, LLC","The Intelligence Analyst will perform intelligence analysis, analyst-driven data extraction and processing, dissemination of applicable reporting products, and..."
16,Customer Service Associate,Wawa,Comply with federal and state laws by requesting personal identification from customers who are purchasing tobacco and/or alcohol....
16,Team Member (Part-Time)0820,Jo-Ann Stores,May use 2-way radios (hear incoming messages and provide verbal response). Processes customer transactions in an efficient and friendly manner at the cash...
6,FAMILY COURT COUNSELOR,"Dallas County, TX","Must be independently licensed in the State of Texas as a Licensed Professional Counselor (LPC), Licensed Marriage and Family Therapist (LMFT), Licensed Master..."
1,Assistant Manager - Commissioned - Northrock Shopping Center,Jos. A Bank,Ensure all customer complaints are resolved immediately or as soon as possible if not remedied during store visit.Handle all Company assets according to...
13,Bar Manager/Bartender,Poplar Springs Inn and Spa,"Fantastic oppurtunity to progress within the company. To oversee, maintain and elevate the bar and lounge to the high end status it is to further heights...."
6,Social Worker-MSW-PRN Weekday & Weekends,Fauquier Health System,Masters of Science in Social Work. Experience in health–related field or setting. The Social Worker-MSW provides general social work services and participates...
20,"Maintenance Mechanic-Remington, Virginia",U.S. Pipe,"Directs and performs complex mechanical repair work &amp; is responsible for the more intricate repair assignments, including hydraulic and pneumatic systems...."
2,Portfolio Administrator,"Greystone & Co., Inc.","Transfer incoming mortgage payments to various custodial accounts in compliance with agency requirements. We are seeking a Portfolio Operations Specialist, for..."
20,Auto Body Painter,DriveTime,What Drives You? Making your mark with a company known for excellence? A Chance for real work/life balance? Collaborating and thriving as part of a team?
14,Custodial Worker (Janitor) MWR 03-16,"Naval Air Station - JAX, MWR","Deep cleaning may include defrosting refrigerators and freezers, cleaning windows (interior and exterior), replacing and/or cleaning drapes/curtains, moving..."
13,Full Time Cake Decorator-Northrock Shopping Center,Harris Teeter,"Technical Skills - Assesses own strengths and weaknesses; Answer telephones by saying &quot;Harris Teeter [store name], this is [name], may I help you?&quot;...."
7,Legal Liaison,"Maricopa County, AZ",High School diploma or GED and two (2) years of clerical experience in a legal and/or law enforcement setting with knowledge in legal preparations and legal...
10,Health Technician,Department of Veterans Affairs,Assists the audiologist in various procedures of the program including:. Utilizes electro-acoustical diagnostic equipment to assess the electronic functioning...
1,Shift Supervisor,Rite Aid,"Accountable for store cash and other financial assets, reconciling cash register drawers, preparing deposits, and ordering changes from the bank as directed by..."
17,Teller,The Fauquier Bank,"Accepts deposits, loan payments, credit card deposits and payments. Job requires a higher level of problem solving abilities to find solutions to difficult..."
17,"Clerk, Front Desk (Great Beginnings)",La Clinica,"As a Clerk, working in a fast pace environment, some of your typical job responsibilities will include greeting, registering patients, verifying insurance..."
2,Seasonal Tax Preparer,Jackson Hewitt,"Jackson Hewitt is seeking a seasonal Tax Preparer to perform a variety of activities related to income tax preparation, sales and the delivery of excellent..."
15,Hair Stylist,Sport Clips - VA114,"We're interviewing motivated, positive, reliable, upbeat stylists to help grow and be one of our winning team members...."
16,PT Sales Associate,Food Lion,"Responsible for maintaining standards according to the Front End Standard Practice Manual, maximizing sales through excellent customer service and minimizing..."
15,Barber,GoodBuddyz BarberShop,Chairs available for registered and apprentice barbers at 3-chain barbershop. Build your own clientele or bring your own....
8,Substitute Instructional Aide,San Mateo Union High School District,"Assist the classroom teacher to set up materials or education lessons; Under general supervision, reinforce lessons presented by the classroom teacher by..."
10,Telemedicine Physician,"MeMD, Inc.",MeMD is seeking a Board-Certified Physician possessing a Florida medical license that is interested in joining our team of Telemedicine Providers....
16,Consultative Sales- Fine Jewelry,Stores - Sears Hourly,Maintaining knowledge of products and using this knowledge to assist and educate customers on options available
17,Administrative Assistant to the Provost/Vice President of Academic Affairs,East Central University,"The Administrative Assistant coordinates the Provost’s appointments and travel arrangements. East Central University invites applications for a twelve-month,..."
13,Cook-Full-Time-Hours Evenings 12p-8p,Fauquier Health System,Ability to perform complex math calculations and verify cash handling and reporting. The Cook prepares food items needed for meal service using institutional...
