job_field_id,title,company,description
23,"Analyst, Operations",General Dynamics Information Technology,Extended Air Defense Simulation (EADSIM). Battle Command Sustainment Support System (BCS3). Air and Missile Defense Work Station (AMDWS)....
20,HVAC Installer/Technician,Express Air Sytems,Basic knowledge of standard code requirements of air conditioning systems. \*\*\*\*\*Minimum requirements for Installers\*\*\*\*\*....
2,Cost Accountant III,Weatherford,JOB DESCRIPTION JOB SCOPE: This position will be responsible for the day to day understanding of the plant’s financial performance. The position will also be
22,Air Traffic Control Operator,National Guard,The skills you learn as an Air Traffic Control Operator will qualify you to work in civilian air traffic control towers and centers at airports and airfields....
18,Agricultural & Standards Inspector - I,Placer County,"Recruitments for Agricultural and Standards Inspector I, Agricultural and Standards Inspector II, and Agricultural and Standards Inspector, Senior are being..."
19,Drywall Hanger/Installer,EncoreHR Staffing,"Includes lathers who fasten wooden, metal, or rockboard lath to walls, ceilings or partitions of buildings to provide support base for plaster, fire-proofing,..."
15,Lobby Concierge,Beach Activities of Maui,"The Concierge is knowledgeable about the local area and is the expert on the attractions, tours and activities that we sell.Must be flexible with scheduling and..."
21,Production Operator - 2nd shift,Bostik Inc.,About Bostik - Smart Adhesives. As a production operator at Bostik you will be in a batch making/mixer operator position for a competitive manufacturing...
10,Anesthesiologist,"UF, Department of Anesthesiology","Department anesthesiologists practice at UF Health hospitals in Gainesville, FL at the University of Florida alongside 62 faculty anesthesiologists, 78..."
17,Telephone Operator,The Broadmoor,"Monitors 911 Alert System. Operates the switchboard to relay incoming, outgoing, and interoffice calls by performing the following duties:...."
4,Mid-Level Ground Control Station Engineer,GENERAL ATOMICS,Job ID# 6452BR Company General Atomics Aeronautical Systems Title Mid-Level Ground Control Station Engineer Job Category Engineering City San Diego State...
13,Kitchen Cook,SMG World - Tucson Convention Center,Banquet facility preparing meals for large events:. Fulfilling the service per each Banquet Event Orders (BEO)....
12,Transportation Security Officer (TSO),Trinity Technology Group,TSOs must take the computerized Screener Assessment Battery. Repeatedly lift and carry baggage weighing up to 70 pounds…
6,Senior Addiction Counselor,NYC Health + Hospitals,The Senior Addiction Counselor will be responsible for assisting the consumer with activities relevant to an individual's rehabilitation goals....
16,Digital Sales Account Executive,The Morning Call Media Group,"Manages advertising sales revenue and account management targets. Our digital sales account executives are responsible for selling advertising banners, programs..."
7,Administrative Law Judge,New Mexico State Personnel Office,"Administrative Law Judge, Adjudicator Advanced. This position will conduct administrative hearings on behalf of the State Personnel Board concerning..."
9,Graphic Artist,IGT,"Maya, Autodesk 3D Studio Max). This position is the development and timely delivery of high quality 2D and 3D game...."
5,NATURAL RESOURCES PROGRAM TECHNICIAN,Arkansas Game & Fish Commission,"Knowledge of agricultural methods and basic land laws. Conducts agricultural and forest management activities on wildlife management areas, including preparing..."
14,Janitor - Cleaning Technician - FULL TIME - 84095,Wingfoot Services,"Janitorial, janitor, cleaning specialist, carpet cleaning, floor care technician, buffing, part time, supplemental income, laborers, landscaping, supervisor,..."
3,Data Scientist,Humana,"Bachelor’s Degree in Mathematics, Computer Science, Actuarial Science or related field. Collaborate with other professionals including Actuaries, Mathematicians..."
8,Tutor or Teacher - Elementary Math,,"We are looking for math tutoring for our 4th grader. Improve grades, get ahead and increase confidence. Elementary math Tutoring &amp; Teaching opportunities..."
11,2 Med/Peds Certified Nursing Assistant,Riverside Medical Center,Reports changes in patients' condition to the professional nurse. The 2 Med/Peds Certified Nursing Assitant (CNA) assists with the care of patients ranging from...
1,Regional Marketing Manager,Vishay,Develops a formal marketing plan outlining an appropriate marketing strategy for selling to key accounts. Coordinates the marketing efforts for a product group....
9,TV Line Producer,zulily,"This will include partnering with various production companies to create new scripts, select footage and music and hire freela nce voice over artists...."
9,Animator,National Center for Missing & Exploited Children (NCMEC),"The Animator is responsible for designing and developing 2D and 3D content for web, television, interactive and print projects...."
10,Cardiology Test Nurse,Lifespan,Conforms to the Code of Professional Nurses. Graduate from an accredited School of Nursing with current license to practice as a Registered Nurse in the State...
19,Construction Laborer,Austin Materials,Summary/Objective The construction laborer performs tasks involving physical labor at highway and heavy construction projects....
23,Intelligence Operations Specialist,Department of the Air Force,"Trains, educates, and tests aircrew on worldwide threats, to include surface-to-air missile (SAM), air-to-air missile (AAM), anti-aircraft artillery (AAA), and..."
19,Fabricator/Welder Helper,Kooks Custom Headers Inc,Pass off parts to helper for grinding and straightening flanges. Receive parts back from helper for final assembly and inspection for quality control....
1,"Senior Marketing Campaigns Manager, North America Hardware Marketing",Oracle,"Senior Marketing Campaigns Manager, North America Hardware Marketing. This will include demand generation, brand awareness, events, field marketing, web/online..."
22,Freight Broker,Sunbreak Logistics,Supply Chain / Freight Brokerage:. A new logistics company is looking for a motivated and experienced freight broker to join and to grow in a great team....
5,Public Health Specialist III,State of Oklahoma,"A bachelor’s degree with a major in public health, environmental health, environmental science, physical science, natural science, biological science,..."
11,Physical Therapy Aide,All Star Physical Therapy,Responsibilities include: setting up treatment areas cleaning up following treatment sessions aiding physical therapist during patient sessions Job Type:
10,Dental Assistant,Smile Time Kids,"We are opening our pediatric practice in Richmond, IN in April 2016. We are looking for dental assistants(part time) and business assistants(full time)...."
9,Full Time Artist,Lisa Frank Inc,"When you were growing up, did all your school supplies HAVE to be Lisa Frank? Are you creative, energetic, and hardworking? This might be the job for you!"
13,Bartender - Toms River Chili's,Chili's,"You know how to manage the back bar. Providing an enjoyable bar experience for every Guest. A duck walks into a bar and – oh, wait...."
16,PT Grocery Associate,Food Lion,Provide quality customer service to our customers through the Grocery Department. Engage and interact with customers to create a positive shopping experience....
8,Substitute Instructional Aide,San Mateo Union High School District,"Assist the classroom teacher to set up materials or education lessons; Under general supervision, reinforce lessons presented by the classroom teacher by..."
1,University Gallery Events Manager,Rochester Institute of Technology,"Coordinate the University Gallery space for events and exhibits including the hours of operation, maintenance of University Gallery policies, supplies, and..."
8,Assistant Teaching Professor,Worcester Polytechnic Institute,"The Mathematical Sciences Department currently has 28 tenured/tenure-track faculty members, 9 postdoctoral scholars, 5 teaching professors and features a..."
11,Health Center Associate - Mobile,Planned Parenthood Southeast,Documents ultrasound in medical record. Assures lobby is neat and orderly throughout the day Explains medical tests and procedures and obtain informed consent...
18,FORESTRY TECHNICIAN (TIMBER STAND IMPROVEMENT),Department Of Agriculture,USDA Forest Service. Forest Service Day Care facilities are not available. A career with the Forest Service will challenge you to manage and care for more than...
3,"Quality Assurance Automation Tester at Phoenix ,AZ, Local Preferred",West Coast Consulting LLC,"Hello, Kindly go through the requirement and let me know if you are comfortable with this requirement mentioned below. Job Title : Quality Assurance"
5,Physical Science Technician,Department Of Agriculture,The Functional Foods Research Unit creates new processing technologies to enhance the performance of agricultural materials in existing applications and...
12,Surveillance Officer Full Time,Harrah's Ak-Chin,"The Surveillance Officer assures the overall safety of guests, employees and the property as a whole. Conducts surveillance observation on designated areas both..."
23,Range Operations Specialist (PD D1134000),Department of the Army,"Officer, Not to Exceed O-3/ CPT, Warrant, Enlisted. Small arms, mortars and field artillery rockets or cannons...."
5,Physical Therapy Aide,All Star Physical Therapy,Responsibilities include: setting up treatment areas cleaning up following treatment session aiding physical therapist during patient sessions Job Type:
11,Personal Care Aide,Archangel Personal Home Care,Immediate needs for LIVE-IN aides located in Lackawanna County. Please call 570-507-9420 to schedule interviews....
21,Sheet Metal Fabricator,Arktura LLC,"Ability operate fabrication equipment, Drill presses, Shears, riveters etc. • Attention to detail a must...."
14,Housekeeping/Laundry Aide,Safire Care,"Description Position: Housekeeping/Laundry Aide Hours: FT, PT Available Shift: Day and Evening Shifts Sheridan Manor provides a range of services,"
4,Mechanical Design Engineer,Hydra-Electric Company,Formulate conceptual design of aeronautical or aerospace products or systems to meet customer requirements. The Candidate will be responsible for product design...
5,Environmental Specialist I,PeopleFirst Florida HR,"ENVIRONMENTAL SCIENTISTS AND SPECIALISTS, INCLUDING HEALTH. Knowledge of plant and animal living tissue, cells, organisms, and entities, including their..."
2,Entry Level Quality Assurance Analyst,National Software Management,"*Entry Level Quality Assurance Analyst* Under direct supervision, the Quality Assurance Analyst verifies that software changes submitted by developers"
16,Cashier / Server Immediate Openings Available,Louis Pappas Fresh Greek,"Here are some keys to being a successful Cashier with us:. McMullen Booth Rd Clearwater, FL 33761, Monday through Friday from 3pm - 5pm...."
20,Master Mechanic / Technician Auto Repair,YourMechanic,Excellent customer service skills. Complete set of basic automotive tools. Earn up to $55/hr as a mobile mechanic*....
14,Custodial Worker (Janitor) MWR 03-16,"Naval Air Station - JAX, MWR","Deep cleaning may include defrosting refrigerators and freezers, cleaning windows (interior and exterior), replacing and/or cleaning drapes/curtains, moving..."
20,"Automotive Body Repairer, Fiberglass/Welder",The Logistics Company,The Repairer applies and spreads body filler manually to reestablish surface. Two years related experience. The Automobile Body Repairer mixes polyester resin...
7,District Court Clerk II - O'ahu,Hawaii State Judiciary,Authors the official court record in a court of limited jurisdiction for District Court trial proceedings  Prepares documents ordered by the court
14,Greenskeeper,Heritage Palms Golf Club,*Summary* Assists in a general range of activities involved in golf course maintenance and construction. The individual should be able to perform semi-skilled
19,Plumber,Los Angeles Unified School District,A Los Angeles City Journeyman Plumber License OR a Los Angeles County Certificate of Registration as a Journeyman Plumber....
5,Animal Care Supervisor,University of Colorado,"Animal Facility, implementing the animal care procedures and policies. Care for a variety of species of small laboratory animals used by scientists...."
17,Administrative Associate Round Rock TX,Dell,The Administrative Sr. Coordinates office functions with other departments. We are currently seeking an Administrative Sr....
9,Play-by-Play Announcer,Pittsburgh Pirates,"This position is for a play-by-play announcer for the Pittsburgh Pirates. Plan, prepare, present and perform as a play-by-play announcer on Pirates television..."
21,Sewing Machine Operator,"DI, LLC","This individual will operate machines that are either single or double needle, perform blind stitch, serge, or other specialized operations...."
6,Elementary Counselor 846 (2016-2017),"Kansas City, MO School District","The elementary counselor is a member of the district’s guidance function, charged with providing a comprehensive guidance program for students in grades K-6...."
20,Service Technician (Mechanic),"Franklin Equipment, LLC","The individual will maintain and repair equipment offered by Franklin Equipment to include Construction and Agricultural (small equipment, aerial, dirt, farm,..."
15,Beauty Artist,Benefit Cosmetics,Essential Duties and Responsibilities -Customer Service- · Customer is the number one focus · Greet customers in 30 seconds or less · Follow the 8 Step
15,Valet Attendant: PT & FT- Lisle, Downers Grove,"HealthPark ValetEnjoy working in a social environment? A leader in parking services, HealthPark Hospitality provides its healthcare partners comprehensive parking solutions"
13,Bartender / Barman / Mixologist,Ristorante Capellini,"Bartender, barman, barkeep, barmaid, and mixologist please apply. Bartenders are responsible for positive guest interaction while accurately mixing and serving..."
22,Hiring CDL-A Drivers for L/P,Network 1,"No commercial transportation related felony, theft or larceny conviction. LEASE OPERATORS NEEDED NOW!!*...."
18,Mine Safety and Health Inspector (Coal),Department Of Labor,This position has promotion potential to GS-12 for Underground and Electrical Inspectors and the GS-11 for Surface Inspectors....
2,Claims Auditor,Broadpath,Medical Claims Auditors perform routine and complex audits to identify inaccurate claims adjudication. Knowledge of claims and the ability to recognize patterns...
3,SQL Application Developer - IS Analyst,NewYork-Presbyterian/Columbia University Medical Center,"Advanced proficiency in programming languages (Visual Basic, C, C++, C#, Perl, Java), Applications (Healthcare IS, Allscripts SCM, Enterprise) and/or Database..."
17,Retail Banker/ Teller - Center,Woodforest National Bank,"WOODFOREST NATIONAL BANK. Performs opening, closing, and other branch servicing duties such as cash and vault balancing;..."
18,Park Officer,State of Ohio,Major Worker Characteristics:. Applicants can view the status of this position by logging into their user profile on the Ohio Hiring Management System [OHMS]...
22,Transportation Helper,United Airlines,"Now taking off: Your career Where do you want your career to take you? Chances are you can get there with United Airlines. Our environment is open, honest,..."
13,Cook - Banquet Kitchen,Hilton Hotels & Resorts,Banquets and Catering. A Cook with Hilton Hotels and Resorts is responsible for preparing food items in accordance with recipes and established standards....
7,Legal Analyst,CP Homes,"The role of the Legal Analyst is to support, manage and administer the day-to-day functions of a corporate legal department...."
12,Security Operations Manager,Google,You believe that providing effective security doesn't come at the expense of customer service - you will be our bodyguard (and our long lost pal)....
16,Cashier,Stores - Kmart Hourly,"Responsible for providing excellent customer service, efficiently and accurately completing sales and service transactions at the cash wraps, as well as handle..."
23,Cavalry Scout,National Guard,"Cavalry Scout training never really stops, though. This enables the officer to make informed decisions. As a Cavalry Scout, you are the eyes and ears of the..."
