job_field_id,title,company,description
5,NATURAL RESOURCES PROGRAM TECHNICIAN,Arkansas Game & Fish Commission,"Knowledge of agricultural methods and basic land laws. Conducts agricultural and forest management activities on wildlife management areas, including preparing..."
16,Digital Sales Account Executive,The Morning Call Media Group,"Manages advertising sales revenue and account management targets. Our digital sales account executives are responsible for selling advertising banners, programs..."
15,Lobby Concierge,Beach Activities of Maui,"The Concierge is knowledgeable about the local area and is the expert on the attractions, tours and activities that we sell.Must be flexible with scheduling and..."
14,Janitor - Cleaning Technician - FULL TIME - 84095,Wingfoot Services,"Janitorial, janitor, cleaning specialist, carpet cleaning, floor care technician, buffing, part time, supplemental income, laborers, landscaping, supervisor,..."
23,"Analyst, Operations",General Dynamics Information Technology,Extended Air Defense Simulation (EADSIM). Battle Command Sustainment Support System (BCS3). Air and Missile Defense Work Station (AMDWS)....
22,Air Traffic Control Operator,National Guard,The skills you learn as an Air Traffic Control Operator will qualify you to work in civilian air traffic control towers and centers at airports and airfields....
20,HVAC Installer/Technician,Express Air Sytems,Basic knowledge of standard code requirements of air conditioning systems. \*\*\*\*\*Minimum requirements for Installers\*\*\*\*\*....
12,Transportation Security Officer (TSO),Trinity Technology Group,TSOs must take the computerized Screener Assessment Battery. Repeatedly lift and carry baggage weighing up to 70 pounds…
9,Graphic Artist,IGT,"Maya, Autodesk 3D Studio Max). This position is the development and timely delivery of high quality 2D and 3D game...."
10,Anesthesiologist,"UF, Department of Anesthesiology","Department anesthesiologists practice at UF Health hospitals in Gainesville, FL at the University of Florida alongside 62 faculty anesthesiologists, 78..."
19,Drywall Hanger/Installer,EncoreHR Staffing,"Includes lathers who fasten wooden, metal, or rockboard lath to walls, ceilings or partitions of buildings to provide support base for plaster, fire-proofing,..."
21,Production Operator - 2nd shift,Bostik Inc.,About Bostik - Smart Adhesives. As a production operator at Bostik you will be in a batch making/mixer operator position for a competitive manufacturing...
8,Tutor or Teacher - Elementary Math,,"We are looking for math tutoring for our 4th grader. Improve grades, get ahead and increase confidence. Elementary math Tutoring &amp; Teaching opportunities..."
4,Mid-Level Ground Control Station Engineer,GENERAL ATOMICS,Job ID# 6452BR Company General Atomics Aeronautical Systems Title Mid-Level Ground Control Station Engineer Job Category Engineering City San Diego State...
3,Data Scientist,Humana,"Bachelor’s Degree in Mathematics, Computer Science, Actuarial Science or related field. Collaborate with other professionals including Actuaries, Mathematicians..."
2,Cost Accountant III,Weatherford,JOB DESCRIPTION JOB SCOPE: This position will be responsible for the day to day understanding of the plant’s financial performance. The position will also be
17,Telephone Operator,The Broadmoor,"Monitors 911 Alert System. Operates the switchboard to relay incoming, outgoing, and interoffice calls by performing the following duties:...."
1,Regional Marketing Manager,Vishay,Develops a formal marketing plan outlining an appropriate marketing strategy for selling to key accounts. Coordinates the marketing efforts for a product group....
11,2 Med/Peds Certified Nursing Assistant,Riverside Medical Center,Reports changes in patients' condition to the professional nurse. The 2 Med/Peds Certified Nursing Assitant (CNA) assists with the care of patients ranging from...
7,Administrative Law Judge,New Mexico State Personnel Office,"Administrative Law Judge, Adjudicator Advanced. This position will conduct administrative hearings on behalf of the State Personnel Board concerning..."
13,Kitchen Cook,SMG World - Tucson Convention Center,Banquet facility preparing meals for large events:. Fulfilling the service per each Banquet Event Orders (BEO)....
6,Senior Addiction Counselor,NYC Health + Hospitals,The Senior Addiction Counselor will be responsible for assisting the consumer with activities relevant to an individual's rehabilitation goals....
18,Agricultural & Standards Inspector - I,Placer County,"Recruitments for Agricultural and Standards Inspector I, Agricultural and Standards Inspector II, and Agricultural and Standards Inspector, Senior are being..."
19,Painter/Blaster,CTR Group,"CTR is currently seeking 1st class Painters Location - Pascagoula, MS Industry - Marine Responsibilities: • Perform blasting and painting utilizing marine"
4,CAD Drafter,Raytheon,"Architectural, mechanical, civil, security, structural, and electrical engineering. This drafter position is that of a contributor and will be in direct support..."
6,FAMILY COURT COUNSELOR,"Dallas County, TX","Must be independently licensed in the State of Texas as a Licensed Professional Counselor (LPC), Licensed Marriage and Family Therapist (LMFT), Licensed Master..."
11,Rehab Aide,Accelerated Rehabilitation Centers,Previous Clinical Aide experience preferred. The Rehabilitation Aide will assist the Office Coordinator and clinician by performing requested administrative and...
5,Environmental Specialist I,PeopleFirst Florida HR,"ENVIRONMENTAL SCIENTISTS AND SPECIALISTS, INCLUDING HEALTH. Knowledge of plant and animal living tissue, cells, organisms, and entities, including their..."
23,Air Defense Artillery Officer (14A),U.S. Army,Job training for an air defense artillery officer includes completion of the Air Defense Artillery Officer Basic Course....
17,Bookkeeping Clerk,John Q. Hammons Hotels & Resorts,"Must have 1-2 years in accounting , customer service and/or bookkeeping experience or equivalent. Perform any combination of routine calculating, posting, and..."
11,Health Center Associate - Mobile,Planned Parenthood Southeast,Documents ultrasound in medical record. Assures lobby is neat and orderly throughout the day Explains medical tests and procedures and obtain informed consent...
8,Librarian/Archivst - Part Time,Native Hawaiian Veterans,"Native Hawaiian Veterans, LLC is a Native Hawaiian Owned, Service Disabled Veterans Owned Small Business (SDVOSB), SDB, SBA 8(a), MBE, UDBE, and EEO/W/M/Vet"
10,Health Technician,Department of Veterans Affairs,Assists the audiologist in various procedures of the program including:. Utilizes electro-acoustical diagnostic equipment to assess the electronic functioning...
17,Administrative Secretary RB # 15 - 102,Buffalo Public Schools,"Administrative Secretary – Permanent. The Administrative Secretary performs a wide variety of complex responsible clerical, secretarial and administrative tasks..."
4,ARCHITECT/ENGINEER EAS,United States Postal Service,"Knowledge of architecture, engineering, and building construction sufficient to review and inspect repair and alteration...."
19,Plumber,Los Angeles Unified School District,A Los Angeles City Journeyman Plumber License OR a Los Angeles County Certificate of Registration as a Journeyman Plumber....
1,General Manager - Chesapeake Energy Arena -SMG,SMG,"Manages subordinate Directors and Managers who supervise employees in the Finance, Marketing, Operations, Food &amp; Beverage Departments or other facility..."
14,Housekeeping Tech,Brentwood Behavioral Health of Louisiana,"Patients, staff and visitors. The Housekeeping Tech will ensure. The maintenance of a clean, healthy, pleasant environment for...."
21,Sewing Machine Operator,"DI, LLC","This individual will operate machines that are either single or double needle, perform blind stitch, serge, or other specialized operations...."
1,Advertising Project Manager,Innocean USA,The position requires a minimum of 5 years of well-rounded project management experience in advertising or a related business....
18,Lead Fish Technician,Hubbs-SeaWorld Research Institute,Hatchery building is a damp environment. Stay current with latest technologies related to fish rearing. Assist in all other aspects of fish husbandry as needed....
15,Companion Care / Personal Care - Waukesha,"FirstLight Home Care, Brookfield, WI","Companion Care/ Home Health Aide*. In addition to providing a flexible schedule, we offer potential for advancement, award programs, and opportunity for..."
19,Maintenance Worker - Road Maintenance,"Collier County, FL","Performs light construction projects; Operates a variety of machinery, equipment, and tools associated with division projects, which may include a utility truck..."
8,LANGUAGE ARTS TEACHER,Academy of Hope Adult PCS,"Bachelor's degree and secondary or adult education experience required. Teach a course load of at least 2 classes per day of adult literacy, basic education,..."
12,Security Operations Manager,Google,You believe that providing effective security doesn't come at the expense of customer service - you will be our bodyguard (and our long lost pal)....
12,Security Guard,Bannerman,"Bannerman is looking for professional security guards, and bouncers. Must be self disciplined with a high level of customer service and professionalism...."
18,Wood Mill Operator 2,The AMES Companies,"The Wood Mill Operator 2 works under supervision of foreman encompassing the skills of Equalizer, Paint Line Operator, Stacker and Inspector...."
5,Chemistry Technician - Life Sciences,Xylem,"Xylem’s analytics businesses are leading manufacturers of premium field, portable, laboratory and online analytical instruments used in water and wastewater,..."
14,Residential Lawn Specialist 100889,TruGreen,As a Lawn Specialist with the #1 lawn care company you will be providing regularly scheduled landscape services within your route on a daily basis....
16,PT Grocery Associate,Food Lion,Provide quality customer service to our customers through the Grocery Department. Engage and interact with customers to create a positive shopping experience....
14,Maintenance Worker II - PUBLIC WORKS,City of Port Orange,Clean grounds and remove litter. Experience in operating automotive or maintenance equipment. Provide routine and basic maintenance and repair to small...
19,Heavy Equipment Operator,,"Must operate loaders, trucks, rollers, backhoes, mowers, graders, and other. Loads and unloads sand, dirt, asphalt, rock, and other materials as needed;..."
5,Biologist,Department Of Agriculture,"Participates as a team member, while also training, mentoring, and setting work priorities for a fluctuating team of Biological Science Technicians, students,..."
4,Project Engineer,"Vanir Construction Management, Inc.","Or, non-degree holders must possess 4+ years of experience in a construction, engineering or architectural related position...."
6,Resident Camp Counselor,Busch Gardens Tampa,Provide guidance to campers keeping them on task and behaving appropriately. Must be at least 21 years old in order to drive camp rental vehicles....
10,Recreational Therapist - Full Time - Baylor Rehab - downtown Dallas,Baylor Institute for Rehabilitation,Current national certification from NCTRC as a Certified Therapeutic Recreation Specialist (CTRS). The Therapeutic Recreation Specialist/Recreational Therapist...
8,7th & 8th Grade Social Studies Long Term Substitute Teacher,Willamette Leadership Academy,"We are looking for a dynamic and passionate social studies teacher to teach two periods of 8th grade US History, 2 periods of 7th grade Intro to Western..."
11,Physical Therapy Aide,All Star Physical Therapy,Responsibilities include: setting up treatment areas cleaning up following treatment sessions aiding physical therapist during patient sessions Job Type:
21,Manufacturing Assembler,Manufacturing Supplier,Ideal candidates will have some mechanical aptitude for assembling plastic or metal parts by hand. Advantage Resourcing is currently seeking Manufacturing...
9,TV Line Producer,zulily,"This will include partnering with various production companies to create new scripts, select footage and music and hire freela nce voice over artists...."
5,Veterinary Medical Officer,Department Of Agriculture,"Masters degree in an area of specialization, including but not limited to, animal science, avian medicine, food safety, infectious diseases, veterinary clinical..."
1,University Gallery Events Manager,Rochester Institute of Technology,"Coordinate the University Gallery space for events and exhibits including the hours of operation, maintenance of University Gallery policies, supplies, and..."
17,Retail Banker/ Teller - Center,Woodforest National Bank,"WOODFOREST NATIONAL BANK. Performs opening, closing, and other branch servicing duties such as cash and vault balancing;..."
21,Blow Mold Machine Operator,Consolidated Container Company,"Blow Mold Machine Operators report directly to Maintenance/ Production Manager. The Blow Mold Machine Operator will operate blow-mold, grinders, trimmer..."
9,Full Time Artist,Lisa Frank Inc,"When you were growing up, did all your school supplies HAVE to be Lisa Frank? Are you creative, energetic, and hardworking? This might be the job for you!"
11,DENTAL ASSISTANT,Department of Veterans Affairs,Dental Assistant/ Functional Statement. Sets up operatory for planned dental procedure and cleans dental unit for timely turnover....
17,Administrative Associate Round Rock TX,Dell,The Administrative Sr. Coordinates office functions with other departments. We are currently seeking an Administrative Sr....
6,Staff Development Coordinator,Sayre Christain Village,"Conductscertification or training programs for Nursing Assistants. Frequentlycommunicates with employees, residents, family members, physicians etc...."
7,Paralegal Specialist,Department Of Justice,Specialized experience is defined as experience performing paralegal or legal work which demonstrates a basic knowledge of legal research and the ability to...
13,Bartender / Barman / Mixologist,Ristorante Capellini,"Bartender, barman, barkeep, barmaid, and mixologist please apply. Bartenders are responsible for positive guest interaction while accurately mixing and serving..."
23,Intelligence Operations Specialist,Department of the Air Force,"Trains, educates, and tests aircrew on worldwide threats, to include surface-to-air missile (SAM), air-to-air missile (AAM), anti-aircraft artillery (AAA), and..."
11,Residential Care Aide,Westminster Village.Spanish Fort AL,RESIDENTIAL CARE AIDE*. Must be registered and in good standing with the Alabama Nurse Aide Registry or currently enlisted in an approved nursing assistant...
22,CDL Class A Drivers wanted Immediately!,"Champion Materials, Inc.","Now hiring CDL Class A Truck Drivers to haul bulk cement products across the Northeast, Mid Atlantic region, and Ontario...."
20,Truck/Trailer Mechanic,Snider Fleet Solutions,Truck/Trailer mechanic skills:. Perform valve and injector overhead adjustments according to OEM procedures. We have an immediate opening for a *Tractor Trailer...
18,Forestry Technician (Lookout),Department Of Agriculture,Workers Compensation Separation:. A career with the Forest Service will challenge you to manage and care for more than 193 million acres of our nation's most...
13,House Cook/Chef,Delta Zeta at Univ. of Northern Colorado,"Cook, Prep Cook, Chef, Line Cook, Nutritional Services, Cafeteria:. Responsible for preparing meals taking into consideration nutrition, food availability and..."
21,Shop Assembly and Fabrication,Western Window Systems,*Western Window Systems* is one of the fastest growing and most successful Window Manufacturing Companies in the nation. *Overview* The Warehouse Shop
22,Freight Broker,Sunbreak Logistics,Supply Chain / Freight Brokerage:. A new logistics company is looking for a motivated and experienced freight broker to join and to grow in a great team....
4,RET Engineer,Intel,"Scanning Electron Microscopy, Atomic Force Microscopy, etc.). The RET Design Engineer will deliver test masks, test patterns, sampling strategies, process..."
9,Actor/Actress,Nine30 Media,"We are looking for actors to become a member of our marketing team. Our ideal candidates would have a strong portfolio, a heavy social media presence, and a..."
18,FORESTRY TECHNICIAN (TIMBER STAND IMPROVEMENT),Department Of Agriculture,USDA Forest Service. Forest Service Day Care facilities are not available. A career with the Forest Service will challenge you to manage and care for more than...
21,Plastics Mold Maker,TERMAX CORPORATION,"Craft precision tools by studying specifications, engineering blueprints, tool orders, and shop data to make, alter, or repair tools, jigs, fixtures, molds, or..."
14,Landscape and garden maintenance worker,Lawn Love,\*You must have at least one year of professional lawn care experience. \*You must have all the equipment needed to perform a full lawn care service....
20,Auto Body Painter,DriveTime,What Drives You? Making your mark with a company known for excellence? A Chance for real work/life balance? Collaborating and thriving as part of a team?
20,Service Technician (Mechanic),"Franklin Equipment, LLC","The individual will maintain and repair equipment offered by Franklin Equipment to include Construction and Agricultural (small equipment, aerial, dirt, farm,..."
23,Field Artillery Officer (13A),U.S. Army,Job training for a field artillery officer requires completion of Basic Officer Leaders Course I &amp II and the Field Artillery Officer Basic Course.…
16,Sales Associate/Cashier (part-time),Bed Bath & Beyond,Currently hiring part time sales / cashiers / stock associates and bridal consultants. All shifts available....
22,Hiring CDL-A Drivers for L/P,Network 1,"No commercial transportation related felony, theft or larceny conviction. LEASE OPERATORS NEEDED NOW!!*...."
19,Fabricator/Welder Helper,Kooks Custom Headers Inc,Pass off parts to helper for grinding and straightening flanges. Receive parts back from helper for final assembly and inspection for quality control....
18,Animal Agriculture Management Associate 2016,Cargill,"The Animal Agriculture Management Associate role enables the individual to become familiar with the workflow of animal agriculture operations, and to develop..."
12,Chief of Police,City of Andrews,"The department consists of 19 sworn peace officers, 9 full-time paramedics, an Animal Warden and Executive Assistant, with combined budgets totaling over $3M...."
5,Seafood Innovation Scientist,Oregon State University,"80% AGRICULTURAL EXPERIMENT STATION. Serve on Coastal Oregon Marine Experiment Station, College of Agricultural Sciences, Department of Food Science and..."
2,Athletics Business Manager,University of Indianapolis,"Interpersonal skills to work with internal groups (coaches, students-athletes, faculty, and staff) as well as external groups (officials, bus and rental car..."
15,Beauty Artist,Benefit Cosmetics,Essential Duties and Responsibilities -Customer Service- · Customer is the number one focus · Greet customers in 30 seconds or less · Follow the 8 Step
7,Senior Appellate Law Stenographer,NYS Unified Court System,"Acting as liaison with Justices, court attorneys and administrative personnel with regard to assignments; Responsible for training and supervising Appellate Law..."
20,Master Mechanic / Technician Auto Repair,YourMechanic,Excellent customer service skills. Complete set of basic automotive tools. Earn up to $55/hr as a mobile mechanic*....
23,Range Operations Specialist (PD D1134000),Department of the Army,"Officer, Not to Exceed O-3/ CPT, Warrant, Enlisted. Small arms, mortars and field artillery rockets or cannons...."
