job_field_id,title,company,description
2,Analyst,Employment Enterprises Inc.,"Temporary Solutions is currently seeking an Analyst for a position in Warrenton, Virginia. We would ideally like someone with a property insurance background...."
3,Senior IT Support Specialist,Greystone,"Strong technical knowledge of MS Windows, desktop support and PC hardware, setup and configuration - People management experience and demonstrated leadership..."
4,Agricultural Engineer,Department Of Agriculture,"Or equivalent doctoral degree in Agricultural Engineering, Biological Engineering, or Agricultural and Biological Engineering...."
16,Sales Consultant,K. Hovnanian Companies,"Successful candidate must maintain a valid driver's license. The ability to provide the highest level of customer service, including exceptional communication..."
8,High School Math,Fauquier County Public Schools,"Plans, coordinates, attends, and chaperones field trips as appropriate. Motivates students to develop an interest in and an appreciation of math;..."
14,Housekeeping Staff (Part-Time),Poplar Springs Inn & Spa,"Poplar Springs - 21 Room Inn, Fine Dining Restaurant and full service Spa is seeking cleaning staff to perform general housekeeping duties to include, but not..."
11,"Dental Assistant, Warrenton","Heartland Dental, LLC","X-ray certification required in the state for which you apply. Potentially out of state. The Dental Assistant will also organize and maintain lab equipment,..."
15,Warrenton area CAREGiver,Home Instead Senior Care,"You must have your own vehicle and a valid driver's license as you will be responsible for driving clients to appointments, etc...."
1,Practice Manager,HCI-EBS,Design and implementation of a strategic marketing program. Candidates are expected to be comfortable acting as a managerial liaison between physician and staff...
10,Staff Nurse,South Shore Medical Center,Provide quality care to South Shore Medical Center patients. Administer prescribed medications and treatments. Prepare patient for office visit. Respond to
10,Recreational Therapist - Full Time - Baylor Rehab - downtown Dallas,Baylor Institute for Rehabilitation,Current national certification from NCTRC as a Certified Therapeutic Recreation Specialist (CTRS). The Therapeutic Recreation Specialist/Recreational Therapist...
10,"Technician, Surgical Services-PRN",Fauquier Health System,Completed a formal Surgical Technician program with certification or equivalent training. The Surgical Services Technician assists with the total care given by...
16,Sales Representative - Worcester,Commonwealth of Massachusetts,Instruct Sales Agents on the use of successful marketing and sales techniques. Provide motivation to Sales Agents and recommends incentive plans intended to...
13,Pizza Hut Server,Pizza Hut,"It’s about being independent and having fun, making new friends and earning extra cash. And independently-owned franchised or licensed locations may have..."
8,Basic Skills/Learning Center Non-Credit Instructor,North Orange County Community College District,"Teach pre-college courses in class and lab settings including, but not limited to, adult basic education (ABE), career technical education, adult secondary..."
1,Knight Transportion - Hiring Company Truck Drivers,Knight Transportation,We also pair each truck driver with a dedicated and caring driver manager who learns about your lifestyle and needs to help you find the trucking position that...
17,Asset Protection/Loss Prevention,The Home Depot,"They utilize tools to minimize loss to the Company, including but not limited to identifying incidents of theft and fraud, reviewing CCTV and exception reports,..."
18,Log Yard Scaler,Church & Church Lumber Company,Must be experienced with running equipment such as a log loader. Good people person with management and communication skills....
1,Restaurant Assistant General Manager - Taco Bell,BurgerBusters Inc,"Valid Drivers' License. You also assist the RGM with facility maintenance, finding, hiring and developing great Team Members and Shift Leads and making sure..."
22,Part Time 3rd Shift Stocker North Rock,Harris Teeter,"While performing the duties of this job, the associate is frequently exposed to wet, hot, or cold conditions and moving mechanical parts...."
5,Chemistry Technician - Life Sciences,Xylem,"Xylem’s analytics businesses are leading manufacturers of premium field, portable, laboratory and online analytical instruments used in water and wastewater,..."
1,Management,Panera Bread Franchise (Blue Ridge Bread),Our bakery-cafes are focused on taking care of our guests. Please apply online and a Manager may be in touch if an opportunity matching your qualifications...
3,IT Support Supervisor (Level 2 & 3),TransTech LLC,"IT related college degree, technical school degree or Microsoft certification preferred. Strong technical knowledge of MS Windows, desktop support and PC..."
11,Health Care Assistant or Bilingual Health Care Assitant - LVN,Hanford Elementary School District,HEALTH CARE ASSISTANT. Certified Nursing Assistant (C.N.A.). See Health Care Assistant Job Description. Addendum to Health Care Assistant Job Description....
17,Office/Store Support,The Home Depot,"Facilitating the maintenance and repair of certain computer system related equipment such as cash registers, scanners, scan guns, monitors, signature capture..."
1,All Management levels avialable,McDonalds,"This position works with other store management to manage people, product, equipment, sevice and cleanliness of the restaurant...."
19,Painter/Blaster,CTR Group,"CTR is currently seeking 1st class Painters Location - Pascagoula, MS Industry - Marine Responsibilities: • Perform blasting and painting utilizing marine"
8,Before & Aftercare Teacher,Children of America,Has experience with School Age and state credentials and MUST have the state required registry.*. This approach concentrates on allowing each child to learn...
12,Surveillance Officer Full Time,Harrah's Ak-Chin,"The Surveillance Officer assures the overall safety of guests, employees and the property as a whole. Conducts surveillance observation on designated areas both..."
13,Cook - PRN - Hours vary,Fauquier Health System,"SERVE SAFE certification. Course work/completion from an accredited culinary school. In the absence of the team leader, the cook will supervise the operations..."
21,eCommerce Fulfillment Associate,Stage Stores,Willingness to consult multiple resources to obtain answers. Troubleshoot and problem solve when necessary....
1,Store Manager,Stage Stores,"Work with district manager to develop and execute plans for store to improve profitability, greater productivity and efficiency...."
23,Field Artillery Officer (13A),U.S. Army,Job training for a field artillery officer requires completion of Basic Officer Leaders Course I &amp II and the Field Artillery Officer Basic Course.…
20,Plant Maintenance Mechanic - Night Shift,Vulcan Materials Company," Diagnose problems and perform mechanical repair. Assists plant personnel with repair and maintenance. Mechanical repairs to various types of crushers, screens..."
23,Flight Support,U.S. Navy,"Operate and maintain hydraulic and steam catapults to launch aircraft. As an Officer, you can expect to:. Instead, she refuels fighter jets on aircraft carriers..."
10,"Biometric Screener - Warrenton, VA",Provant,"Medical license or certification required. Provant Health Solutions hires individuals on a contract/per diem basis, provides excellent hourly wages, and further..."
15,Dog Trainer / Apprentice,Petco,Our Petco family is made up of pet lovers who unselfishly put the needs of others before their own. Previous experience teaching positive reinforcement dog...
17,Banking Services Representative - Bakersfield,Rabobank,Knowledgeable regarding all bank products. Assists with reception and vault/merchant attendant duties. Ability to comprehend and interpret Bank policies and...
7,Attorney Advisor (General),Department of the Air Force,"Constitutional, civil, criminal, labor law; Provides SME authoritative advisory, consultation, and collaboration in the areas of ethics, medical and physical..."
13,Restaurant Shift Leaders - Bealton,"Five Guys Enterprises, LLC",Come join the Five Guys team!Five Guys is a family owned business that really cares about the growth and success of their employees....
11,CNA/Medication Aide-PRN-7a-3p,Fauquier Health System,Virginia State Certified Nursing Assistant License. Virginia Registered Medication Aide License. The Certified Nursing Assistant/Medication Aide assists with...
11,Home Health and Hospice Aide Job,HCR ManorCare,"Minimum of one year experience as a Home Health or Hospice Aide, or is currently enrolled as a nursing student who has had a minimum of 6 months clinical..."
16,Keyholder - Commissioned - Northrock Shopping Center,Jos. A Bank,"Understanding merchandise features, marking and fitting techniques and fashion trends to determine what type of garments are desired and advise customers about..."
14,Pest Route Technician,Ecolab,"Previous pest elimination industry or route experience preferred &quot;Certified Pest Control Technician, Commercial Pest Control Technician, Exterminator, Pest..."
17,Reimbursement Specialist,WRB Communications,Complete accurate entry of billing information to ensure timely payment and avoid delay in patient therapy....
6,Resident Camp Counselor,Busch Gardens Tampa,Provide guidance to campers keeping them on task and behaving appropriately. Must be at least 21 years old in order to drive camp rental vehicles....
22,CDL-A Company Truck Drivers (OTR Reefer and Dry Van),J & R Schugel,"Must have valid Class A commercial driver’s license. When you sign on for J&amp;R Schugel company truck driving opportunities, you’ll see advantages like excellent..."
13,Food Service Worker,TrustHouse Service Group,"Such as tray line, dish room, cafeteria and storeroom. The Food Service Worker is responsible for routine food service tasks in the kitchen, cafeteria, dining..."
1,Pizza Hut Shift Manager,Pizza Hut,"You set high standards for yourself and the people you work with – you love keeping things clean, safe and fun for the team and the customers You want to learn..."
10,Telemedicine Physician,"MeMD, Inc.",MeMD is seeking a Board-Certified Physician possessing a Florida medical license that is interested in joining our team of Telemedicine Providers....
16,Counter Manager,Stage Stores,"Scheduling, inviting by telephone and cards, displays at counter and throughout exchange. Maintain standards for counter cleanliness...."
15,Assistant Salon Manager,Hair Cuttery Salon,"BASIC REQUIREMENTS - MUST HAVE A COSMETOLOGY LICENSE in the state you are applying for, eligibility to work in the United States, 6+ months experience in a..."
15,Barber,GoodBuddyz BarberShop,Chairs available for registered and apprentice barbers at 3-chain barbershop. Build your own clientele or bring your own....
11,CNA Assisted Living & Memory Support-PRN-Hours vary,Fauquier Health System,VA State Certified Nursing Assistant license. The Certified Nursing Assistant at our assisted living facility assists with patient care throughout nursing areas...
3,Information Systems Security Analyst,TASC,"Must be familiar with NIST Certification &amp; Accreditation (C&amp;A) processes, NIST policies and documents, NIST Risk Management Framework, Federal Information..."
15,nanny,Ashlea H.,"My 3 children (Girl -11, Girl-9, Boy-7) are in need of a nanny as their current one is headed off to college. My son is often headed to soccer practice...."
8,Summer Camp Teacher,Children of America,"Must have a Drivers License. Perform all duties in compliance with State and Local licensing requirements, policies and procedures...."
16,Consultative Sales- Home Improvement,Stores - Sears Hourly,"Selling and servicing customers within one or more departments including Home Improvement, Lawn and Garden, Tools, Sporting Goods;..."
13,Restaurant Manager,Ashby Inn & Restaurant,"Fauquier County high-end restaurant, seeks professional restaurant/front-of-the-house manager. The right applicant must be tactful;..."
3,Data Management Support w/TS/SCI w/Polygraph,"TekStream Solutions, LLC","Performs a variety of general administrative tasks, such as preparing reports and correspondence, coordinating travel and meeting arrangements, answering phones..."
22,Hiring Class A Truckers - OTR & Regional Positions,Barr-Nunn Transportation,Valid Class A CDL. Barr-Nunn has a reputation for respecting its truck drivers and working diligently to anticipate and meet our drivers needs....
2,Marketing Internship Latin America,Cosmetics of France,Provide customer service to the agent zone in terms of material &amp information needed for events trough com. Consolidate and update the Local Makeup Experts &amp
13,PT Frozen Food/Dairy Associate,Food Lion,Provide total customer satisfaction. Ability to complete Computer Based Training (CBT) and Training Aid courses....
20,Custom Window Treatment Installer,Budget Blinds of Warrenton,Valid drivers and a good driving record. No phone calls please!!! Time Management You must have a good driving record and are able to navigate your way from...
17,Teller,The Fauquier Bank,"Accepts deposits, loan payments, credit card deposits and payments. Job requires a higher level of problem solving abilities to find solutions to difficult..."
1,Advertising Project Manager,Innocean USA,Project Manager may support projects for Innocean projects across all U.S. The Project Manager may also lead process improvement initiatives assigned by the...
16,VA Customer Service Representative,Family Dollar,"Key priorities include greeting customers, assisting them with selection of merchandise, completing transactions, and answering questions regarding the store..."
2,Loan Support Residential Mortgage Processor,The Fauquier Bank,"Specialty may be in one loan field, but this position cross-trains for Consumer, Commercial, and Commercial Real Estate processing...."
12,Chief of Police,City of Andrews,"The department consists of 19 sworn peace officers, 9 full-time paramedics, an Animal Warden and Executive Assistant, with combined budgets totaling over $3M...."
13,"Associate, Food Services-PRN-Hours vary",Fauquier Health System,"These functions include, but are not limited to, portion control, delivery and pick up of trays, equipment operation, washing and sanitizing dishware, and cash..."
22,Driver Patient Services Technician,Advanced Home Care,"Must have a valid driver's license, and be able to operate manual transmission vehicle. Health care technician (EMT, Lab Tech, etc), customer support or service..."
16,Sales Executive - Commissioned - Northrock Shopping Center,Jos. A Bank,"Report discrepancies to the manager on duty.Follow the customer rotation as prescribed by management and good customer service.Maintain your own timecard,..."
13,Food Service Attendant,Riverside Health System,"Formal training as a cook preferred. Performs duties related to therapeutic diets and meal services to include, aides in the preparation of preparation of hot..."
1,Program Manager of Operations,"Amazon Fulfillment Svcs, Inc","Advanced degree (MS,MBA) from an accredited university with focus on Industrial Engineering, Operations, Management, Economics, or related areas...."
19,Metal Mechanic,Spencer-Ogden Energy,"Distribute insulating materials evenly into small spaces within floors, ceilings, or walls, using blowers and hose attachments or cement mortar...."
3,IT and GxP Computer Systems Specialist,Booth Welsh Resources,"Automation, Computerized and Vision systems administrator. O Proceed to the validation of the automated and computerized systems (logic security, backup /..."
17,Securities&Doc Admin,"Greystone & Co., Inc.",Our Securities and Document Management department is seeking a highly motivated individual that is capable of handling multiple tasks simultaneously to issue
13,Part Time Starbucks Clerk Northrock Shopping Center,Harris Teeter,"Must be IST or AST certified. Exposed to hot, cool, and extreme cold, moving mechanical parts, fumes or airborne particles, and toxic or caustic chemicals...."
20,Utility Systems Repairer-Operator,Department of Defense, Operate an Energy Management and Control System (EMCS) used to monitor and control all HVAC systems within the facility....
11,"MEDICAL ASSISTANT CLINIC- INOVA Cardiology Warrenton, VA",Inova Fairfax Hospital,Answering calls and providing pertinent information. Fulfills clerical responsibilities as assigned which may include:....
23,Logistics Management Specialist,Department of the Air Force,"Determines type &amp; number of aircraft required for mission deployment/redeployment. Identifies problems/discrepancies to Logistics Officer, unit, &amp; higher..."
10,Health Technician,Department of Veterans Affairs,Assists the audiologist in various procedures of the program including:. Utilizes electro-acoustical diagnostic equipment to assess the electronic functioning...
11,Residential Care Aide,Westminster Village.Spanish Fort AL,RESIDENTIAL CARE AIDE*. Must be registered and in good standing with the Alabama Nurse Aide Registry or currently enlisted in an approved nursing assistant...
20,"Maintenance Mechanic-Remington, Virginia",U.S. Pipe,"Directs and performs complex mechanical repair work &amp; is responsible for the more intricate repair assignments, including hydraulic and pneumatic systems...."
15,Beauty Advisor,Stage Stores,Develop relationships with customers to insure future sales. Polite and courteous to customers and co-workers....
6,Social Worker-MSW-PRN Weekday & Weekends,Fauquier Health System,Masters of Science in Social Work. Experience in health–related field or setting. The Social Worker-MSW provides general social work services and participates...
2,Controller/Accounting Manager,Poplar Springs Inn and Spa,Advanced Degree or CPA license preferred. Design and maintain detailed financial analysis spreadsheets/tools to measure operational performance and aid with...
18,Arborist Climber,Bartlett Tree Expert Co.,"Having a CDL is. Assists with driving, backing, dumping, and parking duties. Strives to improve job skills and develop the potential for upward mobility...."
16,Technology Sales Associate,Staples,"All qualified applicants will receive consideration for employment without regard to race, color, religion, sex, national origin, protected veteran status,..."
21,Sewing Machine Operator,"DI, LLC","This individual will operate machines that are either single or double needle, perform blind stitch, serge, or other specialized operations...."
11,CNA-FHRNC-Full Time-Evenings,Fauquier Health System,Certified Nursing Assistant License. The Certified Nursing Assistant assists with patient care throughout nursing areas under the direction of licensed...
22,CDL-A Truck Driver - Dedicated Runs,Marten Transport,"Our dedicated truck driving opportunities are open to drivers at least 22 years old with a current CDL-A, at least 1 year of recent OTR experience...."
12,BORDER PATROL AGENT,Department Of Homeland Security,Border Patrol Sectors. And pass the Border Patrol Agent Entrance Examination. Being a border patrol agent makes you a valuable member of the federal Law...
22,Experienced CDL-A Company Truck Driver - Teams,Celadon Trucking Services,Must hold a valid CDL Class A license issued by the applicant’s state of residence. Team Driver Jobs are Available for Experienced Company Drivers and Owner...
13,Restaurant Team Member,RubyTuesday,"Whether its part-time or an entire career, we want to make sure you get everything you want out of your Ruby Tuesday experience...."
4,Mechanical Engineer,GENERAL ATOMICS,Works with multiple interdisciplinary groups to transition equipment and processes from an engineering stage to repeatable productionized processes....
17,Medical Office Asst VA,Novant Health,Graduate of an accredited medical assistant program preferred. The team member's number one job responsibility is to deliver the most remarkable patient...
16,Salesperson,Sheetz,"Ring accurate register transactions. The perfect fit for our Sheetz team would be someone who is people oriented, self-motivated, dependable, able to work..."
8,Assistant Teacher,Children of America,Has obtained a Child Development Associate credential (CDA) and meets the licensing requirements of the state in which they work....
9,Freelance Production Coordinator,"JPL Integrated Communications, Inc.","You will interact with talented Project Managers, Event Producers, Production Managers, Creative Directors, Graphic Artists, Editors, and so many others!..."
