job_field_id,title,company,description
22,Driver Patient Services Technician,Advanced Home Care,"Must have a valid driver's license, and be able to operate manual transmission vehicle. Health care technician (EMT, Lab Tech, etc), customer support or service..."
23,Range Operations Specialist (PD D1134000),Department of the Army,"Officer, Not to Exceed O-3/ CPT, Warrant, Enlisted. Small arms, mortars and field artillery rockets or cannons...."
16,"Rental Sales Representative- Warrenton, VA",H&E Equipment Services,A Bachelor’s degree is a plus• 2 years of business to business sales experience in Construction Equipment and/ or Construction related field is preferred•...
14,Landscape and garden maintenance worker,Lawn Love,\*You must have at least one year of professional lawn care experience. \*You must have all the equipment needed to perform a full lawn care service....
17,Asset Protection/Loss Prevention,The Home Depot,"They utilize tools to minimize loss to the Company, including but not limited to identifying incidents of theft and fraud, reviewing CCTV and exception reports,..."
14,Housekeeping/Laundry Aide,Safire Care,"Description Position: Housekeeping/Laundry Aide Hours: FT, PT Available Shift: Day and Evening Shifts Sheridan Manor provides a range of services,"
22,Bus Aide,Fauquier County Public Schools,Provides help to the school bus driver in maintaining discipline. Assists driver in preparing for and performing periodic emergency bus evacuation drills
20,MAINTENANCE MECHANIC,United States Postal Service,"United States Postal Service External Publication for Job Posting 94976393 If this job requires qualification on an examination, the number of applicants who"
20,Master Mechanic / Technician Auto Repair,YourMechanic,Excellent customer service skills. Complete set of basic automotive tools. Earn up to $55/hr as a mobile mechanic*....
17,Bookkeeping Clerk,John Q. Hammons Hotels & Resorts,"Must have 1-2 years in accounting , customer service and/or bookkeeping experience or equivalent. Perform any combination of routine calculating, posting, and..."
10,Telemedicine Physician,"MeMD, Inc.",MeMD is seeking a Board-Certified Physician possessing a Florida medical license that is interested in joining our team of Telemedicine Providers....
22,Class A CDL Company Truck Drivers,First Fleet,Drivers at FirstFleet enjoy a full set of online tools to manage their employment experience. We are proud to employ and recognize individuals who demonstrate...
12,AIRPORT SECURITY SCREENER,Covenant Services Worldwide,Security Screeners are responsible for day-to-day security screening of airport employees and other individuals passing through Screening Locations....
8,High School Math,Fauquier County Public Schools,"Plans, coordinates, attends, and chaperones field trips as appropriate. Motivates students to develop an interest in and an appreciation of math;..."
16,Customer Advisor Specialist,Petco,"Knowledge of the grooming salon program certification (Petco Promise, Pet Stylist Mentor Program, Canine Heritage Breed Test, Pet First Aid.)...."
20,Auto Glass Installer,Luther Automotive,"At least 1 year of mobile auto glass experience required. Install windshields in shop and mobile, perform rock chip repairs and pull and reinstall glass for the..."
17,Receptionist/Office Assistant,Countryside Family Practice,"Busy medical practice in Marshall, Virginia seeking full-time front office receptionist. To apply, contact Linda Spencer, Practice Administrator at email..."
16,Consultative Sales- Home Improvement,Stores - Sears Hourly,"Selling and servicing customers within one or more departments including Home Improvement, Lawn and Garden, Tools, Sporting Goods;..."
8,Assistant Teaching Professor,Worcester Polytechnic Institute,"The Mathematical Sciences Department currently has 28 tenured/tenure-track faculty members, 9 postdoctoral scholars, 5 teaching professors and features a..."
22,Hiring Company Drivers & Contracting Owner Operators,Prime Inc.,We are hiring Class A CDL Company Drivers and Contracting Owner Operators. Find the Lifestyle You're Looking for as a Prime Truck Driver....
14,Custodian/Freight Associate,Stage Stores,"Assist freight carrier driver with properly staging cartons by colored label. Clean restrooms, store entrance, associate break room, Team-One area and fitting..."
16,VA Customer Service Representative,Family Dollar,"Key priorities include greeting customers, assisting them with selection of merchandise, completing transactions, and answering questions regarding the store..."
10,Cardiologist,U.S. Navy Reserve,*Cardiologist NEEDED* for part-time in Navy Reserve! Currently *1 position* open Nationwide! Your Benefits: * $75K Sign-on Bonus * All pay and allowances of
6,Spiritual Counselor,UPMC,"Knowledge of spiritual effects of terminal illness, grief, and loss. The hospice spiritual counselor provides counseling and guidance to patients, families and..."
2,Business Operations Associate/Sr. Associate,Lending Club,"You’re both comfortable conversing with our front-line agents to truly understand how our operations work, as well as making a convincing case to our executive..."
21,Plastics Mold Maker,TERMAX CORPORATION,"Craft precision tools by studying specifications, engineering blueprints, tool orders, and shop data to make, alter, or repair tools, jigs, fixtures, molds, or..."
10,Pharmacy Technician,Family Care Pharmacy Remington,Required license or certification:. This is a family owned business that is looking for a full time pharmacy technician who can perform data entry as well as...
15,Dog Trainer / Apprentice,Petco,Our Dog Trainer Apprenticeship is a comprehensive training program to prepare you for the role of Dog Trainer in your store....
10,Surgical Tech,trustaff,Must have valid BLS certification. This assignment is for an immediate start with a reputable facility seeking an experienced Surgical Technician to fill a 13...
13,Barista (US),Starbucks,"Starbucks Corporation will consider qualified applicants with criminal histories in a manner consistent with all federal, state, and local ordinances...."
17,Banking Services Representative - Bakersfield,Rabobank,Knowledgeable regarding all bank products. Assists with reception and vault/merchant attendant duties. Ability to comprehend and interpret Bank policies and...
22,Experienced CDL-A Regional Truck Driver,Specialized Transportation Services Inc,Regional truck driving jobs at Specialized Transportation Services offer responsible CDL professionals predictable schedules without having to forfeit great pay...
22,Hiring Company Truck Drivers,Transport America,Company Truck Driver Benefits:. Transport America's fleet of company truck drivers is the best and most experienced on the road....
8,Adjunct Instructor- Computer Science,Lord Fairfax Community College,Master's degree in Computer Science or Computer Engineering from an accredited college/university. The Computer Science Department is seeking qualified...
10,Medical Reviewer LPN,"Blue Cross Blue Shield of IL, MT, NM, OK & TX","3 years clinical experience in physician office, hospital or surgical setting. This position is responsible for pre-authorization reviews in accordance with the..."
19,Industrial Electrician,Novelis,"Novelis Corporation, the global leader in rolled aluminum and can recycling, has an opportunity at its Fairmont, WV plant for an experienced Industrial..."
8,Substitute/Floater Teacher,Children of America,"From infants to toddlers, preschoolers to kindergarteners, our highly trained teachers lead each child to reach developmental milestones, preparing the children..."
22,Freight Broker,Sunbreak Logistics,Supply Chain / Freight Brokerage:. A new logistics company is looking for a motivated and experienced freight broker to join and to grow in a great team....
8,Library Para Educator,Blue Valley School District,Attachment(s): job description Hourly Rate: $10.25 (PA/Col 3/01) Hours per Day: 7.5 (Monday - Friday) Days per Year: 200 (less than 12-month position)
2,Claims Auditor,Broadpath,Medical Claims Auditors perform routine and complex audits to identify inaccurate claims adjudication. Knowledge of claims and the ability to recognize patterns...
5,Public Health Specialist III,State of Oklahoma,"A bachelor’s degree with a major in public health, environmental health, environmental science, physical science, natural science, biological science,..."
16,Consultative Sales- Fine Jewelry,Stores - Sears Hourly,Maintaining knowledge of products and using this knowledge to assist and educate customers on options available
22,Student Class A CDL Truck Driver,Super Service,New Pay Raise April 2015Super Service needs recent truck driving school grads who are ready to hit the road and start earning big!...
4,Civil Engineer EI (Entry Level),Banning Engineering,"BS in Civil or Agricultural Engineering is required. Located in Plainfield, Indiana, Banning Engineering is a Civil Engineering and Surveying firm that offers a..."
17,Operations,The Home Depot,"Requires listening for customer service calls, personal pages and general information announcements. May have to handle merchandise and work with tools with..."
4,RET Engineer,Intel,"Scanning Electron Microscopy, Atomic Force Microscopy, etc.). The RET Design Engineer will deliver test masks, test patterns, sampling strategies, process..."
1,Store Manager,Stage Stores,"Work with district manager to develop and execute plans for store to improve profitability, greater productivity and efficiency...."
11,Health Center Associate - Mobile,Planned Parenthood Southeast,Documents ultrasound in medical record. Assures lobby is neat and orderly throughout the day Explains medical tests and procedures and obtain informed consent...
1,"General Manager - Store 2705 - Warrenton, VA",Petco,"Responsible for handling cash counting, supervision of cashiers and cash register service to maximize customer service and minimize loss of assets...."
8,Lead Teacher,Children of America,Has experience with pre-school age children and state credentials and MUST have the state required registry.*. This approach concentrates on allowing each child...
2,Business Process Analyst,U.S. Pipe,"Handles incoming questions on invoices, handling discrepancies and resolving any issues. Answers the phones, prepares quotes for customers, assists customer..."
21,Assembler,"PDS Tech, Inc.",Inspects own work on electronic assemblies to insure a quality product which conforms to workmanship standards and engineering requirements....
3,"(CSITO) Close Support/Systems Administrator - Warrenton, VA Job",CACI International Inc,"Answer users' inquiries regarding computer software and hardware operation to resolve problems, including requirements originating from a field location...."
13,Catering Coordinator,Panera Bread Franchise (Blue Ridge Bread),Our bakery-cafes are focused on taking care of our guests. Must Have Own Vehicle. Perfect Driving Record. Please apply online and a Manager may be in touch if...
16,Sales Assistant - Northrock Shopping Center,Jos. A Bank,"Properly and accurately operate and capture customer information, including e-mail addresses, in the point-of-sale register system.Comply with all procedures..."
4,Mechanical Engineer,GENERAL ATOMICS,Works with multiple interdisciplinary groups to transition equipment and processes from an engineering stage to repeatable productionized processes....
23,Intelligence Analyst - Junior,"Streamline Defense, LLC","The Intelligence Analyst will perform intelligence analysis, analyst-driven data extraction and processing, dissemination of applicable reporting products, and..."
4,Agricultural Engineer,Department Of Agriculture,"Or equivalent doctoral degree in Agricultural Engineering, Biological Engineering, or Agricultural and Biological Engineering...."
16,Insurance Sales CSR (Member Service Specialist)-Fauquier,Virginia Farm Bureau Mutual Insurance,"Property and Casualty and Life &amp; Health License- Must obtain P&amp;C and L&amp;H licenses within six months of employment,...."
6,LCSW Child/Family,Kaiser Permanente,"Experience working with chidlren, adolescents and their families in individual, family, and group psychotherapy...."
22,Flatbed Company Driver - CDL-A,P & S Transportation,"Drivers must also have a current CDL-A license. Life Insurance/$10,000 policy at no charge to the driver. P&amp;S drivers must be at least 23 years old with at..."
8,Assistant Teacher,Children of America,Has obtained a Child Development Associate credential (CDA) and meets the licensing requirements of the state in which they work....
5,Physical Therapy Aide,All Star Physical Therapy,Responsibilities include: setting up treatment areas cleaning up following treatment session aiding physical therapist during patient sessions Job Type:
22,Bus Driver,Fauquier County Public Schools,"Performs driving functions safely and efficiently in various weather conditions; Performs general maintenance tasks necessary to keep vehicles, equipment and..."
17,LPNs and RNs Needed!,WRB Communications,Active LPN/ RN license. Our LPN/ RN Communicators will take calls from consumers and health care providers and document product complaints or adverse events...
14,Maintenance Worker,Marsh Run MHC,"Valid driver’s license and good driving record. Required license or certification:. General knowledge of electrical, plumbing, and grounds maintenance...."
9,Full Time Artist,Lisa Frank Inc,"When you were growing up, did all your school supplies HAVE to be Lisa Frank? Are you creative, energetic, and hardworking? This might be the job for you!"
13,Cook-Full-Time-Hours Evenings 12p-8p,Fauquier Health System,Ability to perform complex math calculations and verify cash handling and reporting. The Cook prepares food items needed for meal service using institutional...
3,Jr Systems Administrator,City of Rifle,"Systems Administrator, Full-time, 4 year degree required. This position will assists the Systems Administrator in the support of services provided to the user..."
20,"Maintenance Mechanic-Remington, Virginia",U.S. Pipe,"Directs and performs complex mechanical repair work &amp; is responsible for the more intricate repair assignments, including hydraulic and pneumatic systems...."
9,TV Line Producer,zulily,"This will include partnering with various production companies to create new scripts, select footage and music and hire freela nce voice over artists...."
7,Court Clerk IV - Pos. #292,St. Louis County Circuit Court,"Work is performed under the general supervision of a judge, circuit clerk, higher level court clerk and unit manager...."
3,Intelligence Tech Specialist,Raytheon,Other responsibilities include data entry and tracking of documents. Ability to manipulate data using various formats and tools with a serious commitment to...
2,Loan Support Residential Mortgage Processor,The Fauquier Bank,"Specialty may be in one loan field, but this position cross-trains for Consumer, Commercial, and Commercial Real Estate processing...."
16,PT Grocery Associate,Food Lion,Provide quality customer service to our customers through the Grocery Department. Engage and interact with customers to create a positive shopping experience....
2,Small Business Specialist II,BB&T,"Possess an understanding of major technical aspects of small business underwriting, loan structure and deposits, and have a clear understanding of credit and..."
1,Pizza Hut Shift Manager,Pizza Hut,"You set high standards for yourself and the people you work with – you love keeping things clean, safe and fun for the team and the customers You want to learn..."
8,LANGUAGE ARTS TEACHER,Academy of Hope Adult PCS,"Bachelor's degree and secondary or adult education experience required. Teach a course load of at least 2 classes per day of adult literacy, basic education,..."
9,Freelance Production Coordinator,"JPL Integrated Communications, Inc.","You will interact with talented Project Managers, Event Producers, Production Managers, Creative Directors, Graphic Artists, Editors, and so many others!..."
15,Dog Walker/Pet Sitter,Tina Pet Services,"You have to love animals, and feel comfortable around them.:. First impressions are important, so be sure to let your personality come through in your initial..."
10,"Biometric Screener - Warrenton, VA",Provant,"Medical license or certification required. Provant Health Solutions hires individuals on a contract/per diem basis, provides excellent hourly wages, and further..."
18,Mine Safety and Health Inspector (Coal),Department Of Labor,This position has promotion potential to GS-12 for Underground and Electrical Inspectors and the GS-11 for Surface Inspectors....
3,Information Sec Spec,"Greystone & Co., Inc.","IT related college degree, technical school degree, or Microsoft certification such as MCSE, MCITP, etc...."
7,Paralegal Specialist,Department Of Justice,Specialized experience is defined as experience performing paralegal or legal work which demonstrates a basic knowledge of legal research and the ability to...
3,Information Systems Security Analyst,TASC,"Must be familiar with NIST Certification &amp; Accreditation (C&amp;A) processes, NIST policies and documents, NIST Risk Management Framework, Federal Information..."
23,Flight Support,U.S. Navy,"Operate and maintain hydraulic and steam catapults to launch aircraft. As an Officer, you can expect to:. Instead, she refuels fighter jets on aircraft carriers..."
8,Librarian,Fauquier County Public Schools,Answers reference questions in person and by telephone
22,Owner Operator CDL-A Truck Driver - Regional Dedicated Opportunities,NFI,"Class A CDL Owner Operators, NFI understands the reward of business ownership and the importance of a valued partnership. Class A CDL...."
17,Reimbursement Specialist,WRB Communications,Complete accurate entry of billing information to ensure timely payment and avoid delay in patient therapy....
13,"Associate, Food Services-PRN-Hours vary",Fauquier Health System,"These functions include, but are not limited to, portion control, delivery and pick up of trays, equipment operation, washing and sanitizing dishware, and cash..."
7,Legal Assistant,"Warrenton, Virginia Law Firm","Case management and litigation support, preparation of trial exhibits; Drafting basic legal documents, cite checking and proofreading court pleadings...."
10,Nursing Supervisor-FHRNC-Full Time Evenings-Mon-Fri,Fauquier Health System,Current Virginia State RN License. The Nursing Supervisor provides direction and supervision to staff to ascertain delivery of effective high quality patient...
6,Medical Social Worker - Home Health and Hospice Job,HCR ManorCare,"May require licensure or certificate as required by the state, and in good standing. The Medical Social Worker is responsible for providing patients and..."
9,Animator,National Center for Missing & Exploited Children (NCMEC),"The Animator is responsible for designing and developing 2D and 3D content for web, television, interactive and print projects...."
1,Sr. Assistant Store Manager,Stage Stores,"Work with Store Manager and District Manager to develop and execute plans for store to improve profitability, greater productivity and efficiency...."
21,Electronic Assembly,NESC Staffing Corp,Soldering may be required for some positions.• Inspects own work on electronic assemblies to insure a quality product which conforms to workmanship standards...
7,Law Clerk,Colorado Office of the State Court Administrator,"There is an immediate opening for a law clerk in the 19th Judicial District. Judicial Branch Overview. Responsibilities of this position include legal research,..."
20,Heavy Equipment Shop Technician,"Carter Machinery Co., Inc.","This position is responsible for diagnosing problems, performing repairs, reconditioning and servicing heavy equipment and components in a shop environment...."
16,Customer Relations Representative,AmeriGas,"Make credit calls to delinquent customers and perform credit checks on new customers. Answers phone calls and responds to all customer inquiries including, but..."
12,Security Guard,Bannerman,"Bannerman is looking for professional security guards, and bouncers. Must be self disciplined with a high level of customer service and professionalism...."
6,Staff Development Coordinator,Sayre Christain Village,"Conductscertification or training programs for Nursing Assistants. Frequentlycommunicates with employees, residents, family members, physicians etc...."
