job_field_id,title,company,description
1,Regional Marketing Manager,Vishay,Develops a formal marketing plan outlining an appropriate marketing strategy for selling to key accounts. Coordinates the marketing efforts for a product group....
2,Cost Accountant III,Weatherford,JOB DESCRIPTION JOB SCOPE: This position will be responsible for the day to day understanding of the plant’s financial performance. The position will also be
3,Data Scientist,Humana,"Bachelor’s Degree in Mathematics, Computer Science, Actuarial Science or related field. Collaborate with other professionals including Actuaries, Mathematicians..."
4,Mid-Level Ground Control Station Engineer,GENERAL ATOMICS,Job ID# 6452BR Company General Atomics Aeronautical Systems Title Mid-Level Ground Control Station Engineer Job Category Engineering City San Diego State...
5,NATURAL RESOURCES PROGRAM TECHNICIAN,Arkansas Game & Fish Commission,"Knowledge of agricultural methods and basic land laws. Conducts agricultural and forest management activities on wildlife management areas, including preparing..."
6,Senior Addiction Counselor,NYC Health + Hospitals,The Senior Addiction Counselor will be responsible for assisting the consumer with activities relevant to an individual's rehabilitation goals....
7,Administrative Law Judge,New Mexico State Personnel Office,"Administrative Law Judge, Adjudicator Advanced. This position will conduct administrative hearings on behalf of the State Personnel Board concerning..."
8,Tutor or Teacher - Elementary Math,,"We are looking for math tutoring for our 4th grader. Improve grades, get ahead and increase confidence. Elementary math Tutoring &amp; Teaching opportunities..."
9,Graphic Artist,IGT,"Maya, Autodesk 3D Studio Max). This position is the development and timely delivery of high quality 2D and 3D game...."
10,Anesthesiologist,"UF, Department of Anesthesiology","Department anesthesiologists practice at UF Health hospitals in Gainesville, FL at the University of Florida alongside 62 faculty anesthesiologists, 78..."
11,2 Med/Peds Certified Nursing Assistant,Riverside Medical Center,Reports changes in patients' condition to the professional nurse. The 2 Med/Peds Certified Nursing Assitant (CNA) assists with the care of patients ranging from...
12,Transportation Security Officer (TSO),Trinity Technology Group,TSOs must take the computerized Screener Assessment Battery. Repeatedly lift and carry baggage weighing up to 70 pounds…
13,Kitchen Cook,SMG World - Tucson Convention Center,Banquet facility preparing meals for large events:. Fulfilling the service per each Banquet Event Orders (BEO)....
14,Janitor - Cleaning Technician - FULL TIME - 84095,Wingfoot Services,"Janitorial, janitor, cleaning specialist, carpet cleaning, floor care technician, buffing, part time, supplemental income, laborers, landscaping, supervisor,..."
15,Lobby Concierge,Beach Activities of Maui,"The Concierge is knowledgeable about the local area and is the expert on the attractions, tours and activities that we sell.Must be flexible with scheduling and..."
16,Digital Sales Account Executive,The Morning Call Media Group,"Manages advertising sales revenue and account management targets. Our digital sales account executives are responsible for selling advertising banners, programs..."
17,Telephone Operator,The Broadmoor,"Monitors 911 Alert System. Operates the switchboard to relay incoming, outgoing, and interoffice calls by performing the following duties:...."
18,Agricultural & Standards Inspector - I,Placer County,"Recruitments for Agricultural and Standards Inspector I, Agricultural and Standards Inspector II, and Agricultural and Standards Inspector, Senior are being..."
19,Drywall Hanger/Installer,EncoreHR Staffing,"Includes lathers who fasten wooden, metal, or rockboard lath to walls, ceilings or partitions of buildings to provide support base for plaster, fire-proofing,..."
20,HVAC Installer/Technician,Express Air Sytems,Basic knowledge of standard code requirements of air conditioning systems. \*\*\*\*\*Minimum requirements for Installers\*\*\*\*\*....
21,Production Operator - 2nd shift,Bostik Inc.,About Bostik - Smart Adhesives. As a production operator at Bostik you will be in a batch making/mixer operator position for a competitive manufacturing...
22,Air Traffic Control Operator,National Guard,The skills you learn as an Air Traffic Control Operator will qualify you to work in civilian air traffic control towers and centers at airports and airfields....
23,"Analyst, Operations",General Dynamics Information Technology,Extended Air Defense Simulation (EADSIM). Battle Command Sustainment Support System (BCS3). Air and Missile Defense Work Station (AMDWS)....
4,Navy Logistician,LinQuest Corporation,"Review technical studies, reports, and white papers on new enhanced system capability designs, system design requirements, and system failure investigation..."
15,Valet Attendant: PT & FT- Lisle, Downers Grove,"HealthPark ValetEnjoy working in a social environment? A leader in parking services, HealthPark Hospitality provides its healthcare partners comprehensive parking solutions"
20,Diesel Mechanic/Technician III – PART TIME (PB),Penske,"A valid driver’s license is required, and, must either possess a CDL or have the ability to obtain a CDL license required...."
1,Practice Manager,HCI-EBS,Design and implementation of a strategic marketing program. Candidates are expected to be comfortable acting as a managerial liaison between physician and staff...
21,Manufacturing Assembler,Manufacturing Supplier,Ideal candidates will have some mechanical aptitude for assembling plastic or metal parts by hand. Advantage Resourcing is currently seeking Manufacturing...
17,Inpatient Medical Records Coder II-Part Time,Fauquier Health System,"Registered Health Information Administrator certification(RHIA), or Registered Health Information Technician certification(RHIT), or Certified Coding Specialist..."
4,ARCHITECT/ENGINEER EAS,United States Postal Service,"Knowledge of architecture, engineering, and building construction sufficient to review and inspect repair and alteration...."
10,Medical Reviewer LPN,"Blue Cross Blue Shield of IL, MT, NM, OK & TX","3 years clinical experience in physician office, hospital or surgical setting. This position is responsible for pre-authorization reviews in accordance with the..."
12,Firefighter-2016,City of Mesquite,"Possession of or ability to obtain certification/licensing as an Arson Investigator and Peace Officer, as assigned...."
13,Cook - Banquet Kitchen,Hilton Hotels & Resorts,Banquets and Catering. A Cook with Hilton Hotels and Resorts is responsible for preparing food items in accordance with recipes and established standards....
1,Assistant Restaurant Manager,Dunkin' Donuts,Holds the guest as their highest priority and role models exceptional guest service. Manages cash over/short through effective cash control procedures....
23,Cavalry Scout,National Guard,"Cavalry Scout training never really stops, though. This enables the officer to make informed decisions. As a Cavalry Scout, you are the eyes and ears of the..."
22,Roadtrak / Highway - Experienced Regional CDL-A Truck Driver,Hub Group Trucking,HGT’s Roadtrak truck driving opportunities take your career the extra mile! Hub Group Trucking has unique regional driving opportunities available to CDL-A...
2,Junior-Staff Accountant,Poplar Springs Inn and Spa,"Prepared recurring tax reports and other filings, to include sales and occupancy tax returns, personal property tax returns, business license applications..."
22,Experienced Owner Operator Flatbed Truck Driver - CDL-A,Carrier One,"Our owner operator truck driving opportunities offer higher percentage rates, flexible home time and exceptional company support—so your flatbed driving..."
1,Restaurant General Manager - Taco Bell,BurgerBusters Inc,"Valid Drivers' License. Key responsibilities include finding, hiring and developing Taco Bell Restaurant Team Members and Shift Leads, conducting new hire..."
13,Restaurant Team Member - Crew (1628 - Warrenton),CHIPOTLE,Have the ability to develop positive working relationships with all restaurant employees and work as part of a team by helping others as needed or requested •...
2,Account Manager / Estimator,Five Star Painting - Manassas,Be available to answer any questions regarding the job while the project is in progress. Use the proper tools to estimate the job accurately....
22,Driver Patient Services Technician,Advanced Home Care,"Must have a valid driver's license, and be able to operate manual transmission vehicle. Health care technician (EMT, Lab Tech, etc), customer support or service..."
3,Senior Intelligence Technican Associate,Raytheon,Possess a valid driver license for delivering records using government transportation within WMA. Give presentations to visitors as required....
2,Claims Auditor,Broadpath,Medical Claims Auditors perform routine and complex audits to identify inaccurate claims adjudication. Knowledge of claims and the ability to recognize patterns...
22,Decker is Hiring CDL A Company Drivers Now,Decker,Class A CDL. Decker offers great pay and the best equipment as a truck driver to help you get more miles and more money in your job....
19,Carpenter,Chicago Bridge & Iron Company,"Fits and nails sheathing on outer walls and roofs of buildings. Erects scaffolding for buildings and other structures and installs ladders, handrails, walkways,..."
22,Delivery Driver,Domino's,"Valid Driver's license. So if you're looking for casual work or maybe something more permanent, our Delivery Driver position is the perfect way in...."
2,Insurance and Financial Services Position - State Farm Agent Team Member (Sales experience preferred),Charles Robinson - State Farm Agent,"As a State Farm team member for Charles Robinson - State Farm Agent, you will build and develop customer relationships within the community to promote State..."
20,HVAC Service Manager,AireServ - Bull City,"Pre-employment drug screening, background check and valid driver's license with a clean record. CFC Certification REQUIREDMINIMUM 5 years recent experience in..."
20,Automotive Technician,SAFFORD AUTOMOTIVE GROUP,State Inspection license a plus. We want you to grow within our organization and will give you the chance and tools to succeed!...
3,"(CSITO) Close Support/Systems Administrator - Warrenton, VA Job",CACI International Inc,"Answer users' inquiries regarding computer software and hardware operation to resolve problems, including requirements originating from a field location...."
3,Senior Certified Security Analyst,Kforce,"Coordinate with applicable stakeholders to develop security event remediation strategies and timelines. Engineering, Math, or Science Degree...."
5,Seafood Innovation Scientist,Oregon State University,"80% AGRICULTURAL EXPERIMENT STATION. Serve on Coastal Oregon Marine Experiment Station, College of Agricultural Sciences, Department of Food Science and..."
16,Cashier,The Home Depot,"They provide first level escalation for customer issues and assist in the supervision, coaching and training of other Front End Associates by participating in..."
2,FINANCIAL QUALITY COORDINATOR,Inova Fairfax Hospital,"Bachelors Degree = 2 years. Supports Inova Health System or Physician Services, and Patient Registration department financial goals through patient financial..."
16,Sales Associate,Stage Stores,"Interrupt store tasks to greet, assist, and answer questions for customers. Smile and greet each customer promptly...."
3,"Network Deployment and Operations (NDO) Lead, Google Fiber, Midwest",Google,"Familiarity with other network transmission protocols and in-home network architecture. Ensure the best local network is designed, built, and maintained with..."
17,020 - 5600 - OFFICE ASSISTANT,Harris Teeter,"New hire orientation, customer service network, safety, customer service clerk technical skills, floor monitor technical skills...."
13,Crew,Dunkin' Donuts,Acknowledges all guests with a friendly smile and is highly responsive to needs and special requests. Issues a receipt with each order to provide guests with an...
16,Sales Representative,Verizon,Analyze customer needs and present value-added solutions Inspire and excite customers about how our solutions can impact their lives Ensure that our customers...
17,Office Manager,Titan Restoration,"Responsibilities include but are not limited to managing the day to day functions of the office, prescreening and interviewing all applicants for office..."
13,Full Time Saute Cook,Claire's at the Depot Restaurant,"Must be able to execute recipes with consistency and accuracy in a busy kitchen. Claire's at the Depot, a fine dining restaurant located in Old Town Warrenton..."
4,Field Service Engineer / PLC / Machinery / service,Randstad Engineering,"Provide technical support to customers and field technicians to install and maintain equipment. Provide telephone support for installation, troubleshooting, and..."
10,Surgical Technologist - Operating Room (OR),Accountable Healthcare Staffing,"Certified Surgical Tech needed; Operating Room Tech. Will work 4 ten hour weekdays with on-call evenings, weekends, holidays;..."
13,Barista (US),Starbucks,"Starbucks Corporation will consider qualified applicants with criminal histories in a manner consistent with all federal, state, and local ordinances...."
8,Toddler Teacher,Children of America,Has experience with two year olds and state credentials and MUST have the state required registry.*. This approach concentrates on allowing each child to learn...
20,Heavy Equipment Shop Technician,"Carter Machinery Co., Inc.","This position is responsible for diagnosing problems, performing repairs, reconditioning and servicing heavy equipment and components in a shop environment...."
16,AP Clerk,Sheehy Auto Stores,"All applicants must have the ability to pass pre-employment testing to include background checks, MVR, drug test, and valid driver's license...."
20,"Maintenance Mechanic-Remington, Virginia",U.S. Pipe,"Directs and performs complex mechanical repair work &amp; is responsible for the more intricate repair assignments, including hydraulic and pneumatic systems...."
17,Hotel Front Desk Receptionist,HOLIDAY INN EXPRESS AND SUITES,No phone calls. Processing payment from Guests. Responding to Guests request for assistance and information about the local area (i.e....
3,Senior IT Support Specialist,Greystone,"Strong technical knowledge of MS Windows, desktop support and PC hardware, setup and configuration - People management experience and demonstrated leadership..."
22,Part Time Produce Clerk North Rock,Harris Teeter,"While performing the duties of this job, the associate constantly works in a cool environment with an average temperature range of 55-60 degrees Fahrenheit and..."
22,Part Time 3rd Shift Stocker North Rock,Harris Teeter,"While performing the duties of this job, the associate is frequently exposed to wet, hot, or cold conditions and moving mechanical parts...."
22,Class-A CDL Flatbed Company Truck Drivers,E. W. Wylie,"With annual earnings of up to $65K, consistent OTR miles that offer frequent home time, a generous sign-on bonus, a pay raise every 60K miles and more,..."
13,Food Service Attendant,Riverside Health System,"Formal training as a cook preferred. Performs duties related to therapeutic diets and meal services to include, aides in the preparation of preparation of hot..."
22,Owner Operator CDL-A Truck Driver - Regional Dedicated Opportunities,NFI,"Class A CDL Owner Operators, NFI understands the reward of business ownership and the importance of a valued partnership. Class A CDL...."
22,Hiring Class A Truckers - OTR & Regional Positions,Barr-Nunn Transportation,Valid Class A CDL. Barr-Nunn has a reputation for respecting its truck drivers and working diligently to anticipate and meet our drivers needs....
16,Customer Service Associate,Wawa,Comply with federal and state laws by requesting personal identification from customers who are purchasing tobacco and/or alcohol....
17,Night Auditor,Poplar Springs Inn & Spa,"Night Audit, Front Desk:. Poplar Springs Inn &amp; Spa is looking for a dedicated individual to perform the tasks and duties of a Night Auditor...."
12,BORDER PATROL AGENT,Department Of Homeland Security,Border Patrol Sectors. And pass the Border Patrol Agent Entrance Examination. Being a border patrol agent makes you a valuable member of the federal Law...
16,Retail Merchandiser - Warrenton/Culpeper/Marshall - VA,The Pet Firm,"Attend training calls; Implement and reset planograms, test planograms, IRC's point of sale materials,. Our expertise in the pet industry gives our vendor..."
1,Advertising Project Manager,Innocean USA,Project Manager may support projects for Innocean projects across all U.S. The Project Manager may also lead process improvement initiatives assigned by the...
1,Assistant Administrative Manager,Capitol Building Supply,Bachelor’s degree in Business or related field is preferred. Develop product knowledge to assess needs and recommend solutions to customer needs....
3,"Database Specialist, Master",OBXtek,"Performs database programming and supports systems design. (h) Includes maintenance of database dictionaries, overall monitoring of standards and procedures,..."
17,"Front Office Team Member - Business Assistant, Warrenton","Heartland Dental, LLC","The Dental Business Office Assistant will maintain and organize all administrative functions in the front office, including reception tasks – receiving and..."
12,Chief of Police,City of Andrews,"The department consists of 19 sworn peace officers, 9 full-time paramedics, an Animal Warden and Executive Assistant, with combined budgets totaling over $3M...."
23,Flight Support,U.S. Navy,"Operate and maintain hydraulic and steam catapults to launch aircraft. As an Officer, you can expect to:. Instead, she refuels fighter jets on aircraft carriers..."
19,Plumber,Los Angeles Unified School District,A Los Angeles City Journeyman Plumber License OR a Los Angeles County Certificate of Registration as a Journeyman Plumber....
15,Grooming Assistant,Petco,Assist in booking grooming appointments and performing follow-up phone calls and reminders to customers....
3,CSITO- Senior,Preferred Systems Solutions,Responsible for providing technical service desk instruction to junior contract staff. Responsible for coordinating the transitioning IT service and...
13,PT Market Associate,Food Lion,"Provide friendly, courteous and prompt customer service. Ability to complete Computer Based Training (CBT) and Training Aid courses...."
5,Physical Science Technician,Department Of Agriculture,The Functional Foods Research Unit creates new processing technologies to enhance the performance of agricultural materials in existing applications and...
6,Spiritual Counselor,UPMC,"Knowledge of spiritual effects of terminal illness, grief, and loss. The hospice spiritual counselor provides counseling and guidance to patients, families and..."
1,Pizza Hut Shift Manager,Pizza Hut,"You set high standards for yourself and the people you work with – you love keeping things clean, safe and fun for the team and the customers You want to learn..."
17,Asset Protection/Loss Prevention,The Home Depot,"They utilize tools to minimize loss to the Company, including but not limited to identifying incidents of theft and fraud, reviewing CCTV and exception reports,..."
11,CNA - Certified Nursing Assistant,"Blue Ridge Caregivers, Inc",Drive/operate a motor vehicle (valid driver's license required). Current Certified Nursing Assistant or Personal Care Aide Certification....
3,Network Controller with TS + Clearance,ManTech International Corporation,"Requires Bachelor’s degree (in Computer Science, Math or Engineering) or equivalent, and zero to two years of related experience...."
14,Greenskeeper,Heritage Palms Golf Club,*Summary* Assists in a general range of activities involved in golf course maintenance and construction. The individual should be able to perform semi-skilled
17,Administrative Assistant to the Provost/Vice President of Academic Affairs,East Central University,"The Administrative Assistant coordinates the Provost’s appointments and travel arrangements. East Central University invites applications for a twelve-month,..."
17,Front Desk Agent,Holiday Inn & Suites - Tulsa,At *Holiday Inn® Hotels* our job is to bring the joy of travel to everyone. That’s where you come in. When you’re part of the Holiday Inn Hotels brand you’re
16,Consultative Sales- Fine Jewelry,Stores - Sears Hourly,Maintaining knowledge of products and using this knowledge to assist and educate customers on options available
8,Adjunct Faculty-Communications,Lord Fairfax Community College,"Certain developmental or technical courses may be taught by instructors with a Bachelor's degree, a special certification, and/or work experience...."
14,Housekeeping/Laundry Aide,Safire Care,"Description Position: Housekeeping/Laundry Aide Hours: FT, PT Available Shift: Day and Evening Shifts Sheridan Manor provides a range of services,"
8,Summer Camp Teacher,Children of America,"Must have a Drivers License. Perform all duties in compliance with State and Local licensing requirements, policies and procedures...."
22,Freight Broker,Sunbreak Logistics,Supply Chain / Freight Brokerage:. A new logistics company is looking for a motivated and experienced freight broker to join and to grow in a great team....
11,Personal Care Aide,Archangel Personal Home Care,Immediate needs for LIVE-IN aides located in Lackawanna County. Please call 570-507-9420 to schedule interviews....
22,Hiring CDL Student Drivers - We WIll Pick up the tab,American Professional Truck Driving Academy,"Student Requirements are the following Candidates Must Have CDL Learners Permit in State of Residency, Prospects Must Have Valid DOT Medical Card, Candidates..."
11,"MEDICAL ASSISTANT CLINIC- INOVA Cardiology Warrenton, VA",Inova Fairfax Hospital,Answering calls and providing pertinent information. Fulfills clerical responsibilities as assigned which may include:....
16,Sales Assistant - Northrock Shopping Center,Jos. A Bank,"Properly and accurately operate and capture customer information, including e-mail addresses, in the point-of-sale register system.Comply with all procedures..."
2,Portfolio Administrator,"Greystone & Co., Inc.","Transfer incoming mortgage payments to various custodial accounts in compliance with agency requirements. We are seeking a Portfolio Operations Specialist, for..."
2,Business Process Analyst,U.S. Pipe,"Handles incoming questions on invoices, handling discrepancies and resolving any issues. Answers the phones, prepares quotes for customers, assists customer..."
15,Hair Stylist,Sport Clips - VA114,"We're interviewing motivated, positive, reliable, upbeat stylists to help grow and be one of our winning team members...."
16,Clerk\Cashier,CVS Health,"Answer the telephone using the appropriate greeting. Operate a cash register including cash transactions, checks, charges...."
14,Pest Route Technician,Ecolab,"Previous pest elimination industry or route experience preferred &quot;Certified Pest Control Technician, Commercial Pest Control Technician, Exterminator, Pest..."
3,IT Support Specialist,"Greystone & Co., Inc.",This role is responsible for answering incoming calls and monitoring incoming email for internal users in an IT help desk environment through a ticket tracking...
10,Health Technician,Department of Veterans Affairs,Assists the audiologist in various procedures of the program including:. Utilizes electro-acoustical diagnostic equipment to assess the electronic functioning...
16,Brand Ambassador Sales Part Time,Advantage Sales and Marketing,Participate in mandatory on-line training and conference calls (paid). Field of Study/Area of Experience:....
1,Assistant Manager,Domino's,"Occasionally, pizza sauce weighing 30 pounds is carried from the storage room to the front of the store. If you like the thought of managing your own million..."
14,Custodian,Fauquier County Public Schools,"Checks play areas and around school building for trash, debris or hazards. Delivers copy paper to rooms. Empties trash receptacles and deposits collected refuse..."
13,Expeditor,Potomac Family Dining,"As an Expeditor, you will be responsible for coordination and consolidation of all outgoing food items from the kitchen assuring high standards of plate..."
1,Assistant Manager - Commissioned - Northrock Shopping Center,Jos. A Bank,Ensure all customer complaints are resolved immediately or as soon as possible if not remedied during store visit.Handle all Company assets according to...
21,"Machine Operator-Remington, Virginia",U.S. Pipe,Must have at least one to three years of previous fabrication or manufacturing assembly or production work experience in a fast paced manufacturing or...
21,Shop Assembly and Fabrication,Western Window Systems,*Western Window Systems* is one of the fastest growing and most successful Window Manufacturing Companies in the nation. *Overview* The Warehouse Shop
21,Blow Mold Machine Operator,Consolidated Container Company,"Blow Mold Machine Operators report directly to Maintenance/ Production Manager. The Blow Mold Machine Operator will operate blow-mold, grinders, trimmer..."
8,Adjunct Instructor - Physics,Lord Fairfax Community College,"The major emphasis shall be on good teaching by working with students in classrooms, laboratories, individual conferences, and related activities—to help the..."
16,VA Assistant Store Manager,Family Dollar,"Assists Store Manager in ordering merchandise and record keeping to include payroll, scheduling and cash register deposits and receipts...."
6,LCSW Child/Family,Kaiser Permanente,"Experience working with chidlren, adolescents and their families in individual, family, and group psychotherapy...."
