job_field_id,title,company,description
8,Tutor or Teacher - Elementary Math,,"We are looking for math tutoring for our 4th grader. Improve grades, get ahead and increase confidence. Elementary math Tutoring &amp; Teaching opportunities..."
14,Janitor - Cleaning Technician - FULL TIME - 84095,Wingfoot Services,"Janitorial, janitor, cleaning specialist, carpet cleaning, floor care technician, buffing, part time, supplemental income, laborers, landscaping, supervisor,..."
19,Drywall Hanger/Installer,EncoreHR Staffing,"Includes lathers who fasten wooden, metal, or rockboard lath to walls, ceilings or partitions of buildings to provide support base for plaster, fire-proofing,..."
2,Cost Accountant III,Weatherford,JOB DESCRIPTION JOB SCOPE: This position will be responsible for the day to day understanding of the plant’s financial performance. The position will also be
12,Transportation Security Officer (TSO),Trinity Technology Group,TSOs must take the computerized Screener Assessment Battery. Repeatedly lift and carry baggage weighing up to 70 pounds…
7,Administrative Law Judge,New Mexico State Personnel Office,"Administrative Law Judge, Adjudicator Advanced. This position will conduct administrative hearings on behalf of the State Personnel Board concerning..."
22,Air Traffic Control Operator,National Guard,The skills you learn as an Air Traffic Control Operator will qualify you to work in civilian air traffic control towers and centers at airports and airfields....
5,NATURAL RESOURCES PROGRAM TECHNICIAN,Arkansas Game & Fish Commission,"Knowledge of agricultural methods and basic land laws. Conducts agricultural and forest management activities on wildlife management areas, including preparing..."
9,Graphic Artist,IGT,"Maya, Autodesk 3D Studio Max). This position is the development and timely delivery of high quality 2D and 3D game...."
10,Anesthesiologist,"UF, Department of Anesthesiology","Department anesthesiologists practice at UF Health hospitals in Gainesville, FL at the University of Florida alongside 62 faculty anesthesiologists, 78..."
3,Data Scientist,Humana,"Bachelor’s Degree in Mathematics, Computer Science, Actuarial Science or related field. Collaborate with other professionals including Actuaries, Mathematicians..."
23,"Analyst, Operations",General Dynamics Information Technology,Extended Air Defense Simulation (EADSIM). Battle Command Sustainment Support System (BCS3). Air and Missile Defense Work Station (AMDWS)....
1,Regional Marketing Manager,Vishay,Develops a formal marketing plan outlining an appropriate marketing strategy for selling to key accounts. Coordinates the marketing efforts for a product group....
16,Digital Sales Account Executive,The Morning Call Media Group,"Manages advertising sales revenue and account management targets. Our digital sales account executives are responsible for selling advertising banners, programs..."
11,2 Med/Peds Certified Nursing Assistant,Riverside Medical Center,Reports changes in patients' condition to the professional nurse. The 2 Med/Peds Certified Nursing Assitant (CNA) assists with the care of patients ranging from...
4,Mid-Level Ground Control Station Engineer,GENERAL ATOMICS,Job ID# 6452BR Company General Atomics Aeronautical Systems Title Mid-Level Ground Control Station Engineer Job Category Engineering City San Diego State...
17,Telephone Operator,The Broadmoor,"Monitors 911 Alert System. Operates the switchboard to relay incoming, outgoing, and interoffice calls by performing the following duties:...."
13,Kitchen Cook,SMG World - Tucson Convention Center,Banquet facility preparing meals for large events:. Fulfilling the service per each Banquet Event Orders (BEO)....
15,Lobby Concierge,Beach Activities of Maui,"The Concierge is knowledgeable about the local area and is the expert on the attractions, tours and activities that we sell.Must be flexible with scheduling and..."
6,Senior Addiction Counselor,NYC Health + Hospitals,The Senior Addiction Counselor will be responsible for assisting the consumer with activities relevant to an individual's rehabilitation goals....
18,Agricultural & Standards Inspector - I,Placer County,"Recruitments for Agricultural and Standards Inspector I, Agricultural and Standards Inspector II, and Agricultural and Standards Inspector, Senior are being..."
20,HVAC Installer/Technician,Express Air Sytems,Basic knowledge of standard code requirements of air conditioning systems. \*\*\*\*\*Minimum requirements for Installers\*\*\*\*\*....
21,Production Operator - 2nd shift,Bostik Inc.,About Bostik - Smart Adhesives. As a production operator at Bostik you will be in a batch making/mixer operator position for a competitive manufacturing...
17,020 - 5600 - OFFICE ASSISTANT,Harris Teeter,"New hire orientation, customer service network, safety, customer service clerk technical skills, floor monitor technical skills...."
23,Cavalry Scout,National Guard,"Cavalry Scout training never really stops, though. This enables the officer to make informed decisions. As a Cavalry Scout, you are the eyes and ears of the..."
16,Part Time Deli Bakery Clerk North Rock,Harris Teeter,"Ability to read and comprehend simple instructions, short correspondence, and memos [in English]. Ability to write simple correspondence [in English]...."
20,MAINTENANCE MECHANIC,United States Postal Service,"United States Postal Service External Publication for Job Posting 94976393 If this job requires qualification on an examination, the number of applicants who"
15,Valet Attendant: PT & FT- Lisle, Downers Grove,"HealthPark ValetEnjoy working in a social environment? A leader in parking services, HealthPark Hospitality provides its healthcare partners comprehensive parking solutions"
21,Blow Mold Machine Operator,Consolidated Container Company,"Blow Mold Machine Operators report directly to Maintenance/ Production Manager. The Blow Mold Machine Operator will operate blow-mold, grinders, trimmer..."
13,Restaurant Team Member - Crew (1628 - Warrenton),CHIPOTLE,Have the ability to develop positive working relationships with all restaurant employees and work as part of a team by helping others as needed or requested •...
17,Administrative Assistant to the Provost/Vice President of Academic Affairs,East Central University,"The Administrative Assistant coordinates the Provost’s appointments and travel arrangements. East Central University invites applications for a twelve-month,..."
21,Shop Assembly and Fabrication,Western Window Systems,*Western Window Systems* is one of the fastest growing and most successful Window Manufacturing Companies in the nation. *Overview* The Warehouse Shop
18,Forestry Technician (Lookout),Department Of Agriculture,Workers Compensation Separation:. A career with the Forest Service will challenge you to manage and care for more than 193 million acres of our nation's most...
1,District Executive,Boy Scouts of America,Achieve net income and participation objectives for assigned camps and activities. Bachelor's degree from an accredited college or university (transcript with...
20,Auto Body Painter,DriveTime,What Drives You? Making your mark with a company known for excellence? A Chance for real work/life balance? Collaborating and thriving as part of a team?
10,Nursing Supervisor-FHRNC-Full Time Evenings-Mon-Fri,Fauquier Health System,Current Virginia State RN License. The Nursing Supervisor provides direction and supervision to staff to ascertain delivery of effective high quality patient...
1,"Sales Strategy and Operations Manager, Google Fiber",Google,"Working with them, you set the vision and the strategy for how their advertising can reach thousands of users...."
1,Technical Training Manager Job,CACI International Inc,The desired candidate must apply technical knowledge and experience to continually monitor the current training objectives as well as provide intuitive input to...
18,Wood Mill Operator 2,The AMES Companies,"The Wood Mill Operator 2 works under supervision of foreman encompassing the skills of Equalizer, Paint Line Operator, Stacker and Inspector...."
10,Cardiologist,U.S. Navy Reserve,*Cardiologist NEEDED* for part-time in Navy Reserve! Currently *1 position* open Nationwide! Your Benefits: * $75K Sign-on Bonus * All pay and allowances of
17,Retail Banker/ Teller - Center,Woodforest National Bank,"WOODFOREST NATIONAL BANK. Performs opening, closing, and other branch servicing duties such as cash and vault balancing;..."
20,Truck/Trailer Mechanic,Snider Fleet Solutions,Truck/Trailer mechanic skills:. Perform valve and injector overhead adjustments according to OEM procedures. We have an immediate opening for a *Tractor Trailer...
11,Personal Care Aide,Archangel Personal Home Care,Immediate needs for LIVE-IN aides located in Lackawanna County. Please call 570-507-9420 to schedule interviews....
22,Decker is Hiring CDL A Company Drivers Now,Decker,Class A CDL. Decker offers great pay and the best equipment as a truck driver to help you get more miles and more money in your job....
18,Climbers,Bartlett Tree Experts,Having a CDL is a big plus!! Great Benefits and competitive compensation AND we will assist with relocation for the right candidates!!...
15,Dog Walker/Pet Sitter,Tina Pet Services,"You have to love animals, and feel comfortable around them.:. First impressions are important, so be sure to let your personality come through in your initial..."
17,Night Auditor,Poplar Springs Inn & Spa,"Night Audit, Front Desk:. Poplar Springs Inn &amp; Spa is looking for a dedicated individual to perform the tasks and duties of a Night Auditor...."
20,Crew chief,SERVPRO of Culpeper & Fauquier Counties,High School Diploma or equivalentRestoration industry experience required.IICRC certificate required and ASD certification a plus.Ability to pass a criminal...
1,Assistant Administrative Manager,Capitol Building Supply,Bachelor’s degree in Business or related field is preferred. Develop product knowledge to assess needs and recommend solutions to customer needs....
13,Crew Person,McDonalds,"This position is for a friendly,enthusiastic person who can deliver prompt and accurate service with a smile...."
11,Certified Nursing Assistant,"Quadrant, Inc.",Must have a valid License. Certified Nursing Assistant. Cleaning resident's rooms. Has an immediate need for a CNA for a Major Medical Facility located in...
2,Business Operations Associate/Sr. Associate,Lending Club,"You’re both comfortable conversing with our front-line agents to truly understand how our operations work, as well as making a convincing case to our executive..."
3,Intelligence Tech Specialist,Raytheon,Other responsibilities include data entry and tracking of documents. Ability to manipulate data using various formats and tools with a serious commitment to...
23,Intelligence Analyst - Junior,"Streamline Defense, LLC","The Intelligence Analyst will perform intelligence analysis, analyst-driven data extraction and processing, dissemination of applicable reporting products, and..."
21,"Machine Operator-Remington, Virginia",U.S. Pipe,Must have at least one to three years of previous fabrication or manufacturing assembly or production work experience in a fast paced manufacturing or...
11,Rehab Aide,Accelerated Rehabilitation Centers,Previous Clinical Aide experience preferred. The Rehabilitation Aide will assist the Office Coordinator and clinician by performing requested administrative and...
21,Tailor - Northrock Shopping Center,Jos. A Bank,Listen to the wants and requests of the customer and answer the customer’s questions.Communicate to the customer and/or sales executive in a professional manner...
6,Counselor (K-8),Grambling State University,Teach school developmental guidance curriculum to students. Plan school guidance and counseling programs to ensure that they meet identified needs....
22,Regional / OTR Class A CDL Truck Driver,Marten Transport,Then now is the time for experienced Class-A CDL truck drivers who want Regional and OTR runs to join Marten!...
1,Manager Trainee,Olympia Sports,"Benefit package includes Medical/Dental Plan, 401K, paid vacation and holidays, bonus incentives and generous employee discount...."
14,Housekeeping Tech,Brentwood Behavioral Health of Louisiana,"Patients, staff and visitors. The Housekeeping Tech will ensure. The maintenance of a clean, healthy, pleasant environment for...."
22,Transportation Helper,United Airlines,"Now taking off: Your career Where do you want your career to take you? Chances are you can get there with United Airlines. Our environment is open, honest,..."
3,SQL Application Developer - IS Analyst,NewYork-Presbyterian/Columbia University Medical Center,"Advanced proficiency in programming languages (Visual Basic, C, C++, C#, Perl, Java), Applications (Healthcare IS, Allscripts SCM, Enterprise) and/or Database..."
17,Supervisor,Stage Stores,Interrupt store tasks to assist and answer questions for customers in a pleasant and courteous manner. O Key in telephone number and e-mail address when...
4,Mechanical Design Engineer,Hydra-Electric Company,Formulate conceptual design of aeronautical or aerospace products or systems to meet customer requirements. The Candidate will be responsible for product design...
22,Traffic Flagger - Warrenton VA,Flagger Force Traffic Control Services,"No experience is required, but you must have a valid driver’s license, reliable transportation and a cell phone...."
1,ASST STORE MGR,Dollar General,"Assist in ensuring the financial integrity of the store through strict cashier accountability, key control, and adherence to company security practices and cash..."
14,Maintenance Worker,Marsh Run MHC,"Valid driver’s license and good driving record. Required license or certification:. General knowledge of electrical, plumbing, and grounds maintenance...."
21,Processing Operator I - 3rd Shift,"SOFTPATH SYSTEM LLC in Sturgis, MI",Processing Operator I - 3rd Shift. Production or manufacturing and machine or forklift experience:. Primary responsibility will be to support the Dry blending...
1,Assistant Restaurant Manager,Dunkin' Donuts,Holds the guest as their highest priority and role models exceptional guest service. Manages cash over/short through effective cash control procedures....
10,"Dental Hygienist, Warrenton, VA","Heartland Dental, LLC",Valid Dental Hygienist license in the state for which you apply. Potentially out of state. Applying fluorides and other cavity preventing agents to prevent...
7,District Court Clerk II - O'ahu,Hawaii State Judiciary,Authors the official court record in a court of limited jurisdiction for District Court trial proceedings  Prepares documents ordered by the court
10,Surgical Technologist - Operating Room (OR),Accountable Healthcare Staffing,"Certified Surgical Tech needed; Operating Room Tech. Will work 4 ten hour weekdays with on-call evenings, weekends, holidays;..."
19,Plumber,Los Angeles Unified School District,A Los Angeles City Journeyman Plumber License OR a Los Angeles County Certificate of Registration as a Journeyman Plumber....
3,Software Specialist,TransTech LLC,"Where appropriate, lead implementation of innovative technical solutions. Continuously consider ways to implement technical solutions to improve Greystone..."
17,"Warrenton, VA - Furniture Assembler/Merchandiser",Spar Business Services,"Required license or certification:. As an Independent Contractor with SPAR Business Services, Inc. Have own tools...."
22,Student Class A CDL Truck Driver,Super Service,New Pay Raise April 2015Super Service needs recent truck driving school grads who are ready to hit the road and start earning big!...
13,Crew Person,McDonalds,"Greeting customers with a smile. It's time you worked for someone who will give you the tools to learn, grow and be what you want to be - both personally and..."
14,Exterminator,University City Housing Company,University City Housing (UCH) is a Philadelphia-based property management company with significant real estate holdings in and around the Philadelphia
16,Warrenton - Sprint Store by Adcomm Digitel Wireless Retail Sales Associate,Sprint Store by Adcomm Digitel,Making outgoing calls to warm leads representing companies and individuals in the area. The Retail Sales Consultant will help to build business and develop....
15,Grooming Assistant,Petco,Assist in booking grooming appointments and performing follow-up phone calls and reminders to customers....
3,Senior Intelligence Technican Associate,Raytheon,Possess a valid driver license for delivering records using government transportation within WMA. Give presentations to visitors as required....
16,Sales Associate/Cashier (part-time),Bed Bath & Beyond,Currently hiring part time sales / cashiers / stock associates and bridal consultants. All shifts available....
2,Fraud Risk Agent,Best Buy,Fraud Risk Agent. The Fraud Agent will support the efforts of BestBuy.com to provide timely service to our customers while controlling risk associated with...
10,Surgical Tech,trustaff,Must have valid BLS certification. This assignment is for an immediate start with a reputable facility seeking an experienced Surgical Technician to fill a 13...
3,"(CSITO) Close Support/Systems Administrator - Warrenton, VA Job",CACI International Inc,"Answer users' inquiries regarding computer software and hardware operation to resolve problems, including requirements originating from a field location...."
19,Industrial Electrician,Novelis,"Novelis Corporation, the global leader in rolled aluminum and can recycling, has an opportunity at its Fairmont, WV plant for an experienced Industrial..."
19,Lead Carpenter,Genesis Home Improvement,"Required license or certification:. Have a driver’s license and reliable transportation. Must have own tools. Utilize chisels, planes, saws, drills, and sanders..."
22,Class A CDL Flatbed Company Truck Driver,Builders Transportation Company,EXPERIENCED FLATBED COMPANY TRUCK DRIVING JOBS AT BTC. A flatbed truck driver with 2 years of experience can start off making 50 CPM or 29% Freight Revenue and...
14,Custodian/Freight Associate,Stage Stores,"Assist freight carrier driver with properly staging cartons by colored label. Clean restrooms, store entrance, associate break room, Team-One area and fitting..."
10,Pharmacy Technician,CVS Health,Answer telephone with appropriate greeting. The Pharmacy Technician Trainee is a training position where you can move to a Pharmacy Technician upon successful...
16,"Part Time Merchandiser-Warrenton, VA",American Greetings,EOE M/F/disability/vet VEVRAA Federal Contractor&quot
16,Sales Representative,Cantium Sports,ADVERTISING SALES - Connect Golf Courses &amp Local Businesses*. NO Florida state sales tax!*. Manage ad space &amp cost to meet sales goal*.…
20,Mechanic Helper,Pace Bus,Qualified candidate must possess at least one (1) years previous diesel/gas experience and/or technical training and meet the criteria of Pace's Mechanic...
6,Medical Social Worker - Home Health and Hospice Job,HCR ManorCare,"May require licensure or certificate as required by the state, and in good standing. The Medical Social Worker is responsible for providing patients and..."
1,Sr. Assistant Store Manager,Stage Stores,"Work with Store Manager and District Manager to develop and execute plans for store to improve profitability, greater productivity and efficiency...."
2,Account Manager / Estimator,Five Star Painting - Manassas,Be available to answer any questions regarding the job while the project is in progress. Use the proper tools to estimate the job accurately....
1,"Senior Marketing Campaigns Manager, North America Hardware Marketing",Oracle,"Senior Marketing Campaigns Manager, North America Hardware Marketing. This will include demand generation, brand awareness, events, field marketing, web/online..."
9,Actor/Actress,Nine30 Media,"We are looking for actors to become a member of our marketing team. Our ideal candidates would have a strong portfolio, a heavy social media presence, and a..."
1,Dog and Cat Dept Manager,Petco,"Accountable for driving sales and for the overall effective operations within the area of dog and cat food, litter, supplies, toys, treats, rawhide, containment..."
13,Starbucks Clerk (11973),Safeway,The Company is an equal opportunity employer and is committed to compliance with its obligations under all applicable state and federal laws prohibiting...
17,Administrative Associate Round Rock TX,Dell,The Administrative Sr. Coordinates office functions with other departments. We are currently seeking an Administrative Sr....
4,Project Engineer,"Vanir Construction Management, Inc.","Or, non-degree holders must possess 4+ years of experience in a construction, engineering or architectural related position...."
9,Full Time Artist,Lisa Frank Inc,"When you were growing up, did all your school supplies HAVE to be Lisa Frank? Are you creative, energetic, and hardworking? This might be the job for you!"
8,Summer Technology Camp Staff - Lead & Assistant Instructors,Black Rocket Productions,"We have multiple locations in over 30 state states! Are you passionate about Video Games, App Design, Digital Movies, Robotics, or STEM?..."
4,Field Service Engineer / PLC / Machinery / service,Randstad Engineering,"Provide technical support to customers and field technicians to install and maintain equipment. Provide telephone support for installation, troubleshooting, and..."
22,"Traffic Control Specialist - Flagger - Warrenton, VA",Area Wide Protective,Must possess a valid driver's license and maintain an acceptable driving record by complying with standards established by AWP policy....
18,Arborist Climber Trainee,Bartlett Tree Experts,The ideal candidate will have experience working on a tree crew as a Ground Man OR a 2/4 year degree in Forestry or a related field....
17,Clinical & Secretarial Services Technician-ER-Part Time-Days,Fauquier Health System,"The Clinical &amp; Secretarial Services Technician also coordinates the activities of the department through communication, requisitioning and management of..."
17,Operations,The Home Depot,"Requires listening for customer service calls, personal pages and general information announcements. May have to handle merchandise and work with tools with..."
8,Assistant Teaching Professor,Worcester Polytechnic Institute,"The Mathematical Sciences Department currently has 28 tenured/tenure-track faculty members, 9 postdoctoral scholars, 5 teaching professors and features a..."
8,Adjunct Instructor - Physics,Lord Fairfax Community College,"The major emphasis shall be on good teaching by working with students in classrooms, laboratories, individual conferences, and related activities—to help the..."
14,Greenskeeper,Heritage Palms Golf Club,*Summary* Assists in a general range of activities involved in golf course maintenance and construction. The individual should be able to perform semi-skilled
17,LPNs and RNs Needed!,WRB Communications,Active LPN/ RN license. Our LPN/ RN Communicators will take calls from consumers and health care providers and document product complaints or adverse events...
13,Server Assistant / Busser /Food Runner,Royal Docks Brewing Company,"It’s a place where the welcome is a little warmer, the room is a little cozier, the barkeep is a little friendlier and the crowd is somehow a wee bit more..."
9,TV Line Producer,zulily,"This will include partnering with various production companies to create new scripts, select footage and music and hire freela nce voice over artists...."
13,PT Deli/Bakery Associate,Food Lion,Answer the telephone. Technical skills in all areas of preparation and handling of Deli/Bakery product in compliance with Food Lion standards....
16,Sales Associate,Petco,This role also involves completing cash register transactions as well as providing customer carry-out service....
3,"Database Specialist, Master",OBXtek,"Performs database programming and supports systems design. (h) Includes maintenance of database dictionaries, overall monitoring of standards and procedures,..."
13,Day Baker,Panera Bread Franchise (Blue Ridge Bread),Our bakery-cafes are focused on taking care of our guests. We work diligently and with flexibility to coordinate our daily responsibilities and uphold the...
8,Lead Teacher,Children of America,Has experience with pre-school age children and state credentials and MUST have the state required registry.*. This approach concentrates on allowing each child...
22,School Bus Driver -aftercare program,Lake Forest Park Montessori,"Part time aftercare/ bus driver:. If CDL required for vehicle driver, driver is subject to NLCI and state/federal policies, procedures and requirements..."
2,FINANCIAL QUALITY COORDINATOR,Inova Fairfax Hospital,"Bachelors Degree = 2 years. Supports Inova Health System or Physician Services, and Patient Registration department financial goals through patient financial..."
11,Massage Therapist/Chiropractic Assistant,Physicians Plus Spine and Rehab Center,Chiropractic office is seeking a full time massage therapist/chiropractic assistant. This position offers great opportunity for the right person....
17,Human Resources and Payroll Clerk,Tennessee Performing Arts Center,Reconcile monthly billing. Facilitate job posting as necessary. The Tennessee Performing Arts Center is looking for a full time HR/Payroll Clerk....
11,Environmental Services Associate-PRN-7a-3p,Fauquier Health System,"The Environmental Services Associate is responsible for cleaning all patient rooms, nurses’ station, bathrooms, waiting areas, departmental areas, offices,..."
2,Recruiter,Cascades Specialty Products Group,Additional responsibilities include developing relationships with the HR and Hiring Managers and the complete onboarding of placed candidates....
