job_field_id,title,company,description
21,Production Operator - 2nd shift,Bostik Inc.,About Bostik - Smart Adhesives. As a production operator at Bostik you will be in a batch making/mixer operator position for a competitive manufacturing...
6,Senior Addiction Counselor,NYC Health + Hospitals,The Senior Addiction Counselor will be responsible for assisting the consumer with activities relevant to an individual's rehabilitation goals....
14,Janitor - Cleaning Technician - FULL TIME - 84095,Wingfoot Services,"Janitorial, janitor, cleaning specialist, carpet cleaning, floor care technician, buffing, part time, supplemental income, laborers, landscaping, supervisor,..."
20,HVAC Installer/Technician,Express Air Sytems,Basic knowledge of standard code requirements of air conditioning systems. \*\*\*\*\*Minimum requirements for Installers\*\*\*\*\*....
13,Kitchen Cook,SMG World - Tucson Convention Center,Banquet facility preparing meals for large events:. Fulfilling the service per each Banquet Event Orders (BEO)....
15,Lobby Concierge,Beach Activities of Maui,"The Concierge is knowledgeable about the local area and is the expert on the attractions, tours and activities that we sell.Must be flexible with scheduling and..."
11,2 Med/Peds Certified Nursing Assistant,Riverside Medical Center,Reports changes in patients' condition to the professional nurse. The 2 Med/Peds Certified Nursing Assitant (CNA) assists with the care of patients ranging from...
18,Agricultural & Standards Inspector - I,Placer County,"Recruitments for Agricultural and Standards Inspector I, Agricultural and Standards Inspector II, and Agricultural and Standards Inspector, Senior are being..."
10,Anesthesiologist,"UF, Department of Anesthesiology","Department anesthesiologists practice at UF Health hospitals in Gainesville, FL at the University of Florida alongside 62 faculty anesthesiologists, 78..."
17,Telephone Operator,The Broadmoor,"Monitors 911 Alert System. Operates the switchboard to relay incoming, outgoing, and interoffice calls by performing the following duties:...."
2,Cost Accountant III,Weatherford,JOB DESCRIPTION JOB SCOPE: This position will be responsible for the day to day understanding of the plant’s financial performance. The position will also be
1,Regional Marketing Manager,Vishay,Develops a formal marketing plan outlining an appropriate marketing strategy for selling to key accounts. Coordinates the marketing efforts for a product group....
23,"Analyst, Operations",General Dynamics Information Technology,Extended Air Defense Simulation (EADSIM). Battle Command Sustainment Support System (BCS3). Air and Missile Defense Work Station (AMDWS)....
7,Administrative Law Judge,New Mexico State Personnel Office,"Administrative Law Judge, Adjudicator Advanced. This position will conduct administrative hearings on behalf of the State Personnel Board concerning..."
4,Mid-Level Ground Control Station Engineer,GENERAL ATOMICS,Job ID# 6452BR Company General Atomics Aeronautical Systems Title Mid-Level Ground Control Station Engineer Job Category Engineering City San Diego State...
22,Air Traffic Control Operator,National Guard,The skills you learn as an Air Traffic Control Operator will qualify you to work in civilian air traffic control towers and centers at airports and airfields....
9,Graphic Artist,IGT,"Maya, Autodesk 3D Studio Max). This position is the development and timely delivery of high quality 2D and 3D game...."
12,Transportation Security Officer (TSO),Trinity Technology Group,TSOs must take the computerized Screener Assessment Battery. Repeatedly lift and carry baggage weighing up to 70 pounds…
16,Digital Sales Account Executive,The Morning Call Media Group,"Manages advertising sales revenue and account management targets. Our digital sales account executives are responsible for selling advertising banners, programs..."
19,Drywall Hanger/Installer,EncoreHR Staffing,"Includes lathers who fasten wooden, metal, or rockboard lath to walls, ceilings or partitions of buildings to provide support base for plaster, fire-proofing,..."
5,NATURAL RESOURCES PROGRAM TECHNICIAN,Arkansas Game & Fish Commission,"Knowledge of agricultural methods and basic land laws. Conducts agricultural and forest management activities on wildlife management areas, including preparing..."
3,Data Scientist,Humana,"Bachelor’s Degree in Mathematics, Computer Science, Actuarial Science or related field. Collaborate with other professionals including Actuaries, Mathematicians..."
8,Tutor or Teacher - Elementary Math,,"We are looking for math tutoring for our 4th grader. Improve grades, get ahead and increase confidence. Elementary math Tutoring &amp; Teaching opportunities..."
8,Basic Skills/Learning Center Non-Credit Instructor,North Orange County Community College District,"Teach pre-college courses in class and lab settings including, but not limited to, adult basic education (ABE), career technical education, adult secondary..."
11,"MEDICAL ASSISTANT CLINIC- INOVA Cardiology Warrenton, VA",Inova Fairfax Hospital,Answering calls and providing pertinent information. Fulfills clerical responsibilities as assigned which may include:....
22,Parts Specialist,Auto Plus Auto Parts,"Must maintain a clean and valid driver’s license in the state of operation. The candidate will complete cash balance sheets accurately, practice option and add..."
10,Staff Nurse,South Shore Medical Center,Provide quality care to South Shore Medical Center patients. Administer prescribed medications and treatments. Prepare patient for office visit. Respond to
19,Lead Remodeler/Construction Technician,Gibson Home Services LLC,Must have a valid driver's license with a clean driving history and successfully pass a background check and drug screening....
11,Massage Therapist/Chiropractic Assistant,Physicians Plus Spine and Rehab Center,Chiropractic office is seeking a full time massage therapist/chiropractic assistant. This position offers great opportunity for the right person....
22,Transportation Helper,United Airlines,"Now taking off: Your career Where do you want your career to take you? Chances are you can get there with United Airlines. Our environment is open, honest,..."
2,Federal Business Development Representative,Insperity,"Develop strategic account business plans and own the sales cycle from lead generation to closure. Proactively identifies, locates and qualifies new business..."
22,CDL-A Company Truck Drivers,Fleetmaster Express,"Build the perfect truck driving career with company driving jobs at Fleetmaster! Whether you need more miles or more time at home, Fleetmaster Express has the..."
13,Day Baker,Panera Bread Franchise (Blue Ridge Bread),Our bakery-cafes are focused on taking care of our guests. We work diligently and with flexibility to coordinate our daily responsibilities and uphold the...
3,Software Specialist,TransTech LLC,"Where appropriate, lead implementation of innovative technical solutions. Continuously consider ways to implement technical solutions to improve Greystone..."
18,Arborist Climber Trainee,Bartlett Tree Experts,The ideal candidate will have experience working on a tree crew as a Ground Man OR a 2/4 year degree in Forestry or a related field....
2,Portfolio Administrator,"Greystone & Co., Inc.","Transfer incoming mortgage payments to various custodial accounts in compliance with agency requirements. We are seeking a Portfolio Operations Specialist, for..."
14,Maintenance Worker II - PUBLIC WORKS,City of Port Orange,Clean grounds and remove litter. Experience in operating automotive or maintenance equipment. Provide routine and basic maintenance and repair to small...
16,PT Sales Associate,Food Lion,"Responsible for maintaining standards according to the Front End Standard Practice Manual, maximizing sales through excellent customer service and minimizing..."
3,Senior Certified Security Analyst,Kforce,"Coordinate with applicable stakeholders to develop security event remediation strategies and timelines. Engineering, Math, or Science Degree...."
11,CNA/Medication Aide-PRN-7a-3p,Fauquier Health System,Virginia State Certified Nursing Assistant License. Virginia Registered Medication Aide License. The Certified Nursing Assistant/Medication Aide assists with...
3,"Network Deployment and Operations (NDO) Lead, Google Fiber, Midwest",Google,"Familiarity with other network transmission protocols and in-home network architecture. Ensure the best local network is designed, built, and maintained with..."
8,7th & 8th Grade Social Studies Long Term Substitute Teacher,Willamette Leadership Academy,"We are looking for a dynamic and passionate social studies teacher to teach two periods of 8th grade US History, 2 periods of 7th grade Intro to Western..."
23,Air Defense Artillery Officer (14A),U.S. Army,Job training for an air defense artillery officer includes completion of the Air Defense Artillery Officer Basic Course....
10,Recreational Therapist - Full Time - Baylor Rehab - downtown Dallas,Baylor Institute for Rehabilitation,Current national certification from NCTRC as a Certified Therapeutic Recreation Specialist (CTRS). The Therapeutic Recreation Specialist/Recreational Therapist...
12,BORDER PATROL AGENT,Department Of Homeland Security,Border Patrol Sectors. And pass the Border Patrol Agent Entrance Examination. Being a border patrol agent makes you a valuable member of the federal Law...
15,Pet Stylist (Dog Groomer),Petco,"We’re making things better for pets, people and the planet through our Think Adoption First philosophy, the Petco Foundation and other important initiatives..."
17,Retail Store Shift Supervisor,CVS Health,Ensure compliance with all company policies and procedures (such as cash management) and federal and state....
15,Dog Trainer / Apprentice,Petco,Our Petco family is made up of pet lovers who unselfishly put the needs of others before their own. Previous experience teaching positive reinforcement dog...
10,Mammography Technologist-Part Time-Days,Fauquier Health System,Must be able to utilize independent decision making skills in a wide variety of situations. 1+ years of experience as a registered technologist in the...
2,Marketing Internship Latin America,Cosmetics of France,Provide customer service to the agent zone in terms of material &amp information needed for events trough com. Consolidate and update the Local Makeup Experts &amp
3,Configuration Manager/Specialist,ManTech International Corporation,An additional four years of relevant technical experience may be substituted for the Bachelor’s Degree....
22,Hiring CDL-A Drivers for L/P,Network 1,"No commercial transportation related felony, theft or larceny conviction. LEASE OPERATORS NEEDED NOW!!*...."
2,Community Banking Branch Banker III Full Time,BB&T,"Perform basic teller transaction such as accepting deposits and loan payments, verifying cash and endorsements, cashing checks within limits and obtaining..."
20,Aquatic Scientist/Customer Service Manager,"Virginia Waters and Wetlands, Inc.",Required license or certification:. Valid driver’s license required. Commercial Herbicide Applicator License – Category 5A preferred• Arborist certificate - a...
2,Senior Accountant (Tax),"PBMares, LLP",150 hours required by the Virginia Board of Accountancy to acquire a CPA license. Our Firm’s policy is to provide equal opportunity for employment to all...
17,Medical Office Asst VA,Novant Health,Graduate of an accredited medical assistant program preferred. The team member's number one job responsibility is to deliver the most remarkable patient...
13,Evening Server,Denny's,"Looking for an individual with a positive attitude to provide friendly, fast, accurate service to guests dining in our restaurant...."
3,Junior Software Tester,"FEi Systems, Inc.","FEi Systems provides extensive IT services for multiple federal agencies and state governments in the areas of Medicare management, Health Information Exchanges..."
16,LEAD SALES ASSOC-PT,Dollar General,Operate cash register and flatbed scanner to itemize and total customer's purchase
16,Sales Representative - Worcester,Commonwealth of Massachusetts,Instruct Sales Agents on the use of successful marketing and sales techniques. Provide motivation to Sales Agents and recommends incentive plans intended to...
17,Night Auditor,Poplar Springs Inn & Spa,"Night Audit, Front Desk:. Poplar Springs Inn &amp; Spa is looking for a dedicated individual to perform the tasks and duties of a Night Auditor...."
9,Audio/Video Installer,Wilshire Media Systems Inc,"Wilshire Media System’s is Southern California’s premier source for home theater, high performance audio, home automation and lighting control...."
22,Delivery Driver/Garbage Truck Driver,Waste Connections,In this position you will be delivering garbage and recycling container to commercial and residential customers in and around anchorage....
20,Plant Maintenance Mechanic - Night Shift,Vulcan Materials Company," Diagnose problems and perform mechanical repair. Assists plant personnel with repair and maintenance. Mechanical repairs to various types of crushers, screens..."
19,Fabricator/Welder Helper,Kooks Custom Headers Inc,Pass off parts to helper for grinding and straightening flanges. Receive parts back from helper for final assembly and inspection for quality control....
18,Lead Fish Technician,Hubbs-SeaWorld Research Institute,Hatchery building is a damp environment. Stay current with latest technologies related to fish rearing. Assist in all other aspects of fish husbandry as needed....
7,Legal Liaison,"Maricopa County, AZ",High School diploma or GED and two (2) years of clerical experience in a legal and/or law enforcement setting with knowledge in legal preparations and legal...
15,Assistant Salon Manager,Hair Cuttery Salon,"BASIC REQUIREMENTS - MUST HAVE A COSMETOLOGY LICENSE in the state you are applying for, eligibility to work in the United States, 6+ months experience in a..."
4,Navy Logistician,LinQuest Corporation,"Review technical studies, reports, and white papers on new enhanced system capability designs, system design requirements, and system failure investigation..."
13,Food Service Attendant,Riverside Health System,"Formal training as a cook preferred. Performs duties related to therapeutic diets and meal services to include, aides in the preparation of preparation of hot..."
9,Visual Associate,Stage Stores,"Implement all major floor moves in quarterly floor plans. Maintain all visual elements (signs, mannequins, collateral, door signs, banners, etc.)...."
10,Dental Assistant,Smile Time Kids,"We are opening our pediatric practice in Richmond, IN in April 2016. We are looking for dental assistants(part time) and business assistants(full time)...."
7,Senior Appellate Law Stenographer,NYS Unified Court System,"Acting as liaison with Justices, court attorneys and administrative personnel with regard to assignments; Responsible for training and supervising Appellate Law..."
1,District Executive,Boy Scouts of America,Achieve net income and participation objectives for assigned camps and activities. Bachelor's degree from an accredited college or university (transcript with...
13,Line Cook,Longhorn Steakhouse,"Work in a team-oriented, high-volume, fast-paced, guest-centric environment to deliver Genuine Western Hospitality to our guests by:...."
3,SQL Application Developer - IS Analyst,NewYork-Presbyterian/Columbia University Medical Center,"Advanced proficiency in programming languages (Visual Basic, C, C++, C#, Perl, Java), Applications (Healthcare IS, Allscripts SCM, Enterprise) and/or Database..."
6,School Psychologist-Full Time-Warrenton Virginia-Upcoming School Year,ProCare Therapy,"School Psychologists will need to be able to work with and provide services including, but not limited to performing assessments and evaluations...."
11,Health Care Assistant or Bilingual Health Care Assitant - LVN,Hanford Elementary School District,HEALTH CARE ASSISTANT. Certified Nursing Assistant (C.N.A.). See Health Care Assistant Job Description. Addendum to Health Care Assistant Job Description....
10,Pharmacy Technician,Rite Aid,"Pharmacy Technician certification where required by state law. Rite Aid Technician Training Program certification in all modules, job class/codes up to and..."
13,Cook - PRN - Hours vary,Fauquier Health System,"SERVE SAFE certification. Course work/completion from an accredited culinary school. In the absence of the team leader, the cook will supervise the operations..."
3,"Quality Assurance Automation Tester at Phoenix ,AZ, Local Preferred",West Coast Consulting LLC,"Hello, Kindly go through the requirement and let me know if you are comfortable with this requirement mentioned below. Job Title : Quality Assurance"
16,Kitchen/Bath Designer,The Home Depot,"Requires listening for customer service calls, personal pages and general information announcements. Answer questions about merchandise for the customer's level..."
13,Dishwasher and Busser,Jefferson Manor Health & Rehab,This is a full time dishwasher position in a nursing home facility. Prior experience preferred but not required....
16,Retail Floater,The Fauquier Bank,"Accepts deposits, loan payments, TT&amp;L Payments, VISA deposits and payments. Processes requests for cash advances, gift and travel cards, and transfer of funds.*..."
20,Service Technician (Mechanic),"Franklin Equipment, LLC","The individual will maintain and repair equipment offered by Franklin Equipment to include Construction and Agricultural (small equipment, aerial, dirt, farm,..."
21,Processing Operator I - 3rd Shift,"SOFTPATH SYSTEM LLC in Sturgis, MI",Processing Operator I - 3rd Shift. Production or manufacturing and machine or forklift experience:. Primary responsibility will be to support the Dry blending...
16,Sales Associate,Lands' End,"Including courteously, conversationally greeting customers, adjusting individual customer attention based on store traffic, suggesting solutions based on..."
4,CAD Drafter,Raytheon,"Architectural, mechanical, civil, security, structural, and electrical engineering. This drafter position is that of a contributor and will be in direct support..."
17,Office Manager and Billing Specialist,"Fauquier Neurological Associates, Limited",Looking to hire a medical office manager with medical coding/billing experience. Must have knowledge of Quickbooks payroll program
15,Grooming Assistant,Petco,Assist in booking grooming appointments and performing follow-up phone calls and reminders to customers....
14,Housekeeping Tech,Brentwood Behavioral Health of Louisiana,"Patients, staff and visitors. The Housekeeping Tech will ensure. The maintenance of a clean, healthy, pleasant environment for...."
16,Sales Consultant,K. Hovnanian Companies,"Successful candidate must maintain a valid driver's license. The ability to provide the highest level of customer service, including exceptional communication..."
16,Customer Service/Deliveries,The Home Depot,"A valid drivers license and proof of insurance is required for driving. Whether directing customers to store departments or merchandise, answering customer..."
13,Teller - On Call for the Warrenton/Fauquier County area,BB&T,"Perform the basic transactions of a paying and receiving teller such as accepting deposits and loan payments, verifying cash and endorsements, cashing checks..."
13,Cook - Banquet Kitchen,Hilton Hotels & Resorts,Banquets and Catering. A Cook with Hilton Hotels and Resorts is responsible for preparing food items in accordance with recipes and established standards....
13,Crew Person,McDonalds,"Greeting customers with a smile. It's time you worked for someone who will give you the tools to learn, grow and be what you want to be - both personally and..."
20,"Automotive Body Repairer, Fiberglass/Welder",The Logistics Company,The Repairer applies and spreads body filler manually to reestablish surface. Two years related experience. The Automobile Body Repairer mixes polyester resin...
11,CNA-Tele/MedSurg Unit-Full Time-Nights,Fauquier Health System,Virginia State Certified Nursing Assistant License. The Certified Nursing Assistant assists with patient care throughout nursing areas under the direction of...
22,Part Time 3rd Shift Stocker North Rock,Harris Teeter,"While performing the duties of this job, the associate is frequently exposed to wet, hot, or cold conditions and moving mechanical parts...."
3,IT Support Specialist,"Greystone & Co., Inc.",This role is responsible for answering incoming calls and monitoring incoming email for internal users in an IT help desk environment through a ticket tracking...
13,Food Service Worker,TrustHouse Service Group,"Such as tray line, dish room, cafeteria and storeroom. The Food Service Worker is responsible for routine food service tasks in the kitchen, cafeteria, dining..."
2,Junior-Staff Accountant,Poplar Springs Inn and Spa,"Prepared recurring tax reports and other filings, to include sales and occupancy tax returns, personal property tax returns, business license applications..."
17,Help Desk / Support Specialist,Raytheon,Provide on-demand and scheduled training to individuals and groups in the use of Maximo and other technical support tools....
5,Biologist,Department Of Agriculture,"Participates as a team member, while also training, mentoring, and setting work priorities for a fluctuating team of Biological Science Technicians, students,..."
13,House Cook/Chef,Delta Zeta at Univ. of Northern Colorado,"Cook, Prep Cook, Chef, Line Cook, Nutritional Services, Cafeteria:. Responsible for preparing meals taking into consideration nutrition, food availability and..."
23,Surface Warfare Officer (Nuclear Aircraft Carriers),U.S. Navy,"Managing shipboard vertical launch systems. For those going the Surface Warfare Officer (Nuclear) route, the first step is Officer Candidate School (OCS) – a 12..."
16,Technology Sales Associate,Staples,"All qualified applicants will receive consideration for employment without regard to race, color, religion, sex, national origin, protected veteran status,..."
21,"Lead, Upholstery",StandardAero,"The Senior Tech Upholsterer is technically competent in aircraft upholstery, and is technically competent to accomplish all of his/her duties with little or no..."
8,Summer Camp Teacher,Children of America,"Must have a Drivers License. Perform all duties in compliance with State and Local licensing requirements, policies and procedures...."
1,Management,Panera Bread Franchise (Blue Ridge Bread),Our bakery-cafes are focused on taking care of our guests. Please apply online and a Manager may be in touch if an opportunity matching your qualifications...
8,Talent and Workforce Skills Trainer,Shangri-La,Ø Education and Experience. Requires a basic understanding of alpha numeric filing. 1.3.2 Utilize multiple adult learning styles for maximum information...
23,Senior Analyst - Ground,Scientific Research Corporation,USA Warrant Officer MOS 140E - Air and Missile Defense Tactician / Technician. USA MOS Air Defense Artillery Officer with air operations center experience or....
18,Climbers,Bartlett Tree Experts,Having a CDL is a big plus!! Great Benefits and competitive compensation AND we will assist with relocation for the right candidates!!...
19,Carpenter,Chicago Bridge & Iron Company,"Fits and nails sheathing on outer walls and roofs of buildings. Erects scaffolding for buildings and other structures and installs ladders, handrails, walkways,..."
20,Photo Lab Technician,CVS Health,Follow Federal and State laws and OSHA regulations. Actively participate in the Photo Lab Training and Certification Program by certifying in all necessary...
3,Hadoop Administrator,General Dynamics Information Technology,"Bachelors Degree in Computer Science or a related technical discipline, or the equivalent combination of education, technical certifications or training, or..."
17,Retail Banker/ Teller - Center,Woodforest National Bank,"WOODFOREST NATIONAL BANK. Performs opening, closing, and other branch servicing duties such as cash and vault balancing;..."
13,Bartender - Toms River Chili's,Chili's,"You know how to manage the back bar. Providing an enjoyable bar experience for every Guest. A duck walks into a bar and – oh, wait...."
22,CDL-A Company Truck Drivers,Mesilla Valley Transportation East,"Mesilla Valley Transportation, a 48-state motor carrier, is now hiring company truck driving teams for OTR, Shuttle and Super Local runs...."
1,Assistant Administrative Manager,Capitol Building Supply,Bachelor’s degree in Business or related field is preferred. Develop product knowledge to assess needs and recommend solutions to customer needs....
15,Companion Care / Personal Care - Waukesha,"FirstLight Home Care, Brookfield, WI","Companion Care/ Home Health Aide*. In addition to providing a flexible schedule, we offer potential for advancement, award programs, and opportunity for..."
13,Restaurant General Manager,Taco Bell,"It is not all-inclusive, and a similar job at other Brands, Franchise or License locations may be different...."
11,Home Health and Hospice Aide Job,HCR ManorCare,"Minimum of one year experience as a Home Health or Hospice Aide, or is currently enrolled as a nursing student who has had a minimum of 6 months clinical..."
15,Beauty Advisor,Stage Stores,Develop relationships with customers to insure future sales. Polite and courteous to customers and co-workers....
22,Flight Attendant,Compass Airlines,Flight Attendant - LAX. One year previous flight attendant experience preferred The Flight Attendant will demonstrate the Compass Airlines' core values and…
1,Assistant Manager,Domino's,"Occasionally, pizza sauce weighing 30 pounds is carried from the storage room to the front of the store. If you like the thought of managing your own million..."
