job_field_id,title,company,description
3,Software Specialist,TransTech LLC,"Where appropriate, lead implementation of innovative technical solutions. Continuously consider ways to implement technical solutions to improve Greystone..."
13,Banquet Chef/Line Cook,Golf Course North Houston,"Preferred Banquet experience but not required. All kitchen staff must be able to cook high-quality balanced meals, cook from scratch and maintain proper food..."
15,Barber,GoodBuddyz BarberShop,Chairs available for registered and apprentice barbers at 3-chain barbershop. Build your own clientele or bring your own....
17,Administrative Secretary RB # 15 - 102,Buffalo Public Schools,"Administrative Secretary – Permanent. The Administrative Secretary performs a wide variety of complex responsible clerical, secretarial and administrative tasks..."
16,Keyholder - Commissioned - Northrock Shopping Center,Jos. A Bank,"Understanding merchandise features, marking and fitting techniques and fashion trends to determine what type of garments are desired and advise customers about..."
22,School Bus Driver -aftercare program,Lake Forest Park Montessori,"Part time aftercare/ bus driver:. If CDL required for vehicle driver, driver is subject to NLCI and state/federal policies, procedures and requirements..."
17,Office Manager and Billing Specialist,"Fauquier Neurological Associates, Limited",Looking to hire a medical office manager with medical coding/billing experience. Must have knowledge of Quickbooks payroll program
19,Carpenter Assistant,Genesis Home Improvement,"Required license or certification:. Entry level or 1+ years of experience in the construction field, willing to train the right candidate...."
1,Store Manager (or Manager in Training) - Northrock Shopping Center,Jos. A Bank,"They are effective communicators and interact professionally whether they are assisting customers with issue resolution, coaching associates on selling..."
17,Bookkeeping Clerk,John Q. Hammons Hotels & Resorts,"Must have 1-2 years in accounting , customer service and/or bookkeeping experience or equivalent. Perform any combination of routine calculating, posting, and..."
6,Social Worker-MSW-PRN Weekday & Weekends,Fauquier Health System,Masters of Science in Social Work. Experience in health–related field or setting. The Social Worker-MSW provides general social work services and participates...
8,Teacher- Spanish (Part-Time),Fauquier County Public Schools,"Plans, coordinates, attends, and chaperones field trips as appropriate. Motivates students to develop an interest in and an appreciation of language (French and..."
13,Full Time Cake Decorator-Northrock Shopping Center,Harris Teeter,"Technical Skills - Assesses own strengths and weaknesses; Answer telephones by saying &quot;Harris Teeter [store name], this is [name], may I help you?&quot;...."
17,Securities&Doc Admin,"Greystone & Co., Inc.",Our Securities and Document Management department is seeking a highly motivated individual that is capable of handling multiple tasks simultaneously to issue
8,Librarian/Archivst - Part Time,Native Hawaiian Veterans,"Native Hawaiian Veterans, LLC is a Native Hawaiian Owned, Service Disabled Veterans Owned Small Business (SDVOSB), SDB, SBA 8(a), MBE, UDBE, and EEO/W/M/Vet"
22,Experienced CDL-A Regional Truck Driver,Specialized Transportation Services Inc,Regional truck driving jobs at Specialized Transportation Services offer responsible CDL professionals predictable schedules without having to forfeit great pay...
16,Sales Associate/Cashier (part-time),Bed Bath & Beyond,Currently hiring part time sales / cashiers / stock associates and bridal consultants. All shifts available....
10,Telemedicine Physician,"MeMD, Inc.",MeMD is seeking a Board-Certified Physician possessing a Florida medical license that is interested in joining our team of Telemedicine Providers....
3,Intelligence Tech Specialist,Raytheon,Other responsibilities include data entry and tracking of documents. Ability to manipulate data using various formats and tools with a serious commitment to...
2,Federal Business Development Representative,Insperity,"Develop strategic account business plans and own the sales cycle from lead generation to closure. Proactively identifies, locates and qualifies new business..."
20,Auto Glass Installer,Luther Automotive,"At least 1 year of mobile auto glass experience required. Install windshields in shop and mobile, perform rock chip repairs and pull and reinstall glass for the..."
18,Park Officer,State of Ohio,Major Worker Characteristics:. Applicants can view the status of this position by logging into their user profile on the Ohio Hiring Management System [OHMS]...
3,Jr Systems Administrator,City of Rifle,"Systems Administrator, Full-time, 4 year degree required. This position will assists the Systems Administrator in the support of services provided to the user..."
18,Wood Mill Operator 2,The AMES Companies,"The Wood Mill Operator 2 works under supervision of foreman encompassing the skills of Equalizer, Paint Line Operator, Stacker and Inspector...."
13,$10.00 Hr Dishwasher,Ruby Tuesday,As soon as you join the team you'll notice the friendly working environment and the variety of experience that comes with working at Ruby Tuesday.Apply at:....
11,CNA - Certified Nursing Assistant,Oak Springs of Warrenton,Seeking Licensed CNA's for all shifts. Participate in assessments and development of treatment plans. Full or Part Time shifts are available to provide direct...
22,CDL-A Company Truck Drivers,Purdy Brothers Trucking,We offer a better driving career by asking YOU what you need and then doing whatever we can to meet those needs....
22,Flight Attendant,Compass Airlines,Flight Attendant - LAX. One year previous flight attendant experience preferred The Flight Attendant will demonstrate the Compass Airlines' core values and…
15,Companion Care / Personal Care - Waukesha,"FirstLight Home Care, Brookfield, WI","Companion Care/ Home Health Aide*. In addition to providing a flexible schedule, we offer potential for advancement, award programs, and opportunity for..."
9,Animator,National Center for Missing & Exploited Children (NCMEC),"The Animator is responsible for designing and developing 2D and 3D content for web, television, interactive and print projects...."
11,Health Care Assistant or Bilingual Health Care Assitant - LVN,Hanford Elementary School District,HEALTH CARE ASSISTANT. Certified Nursing Assistant (C.N.A.). See Health Care Assistant Job Description. Addendum to Health Care Assistant Job Description....
20,Aquatic Scientist/Customer Service Manager,"Virginia Waters and Wetlands, Inc.",Required license or certification:. Valid driver’s license required. Commercial Herbicide Applicator License – Category 5A preferred• Arborist certificate - a...
1,Restaurant Shift Manager - Taco Bell,BurgerBusters Inc,"Valid Drivers' License. Following cash, security, inventory and labor policies and procedures. Solving customer complaints quickly and with a smile...."
7,Senior Appellate Law Stenographer,NYS Unified Court System,"Acting as liaison with Justices, court attorneys and administrative personnel with regard to assignments; Responsible for training and supervising Appellate Law..."
15,Beauty Advisor,Stage Stores,Develop relationships with customers to insure future sales. Polite and courteous to customers and co-workers....
23,Logistics Management Specialist,Department of the Air Force,"Determines type &amp; number of aircraft required for mission deployment/redeployment. Identifies problems/discrepancies to Logistics Officer, unit, &amp; higher..."
19,Construction Laborer,Austin Materials,Summary/Objective The construction laborer performs tasks involving physical labor at highway and heavy construction projects....
13,Experienced Culinary Professionals,The Orlean Market,Local Market/Restaurant is rapidly changing! We are in search of experienced and responsible culinary professionals who want to be a part of our unique and
13,Cook - PRN - Hours vary,Fauquier Health System,"SERVE SAFE certification. Course work/completion from an accredited culinary school. In the absence of the team leader, the cook will supervise the operations..."
16,Retail Floater,The Fauquier Bank,"Accepts deposits, loan payments, TT&amp;L Payments, VISA deposits and payments. Processes requests for cash advances, gift and travel cards, and transfer of funds.*..."
22,Transportation Helper,United Airlines,"Now taking off: Your career Where do you want your career to take you? Chances are you can get there with United Airlines. Our environment is open, honest,..."
22,CDL-A Company Truck Drivers,Fleetmaster Express,"Build the perfect truck driving career with company driving jobs at Fleetmaster! Whether you need more miles or more time at home, Fleetmaster Express has the..."
13,"Host - 7982 - West Lee Highway - Warrenton, VA (Warrenton, VA)",Applebee's,Our Hosts greet and seat all arriving guests and acknowledge all departing guests in a friendly manner and assist in maintaining the overall guest flow of the...
10,Nursing Supervisor-FHRNC-Full Time Evenings-Mon-Fri,Fauquier Health System,Current Virginia State RN License. The Nursing Supervisor provides direction and supervision to staff to ascertain delivery of effective high quality patient...
10,Veterinary Technician,Middleburg Humane Foundation,Veterinary Technician will be responsible for overseeing medical care of shelter animals. PT Veterinary Technician/Assistant (license preferred) needed at the...
23,Intelligence Analyst - Junior,"Streamline Defense, LLC","The Intelligence Analyst will perform intelligence analysis, analyst-driven data extraction and processing, dissemination of applicable reporting products, and..."
3,Technology Support Specialist,City of Durham,"Database management experience; Maintains, administers, monitors, and supervises departmental software database and application; Monday-Friday 8 am - 4:30 pm;..."
7,District Court Clerk II - O'ahu,Hawaii State Judiciary,Authors the official court record in a court of limited jurisdiction for District Court trial proceedings  Prepares documents ordered by the court
5,Physical Therapy Aide,All Star Physical Therapy,Responsibilities include: setting up treatment areas cleaning up following treatment session aiding physical therapist during patient sessions Job Type:
5,Environmental Specialist I,PeopleFirst Florida HR,"ENVIRONMENTAL SCIENTISTS AND SPECIALISTS, INCLUDING HEALTH. Knowledge of plant and animal living tissue, cells, organisms, and entities, including their..."
19,Project Manager - Residential & Commercial Painting,Five Star Painting - Manassas,"Experience in the painting industry, construction, or building maintenance industry with knowledge of paint and material application...."
17,Front Desk Agent,Poplar Springs Inn & Spa,"Customer Service, Hotel Front Desk:. Prior hotel experience is preferred. Poplar Springs Inn &amp; Spa is looking for a dedicated individual to fill the need of a..."
7,Legal Consultant,Softpath System LLC,Understanding and researching complex international legal and/or regulatory issues. Looking for an energetic and talented professional to join the International...
2,Senior Staff Accountant,MFA Oil Co.,Summary of Responsibilities: Job Responsibilities include but are not limited to: Ensuring the integrity of the general ledger and financial statements
16,VA Customer Service Representative,Family Dollar,"Key priorities include greeting customers, assisting them with selection of merchandise, completing transactions, and answering questions regarding the store..."
21,Assembler,"PDS Tech, Inc.",Inspects own work on electronic assemblies to insure a quality product which conforms to workmanship standards and engineering requirements....
6,Police Officer,Virginia Association of Chiefs of Police (VACP),"Applicants must be at least 21 years old, in good physical health, possess a high school diploma or G.E.D, valid Virginia driver’s license, and be able to deal..."
13,Dishwasher and Busser,Jefferson Manor Health & Rehab,This is a full time dishwasher position in a nursing home facility. Prior experience preferred but not required....
2,Athletics Business Manager,University of Indianapolis,"Interpersonal skills to work with internal groups (coaches, students-athletes, faculty, and staff) as well as external groups (officials, bus and rental car..."
20,Auto Body Painter,DriveTime,What Drives You? Making your mark with a company known for excellence? A Chance for real work/life balance? Collaborating and thriving as part of a team?
13,Bar Manager/Bartender,Poplar Springs Inn and Spa,"Fantastic oppurtunity to progress within the company. To oversee, maintain and elevate the bar and lounge to the high end status it is to further heights...."
8,Pharmacy Technician Instructor,Lord Fairfax Community College,The Pharmacy Technician instructor will teach the LFCC Workforce Solutions Pharmacy Technician class. Instructor must have experience as a licensed Pharmacist....
13,Restaurant Manager,Denny's-Little Apple Properties,"Must have the ability to work a flexible and-or irregular schedule. Individual will manage a sit-down restaurant wit daily operations including recruiting,..."
13,Bartender,Longhorn Steakhouse,"Helping guests be aware of and choose menu items, taking orders and making guests feel taken care of during their visit...."
10,Pharmacy Technician,Rite Aid,"Pharmacy Technician certification where required by state law. Rite Aid Technician Training Program certification in all modules, job class/codes up to and..."
17,Clinical & Secretarial Services Technician-ER-Part Time-Days,Fauquier Health System,"The Clinical &amp; Secretarial Services Technician also coordinates the activities of the department through communication, requisitioning and management of..."
14,"Custodian Part-Time (Warrenton, VA 20187)",Children of America,"Meets state age requirement. As a Leader is child care, Children of America's commitment is to provide a safe, and sanitary environment for all Children in our..."
15,Pet Stylist (Dog Groomer) - Apprentice,Petco,"To receive technical training from Petco’s Professional Pet Stylist Program. We’re making things better for pets, people and the planet through our Think..."
3,Junior Software Tester,"FEi Systems, Inc.","FEi Systems provides extensive IT services for multiple federal agencies and state governments in the areas of Medicare management, Health Information Exchanges..."
11,School Nutrition Worker,Fauquier County Public Schools,"The omission of specific duties does not exclude them from the position if the work is similar, related, or a logical assignment to the position.)...."
22,CDL-A OTR Solo and Team Truck Drivers - Owner Operators,Titan Transfer,"Titan Transfer is seeking professional Class A CDL truck drivers to join our team! At Titan Transfer, responsible, motivated professional truck drivers can have..."
16,Merchandising,The Home Depot,"Must have a valid state driver s license and proof of insurance. Requires listening for customer service calls, personal pages and general information..."
22,Experienced CDL-A OTR Truck Driver,Specialized Transportation Services Inc,OTR truck driving jobs at STS offer high miles &amp
3,SQL Application Developer - IS Analyst,NewYork-Presbyterian/Columbia University Medical Center,"Advanced proficiency in programming languages (Visual Basic, C, C++, C#, Perl, Java), Applications (Healthcare IS, Allscripts SCM, Enterprise) and/or Database..."
11,CNA-Tele/MedSurg Unit-Full Time-Nights,Fauquier Health System,Virginia State Certified Nursing Assistant License. The Certified Nursing Assistant assists with patient care throughout nursing areas under the direction of...
2,Marketing Internship Latin America,Cosmetics of France,Provide customer service to the agent zone in terms of material &amp information needed for events trough com. Consolidate and update the Local Makeup Experts &amp
9,TV Line Producer,zulily,"This will include partnering with various production companies to create new scripts, select footage and music and hire freela nce voice over artists...."
19,Lead Carpenter,Genesis Home Improvement,"Required license or certification:. Have a driver’s license and reliable transportation. Must have own tools. Utilize chisels, planes, saws, drills, and sanders..."
17,LPNs and RNs Needed!,WRB Communications,Active LPN/ RN license. Our LPN/ RN Communicators will take calls from consumers and health care providers and document product complaints or adverse events...
19,Lead Remodeler/Construction Technician,Gibson Home Services LLC,Must have a valid driver's license with a clean driving history and successfully pass a background check and drug screening....
18,Farm Worker,Meadowview Farms,We are looking for an independent employee with leadership and problem solving skills for our grain and cattle operation....
9,Freelance Production Coordinator,"JPL Integrated Communications, Inc.","You will interact with talented Project Managers, Event Producers, Production Managers, Creative Directors, Graphic Artists, Editors, and so many others!..."
5,Animal Care Supervisor,University of Colorado,"Animal Facility, implementing the animal care procedures and policies. Care for a variety of species of small laboratory animals used by scientists...."
5,Chemistry Technician - Life Sciences,Xylem,"Xylem’s analytics businesses are leading manufacturers of premium field, portable, laboratory and online analytical instruments used in water and wastewater,..."
11,Massage Therapist/Chiropractic Assistant,Physicians Plus Spine and Rehab Center,Chiropractic office is seeking a full time massage therapist/chiropractic assistant. This position offers great opportunity for the right person....
8,Library Para Educator,Blue Valley School District,Attachment(s): job description Hourly Rate: $10.25 (PA/Col 3/01) Hours per Day: 7.5 (Monday - Friday) Days per Year: 200 (less than 12-month position)
12,Security Operations Manager,Google,You believe that providing effective security doesn't come at the expense of customer service - you will be our bodyguard (and our long lost pal)....
22,Hiring Company Truck Drivers,Transport America,Company Truck Driver Benefits:. Transport America's fleet of company truck drivers is the best and most experienced on the road....
18,FORESTRY TECHNICIAN (TIMBER STAND IMPROVEMENT),Department Of Agriculture,USDA Forest Service. Forest Service Day Care facilities are not available. A career with the Forest Service will challenge you to manage and care for more than...
22,Hiring Company Drivers & Contracting Owner Operators,Prime Inc.,We are hiring Class A CDL Company Drivers and Contracting Owner Operators. Find the Lifestyle You're Looking for as a Prime Truck Driver....
15,Pet Stylist (Dog Groomer),Petco,"We’re making things better for pets, people and the planet through our Think Adoption First philosophy, the Petco Foundation and other important initiatives..."
16,Sales Consultant,K. Hovnanian Companies,"Successful candidate must maintain a valid driver's license. The ability to provide the highest level of customer service, including exceptional communication..."
10,Recreational Therapist - Full Time - Baylor Rehab - downtown Dallas,Baylor Institute for Rehabilitation,Current national certification from NCTRC as a Certified Therapeutic Recreation Specialist (CTRS). The Therapeutic Recreation Specialist/Recreational Therapist...
9,Morning Show Host,"iHeartMedia, Inc.",Radio talk show host. 3+ years of on-air radio experience required. Serves as ambassador for the radio station(s) when out in public....
16,PT Sales Associate,Food Lion,"Responsible for maintaining standards according to the Front End Standard Practice Manual, maximizing sales through excellent customer service and minimizing..."
13,Cook-Full-Time-Hours Evenings 12p-8p,Fauquier Health System,Ability to perform complex math calculations and verify cash handling and reporting. The Cook prepares food items needed for meal service using institutional...
22,CDL Class A Drivers wanted Immediately!,"Champion Materials, Inc.","Now hiring CDL Class A Truck Drivers to haul bulk cement products across the Northeast, Mid Atlantic region, and Ontario...."
10,"Dental Hygienist, Warrenton, VA","Heartland Dental, LLC",Valid Dental Hygienist license in the state for which you apply. Potentially out of state. Applying fluorides and other cavity preventing agents to prevent...
22,Regional CDL-A Company Truck Driver - Mid-Atlantic Region,Celadon Trucking Services,Celadon has a variety of regional truck driving jobs for those who want consistent miles and pay paired with frequent home time....
4,CAD Drafter,Raytheon,"Architectural, mechanical, civil, security, structural, and electrical engineering. This drafter position is that of a contributor and will be in direct support..."
