job_field_id,title,company,description
18,Agricultural & Standards Inspector - I,Placer County,"Recruitments for Agricultural and Standards Inspector I, Agricultural and Standards Inspector II, and Agricultural and Standards Inspector, Senior are being..."
16,Digital Sales Account Executive,The Morning Call Media Group,"Manages advertising sales revenue and account management targets. Our digital sales account executives are responsible for selling advertising banners, programs..."
15,Lobby Concierge,Beach Activities of Maui,"The Concierge is knowledgeable about the local area and is the expert on the attractions, tours and activities that we sell.Must be flexible with scheduling and..."
14,Janitor - Cleaning Technician - FULL TIME - 84095,Wingfoot Services,"Janitorial, janitor, cleaning specialist, carpet cleaning, floor care technician, buffing, part time, supplemental income, laborers, landscaping, supervisor,..."
1,Regional Marketing Manager,Vishay,Develops a formal marketing plan outlining an appropriate marketing strategy for selling to key accounts. Coordinates the marketing efforts for a product group....
22,Air Traffic Control Operator,National Guard,The skills you learn as an Air Traffic Control Operator will qualify you to work in civilian air traffic control towers and centers at airports and airfields....
20,HVAC Installer/Technician,Express Air Sytems,Basic knowledge of standard code requirements of air conditioning systems. \*\*\*\*\*Minimum requirements for Installers\*\*\*\*\*....
13,Kitchen Cook,SMG World - Tucson Convention Center,Banquet facility preparing meals for large events:. Fulfilling the service per each Banquet Event Orders (BEO)....
9,Graphic Artist,IGT,"Maya, Autodesk 3D Studio Max). This position is the development and timely delivery of high quality 2D and 3D game...."
10,Anesthesiologist,"UF, Department of Anesthesiology","Department anesthesiologists practice at UF Health hospitals in Gainesville, FL at the University of Florida alongside 62 faculty anesthesiologists, 78..."
19,Drywall Hanger/Installer,EncoreHR Staffing,"Includes lathers who fasten wooden, metal, or rockboard lath to walls, ceilings or partitions of buildings to provide support base for plaster, fire-proofing,..."
8,Tutor or Teacher - Elementary Math,,"We are looking for math tutoring for our 4th grader. Improve grades, get ahead and increase confidence. Elementary math Tutoring &amp; Teaching opportunities..."
21,Production Operator - 2nd shift,Bostik Inc.,About Bostik - Smart Adhesives. As a production operator at Bostik you will be in a batch making/mixer operator position for a competitive manufacturing...
4,Mid-Level Ground Control Station Engineer,GENERAL ATOMICS,Job ID# 6452BR Company General Atomics Aeronautical Systems Title Mid-Level Ground Control Station Engineer Job Category Engineering City San Diego State...
3,Data Scientist,Humana,"Bachelor’s Degree in Mathematics, Computer Science, Actuarial Science or related field. Collaborate with other professionals including Actuaries, Mathematicians..."
2,Cost Accountant III,Weatherford,JOB DESCRIPTION JOB SCOPE: This position will be responsible for the day to day understanding of the plant’s financial performance. The position will also be
17,Telephone Operator,The Broadmoor,"Monitors 911 Alert System. Operates the switchboard to relay incoming, outgoing, and interoffice calls by performing the following duties:...."
23,"Analyst, Operations",General Dynamics Information Technology,Extended Air Defense Simulation (EADSIM). Battle Command Sustainment Support System (BCS3). Air and Missile Defense Work Station (AMDWS)....
11,2 Med/Peds Certified Nursing Assistant,Riverside Medical Center,Reports changes in patients' condition to the professional nurse. The 2 Med/Peds Certified Nursing Assitant (CNA) assists with the care of patients ranging from...
7,Administrative Law Judge,New Mexico State Personnel Office,"Administrative Law Judge, Adjudicator Advanced. This position will conduct administrative hearings on behalf of the State Personnel Board concerning..."
12,Transportation Security Officer (TSO),Trinity Technology Group,TSOs must take the computerized Screener Assessment Battery. Repeatedly lift and carry baggage weighing up to 70 pounds…
6,Senior Addiction Counselor,NYC Health + Hospitals,The Senior Addiction Counselor will be responsible for assisting the consumer with activities relevant to an individual's rehabilitation goals....
5,NATURAL RESOURCES PROGRAM TECHNICIAN,Arkansas Game & Fish Commission,"Knowledge of agricultural methods and basic land laws. Conducts agricultural and forest management activities on wildlife management areas, including preparing..."
16,Cashier,The Home Depot,"They provide first level escalation for customer issues and assist in the supervision, coaching and training of other Front End Associates by participating in..."
23,Surface Warfare Officer (Nuclear Aircraft Carriers),U.S. Navy,"Managing shipboard vertical launch systems. For those going the Surface Warfare Officer (Nuclear) route, the first step is Officer Candidate School (OCS) – a 12..."
23,Field Artillery Officer (13A),U.S. Army,Job training for a field artillery officer requires completion of Basic Officer Leaders Course I &amp II and the Field Artillery Officer Basic Course.…
23,Logistics Management Specialist,Department of the Air Force,"Determines type &amp; number of aircraft required for mission deployment/redeployment. Identifies problems/discrepancies to Logistics Officer, unit, &amp; higher..."
23,Air Defense Artillery Officer (14A),U.S. Army,Job training for an air defense artillery officer includes completion of the Air Defense Artillery Officer Basic Course....
19,Industrial Electrician,Novelis,"Novelis Corporation, the global leader in rolled aluminum and can recycling, has an opportunity at its Fairmont, WV plant for an experienced Industrial..."
23,Senior Analyst - Ground,Scientific Research Corporation,USA Warrant Officer MOS 140E - Air and Missile Defense Tactician / Technician. USA MOS Air Defense Artillery Officer with air operations center experience or....
23,Cavalry Scout,National Guard,"Cavalry Scout training never really stops, though. This enables the officer to make informed decisions. As a Cavalry Scout, you are the eyes and ears of the..."
17,Retail Banker/ Teller - Center,Woodforest National Bank,"WOODFOREST NATIONAL BANK. Performs opening, closing, and other branch servicing duties such as cash and vault balancing;..."
3,"(CSITO) Close Support/Systems Administrator - Warrenton, VA Job",CACI International Inc,"Answer users' inquiries regarding computer software and hardware operation to resolve problems, including requirements originating from a field location...."
2,Claim Specialist,CCMSI,The Claim Representative is accountable for the quality of claim services as perceived by CCMSI clients and within our corporate claim standards....
22,Delivery Driver/Garbage Truck Driver,Waste Connections,In this position you will be delivering garbage and recycling container to commercial and residential customers in and around anchorage....
22,CDL Class A Drivers wanted Immediately!,"Champion Materials, Inc.","Now hiring CDL Class A Truck Drivers to haul bulk cement products across the Northeast, Mid Atlantic region, and Ontario...."
16,Marketing & Sales Representative - Level 5,BOEING,We are engineers and technicians. Defense Systems Division Sales &amp Marketing team. This is a senior sales and marketing analyst position.…
22,Transportation Helper,United Airlines,"Now taking off: Your career Where do you want your career to take you? Chances are you can get there with United Airlines. Our environment is open, honest,..."
9,Morning Show Host,"iHeartMedia, Inc.",Radio talk show host. 3+ years of on-air radio experience required. Serves as ambassador for the radio station(s) when out in public....
22,Flight Attendant,Compass Airlines,Flight Attendant - LAX. One year previous flight attendant experience preferred The Flight Attendant will demonstrate the Compass Airlines' core values and…
1,Assistant Restaurant Manager,Dunkin' Donuts,Holds the guest as their highest priority and role models exceptional guest service. Manages cash over/short through effective cash control procedures....
22,Freight Broker,Sunbreak Logistics,Supply Chain / Freight Brokerage:. A new logistics company is looking for a motivated and experienced freight broker to join and to grow in a great team....
22,Driver Patient Services Technician,Advanced Home Care,"Must have a valid driver's license, and be able to operate manual transmission vehicle. Health care technician (EMT, Lab Tech, etc), customer support or service..."
3,Senior IT Support Specialist,Greystone,"Strong technical knowledge of MS Windows, desktop support and PC hardware, setup and configuration - People management experience and demonstrated leadership..."
10,"Dental Hygienist, Warrenton, VA","Heartland Dental, LLC",Valid Dental Hygienist license in the state for which you apply. Potentially out of state. Applying fluorides and other cavity preventing agents to prevent...
22,Parts Specialist,Auto Plus Auto Parts,"Must maintain a clean and valid driver’s license in the state of operation. The candidate will complete cash balance sheets accurately, practice option and add..."
1,"Sales Strategy and Operations Manager, Google Fiber",Google,"Working with them, you set the vision and the strategy for how their advertising can reach thousands of users...."
22,Class A CDL Flatbed Company Truck Driver,Builders Transportation Company,EXPERIENCED FLATBED COMPANY TRUCK DRIVING JOBS AT BTC. A flatbed truck driver with 2 years of experience can start off making 50 CPM or 29% Freight Revenue and...
4,Navy Logistician,LinQuest Corporation,"Review technical studies, reports, and white papers on new enhanced system capability designs, system design requirements, and system failure investigation..."
22,Experienced Owner Operator Flatbed Truck Driver - CDL-A,Carrier One,"Our owner operator truck driving opportunities offer higher percentage rates, flexible home time and exceptional company support—so your flatbed driving..."
16,Counter Manager,Stage Stores,"Scheduling, inviting by telephone and cards, displays at counter and throughout exchange. Maintain standards for counter cleanliness...."
1,Sr. Assistant Store Manager,Stage Stores,"Work with Store Manager and District Manager to develop and execute plans for store to improve profitability, greater productivity and efficiency...."
16,Customer Advisor Specialist,Petco,"Knowledge of the grooming salon program certification (Petco Promise, Pet Stylist Mentor Program, Canine Heritage Breed Test, Pet First Aid.)...."
21,Plastics Mold Maker,TERMAX CORPORATION,"Craft precision tools by studying specifications, engineering blueprints, tool orders, and shop data to make, alter, or repair tools, jigs, fixtures, molds, or..."
13,Crew,Dunkin' Donuts,Acknowledges all guests with a friendly smile and is highly responsive to needs and special requests. Issues a receipt with each order to provide guests with an...
22,Bus Driver,Fauquier County Public Schools,"Performs driving functions safely and efficiently in various weather conditions; Performs general maintenance tasks necessary to keep vehicles, equipment and..."
3,Software Specialist,TransTech LLC,"Where appropriate, lead implementation of innovative technical solutions. Continuously consider ways to implement technical solutions to improve Greystone..."
23,Intelligence Analyst - Junior,"Streamline Defense, LLC","The Intelligence Analyst will perform intelligence analysis, analyst-driven data extraction and processing, dissemination of applicable reporting products, and..."
9,Freelance Production Coordinator,"JPL Integrated Communications, Inc.","You will interact with talented Project Managers, Event Producers, Production Managers, Creative Directors, Graphic Artists, Editors, and so many others!..."
22,Traffic Flagger - Warrenton VA,Flagger Force Traffic Control Services,"No experience is required, but you must have a valid driver’s license, reliable transportation and a cell phone...."
6,Spiritual Counselor,UPMC,"Knowledge of spiritual effects of terminal illness, grief, and loss. The hospice spiritual counselor provides counseling and guidance to patients, families and..."
22,PT Produce Associate,Food Lion,"Ability to analyze situations, identify problems and implement solutions. Ability to complete Computer Based Training (CBT) and Training Aid courses...."
22,Class A CDL Owner Operator HHG Truck Drivers,Graebel Van Lines,Great Moves for Class A CDL Owner Operators Begin with Graebel Van Lines! Make a great driving career move and join the Graebel Van Line team!...
22,Part Time Produce Clerk North Rock,Harris Teeter,"While performing the duties of this job, the associate constantly works in a cool environment with an average temperature range of 55-60 degrees Fahrenheit and..."
22,Part Time 3rd Shift Stocker North Rock,Harris Teeter,"While performing the duties of this job, the associate is frequently exposed to wet, hot, or cold conditions and moving mechanical parts...."
22,Roadtrak / Highway - Experienced Regional CDL-A Truck Driver,Hub Group Trucking,HGT’s Roadtrak truck driving opportunities take your career the extra mile! Hub Group Trucking has unique regional driving opportunities available to CDL-A...
22,CDL-A Company Truck Drivers (OTR Reefer and Dry Van),J & R Schugel,"Must have valid Class A commercial driver’s license. When you sign on for J&amp;R Schugel company truck driving opportunities, you’ll see advantages like excellent..."
8,Adjunct Faculty-Communications,Lord Fairfax Community College,"Certain developmental or technical courses may be taught by instructors with a Bachelor's degree, a special certification, and/or work experience...."
18,Arborist Climber,Bartlett Tree Expert Co.,"Having a CDL is. Assists with driving, backing, dumping, and parking duties. Strives to improve job skills and develop the potential for upward mobility...."
15,Funeral Attendant,Service Corporation International,"The Funeral Attendant will set-up and assist with viewings, funeral services, memorial services, etc. Performs a variety of tasks during funerals and..."
13,Cook-Full-Time-Hours Evenings 12p-8p,Fauquier Health System,Ability to perform complex math calculations and verify cash handling and reporting. The Cook prepares food items needed for meal service using institutional...
22,Owner Operator CDL-A Truck Driver - Regional Dedicated Opportunities,NFI,"Class A CDL Owner Operators, NFI understands the reward of business ownership and the importance of a valued partnership. Class A CDL...."
22,Flatbed Company Driver - CDL-A,P & S Transportation,"Drivers must also have a current CDL-A license. Life Insurance/$10,000 policy at no charge to the driver. P&amp;S drivers must be at least 23 years old with at..."
22,Class A CDL Company Truck Drivers,First Fleet,Drivers at FirstFleet enjoy a full set of online tools to manage their employment experience. We are proud to employ and recognize individuals who demonstrate...
12,Animal Control Officer,"City of Springfield, MO",Animal Control collaborates with many other community groups involved in animal welfare. Springfield Animal Control Officers enforce the ordinances of the city...
22,CDL-A Dry Van & Refrigerated Drivers,RWH Trucking,Why do so many CDL professionals come to RWH for truck driving jobs? CDL professionals know RWH has the driving opportunities to keep their wheels moving and...
13,Evening Server,Denny's,"Looking for an individual with a positive attitude to provide friendly, fast, accurate service to guests dining in our restaurant...."
17,"Clerk, Front Desk (Great Beginnings)",La Clinica,"As a Clerk, working in a fast pace environment, some of your typical job responsibilities will include greeting, registering patients, verifying insurance..."
16,Customer Service/Deliveries,The Home Depot,"A valid drivers license and proof of insurance is required for driving. Whether directing customers to store departments or merchandise, answering customer..."
16,Customer Relations Representative,AmeriGas,"Make credit calls to delinquent customers and perform credit checks on new customers. Answers phone calls and responds to all customer inquiries including, but..."
22,Truck Driver/Custodian,The Salvation Army,Valid State Driver's License. Operates the truck in compliance with established Salvation Army standards and state driving regulations
22,CDL-A OTR Solo and Team Truck Drivers - Owner Operators,Titan Transfer,"Titan Transfer is seeking professional Class A CDL truck drivers to join our team! At Titan Transfer, responsible, motivated professional truck drivers can have..."
17,020 - 5600 - OFFICE ASSISTANT,Harris Teeter,"New hire orientation, customer service network, safety, customer service clerk technical skills, floor monitor technical skills...."
17,Asset Protection/Loss Prevention,The Home Depot,"They utilize tools to minimize loss to the Company, including but not limited to identifying incidents of theft and fraud, reviewing CCTV and exception reports,..."
21,Product Manager,"Specialty Resources, Inc.","(SRI) is a global sourcing and inventory management company for precision components &amp; specialty products such as precision machined components, stampings,..."
19,Project Manager - Residential & Commercial Painting,Five Star Painting - Manassas,"Experience in the painting industry, construction, or building maintenance industry with knowledge of paint and material application...."
11,Massage Therapist/Chiropractic Assistant,Physicians Plus Spine and Rehab Center,Chiropractic office is seeking a full time massage therapist/chiropractic assistant. This position offers great opportunity for the right person....
9,Animator,National Center for Missing & Exploited Children (NCMEC),"The Animator is responsible for designing and developing 2D and 3D content for web, television, interactive and print projects...."
21,Manufacturing Assembler,Manufacturing Supplier,Ideal candidates will have some mechanical aptitude for assembling plastic or metal parts by hand. Advantage Resourcing is currently seeking Manufacturing...
21,"Lead, Upholstery",StandardAero,"The Senior Tech Upholsterer is technically competent in aircraft upholstery, and is technically competent to accomplish all of his/her duties with little or no..."
3,IT Support Supervisor (Level 2 & 3),TransTech LLC,"IT related college degree, technical school degree or Microsoft certification preferred. Strong technical knowledge of MS Windows, desktop support and PC..."
17,Retail Store Shift Supervisor,CVS Health,Ensure compliance with all company policies and procedures (such as cash management) and federal and state....
14,Custodial Worker (Janitor) MWR 03-16,"Naval Air Station - JAX, MWR","Deep cleaning may include defrosting refrigerators and freezers, cleaning windows (interior and exterior), replacing and/or cleaning drapes/curtains, moving..."
21,Electronic Assembly,NESC Staffing Corp,Soldering may be required for some positions.• Inspects own work on electronic assemblies to insure a quality product which conforms to workmanship standards...
17,Front Desk Agent,Poplar Springs Inn & Spa,"Customer Service, Hotel Front Desk:. Prior hotel experience is preferred. Poplar Springs Inn &amp; Spa is looking for a dedicated individual to fill the need of a..."
22,Experienced CDL-A Regional Truck Driver,Specialized Transportation Services Inc,Regional truck driving jobs at Specialized Transportation Services offer responsible CDL professionals predictable schedules without having to forfeit great pay...
17,Hotel Front Desk Receptionist,HOLIDAY INN EXPRESS AND SUITES,No phone calls. Processing payment from Guests. Responding to Guests request for assistance and information about the local area (i.e....
20,HVAC Service Manager,AireServ - Bull City,"Pre-employment drug screening, background check and valid driver's license with a clean record. CFC Certification REQUIREDMINIMUM 5 years recent experience in..."
20,Auto Body Painter,DriveTime,What Drives You? Making your mark with a company known for excellence? A Chance for real work/life balance? Collaborating and thriving as part of a team?
20,Mechanic Helper,Pace Bus,Qualified candidate must possess at least one (1) years previous diesel/gas experience and/or technical training and meet the criteria of Pace's Mechanic...
20,Service Technician (Mechanic),"Franklin Equipment, LLC","The individual will maintain and repair equipment offered by Franklin Equipment to include Construction and Agricultural (small equipment, aerial, dirt, farm,..."
22,Student Class A CDL Truck Driver,Super Service,New Pay Raise April 2015Super Service needs recent truck driving school grads who are ready to hit the road and start earning big!...
20,Master Mechanic / Technician Auto Repair,YourMechanic,Excellent customer service skills. Complete set of basic automotive tools. Earn up to $55/hr as a mobile mechanic*....
20,Utility Systems Repairer-Operator,Department of Defense, Operate an Energy Management and Control System (EMCS) used to monitor and control all HVAC systems within the facility....
20,MAINTENANCE MECHANIC,United States Postal Service,"United States Postal Service External Publication for Job Posting 94976393 If this job requires qualification on an examination, the number of applicants who"
20,Truck/Trailer Mechanic,Snider Fleet Solutions,Truck/Trailer mechanic skills:. Perform valve and injector overhead adjustments according to OEM procedures. We have an immediate opening for a *Tractor Trailer...
22,CDL-A Company Truck Drivers,Mesilla Valley Transportation East,"Mesilla Valley Transportation, a 48-state motor carrier, is now hiring company truck driving teams for OTR, Shuttle and Super Local runs...."
20,Cabling Tech/WAP Installer,Airlie,"Must have own tools. Low voltage cabling contractor needed. Experience with installation of copper voice , data cable and Wireless Access Point installs...."
20,Custom Window Treatment Installer,Budget Blinds of Warrenton,Valid drivers and a good driving record. No phone calls please!!! Time Management You must have a good driving record and are able to navigate your way from...
20,Heavy Equipment Shop Technician,"Carter Machinery Co., Inc.","This position is responsible for diagnosing problems, performing repairs, reconditioning and servicing heavy equipment and components in a shop environment...."
20,Heavy Equipment Shop Technician,Carter Machinery Company Inc,"Excellent driving record required. Strong mechanical aptitude and troubleshooting skills. This position is responsible for diagnosing problems, performing..."
20,Photo Lab Technician,CVS Health,Follow Federal and State laws and OSHA regulations. Actively participate in the Photo Lab Training and Certification Program by certifying in all necessary...
8,Substitute Instructional Aide,San Mateo Union High School District,"Assist the classroom teacher to set up materials or education lessons; Under general supervision, reinforce lessons presented by the classroom teacher by..."
20,Diesel Mechanic/Technician III – PART TIME (PB),Penske,"A valid driver’s license is required, and, must either possess a CDL or have the ability to obtain a CDL license required...."
20,Automotive Technician,SAFFORD AUTOMOTIVE GROUP,State Inspection license a plus. We want you to grow within our organization and will give you the chance and tools to succeed!...
22,Decker is Hiring CDL A Company Drivers Now,Decker,Class A CDL. Decker offers great pay and the best equipment as a truck driver to help you get more miles and more money in your job....
22,Class-A CDL Flatbed Company Truck Drivers,E. W. Wylie,"With annual earnings of up to $65K, consistent OTR miles that offer frequent home time, a generous sign-on bonus, a pay raise every 60K miles and more,..."
20,Crew chief,SERVPRO of Culpeper & Fauquier Counties,High School Diploma or equivalentRestoration industry experience required.IICRC certificate required and ASD certification a plus.Ability to pass a criminal...
16,Sales Associate/Cashier (part-time),Bed Bath & Beyond,Currently hiring part time sales / cashiers / stock associates and bridal consultants. All shifts available....
21,Processing Operator I - 3rd Shift,"SOFTPATH SYSTEM LLC in Sturgis, MI",Processing Operator I - 3rd Shift. Production or manufacturing and machine or forklift experience:. Primary responsibility will be to support the Dry blending...
20,Plant Maintenance Mechanic - Night Shift,Vulcan Materials Company," Diagnose problems and perform mechanical repair. Assists plant personnel with repair and maintenance. Mechanical repairs to various types of crushers, screens..."
22,Regional / OTR Class A CDL Truck Driver,Marten Transport,Then now is the time for experienced Class-A CDL truck drivers who want Regional and OTR runs to join Marten!...
7,Legal Analyst,CP Homes,"The role of the Legal Analyst is to support, manage and administer the day-to-day functions of a corporate legal department...."
16,Sales Associate,Lands' End,"Including courteously, conversationally greeting customers, adjusting individual customer attention based on store traffic, suggesting solutions based on..."
19,Heavy Equipment Operator,,"Must operate loaders, trucks, rollers, backhoes, mowers, graders, and other. Loads and unloads sand, dirt, asphalt, rock, and other materials as needed;..."
19,Fabricator/Welder Helper,Kooks Custom Headers Inc,Pass off parts to helper for grinding and straightening flanges. Receive parts back from helper for final assembly and inspection for quality control....
19,Construction Laborer,Austin Materials,Summary/Objective The construction laborer performs tasks involving physical labor at highway and heavy construction projects....
