job_field_id,title,company,description
20,Lead Technician,ServiceMaster by Simmons,Valid Driver’s license. Responds to emergency mitigation calls driving company vehicle to job site....
22,Class A CDL Company Truck Driver (Teams),Super Service,"Super Service has dedicated team truck driving jobs available for drivers who live within a 50 mile radius of Tupelo, MS, Georgetown, KY, and San Antonio and..."
19,Carpenter,Chicago Bridge & Iron Company,"Fits and nails sheathing on outer walls and roofs of buildings. Erects scaffolding for buildings and other structures and installs ladders, handrails, walkways,..."
10,Rehabilitation Technician,Blue Ridge Orthopaedic & Spine Center,"Blue Ridge Orthopaedic and Spine Center in Warrenton, VA, is looking for a FT Rehabilitation Specialist/ Physical Therapy Technician in our state of the art..."
19,Carpenter Assistant,Genesis Home Improvement,"Required license or certification:. Entry level or 1+ years of experience in the construction field, willing to train the right candidate...."
22,Railroad Openings- Now Hiring,JNI,*RAILROAD OPENINGS- NOW HIRING* *Trainees & Experience Welcome* *Call 205-536-7500 FOR IMMEDIATE ATTENTION* * Fireman/ Oiler – Forklift Operator…..$-23/HR *...
19,Lead Remodeler/Construction Technician,Gibson Home Services LLC,Must have a valid driver's license with a clean driving history and successfully pass a background check and drug screening....
18,Park Officer,State of Ohio,Major Worker Characteristics:. Applicants can view the status of this position by logging into their user profile on the Ohio Hiring Management System [OHMS]...
18,Farm Worker,Meadowview Farms,We are looking for an independent employee with leadership and problem solving skills for our grain and cattle operation....
18,Mine Safety and Health Inspector (Coal),Department Of Labor,This position has promotion potential to GS-12 for Underground and Electrical Inspectors and the GS-11 for Surface Inspectors....
16,"Rental Sales Representative- Warrenton, VA",H&E Equipment Services,A Bachelor’s degree is a plus• 2 years of business to business sales experience in Construction Equipment and/ or Construction related field is preferred•...
18,Log Yard Scaler,Church & Church Lumber Company,Must be experienced with running equipment such as a log loader. Good people person with management and communication skills....
18,Lead Fish Technician,Hubbs-SeaWorld Research Institute,Hatchery building is a damp environment. Stay current with latest technologies related to fish rearing. Assist in all other aspects of fish husbandry as needed....
11,CNA-Tele/MedSurg Unit-Full Time-Nights,Fauquier Health System,Virginia State Certified Nursing Assistant License. The Certified Nursing Assistant assists with patient care throughout nursing areas under the direction of...
10,Family Practitioner,Fauquier Health System,Family Practitioner to provide the full spectrum of primary care. This position is for a BC/BEFamily Practitioner to join an outpatient-only practice with
3,Senior Certified Security Analyst,Kforce,"Coordinate with applicable stakeholders to develop security event remediation strategies and timelines. Engineering, Math, or Science Degree...."
6,Counselor (K-8),Grambling State University,Teach school developmental guidance curriculum to students. Plan school guidance and counseling programs to ensure that they meet identified needs....
18,Plant Health Care Specialist,Bartlett Tree Experts,Certified Pesticide Applicator License is preferred. The ideal candidates will have 1+ yrs experience working in Plant Health Care OR a 2/4 year degree in...
18,FORESTRY TECHNICIAN (TIMBER STAND IMPROVEMENT),Department Of Agriculture,USDA Forest Service. Forest Service Day Care facilities are not available. A career with the Forest Service will challenge you to manage and care for more than...
18,Arborist Climber Trainee,Bartlett Tree Experts,The ideal candidate will have experience working on a tree crew as a Ground Man OR a 2/4 year degree in Forestry or a related field....
22,CDL-A OTR Company Truck Driver - Solo and Teams,Cargo Transporters,"Effective July 5, 2015, we’re increasing company driver pay by 5%! As one of the largest, privately owned over-the-road trucking companies in western North..."
17,Human Resources and Payroll Clerk,Tennessee Performing Arts Center,Reconcile monthly billing. Facilitate job posting as necessary. The Tennessee Performing Arts Center is looking for a full time HR/Payroll Clerk....
2,Senior Accountant (Tax),"PBMares, LLP",150 hours required by the Virginia Board of Accountancy to acquire a CPA license. Our Firm’s policy is to provide equal opportunity for employment to all...
22,Experienced CDL-A Company Truck Driver - Teams,Celadon Trucking Services,Must hold a valid CDL Class A license issued by the applicant’s state of residence. Team Driver Jobs are Available for Experienced Company Drivers and Owner...
14,Exterminator,University City Housing Company,University City Housing (UCH) is a Philadelphia-based property management company with significant real estate holdings in and around the Philadelphia
17,Bookkeeping Clerk,John Q. Hammons Hotels & Resorts,"Must have 1-2 years in accounting , customer service and/or bookkeeping experience or equivalent. Perform any combination of routine calculating, posting, and..."
3,Hadoop Administrator,General Dynamics Information Technology,"Bachelors Degree in Computer Science or a related technical discipline, or the equivalent combination of education, technical certifications or training, or..."
17,Front Desk Agent,Holiday Inn & Suites - Tulsa,At *Holiday Inn® Hotels* our job is to bring the joy of travel to everyone. That’s where you come in. When you’re part of the Holiday Inn Hotels brand you’re
17,Administrative Assistant to the Provost/Vice President of Academic Affairs,East Central University,"The Administrative Assistant coordinates the Provost’s appointments and travel arrangements. East Central University invites applications for a twelve-month,..."
20,Chrysler Certified Automotive Technician,SAFFORD AUTOMOTIVE GROUP,"The technician must understand, stays abreast of, and comply with federal, state, and local regulations such as hazardous waste disposal, OSHA Right-to-Know,..."
1,Restaurant General Manager - Taco Bell,BurgerBusters Inc,"Valid Drivers' License. Key responsibilities include finding, hiring and developing Taco Bell Restaurant Team Members and Shift Leads, conducting new hire..."
6,Juvenile Probation Officer - Court,Williamson County,Constant contact with juvenile offenders and their families. Performs complex social service work in interviewing and counseling....
17,STORE CLERK - TEMPORARY,Dollar General,"This temporary position will be supporting new store openings, remodels and/or relocations of Dollar General stores by setting the store merchandise, organizing..."
17,Shift Leader,Dunkin' Donuts,Holds the guest as their highest priority and role models exceptional guest service. Acknowledges all guests with a friendly smile and is highly responsive to...
21,Blow Mold Machine Operator,Consolidated Container Company,"Blow Mold Machine Operators report directly to Maintenance/ Production Manager. The Blow Mold Machine Operator will operate blow-mold, grinders, trimmer..."
17,Clinical & Secretarial Services Technician-ER-Part Time-Days,Fauquier Health System,"The Clinical &amp; Secretarial Services Technician also coordinates the activities of the department through communication, requisitioning and management of..."
17,Office Manager and Billing Specialist,"Fauquier Neurological Associates, Limited",Looking to hire a medical office manager with medical coding/billing experience. Must have knowledge of Quickbooks payroll program
1,Restaurant Assistant General Manager - Taco Bell,BurgerBusters Inc,"Valid Drivers' License. You also assist the RGM with facility maintenance, finding, hiring and developing great Team Members and Shift Leads and making sure..."
16,Detailer,Frito Lay,The Part-Time Detailer is a part-time position that is responsible for merchandising Frito-Lay's complete line of quality products to existing accounts while...
13,Cook - Banquet Kitchen,Hilton Hotels & Resorts,Banquets and Catering. A Cook with Hilton Hotels and Resorts is responsible for preparing food items in accordance with recipes and established standards....
17,"Front Office Team Member - Business Assistant, Warrenton","Heartland Dental, LLC","The Dental Business Office Assistant will maintain and organize all administrative functions in the front office, including reception tasks – receiving and..."
21,Tailor - Northrock Shopping Center,Jos. A Bank,Listen to the wants and requests of the customer and answer the customer’s questions.Communicate to the customer and/or sales executive in a professional manner...
17,SCHEDULING/REGISTRATION REPRESENTATIVE II,Inova Fairfax Hospital,"Medical terminology class; Bachelors Degree = 2 years). Obtains medical case information including diagnosis(es), ICD-9 and CPT codes, anesthesia type, ordering..."
17,Medical Office Asst VA,Novant Health,Graduate of an accredited medical assistant program preferred. The team member's number one job responsibility is to deliver the most remarkable patient...
5,Physical Science Technician,Department Of Agriculture,The Functional Foods Research Unit creates new processing technologies to enhance the performance of agricultural materials in existing applications and...
22,Regional CDL-A Company Truck Driver - Mid-Atlantic Region,Celadon Trucking Services,Celadon has a variety of regional truck driving jobs for those who want consistent miles and pay paired with frequent home time....
17,Help Desk / Support Specialist,Raytheon,Provide on-demand and scheduled training to individuals and groups in the use of Maximo and other technical support tools....
17,"Warrenton, VA - Furniture Assembler/Merchandiser",Spar Business Services,"Required license or certification:. As an Independent Contractor with SPAR Business Services, Inc. Have own tools...."
17,Supervisor,Stage Stores,Interrupt store tasks to assist and answer questions for customers in a pleasant and courteous manner. O Key in telephone number and e-mail address when...
17,Shift Supervisor (US),Starbucks,Follows all cash management and cash register policies and ensures proper cash management practices are followed by shift team....
13,Chef de Cuisine,Claire's at the Depot Restaurant,"Must be detail oriented and proficient in a high volume kitchen. Claire's at the Depot, a fine dining restaurant located in historic Old Town Warrenton, is..."
21,Sheet Metal Fabricator,Arktura LLC,"Ability operate fabrication equipment, Drill presses, Shears, riveters etc. • Attention to detail a must...."
17,Operations,The Home Depot,"Requires listening for customer service calls, personal pages and general information announcements. May have to handle merchandise and work with tools with..."
17,Department Supervisor,The Home Depot,"Specific store departments may include Building Materials, Décor, Electrical, Flooring, Gardening, Hardware, Kitchen &amp; Bath, Lumber, Millwork, Paint, Plumbing,..."
10,Veterinary Technician,Middleburg Humane Foundation,Veterinary Technician will be responsible for overseeing medical care of shelter animals. PT Veterinary Technician/Assistant (license preferred) needed at the...
17,Office/Store Support,The Home Depot,"Facilitating the maintenance and repair of certain computer system related equipment such as cash registers, scanners, scan guns, monitors, signature capture..."
17,LPNs and RNs Needed!,WRB Communications,Active LPN/ RN license. Our LPN/ RN Communicators will take calls from consumers and health care providers and document product complaints or adverse events...
3,Junior Software Tester,"FEi Systems, Inc.","FEi Systems provides extensive IT services for multiple federal agencies and state governments in the areas of Medicare management, Health Information Exchanges..."
16,Cashier / Server Immediate Openings Available,Louis Pappas Fresh Greek,"Here are some keys to being a successful Cashier with us:. McMullen Booth Rd Clearwater, FL 33761, Monday through Friday from 3pm - 5pm...."
16,PT Grocery Associate,Food Lion,Provide quality customer service to our customers through the Grocery Department. Engage and interact with customers to create a positive shopping experience....
22,AMBULANCE DRIVER,Catholic Health Initiatives,"Job Summary: Provides transportation for patients, visitors, employees and students. Essential Duties: Picks up and delivers patients, visitors, employees"
16,Customer Service Representative,We Insure Group,Our agents have access to over 100 Top Partner Companies and one of the best service and support personnel in the business....
16,Sales Representative - Worcester,Commonwealth of Massachusetts,Instruct Sales Agents on the use of successful marketing and sales techniques. Provide motivation to Sales Agents and recommends incentive plans intended to...
16,Rental Sales Agent,Sixt Rent a Car LLC,"The Rental Sales Agent is responsible for optimizing the rental experience by selling extras based on the customer’s needs, drafting rental agreements, and..."
1,Assistant Project Manager,Bohler Engineering,"Local Professional Engineer License, majority of work experience conducted in the local area. Design of Utility Systems, including stormwater conveyance,..."
16,Cashier,Stores - Kmart Hourly,"Responsible for providing excellent customer service, efficiently and accurately completing sales and service transactions at the cash wraps, as well as handle..."
13,Restaurant Shift Leaders - Bealton,"Five Guys Enterprises, LLC",Come join the Five Guys team!Five Guys is a family owned business that really cares about the growth and success of their employees....
2,FINANCIAL QUALITY COORDINATOR,Inova Fairfax Hospital,"Bachelors Degree = 2 years. Supports Inova Health System or Physician Services, and Patient Registration department financial goals through patient financial..."
1,Store Manager,Stage Stores,"Work with district manager to develop and execute plans for store to improve profitability, greater productivity and efficiency...."
16,Clerk\Cashier,CVS Health,"Answer the telephone using the appropriate greeting. Operate a cash register including cash transactions, checks, charges...."
16,Part-Time Teller - Northrock Shopping Center,Capital One,Live the company values of Excellence and Do the Right Thing - Act as a Customer Advocate - Take an active role in educating customers on other banking channel...
13,Pizza Hut Server,Pizza Hut,"It’s about being independent and having fun, making new friends and earning extra cash. And independently-owned franchised or licensed locations may have..."
13,Pizza Hut Team Member,Pizza Hut,"It’s about being independent and having fun, making new friends and earning extra cash. And you’re at least 16 years old – 18 if you want to be a driver...."
16,VA Assistant Store Manager,Family Dollar,"Assists Store Manager in ordering merchandise and record keeping to include payroll, scheduling and cash register deposits and receipts...."
10,Mammography Technologist-Part Time-Days,Fauquier Health System,Must be able to utilize independent decision making skills in a wide variety of situations. 1+ years of experience as a registered technologist in the...
16,PT Sales Associate,Food Lion,"Responsible for maintaining standards according to the Front End Standard Practice Manual, maximizing sales through excellent customer service and minimizing..."
18,Climbers,Bartlett Tree Experts,Having a CDL is a big plus!! Great Benefits and competitive compensation AND we will assist with relocation for the right candidates!!...
13,Cook - PRN - Hours vary,Fauquier Health System,"SERVE SAFE certification. Course work/completion from an accredited culinary school. In the absence of the team leader, the cook will supervise the operations..."
16,Part Time Deli Bakery Clerk North Rock,Harris Teeter,"Ability to read and comprehend simple instructions, short correspondence, and memos [in English]. Ability to write simple correspondence [in English]...."
16,Team Member (Part-Time)0820,Jo-Ann Stores,May use 2-way radios (hear incoming messages and provide verbal response). Processes customer transactions in an efficient and friendly manner at the cash...
16,Sales Assistant - Northrock Shopping Center,Jos. A Bank,"Properly and accurately operate and capture customer information, including e-mail addresses, in the point-of-sale register system.Comply with all procedures..."
2,Claims Auditor,Broadpath,Medical Claims Auditors perform routine and complex audits to identify inaccurate claims adjudication. Knowledge of claims and the ability to recognize patterns...
16,Keyholder - Commissioned - Northrock Shopping Center,Jos. A Bank,"Understanding merchandise features, marking and fitting techniques and fashion trends to determine what type of garments are desired and advise customers about..."
22,Hiring Company Truck Drivers,Transport America,Company Truck Driver Benefits:. Transport America's fleet of company truck drivers is the best and most experienced on the road....
17,Inpatient Medical Records Coder II-Part Time,Fauquier Health System,"Registered Health Information Administrator certification(RHIA), or Registered Health Information Technician certification(RHIT), or Certified Coding Specialist..."
21,Sewing Machine Operator,"DI, LLC","This individual will operate machines that are either single or double needle, perform blind stitch, serge, or other specialized operations...."
16,Sales Associate,Petco,This role also involves completing cash register transactions as well as providing customer carry-out service....
22,Federal Companies - OO - Household Goods,Federal Companies,Valid Class A CDL. Must own truck. Drivers are eligible for Hauling Bonus/Safety Bonus. Owner Operator Benefits:....
2,Account Liaison- Hospice Job,HCR ManorCare,"Bachelors degree in marketing, business, communications or related health field from an accredited institution required or RN,...."
13,"Associate, Food Services-PRN-Hours vary",Fauquier Health System,"These functions include, but are not limited to, portion control, delivery and pick up of trays, equipment operation, washing and sanitizing dishware, and cash..."
16,Sales Associate,Stage Stores,"Interrupt store tasks to greet, assist, and answer questions for customers. Smile and greet each customer promptly...."
16,AP Clerk,Sheehy Auto Stores,"All applicants must have the ability to pass pre-employment testing to include background checks, MVR, drug test, and valid driver's license...."
9,Visual Associate,Stage Stores,"Implement all major floor moves in quarterly floor plans. Maintain all visual elements (signs, mannequins, collateral, door signs, banners, etc.)...."
21,eCommerce Fulfillment Associate,Stage Stores,Willingness to consult multiple resources to obtain answers. Troubleshoot and problem solve when necessary....
16,Consultative Sales- Fine Jewelry,Stores - Sears Hourly,Maintaining knowledge of products and using this knowledge to assist and educate customers on options available
8,Assistant Professor,Oklahoma State University,"Applicants must have an appropriate earned doctorate in accounting, demonstrate instructional excellence, and be committed to active engagement in the life of..."
16,Consultative Sales Associate – Home Appliances,Stores - Sears Hourly,The Consultative Sales Associate is responsible for enhancing the experience of members and driving profitable sales of Home Appliance area by providing...
4,Mechanical Engineer,GENERAL ATOMICS,Works with multiple interdisciplinary groups to transition equipment and processes from an engineering stage to repeatable productionized processes....
13,PT Market Associate,Food Lion,"Provide friendly, courteous and prompt customer service. Ability to complete Computer Based Training (CBT) and Training Aid courses...."
17,Banking Services Representative - Bakersfield,Rabobank,Knowledgeable regarding all bank products. Assists with reception and vault/merchant attendant duties. Ability to comprehend and interpret Bank policies and...
16,Kitchen/Bath Designer,The Home Depot,"Requires listening for customer service calls, personal pages and general information announcements. Answer questions about merchandise for the customer's level..."
16,Sales/Customer Service,The Home Depot,"Requires listening for customer service calls, personal pages and general information announcements. Promote services offered at the Special Services Desk, Tool..."
12,Chief of Police,City of Andrews,"The department consists of 19 sworn peace officers, 9 full-time paramedics, an Animal Warden and Executive Assistant, with combined budgets totaling over $3M...."
16,Retail Merchandiser - Warrenton/Culpeper/Marshall - VA,The Pet Firm,"Attend training calls; Implement and reset planograms, test planograms, IRC's point of sale materials,. Our expertise in the pet industry gives our vendor..."
16,Sales Comfort Consultant,TLC Services LLC,Realize Your Maximum Potential And Income Possibilities. No overnight travel – Sell at the customer’s kitchen table on leads from the immediate area....
22,Hiring Class A Truckers - OTR & Regional Positions,Barr-Nunn Transportation,Valid Class A CDL. Barr-Nunn has a reputation for respecting its truck drivers and working diligently to anticipate and meet our drivers needs....
16,Sales Representative,Verizon,Analyze customer needs and present value-added solutions Inspire and excite customers about how our solutions can impact their lives Ensure that our customers...
14,Custodian,Fauquier County Public Schools,"Checks play areas and around school building for trash, debris or hazards. Delivers copy paper to rooms. Empties trash receptacles and deposits collected refuse..."
18,Wood Mill Operator 2,The AMES Companies,"The Wood Mill Operator 2 works under supervision of foreman encompassing the skills of Equalizer, Paint Line Operator, Stacker and Inspector...."
15,Beauty Artist,Benefit Cosmetics,Essential Duties and Responsibilities -Customer Service- · Customer is the number one focus · Greet customers in 30 seconds or less · Follow the 8 Step
15,Dog Walker/Pet Sitter,Tina Pet Services,"You have to love animals, and feel comfortable around them.:. First impressions are important, so be sure to let your personality come through in your initial..."
15,Fitness Instructors,Woodlake Swim and Racquet Club,"Woodlake Swim and Racquet Club is currently looking to hire certified Water aerobics, Pilates, Meditation, Tai Chi, and Les Mills instructors...."
15,Valet Attendant: PT & FT- Lisle, Downers Grove,"HealthPark ValetEnjoy working in a social environment? A leader in parking services, HealthPark Hospitality provides its healthcare partners comprehensive parking solutions"
2,Analyst,Employment Enterprises Inc.,"Temporary Solutions is currently seeking an Analyst for a position in Warrenton, Virginia. We would ideally like someone with a property insurance background...."
15,Companion Care / Personal Care - Waukesha,"FirstLight Home Care, Brookfield, WI","Companion Care/ Home Health Aide*. In addition to providing a flexible schedule, we offer potential for advancement, award programs, and opportunity for..."
15,Barber,GoodBuddyz BarberShop,Chairs available for registered and apprentice barbers at 3-chain barbershop. Build your own clientele or bring your own....
15,Central Baggage Agent,Virgin America,O Perform Baggage. O Following proper guiding principles in order to compensate guests for any misplaced baggage....
22,School Bus Driver -aftercare program,Lake Forest Park Montessori,"Part time aftercare/ bus driver:. If CDL required for vehicle driver, driver is subject to NLCI and state/federal policies, procedures and requirements..."
15,Assistant Salon Manager,Hair Cuttery Salon,"BASIC REQUIREMENTS - MUST HAVE A COSMETOLOGY LICENSE in the state you are applying for, eligibility to work in the United States, 6+ months experience in a..."
16,"Part Time Merchandiser-Warrenton, VA",American Greetings,EOE M/F/disability/vet VEVRAA Federal Contractor&quot
15,Warrenton area CAREGiver,Home Instead Senior Care,"You must have your own vehicle and a valid driver's license as you will be responsible for driving clients to appointments, etc...."
15,Grooming Assistant,Petco,Assist in booking grooming appointments and performing follow-up phone calls and reminders to customers....
15,Dog Trainer / Apprentice,Petco,Our Petco family is made up of pet lovers who unselfishly put the needs of others before their own. Previous experience teaching positive reinforcement dog...
10,Pharmacy Technician,CVS Health,Answer telephone with appropriate greeting. The Pharmacy Technician Trainee is a training position where you can move to a Pharmacy Technician upon successful...
15,Pet Stylist (Dog Groomer),Petco,"We’re making things better for pets, people and the planet through our Think Adoption First philosophy, the Petco Foundation and other important initiatives..."
15,Hair Stylist,Sport Clips - VA114,"We're interviewing motivated, positive, reliable, upbeat stylists to help grow and be one of our winning team members...."
23,Flight Support,U.S. Navy,"Operate and maintain hydraulic and steam catapults to launch aircraft. As an Officer, you can expect to:. Instead, she refuels fighter jets on aircraft carriers..."
14,Pest Route Technician,Ecolab,"Previous pest elimination industry or route experience preferred &quot;Certified Pest Control Technician, Commercial Pest Control Technician, Exterminator, Pest..."
14,Maintenance Worker,Marsh Run MHC,"Valid driver’s license and good driving record. Required license or certification:. General knowledge of electrical, plumbing, and grounds maintenance...."
