job_field_id,title,company,description
14,Housekeeping/Laundry Aide,Safire Care,"Description Position: Housekeeping/Laundry Aide Hours: FT, PT Available Shift: Day and Evening Shifts Sheridan Manor provides a range of services,"
22,Hiring CDL Student Drivers - We WIll Pick up the tab,American Professional Truck Driving Academy,"Student Requirements are the following Candidates Must Have CDL Learners Permit in State of Residency, Prospects Must Have Valid DOT Medical Card, Candidates..."
13,Bar Manager/Bartender,Poplar Springs Inn and Spa,"Fantastic oppurtunity to progress within the company. To oversee, maintain and elevate the bar and lounge to the high end status it is to further heights...."
8,Assistant Teacher,Children of America,Has obtained a Child Development Associate credential (CDA) and meets the licensing requirements of the state in which they work....
4,Continuity SME,Booz Allen Hamilton,"BS degree in Science, Mathematics, Engineering, or a related field. FEMA Continuity or Associate Business Continuity Professional (ABCP) or higher Certification..."
2,Loan Support Residential Mortgage Processor,The Fauquier Bank,"Specialty may be in one loan field, but this position cross-trains for Consumer, Commercial, and Commercial Real Estate processing...."
14,Landscape and garden maintenance worker,Lawn Love,\*You must have at least one year of professional lawn care experience. \*You must have all the equipment needed to perform a full lawn care service....
14,Stocking and Merchandising for Grocery Stores,Acosta Sales & Marketing,"This IS a part time position, but permanent. This is a heavy stocking position...."
16,Salesperson,Sheetz,"Ring accurate register transactions. The perfect fit for our Sheetz team would be someone who is people oriented, self-motivated, dependable, able to work..."
14,"Custodian Part-Time (Warrenton, VA 20187)",Children of America,"Meets state age requirement. As a Leader is child care, Children of America's commitment is to provide a safe, and sanitary environment for all Children in our..."
13,$10.00 Hr Dishwasher,Ruby Tuesday,As soon as you join the team you'll notice the friendly working environment and the variety of experience that comes with working at Ruby Tuesday.Apply at:....
14,Maintenance,McDonalds,"A self starting individual in charge of general cleanliness of the restaurant, to include windows, floors, restrooms, dining room, parking lot, filtering vats..."
1,District Executive,Boy Scouts of America,Achieve net income and participation objectives for assigned camps and activities. Bachelor's degree from an accredited college or university (transcript with...
14,Custodian/Freight Associate,Stage Stores,"Assist freight carrier driver with properly staging cartons by colored label. Clean restrooms, store entrance, associate break room, Team-One area and fitting..."
13,Bartender - Toms River Chili's,Chili's,"You know how to manage the back bar. Providing an enjoyable bar experience for every Guest. A duck walks into a bar and – oh, wait...."
1,"Senior Marketing Campaigns Manager, North America Hardware Marketing",Oracle,"Senior Marketing Campaigns Manager, North America Hardware Marketing. This will include demand generation, brand awareness, events, field marketing, web/online..."
13,Server Assistant / Busser /Food Runner,Royal Docks Brewing Company,"It’s a place where the welcome is a little warmer, the room is a little cozier, the barkeep is a little friendlier and the crowd is somehow a wee bit more..."
12,BORDER PATROL AGENT,Department Of Homeland Security,Border Patrol Sectors. And pass the Border Patrol Agent Entrance Examination. Being a border patrol agent makes you a valuable member of the federal Law...
13,House Cook/Chef,Delta Zeta at Univ. of Northern Colorado,"Cook, Prep Cook, Chef, Line Cook, Nutritional Services, Cafeteria:. Responsible for preparing meals taking into consideration nutrition, food availability and..."
5,Public Health Specialist III,State of Oklahoma,"A bachelor’s degree with a major in public health, environmental health, environmental science, physical science, natural science, biological science,..."
13,Food Service Worker,TrustHouse Service Group,"Such as tray line, dish room, cafeteria and storeroom. The Food Service Worker is responsible for routine food service tasks in the kitchen, cafeteria, dining..."
4,Production Technician,SERVPRO of Culpeper & Fauquier Counties,A valid driver's license with a clean driving record.. Develop production expertise:. Having a cell phone that can be reached at all times to respond to...
4,RET Engineer,Intel,"Scanning Electron Microscopy, Atomic Force Microscopy, etc.). The RET Design Engineer will deliver test masks, test patterns, sampling strategies, process..."
13,"Host - 7982 - West Lee Highway - Warrenton, VA (Warrenton, VA)",Applebee's,Our Hosts greet and seat all arriving guests and acknowledge all departing guests in a friendly manner and assist in maintaining the overall guest flow of the...
13,Restaurant Manager,Ashby Inn & Restaurant,"Fauquier County high-end restaurant, seeks professional restaurant/front-of-the-house manager. The right applicant must be tactful;..."
13,Teller - On Call for the Warrenton/Fauquier County area,BB&T,"Perform the basic transactions of a paying and receiving teller such as accepting deposits and loan payments, verifying cash and endorsements, cashing checks..."
13,Restaurant Team Member - Crew (1628 - Warrenton),CHIPOTLE,Have the ability to develop positive working relationships with all restaurant employees and work as part of a team by helping others as needed or requested •...
13,Full Time Saute Cook,Claire's at the Depot Restaurant,"Must be able to execute recipes with consistency and accuracy in a busy kitchen. Claire's at the Depot, a fine dining restaurant located in Old Town Warrenton..."
13,Pizza Hut Restaurant General Manager,Pizza Hut,"And, you’re at least 18 years old with a valid driver’s license, reliable transportation (not public transportation – you may need to drive to make deposits for..."
12,Firefighter-2016,City of Mesquite,"Possession of or ability to obtain certification/licensing as an Arson Investigator and Peace Officer, as assigned...."
13,Restaurant Manager,Denny's-Little Apple Properties,"Must have the ability to work a flexible and-or irregular schedule. Individual will manage a sit-down restaurant wit daily operations including recruiting,..."
22,Bus Aide,Fauquier County Public Schools,Provides help to the school bus driver in maintaining discipline. Assists driver in preparing for and performing periodic emergency bus evacuation drills
13,Baker/Finisher,Dunkin' Donuts,Guest Focus – deliver high quality finished products for guest satisfaction. Ensure the safety and security of team and guests through a focus on food safety...
1,Part time shift manager,Vocelli pizza,Must available to work two days a week 11am -10 pm. Answer phone calls and take orders and check out pick up customer. Help in the kitchen with the cook....
9,TV Line Producer,zulily,"This will include partnering with various production companies to create new scripts, select footage and music and hire freela nce voice over artists...."
16,Sales Executive - Commissioned - Northrock Shopping Center,Jos. A Bank,"Report discrepancies to the manager on duty.Follow the customer rotation as prescribed by management and good customer service.Maintain your own timecard,..."
8,Librarian/Archivst - Part Time,Native Hawaiian Veterans,"Native Hawaiian Veterans, LLC is a Native Hawaiian Owned, Service Disabled Veterans Owned Small Business (SDVOSB), SDB, SBA 8(a), MBE, UDBE, and EEO/W/M/Vet"
21,"Machine Operator-Remington, Virginia",U.S. Pipe,Must have at least one to three years of previous fabrication or manufacturing assembly or production work experience in a fast paced manufacturing or...
17,Administrative Associate Round Rock TX,Dell,The Administrative Sr. Coordinates office functions with other departments. We are currently seeking an Administrative Sr....
22,CDL-A Refriegerated OTR Company Truck Driver,J.S. Helwig & Son,Minimum age 25 years Valid commercial license Safe driving record meeting our minimum requirements One (1) year verifiable over the road experience in the past...
13,PT Frozen Food/Dairy Associate,Food Lion,Provide total customer satisfaction. Ability to complete Computer Based Training (CBT) and Training Aid courses....
7,Legal Assistant,"Warrenton, Virginia Law Firm","Case management and litigation support, preparation of trial exhibits; Drafting basic legal documents, cite checking and proofreading court pleadings...."
13,Full Time Cake Decorator-Northrock Shopping Center,Harris Teeter,"Technical Skills - Assesses own strengths and weaknesses; Answer telephones by saying &quot;Harris Teeter [store name], this is [name], may I help you?&quot;...."
13,Bartender,Longhorn Steakhouse,"Helping guests be aware of and choose menu items, taking orders and making guests feel taken care of during their visit...."
2,Account Manager / Estimator,Five Star Painting - Manassas,Be available to answer any questions regarding the job while the project is in progress. Use the proper tools to estimate the job accurately....
11,Health Care Assistant or Bilingual Health Care Assitant - LVN,Hanford Elementary School District,HEALTH CARE ASSISTANT. Certified Nursing Assistant (C.N.A.). See Health Care Assistant Job Description. Addendum to Health Care Assistant Job Description....
13,Crew Person,McDonalds,"This position is for a friendly,enthusiastic person who can deliver prompt and accurate service with a smile...."
13,Catering Coordinator,Panera Bread Franchise (Blue Ridge Bread),Our bakery-cafes are focused on taking care of our guests. Must Have Own Vehicle. Perfect Driving Record. Please apply online and a Manager may be in touch if...
2,Fraud Risk Agent,Best Buy,Fraud Risk Agent. The Fraud Agent will support the efforts of BestBuy.com to provide timely service to our customers while controlling risk associated with...
22,Delivery Driver,Domino's,"Valid Driver's license. So if you're looking for casual work or maybe something more permanent, our Delivery Driver position is the perfect way in...."
13,Banquet Chef/Line Cook,Golf Course North Houston,"Preferred Banquet experience but not required. All kitchen staff must be able to cook high-quality balanced meals, cook from scratch and maintain proper food..."
23,Range Operations Specialist (PD D1134000),Department of the Army,"Officer, Not to Exceed O-3/ CPT, Warrant, Enlisted. Small arms, mortars and field artillery rockets or cannons...."
13,Pizza Hut Delivery Driver,Pizza Hut,"You’ll also need a valid driver’s license, insurance and reliable vehicle. That’s right, we’ll pay you to cruise around in your mobile office – your car –..."
2,Junior-Staff Accountant,Poplar Springs Inn and Spa,"Prepared recurring tax reports and other filings, to include sales and occupancy tax returns, personal property tax returns, business license applications..."
13,Line Cook/Prep Cook,Poplar Springs Inn and Spa,Looking for someone passionate about food and wants to learn or is already seasoned in the kitchen. Poplar Springs is making exciting food!!!...
3,"Database Specialist, Master",OBXtek,"Performs database programming and supports systems design. (h) Includes maintenance of database dictionaries, overall monitoring of standards and procedures,..."
6,Resident Camp Counselor,Busch Gardens Tampa,Provide guidance to campers keeping them on task and behaving appropriately. Must be at least 21 years old in order to drive camp rental vehicles....
13,Restaurant Team Member,RubyTuesday,"Whether its part-time or an entire career, we want to make sure you get everything you want out of your Ruby Tuesday experience...."
13,Clerk-Service (11195) Deli,Safeway,"Greet customers and take orders, in person and over telephone, in a friendly manner. Maintain area and conduct business in accordance with all federal, state..."
13,Starbucks Clerk (11973),Safeway,The Company is an equal opportunity employer and is committed to compliance with its obligations under all applicable state and federal laws prohibiting...
13,Barista (US),Starbucks,"Starbucks Corporation will consider qualified applicants with criminal histories in a manner consistent with all federal, state, and local ordinances...."
13,Food Service Attendant,Riverside Health System,"Formal training as a cook preferred. Performs duties related to therapeutic diets and meal services to include, aides in the preparation of preparation of hot..."
13,Taco Bell Restaurant Jobs,Taco Bell-BurgerBusters Inc.,"Key responsibilities include greeting customers in the restaurant or drive-thru, taking and ringing up orders, handling payment and thanking customers...."
3,Information Sec Spec,"Greystone & Co., Inc.","IT related college degree, technical school degree, or Microsoft certification such as MCSE, MCITP, etc...."
3,Jr Systems Administrator,City of Rifle,"Systems Administrator, Full-time, 4 year degree required. This position will assists the Systems Administrator in the support of services provided to the user..."
11,School Nutrition Worker,Fauquier County Public Schools,"The omission of specific duties does not exclude them from the position if the work is similar, related, or a logical assignment to the position.)...."
17,Administrative Secretary RB # 15 - 102,Buffalo Public Schools,"Administrative Secretary – Permanent. The Administrative Secretary performs a wide variety of complex responsible clerical, secretarial and administrative tasks..."
12,AIRPORT SECURITY SCREENER,Covenant Services Worldwide,Security Screeners are responsible for day-to-day security screening of airport employees and other individuals passing through Screening Locations....
12,Security Operations Manager,Google,You believe that providing effective security doesn't come at the expense of customer service - you will be our bodyguard (and our long lost pal)....
19,Maintenance Worker - Road Maintenance,"Collier County, FL","Performs light construction projects; Operates a variety of machinery, equipment, and tools associated with division projects, which may include a utility truck..."
15,nanny,Ashlea H.,"My 3 children (Girl -11, Girl-9, Boy-7) are in need of a nanny as their current one is headed off to college. My son is often headed to soccer practice...."
12,Surveillance Officer Full Time,Harrah's Ak-Chin,"The Surveillance Officer assures the overall safety of guests, employees and the property as a whole. Conducts surveillance observation on designated areas both..."
12,SHERIFF - DEPUTY SHERIFF,"Hidalgo County, TX","Serve as a bailiff in county and district courts. May be assigned to patrol, narcotics, civil process, warrants, courthouse security, criminal investigation or..."
12,Police Officer,Lord Fairfax Community College,Applicants must be able to successfully qualify with the service weapon (initially and annually) and possess a valid Virginia driver's license with an...
11,Physical Therapist or Physical Therapy Assistant,Accelerated Rehabilitation Centers,Athletico is looking for a dedicated and compassionate Physical Therapist Assistant to provide a hands-on approach to rehabilitation....
11,Rehab Aide,Accelerated Rehabilitation Centers,Previous Clinical Aide experience preferred. The Rehabilitation Aide will assist the Office Coordinator and clinician by performing requested administrative and...
15,Beauty Advisor,Stage Stores,Develop relationships with customers to insure future sales. Polite and courteous to customers and co-workers....
