job_field_id,title,company,description
8,Tutor or Teacher - Elementary Math,,"We are looking for math tutoring for our 4th grader. Improve grades, get ahead and increase confidence. Elementary math Tutoring &amp; Teaching opportunities..."
19,Drywall Hanger/Installer,EncoreHR Staffing,"Includes lathers who fasten wooden, metal, or rockboard lath to walls, ceilings or partitions of buildings to provide support base for plaster, fire-proofing,..."
6,Senior Addiction Counselor,NYC Health + Hospitals,The Senior Addiction Counselor will be responsible for assisting the consumer with activities relevant to an individual's rehabilitation goals....
3,Data Scientist,Humana,"Bachelor’s Degree in Mathematics, Computer Science, Actuarial Science or related field. Collaborate with other professionals including Actuaries, Mathematicians..."
12,Transportation Security Officer (TSO),Trinity Technology Group,TSOs must take the computerized Screener Assessment Battery. Repeatedly lift and carry baggage weighing up to 70 pounds…
16,Digital Sales Account Executive,The Morning Call Media Group,"Manages advertising sales revenue and account management targets. Our digital sales account executives are responsible for selling advertising banners, programs..."
4,Mid-Level Ground Control Station Engineer,GENERAL ATOMICS,Job ID# 6452BR Company General Atomics Aeronautical Systems Title Mid-Level Ground Control Station Engineer Job Category Engineering City San Diego State...
5,NATURAL RESOURCES PROGRAM TECHNICIAN,Arkansas Game & Fish Commission,"Knowledge of agricultural methods and basic land laws. Conducts agricultural and forest management activities on wildlife management areas, including preparing..."
17,Telephone Operator,The Broadmoor,"Monitors 911 Alert System. Operates the switchboard to relay incoming, outgoing, and interoffice calls by performing the following duties:...."
9,Graphic Artist,IGT,"Maya, Autodesk 3D Studio Max). This position is the development and timely delivery of high quality 2D and 3D game...."
20,HVAC Installer/Technician,Express Air Sytems,Basic knowledge of standard code requirements of air conditioning systems. \*\*\*\*\*Minimum requirements for Installers\*\*\*\*\*....
23,"Analyst, Operations",General Dynamics Information Technology,Extended Air Defense Simulation (EADSIM). Battle Command Sustainment Support System (BCS3). Air and Missile Defense Work Station (AMDWS)....
1,Regional Marketing Manager,Vishay,Develops a formal marketing plan outlining an appropriate marketing strategy for selling to key accounts. Coordinates the marketing efforts for a product group....
15,Lobby Concierge,Beach Activities of Maui,"The Concierge is knowledgeable about the local area and is the expert on the attractions, tours and activities that we sell.Must be flexible with scheduling and..."
22,Air Traffic Control Operator,National Guard,The skills you learn as an Air Traffic Control Operator will qualify you to work in civilian air traffic control towers and centers at airports and airfields....
11,2 Med/Peds Certified Nursing Assistant,Riverside Medical Center,Reports changes in patients' condition to the professional nurse. The 2 Med/Peds Certified Nursing Assitant (CNA) assists with the care of patients ranging from...
10,Anesthesiologist,"UF, Department of Anesthesiology","Department anesthesiologists practice at UF Health hospitals in Gainesville, FL at the University of Florida alongside 62 faculty anesthesiologists, 78..."
13,Kitchen Cook,SMG World - Tucson Convention Center,Banquet facility preparing meals for large events:. Fulfilling the service per each Banquet Event Orders (BEO)....
7,Administrative Law Judge,New Mexico State Personnel Office,"Administrative Law Judge, Adjudicator Advanced. This position will conduct administrative hearings on behalf of the State Personnel Board concerning..."
14,Janitor - Cleaning Technician - FULL TIME - 84095,Wingfoot Services,"Janitorial, janitor, cleaning specialist, carpet cleaning, floor care technician, buffing, part time, supplemental income, laborers, landscaping, supervisor,..."
18,Agricultural & Standards Inspector - I,Placer County,"Recruitments for Agricultural and Standards Inspector I, Agricultural and Standards Inspector II, and Agricultural and Standards Inspector, Senior are being..."
2,Cost Accountant III,Weatherford,JOB DESCRIPTION JOB SCOPE: This position will be responsible for the day to day understanding of the plant’s financial performance. The position will also be
21,Production Operator - 2nd shift,Bostik Inc.,About Bostik - Smart Adhesives. As a production operator at Bostik you will be in a batch making/mixer operator position for a competitive manufacturing...
15,Assistant Salon Manager,Hair Cuttery Salon,"BASIC REQUIREMENTS - MUST HAVE A COSMETOLOGY LICENSE in the state you are applying for, eligibility to work in the United States, 6+ months experience in a..."
8,7th & 8th Grade Social Studies Long Term Substitute Teacher,Willamette Leadership Academy,"We are looking for a dynamic and passionate social studies teacher to teach two periods of 8th grade US History, 2 periods of 7th grade Intro to Western..."
17,STORE CLERK - TEMPORARY,Dollar General,"This temporary position will be supporting new store openings, remodels and/or relocations of Dollar General stores by setting the store merchandise, organizing..."
16,Sales Assistant - Northrock Shopping Center,Jos. A Bank,"Properly and accurately operate and capture customer information, including e-mail addresses, in the point-of-sale register system.Comply with all procedures..."
7,Court Clerk IV - Pos. #292,St. Louis County Circuit Court,"Work is performed under the general supervision of a judge, circuit clerk, higher level court clerk and unit manager...."
21,Blow Mold Machine Operator,Consolidated Container Company,"Blow Mold Machine Operators report directly to Maintenance/ Production Manager. The Blow Mold Machine Operator will operate blow-mold, grinders, trimmer..."
10,"Optometrist needed in Fauquier County, VA",ETS Vision,Licensed in VA. Beautiful region less than an hour from the DC area- lower cost of living and far less traffic hassles....
23,Surface Warfare Officer (Nuclear Aircraft Carriers),U.S. Navy,"Managing shipboard vertical launch systems. For those going the Surface Warfare Officer (Nuclear) route, the first step is Officer Candidate School (OCS) – a 12..."
22,School Bus Driver -aftercare program,Lake Forest Park Montessori,"Part time aftercare/ bus driver:. If CDL required for vehicle driver, driver is subject to NLCI and state/federal policies, procedures and requirements..."
21,Plastics Mold Maker,TERMAX CORPORATION,"Craft precision tools by studying specifications, engineering blueprints, tool orders, and shop data to make, alter, or repair tools, jigs, fixtures, molds, or..."
10,Health Technician,Department of Veterans Affairs,Assists the audiologist in various procedures of the program including:. Utilizes electro-acoustical diagnostic equipment to assess the electronic functioning...
2,Athletics Business Manager,University of Indianapolis,"Interpersonal skills to work with internal groups (coaches, students-athletes, faculty, and staff) as well as external groups (officials, bus and rental car..."
7,Paralegal Specialist,Department Of Justice,Specialized experience is defined as experience performing paralegal or legal work which demonstrates a basic knowledge of legal research and the ability to...
2,Loan Support Residential Mortgage Processor,The Fauquier Bank,"Specialty may be in one loan field, but this position cross-trains for Consumer, Commercial, and Commercial Real Estate processing...."
22,PT Produce Associate,Food Lion,"Ability to analyze situations, identify problems and implement solutions. Ability to complete Computer Based Training (CBT) and Training Aid courses...."
13,Crew Person,McDonalds,"Greeting customers with a smile. It's time you worked for someone who will give you the tools to learn, grow and be what you want to be - both personally and..."
13,Pizza Hut Delivery Driver,Pizza Hut,"You’ll also need a valid driver’s license, insurance and reliable vehicle. That’s right, we’ll pay you to cruise around in your mobile office – your car –..."
22,Regional / OTR Class A CDL Truck Driver,Marten Transport,Then now is the time for experienced Class-A CDL truck drivers who want Regional and OTR runs to join Marten!...
1,Practice Manager,HCI-EBS,Design and implementation of a strategic marketing program. Candidates are expected to be comfortable acting as a managerial liaison between physician and staff...
16,Part-Time Teller - Northrock Shopping Center,Capital One,Live the company values of Excellence and Do the Right Thing - Act as a Customer Advocate - Take an active role in educating customers on other banking channel...
19,Metal Mechanic,Spencer-Ogden Energy,"Distribute insulating materials evenly into small spaces within floors, ceilings, or walls, using blowers and hose attachments or cement mortar...."
22,CDL-A Company Truck Drivers,Mesilla Valley Transportation East,"Mesilla Valley Transportation, a 48-state motor carrier, is now hiring company truck driving teams for OTR, Shuttle and Super Local runs...."
8,Adjunct Instructor- Computer Science,Lord Fairfax Community College,Master's degree in Computer Science or Computer Engineering from an accredited college/university. The Computer Science Department is seeking qualified...
22,AMBULANCE DRIVER,Catholic Health Initiatives,"Job Summary: Provides transportation for patients, visitors, employees and students. Essential Duties: Picks up and delivers patients, visitors, employees"
21,Manufacturing Assembler,Manufacturing Supplier,Ideal candidates will have some mechanical aptitude for assembling plastic or metal parts by hand. Advantage Resourcing is currently seeking Manufacturing...
6,Medical Social Worker - Home Health and Hospice Job,HCR ManorCare,"May require licensure or certificate as required by the state, and in good standing. The Medical Social Worker is responsible for providing patients and..."
13,Full Time Saute Cook,Claire's at the Depot Restaurant,"Must be able to execute recipes with consistency and accuracy in a busy kitchen. Claire's at the Depot, a fine dining restaurant located in Old Town Warrenton..."
17,Teller,The Fauquier Bank,"Accepts deposits, loan payments, credit card deposits and payments. Job requires a higher level of problem solving abilities to find solutions to difficult..."
21,eCommerce Fulfillment Associate,Stage Stores,Willingness to consult multiple resources to obtain answers. Troubleshoot and problem solve when necessary....
3,Senior IT Support Specialist,Greystone,"Strong technical knowledge of MS Windows, desktop support and PC hardware, setup and configuration - People management experience and demonstrated leadership..."
2,Junior-Staff Accountant,Poplar Springs Inn and Spa,"Prepared recurring tax reports and other filings, to include sales and occupancy tax returns, personal property tax returns, business license applications..."
8,Librarian,Fauquier County Public Schools,Answers reference questions in person and by telephone
8,High School Math,Fauquier County Public Schools,"Plans, coordinates, attends, and chaperones field trips as appropriate. Motivates students to develop an interest in and an appreciation of math;..."
22,CDL-A Company Truck Drivers,Purdy Brothers Trucking,We offer a better driving career by asking YOU what you need and then doing whatever we can to meet those needs....
22,Delivery Driver,Domino's,"Valid Driver's license. So if you're looking for casual work or maybe something more permanent, our Delivery Driver position is the perfect way in...."
16,Merchandising,The Home Depot,"Must have a valid state driver s license and proof of insurance. Requires listening for customer service calls, personal pages and general information..."
22,Roadtrak / Highway - Experienced Regional CDL-A Truck Driver,Hub Group Trucking,HGT’s Roadtrak truck driving opportunities take your career the extra mile! Hub Group Trucking has unique regional driving opportunities available to CDL-A...
3,"Network Deployment and Operations (NDO) Lead, Google Fiber, Midwest",Google,"Familiarity with other network transmission protocols and in-home network architecture. Ensure the best local network is designed, built, and maintained with..."
11,Environmental Services Associate-PRN-7a-3p,Fauquier Health System,"The Environmental Services Associate is responsible for cleaning all patient rooms, nurses’ station, bathrooms, waiting areas, departmental areas, offices,..."
8,Summer Technology Camp Staff - Lead & Assistant Instructors,Black Rocket Productions,"We have multiple locations in over 30 state states! Are you passionate about Video Games, App Design, Digital Movies, Robotics, or STEM?..."
1,Marketing Science@Scale – Project Manager,Facebook,"The Marketing Science team is seeking a Project Manager who is passionate about making business operations, tools, and processes more efficient and effective...."
18,Arborist Climber Trainee,Bartlett Tree Experts,The ideal candidate will have experience working on a tree crew as a Ground Man OR a 2/4 year degree in Forestry or a related field....
2,Entry Level Quality Assurance Analyst,National Software Management,"*Entry Level Quality Assurance Analyst* Under direct supervision, the Quality Assurance Analyst verifies that software changes submitted by developers"
17,Help Desk / Support Specialist,Raytheon,Provide on-demand and scheduled training to individuals and groups in the use of Maximo and other technical support tools....
16,Retail Merchandiser- Part Time,TNG Retail Services,"Or person’s looking for permanent part time work. Clients' products, developing strong relationships with store personnel, accurately reporting time worked,..."
16,AP Clerk,Sheehy Auto Stores,"All applicants must have the ability to pass pre-employment testing to include background checks, MVR, drug test, and valid driver's license...."
9,Freelance Production Coordinator,"JPL Integrated Communications, Inc.","You will interact with talented Project Managers, Event Producers, Production Managers, Creative Directors, Graphic Artists, Editors, and so many others!..."
