job_field_id,title,company,description
1,Regional Marketing Manager,Vishay,Develops a formal marketing plan outlining an appropriate marketing strategy for selling to key accounts. Coordinates the marketing efforts for a product group....
20,HVAC Installer/Technician,Express Air Sytems,Basic knowledge of standard code requirements of air conditioning systems. \*\*\*\*\*Minimum requirements for Installers\*\*\*\*\*....
2,Cost Accountant III,Weatherford,JOB DESCRIPTION JOB SCOPE: This position will be responsible for the day to day understanding of the plant’s financial performance. The position will also be
22,Air Traffic Control Operator,National Guard,The skills you learn as an Air Traffic Control Operator will qualify you to work in civilian air traffic control towers and centers at airports and airfields....
5,NATURAL RESOURCES PROGRAM TECHNICIAN,Arkansas Game & Fish Commission,"Knowledge of agricultural methods and basic land laws. Conducts agricultural and forest management activities on wildlife management areas, including preparing..."
19,Drywall Hanger/Installer,EncoreHR Staffing,"Includes lathers who fasten wooden, metal, or rockboard lath to walls, ceilings or partitions of buildings to provide support base for plaster, fire-proofing,..."
15,Lobby Concierge,Beach Activities of Maui,"The Concierge is knowledgeable about the local area and is the expert on the attractions, tours and activities that we sell.Must be flexible with scheduling and..."
8,Tutor or Teacher - Elementary Math,,"We are looking for math tutoring for our 4th grader. Improve grades, get ahead and increase confidence. Elementary math Tutoring &amp; Teaching opportunities..."
10,Anesthesiologist,"UF, Department of Anesthesiology","Department anesthesiologists practice at UF Health hospitals in Gainesville, FL at the University of Florida alongside 62 faculty anesthesiologists, 78..."
17,Telephone Operator,The Broadmoor,"Monitors 911 Alert System. Operates the switchboard to relay incoming, outgoing, and interoffice calls by performing the following duties:...."
4,Mid-Level Ground Control Station Engineer,GENERAL ATOMICS,Job ID# 6452BR Company General Atomics Aeronautical Systems Title Mid-Level Ground Control Station Engineer Job Category Engineering City San Diego State...
12,Transportation Security Officer (TSO),Trinity Technology Group,TSOs must take the computerized Screener Assessment Battery. Repeatedly lift and carry baggage weighing up to 70 pounds…
13,Kitchen Cook,SMG World - Tucson Convention Center,Banquet facility preparing meals for large events:. Fulfilling the service per each Banquet Event Orders (BEO)....
6,Senior Addiction Counselor,NYC Health + Hospitals,The Senior Addiction Counselor will be responsible for assisting the consumer with activities relevant to an individual's rehabilitation goals....
16,Digital Sales Account Executive,The Morning Call Media Group,"Manages advertising sales revenue and account management targets. Our digital sales account executives are responsible for selling advertising banners, programs..."
7,Administrative Law Judge,New Mexico State Personnel Office,"Administrative Law Judge, Adjudicator Advanced. This position will conduct administrative hearings on behalf of the State Personnel Board concerning..."
9,Graphic Artist,IGT,"Maya, Autodesk 3D Studio Max). This position is the development and timely delivery of high quality 2D and 3D game...."
18,Agricultural & Standards Inspector - I,Placer County,"Recruitments for Agricultural and Standards Inspector I, Agricultural and Standards Inspector II, and Agricultural and Standards Inspector, Senior are being..."
14,Janitor - Cleaning Technician - FULL TIME - 84095,Wingfoot Services,"Janitorial, janitor, cleaning specialist, carpet cleaning, floor care technician, buffing, part time, supplemental income, laborers, landscaping, supervisor,..."
3,Data Scientist,Humana,"Bachelor’s Degree in Mathematics, Computer Science, Actuarial Science or related field. Collaborate with other professionals including Actuaries, Mathematicians..."
21,Production Operator - 2nd shift,Bostik Inc.,About Bostik - Smart Adhesives. As a production operator at Bostik you will be in a batch making/mixer operator position for a competitive manufacturing...
11,2 Med/Peds Certified Nursing Assistant,Riverside Medical Center,Reports changes in patients' condition to the professional nurse. The 2 Med/Peds Certified Nursing Assitant (CNA) assists with the care of patients ranging from...
23,"Analyst, Operations",General Dynamics Information Technology,Extended Air Defense Simulation (EADSIM). Battle Command Sustainment Support System (BCS3). Air and Missile Defense Work Station (AMDWS)....
20,"Maintenance Mechanic-Remington, Virginia",U.S. Pipe,"Directs and performs complex mechanical repair work &amp; is responsible for the more intricate repair assignments, including hydraulic and pneumatic systems...."
13,Bartender,Longhorn Steakhouse,"Helping guests be aware of and choose menu items, taking orders and making guests feel taken care of during their visit...."
3,IT and GxP Computer Systems Specialist,Booth Welsh Resources,"Automation, Computerized and Vision systems administrator. O Proceed to the validation of the automated and computerized systems (logic security, backup /..."
7,Legal Consultant,Softpath System LLC,Understanding and researching complex international legal and/or regulatory issues. Looking for an energetic and talented professional to join the International...
11,CNA-FHRNC-Full Time-Evenings,Fauquier Health System,Certified Nursing Assistant License. The Certified Nursing Assistant assists with patient care throughout nursing areas under the direction of licensed...
11,Massage Therapist/Chiropractic Assistant,Physicians Plus Spine and Rehab Center,Chiropractic office is seeking a full time massage therapist/chiropractic assistant. This position offers great opportunity for the right person....
13,Restaurant Manager,Ashby Inn & Restaurant,"Fauquier County high-end restaurant, seeks professional restaurant/front-of-the-house manager. The right applicant must be tactful;..."
16,Sales Assistant - Northrock Shopping Center,Jos. A Bank,"Properly and accurately operate and capture customer information, including e-mail addresses, in the point-of-sale register system.Comply with all procedures..."
9,Head JV Boys Basketball Coach,Highland School,"A VISAA Division 2 Private High School, competing in the Delaney Athletic Conference (DAC). Lead the JV Boys Basketball Program at Highland School in Warrenton,..."
17,Asset Protection/Loss Prevention,The Home Depot,"They utilize tools to minimize loss to the Company, including but not limited to identifying incidents of theft and fraud, reviewing CCTV and exception reports,..."
19,Maintenance Worker - Road Maintenance,"Collier County, FL","Performs light construction projects; Operates a variety of machinery, equipment, and tools associated with division projects, which may include a utility truck..."
20,Custom Window Treatment Installer,Budget Blinds of Warrenton,Valid drivers and a good driving record. No phone calls please!!! Time Management You must have a good driving record and are able to navigate your way from...
13,Line Cook/Prep Cook,Poplar Springs Inn and Spa,Looking for someone passionate about food and wants to learn or is already seasoned in the kitchen. Poplar Springs is making exciting food!!!...
8,Adjunct Faculty-Communications,Lord Fairfax Community College,"Certain developmental or technical courses may be taught by instructors with a Bachelor's degree, a special certification, and/or work experience...."
8,Instructor I - PCT Job,SAIC,"SAIC is a premier technology integrator providing full life cycle services and solutions in the technical, engineering, intelligence, and enterprise information..."
3,Senior Certified Security Analyst,Kforce,"Coordinate with applicable stakeholders to develop security event remediation strategies and timelines. Engineering, Math, or Science Degree...."
1,Assistant Manager,Domino's,"Occasionally, pizza sauce weighing 30 pounds is carried from the storage room to the front of the store. If you like the thought of managing your own million..."
4,Production Technician,SERVPRO of Culpeper & Fauquier Counties,A valid driver's license with a clean driving record.. Develop production expertise:. Having a cell phone that can be reached at all times to respond to...
13,PT Frozen Food/Dairy Associate,Food Lion,Provide total customer satisfaction. Ability to complete Computer Based Training (CBT) and Training Aid courses....
8,"TUTORS - Academic Center for Excellence - Fauquier Campus, Vint Hill Site",Lord Fairfax Community College,Completed LFCC faculty recommendation form(s) for each desired course to tutor OR documented evidence of tutoring/instructional experience in an academic...
13,Cook - PRN - Hours vary,Fauquier Health System,"SERVE SAFE certification. Course work/completion from an accredited culinary school. In the absence of the team leader, the cook will supervise the operations..."
7,Attorney Advisor (General),Department of the Air Force,"Constitutional, civil, criminal, labor law; Provides SME authoritative advisory, consultation, and collaboration in the areas of ethics, medical and physical..."
17,Front Desk Agent,Holiday Inn & Suites - Tulsa,At *Holiday Inn® Hotels* our job is to bring the joy of travel to everyone. That’s where you come in. When you’re part of the Holiday Inn Hotels brand you’re
14,Maintenance Worker,Marsh Run MHC,"Valid driver’s license and good driving record. Required license or certification:. General knowledge of electrical, plumbing, and grounds maintenance...."
3,Intelligence Analyst / Sr. Intelligence Analyst with Security Clearance,"TekStream Solutions, LLC","Bachelor’s Degree in Computer Science or a related technical discipline or military discipline, or the equivalent combination of education, professional..."
16,Insurance Sales CSR (Member Service Specialist)-Fauquier,Virginia Farm Bureau Mutual Insurance,"Property and Casualty and Life &amp; Health License- Must obtain P&amp;C and L&amp;H licenses within six months of employment,...."
18,Arborist Climber Trainee,Bartlett Tree Experts,The ideal candidate will have experience working on a tree crew as a Ground Man OR a 2/4 year degree in Forestry or a related field....
17,Front Desk Agent,Poplar Springs Inn & Spa,"Customer Service, Hotel Front Desk:. Prior hotel experience is preferred. Poplar Springs Inn &amp; Spa is looking for a dedicated individual to fill the need of a..."
22,Hiring CDL-A Drivers for L/P,Network 1,"No commercial transportation related felony, theft or larceny conviction. LEASE OPERATORS NEEDED NOW!!*...."
7,Legal Assistant,"Warrenton, Virginia Law Firm","Case management and litigation support, preparation of trial exhibits; Drafting basic legal documents, cite checking and proofreading court pleadings...."
18,Arborist Climber,Bartlett Tree Expert Co.,"Having a CDL is. Assists with driving, backing, dumping, and parking duties. Strives to improve job skills and develop the potential for upward mobility...."
8,Teacher- Special Education,Fauquier County Public Schools,"Plans, coordinates, attends, and chaperones field trips as appropriate. Provides an effective program of instruction to include instructional skills, knowledge..."
20,Automotive Technician,SAFFORD AUTOMOTIVE GROUP,State Inspection license a plus. We want you to grow within our organization and will give you the chance and tools to succeed!...
2,Account Manager / Estimator,Five Star Painting - Manassas,Be available to answer any questions regarding the job while the project is in progress. Use the proper tools to estimate the job accurately....
21,Processing Operator I - 3rd Shift,"SOFTPATH SYSTEM LLC in Sturgis, MI",Processing Operator I - 3rd Shift. Production or manufacturing and machine or forklift experience:. Primary responsibility will be to support the Dry blending...
15,Dog Trainer / Apprentice,Petco,Our Dog Trainer Apprenticeship is a comprehensive training program to prepare you for the role of Dog Trainer in your store....
13,Starbucks Clerk (11973),Safeway,The Company is an equal opportunity employer and is committed to compliance with its obligations under all applicable state and federal laws prohibiting...
17,Teller,The Fauquier Bank,"Accepts deposits, loan payments, credit card deposits and payments. Job requires a higher level of problem solving abilities to find solutions to difficult..."
6,LCSW Child/Family,Kaiser Permanente,"Experience working with chidlren, adolescents and their families in individual, family, and group psychotherapy...."
10,Pharmacy Technician,Family Care Pharmacy Remington,Required license or certification:. This is a family owned business that is looking for a full time pharmacy technician who can perform data entry as well as...
16,Kitchen/Bath Designer,The Home Depot,"Requires listening for customer service calls, personal pages and general information announcements. Answer questions about merchandise for the customer's level..."
8,Substitute/Floater Teacher,Children of America,"From infants to toddlers, preschoolers to kindergarteners, our highly trained teachers lead each child to reach developmental milestones, preparing the children..."
20,Service Technician (Mechanic),"Franklin Equipment, LLC","The individual will maintain and repair equipment offered by Franklin Equipment to include Construction and Agricultural (small equipment, aerial, dirt, farm,..."
5,Physical Therapy Aide,All Star Physical Therapy,Responsibilities include: setting up treatment areas cleaning up following treatment session aiding physical therapist during patient sessions Job Type:
17,Retail Store Shift Supervisor,CVS Health,Ensure compliance with all company policies and procedures (such as cash management) and federal and state....
3,Junior Software Tester,"FEi Systems, Inc.","FEi Systems provides extensive IT services for multiple federal agencies and state governments in the areas of Medicare management, Health Information Exchanges..."
23,Range Operations Specialist (PD D1134000),Department of the Army,"Officer, Not to Exceed O-3/ CPT, Warrant, Enlisted. Small arms, mortars and field artillery rockets or cannons...."
