job_field_id,title,company,description
5,NATURAL RESOURCES PROGRAM TECHNICIAN,Arkansas Game & Fish Commission,"Knowledge of agricultural methods and basic land laws. Conducts agricultural and forest management activities on wildlife management areas, including preparing..."
16,Digital Sales Account Executive,The Morning Call Media Group,"Manages advertising sales revenue and account management targets. Our digital sales account executives are responsible for selling advertising banners, programs..."
15,Lobby Concierge,Beach Activities of Maui,"The Concierge is knowledgeable about the local area and is the expert on the attractions, tours and activities that we sell.Must be flexible with scheduling and..."
14,Janitor - Cleaning Technician - FULL TIME - 84095,Wingfoot Services,"Janitorial, janitor, cleaning specialist, carpet cleaning, floor care technician, buffing, part time, supplemental income, laborers, landscaping, supervisor,..."
23,"Analyst, Operations",General Dynamics Information Technology,Extended Air Defense Simulation (EADSIM). Battle Command Sustainment Support System (BCS3). Air and Missile Defense Work Station (AMDWS)....
22,Air Traffic Control Operator,National Guard,The skills you learn as an Air Traffic Control Operator will qualify you to work in civilian air traffic control towers and centers at airports and airfields....
20,HVAC Installer/Technician,Express Air Sytems,Basic knowledge of standard code requirements of air conditioning systems. \*\*\*\*\*Minimum requirements for Installers\*\*\*\*\*....
12,Transportation Security Officer (TSO),Trinity Technology Group,TSOs must take the computerized Screener Assessment Battery. Repeatedly lift and carry baggage weighing up to 70 pounds…
9,Graphic Artist,IGT,"Maya, Autodesk 3D Studio Max). This position is the development and timely delivery of high quality 2D and 3D game...."
10,Anesthesiologist,"UF, Department of Anesthesiology","Department anesthesiologists practice at UF Health hospitals in Gainesville, FL at the University of Florida alongside 62 faculty anesthesiologists, 78..."
19,Drywall Hanger/Installer,EncoreHR Staffing,"Includes lathers who fasten wooden, metal, or rockboard lath to walls, ceilings or partitions of buildings to provide support base for plaster, fire-proofing,..."
21,Production Operator - 2nd shift,Bostik Inc.,About Bostik - Smart Adhesives. As a production operator at Bostik you will be in a batch making/mixer operator position for a competitive manufacturing...
8,Tutor or Teacher - Elementary Math,,"We are looking for math tutoring for our 4th grader. Improve grades, get ahead and increase confidence. Elementary math Tutoring &amp; Teaching opportunities..."
4,Mid-Level Ground Control Station Engineer,GENERAL ATOMICS,Job ID# 6452BR Company General Atomics Aeronautical Systems Title Mid-Level Ground Control Station Engineer Job Category Engineering City San Diego State...
3,Data Scientist,Humana,"Bachelor’s Degree in Mathematics, Computer Science, Actuarial Science or related field. Collaborate with other professionals including Actuaries, Mathematicians..."
2,Cost Accountant III,Weatherford,JOB DESCRIPTION JOB SCOPE: This position will be responsible for the day to day understanding of the plant’s financial performance. The position will also be
17,Telephone Operator,The Broadmoor,"Monitors 911 Alert System. Operates the switchboard to relay incoming, outgoing, and interoffice calls by performing the following duties:...."
1,Regional Marketing Manager,Vishay,Develops a formal marketing plan outlining an appropriate marketing strategy for selling to key accounts. Coordinates the marketing efforts for a product group....
11,2 Med/Peds Certified Nursing Assistant,Riverside Medical Center,Reports changes in patients' condition to the professional nurse. The 2 Med/Peds Certified Nursing Assitant (CNA) assists with the care of patients ranging from...
7,Administrative Law Judge,New Mexico State Personnel Office,"Administrative Law Judge, Adjudicator Advanced. This position will conduct administrative hearings on behalf of the State Personnel Board concerning..."
13,Kitchen Cook,SMG World - Tucson Convention Center,Banquet facility preparing meals for large events:. Fulfilling the service per each Banquet Event Orders (BEO)....
6,Senior Addiction Counselor,NYC Health + Hospitals,The Senior Addiction Counselor will be responsible for assisting the consumer with activities relevant to an individual's rehabilitation goals....
18,Agricultural & Standards Inspector - I,Placer County,"Recruitments for Agricultural and Standards Inspector I, Agricultural and Standards Inspector II, and Agricultural and Standards Inspector, Senior are being..."
2,Entry Level Quality Assurance Analyst,National Software Management,"*Entry Level Quality Assurance Analyst* Under direct supervision, the Quality Assurance Analyst verifies that software changes submitted by developers"
9,TV Line Producer,zulily,"This will include partnering with various production companies to create new scripts, select footage and music and hire freela nce voice over artists...."
15,Fitness Instructors,Woodlake Swim and Racquet Club,"Woodlake Swim and Racquet Club is currently looking to hire certified Water aerobics, Pilates, Meditation, Tai Chi, and Les Mills instructors...."
14,Exterminator,University City Housing Company,University City Housing (UCH) is a Philadelphia-based property management company with significant real estate holdings in and around the Philadelphia
5,Environmental Specialist I,PeopleFirst Florida HR,"ENVIRONMENTAL SCIENTISTS AND SPECIALISTS, INCLUDING HEALTH. Knowledge of plant and animal living tissue, cells, organisms, and entities, including their..."
8,LANGUAGE ARTS TEACHER,Academy of Hope Adult PCS,"Bachelor's degree and secondary or adult education experience required. Teach a course load of at least 2 classes per day of adult literacy, basic education,..."
20,Service Technician (Mechanic),"Franklin Equipment, LLC","The individual will maintain and repair equipment offered by Franklin Equipment to include Construction and Agricultural (small equipment, aerial, dirt, farm,..."
11,Massage Therapist/Chiropractic Assistant,Physicians Plus Spine and Rehab Center,Chiropractic office is seeking a full time massage therapist/chiropractic assistant. This position offers great opportunity for the right person....
17,Administrative Assistant to the Provost/Vice President of Academic Affairs,East Central University,"The Administrative Assistant coordinates the Provost’s appointments and travel arrangements. East Central University invites applications for a twelve-month,..."
3,Mid-Level Cyber Security Consultant ( IRS Clearance),Seneca Resources,"Level Cyber Security Consultant to support Cyber Security Program based in Reston, VA. Knowledge of security principles, best practices, conducting security..."
11,Physical Therapist or Physical Therapy Assistant,Accelerated Rehabilitation Centers,Athletico is looking for a dedicated and compassionate Physical Therapist Assistant to provide a hands-on approach to rehabilitation....
20,MAINTENANCE MECHANIC,United States Postal Service,"United States Postal Service External Publication for Job Posting 94976393 If this job requires qualification on an examination, the number of applicants who"
6,Resident Camp Counselor,Busch Gardens Tampa,Provide guidance to campers keeping them on task and behaving appropriately. Must be at least 21 years old in order to drive camp rental vehicles....
7,Senior Appellate Law Stenographer,NYS Unified Court System,"Acting as liaison with Justices, court attorneys and administrative personnel with regard to assignments; Responsible for training and supervising Appellate Law..."
11,Health Center Associate - Mobile,Planned Parenthood Southeast,Documents ultrasound in medical record. Assures lobby is neat and orderly throughout the day Explains medical tests and procedures and obtain informed consent...
10,Cardiologist,U.S. Navy Reserve,*Cardiologist NEEDED* for part-time in Navy Reserve! Currently *1 position* open Nationwide! Your Benefits: * $75K Sign-on Bonus * All pay and allowances of
3,"Database Specialist, Master",OBXtek,"Performs database programming and supports systems design. (h) Includes maintenance of database dictionaries, overall monitoring of standards and procedures,..."
19,Fabricator/Welder Helper,Kooks Custom Headers Inc,Pass off parts to helper for grinding and straightening flanges. Receive parts back from helper for final assembly and inspection for quality control....
19,Metal Mechanic,Spencer-Ogden Energy,"Distribute insulating materials evenly into small spaces within floors, ceilings, or walls, using blowers and hose attachments or cement mortar...."
21,Manufacturing Assembler,Manufacturing Supplier,Ideal candidates will have some mechanical aptitude for assembling plastic or metal parts by hand. Advantage Resourcing is currently seeking Manufacturing...
10,Telemedicine Physician,"MeMD, Inc.",MeMD is seeking a Board-Certified Physician possessing a Florida medical license that is interested in joining our team of Telemedicine Providers....
22,Railroad Openings- Now Hiring,JNI,*RAILROAD OPENINGS- NOW HIRING* *Trainees & Experience Welcome* *Call 205-536-7500 FOR IMMEDIATE ATTENTION* * Fireman/ Oiler – Forklift Operator…..$-23/HR *...
2,Marketing Internship Latin America,Cosmetics of France,Provide customer service to the agent zone in terms of material &amp information needed for events trough com. Consolidate and update the Local Makeup Experts &amp
8,Basic Skills/Learning Center Non-Credit Instructor,North Orange County Community College District,"Teach pre-college courses in class and lab settings including, but not limited to, adult basic education (ABE), career technical education, adult secondary..."
6,Elementary Counselor 846 (2016-2017),"Kansas City, MO School District","The elementary counselor is a member of the district’s guidance function, charged with providing a comprehensive guidance program for students in grades K-6...."
1,"Sales Strategy and Operations Manager, Google Fiber",Google,"Working with them, you set the vision and the strategy for how their advertising can reach thousands of users...."
22,Flight Attendant,Compass Airlines,Flight Attendant - LAX. One year previous flight attendant experience preferred The Flight Attendant will demonstrate the Compass Airlines' core values and…
14,Maintenance Worker II - PUBLIC WORKS,City of Port Orange,Clean grounds and remove litter. Experience in operating automotive or maintenance equipment. Provide routine and basic maintenance and repair to small...
19,Heavy Equipment Operator,,"Must operate loaders, trucks, rollers, backhoes, mowers, graders, and other. Loads and unloads sand, dirt, asphalt, rock, and other materials as needed;..."
21,Processing Operator I - 3rd Shift,"SOFTPATH SYSTEM LLC in Sturgis, MI",Processing Operator I - 3rd Shift. Production or manufacturing and machine or forklift experience:. Primary responsibility will be to support the Dry blending...
14,Landscape and garden maintenance worker,Lawn Love,\*You must have at least one year of professional lawn care experience. \*You must have all the equipment needed to perform a full lawn care service....
21,"Lead, Upholstery",StandardAero,"The Senior Tech Upholsterer is technically competent in aircraft upholstery, and is technically competent to accomplish all of his/her duties with little or no..."
2,Business Operations Associate/Sr. Associate,Lending Club,"You’re both comfortable conversing with our front-line agents to truly understand how our operations work, as well as making a convincing case to our executive..."
2,Seasonal Tax Preparer,Jackson Hewitt,"Jackson Hewitt is seeking a seasonal Tax Preparer to perform a variety of activities related to income tax preparation, sales and the delivery of excellent..."
9,Actor/Actress,Nine30 Media,"We are looking for actors to become a member of our marketing team. Our ideal candidates would have a strong portfolio, a heavy social media presence, and a..."
3,Jr Systems Administrator,City of Rifle,"Systems Administrator, Full-time, 4 year degree required. This position will assists the Systems Administrator in the support of services provided to the user..."
20,Utility Systems Repairer-Operator,Department of Defense, Operate an Energy Management and Control System (EMCS) used to monitor and control all HVAC systems within the facility....
4,Project Engineer,"Vanir Construction Management, Inc.","Or, non-degree holders must possess 4+ years of experience in a construction, engineering or architectural related position...."
10,Recreational Therapist - Full Time - Baylor Rehab - downtown Dallas,Baylor Institute for Rehabilitation,Current national certification from NCTRC as a Certified Therapeutic Recreation Specialist (CTRS). The Therapeutic Recreation Specialist/Recreational Therapist...
21,Shop Assembly and Fabrication,Western Window Systems,*Western Window Systems* is one of the fastest growing and most successful Window Manufacturing Companies in the nation. *Overview* The Warehouse Shop
13,Banquet Chef/Line Cook,Golf Course North Houston,"Preferred Banquet experience but not required. All kitchen staff must be able to cook high-quality balanced meals, cook from scratch and maintain proper food..."
10,Health Technician,Department of Veterans Affairs,Assists the audiologist in various procedures of the program including:. Utilizes electro-acoustical diagnostic equipment to assess the electronic functioning...
9,Freelance Production Coordinator,"JPL Integrated Communications, Inc.","You will interact with talented Project Managers, Event Producers, Production Managers, Creative Directors, Graphic Artists, Editors, and so many others!..."
14,Custodial Worker (Janitor) MWR 03-16,"Naval Air Station - JAX, MWR","Deep cleaning may include defrosting refrigerators and freezers, cleaning windows (interior and exterior), replacing and/or cleaning drapes/curtains, moving..."
6,Staff Development Coordinator,Sayre Christain Village,"Conductscertification or training programs for Nursing Assistants. Frequentlycommunicates with employees, residents, family members, physicians etc...."
1,"Senior Marketing Campaigns Manager, North America Hardware Marketing",Oracle,"Senior Marketing Campaigns Manager, North America Hardware Marketing. This will include demand generation, brand awareness, events, field marketing, web/online..."
15,Dog Trainer / Apprentice,Petco,Our Dog Trainer Apprenticeship is a comprehensive training program to prepare you for the role of Dog Trainer in your store....
23,Intelligence Operations Specialist,Department of the Air Force,"Trains, educates, and tests aircrew on worldwide threats, to include surface-to-air missile (SAM), air-to-air missile (AAM), anti-aircraft artillery (AAA), and..."
15,Barber,GoodBuddyz BarberShop,Chairs available for registered and apprentice barbers at 3-chain barbershop. Build your own clientele or bring your own....
18,Log Yard Scaler,Church & Church Lumber Company,Must be experienced with running equipment such as a log loader. Good people person with management and communication skills....
20,"Automotive Body Repairer, Fiberglass/Welder",The Logistics Company,The Repairer applies and spreads body filler manually to reestablish surface. Two years related experience. The Automobile Body Repairer mixes polyester resin...
3,"Network Deployment and Operations (NDO) Lead, Google Fiber, Midwest",Google,"Familiarity with other network transmission protocols and in-home network architecture. Ensure the best local network is designed, built, and maintained with..."
17,"Clerk, Front Desk (Great Beginnings)",La Clinica,"As a Clerk, working in a fast pace environment, some of your typical job responsibilities will include greeting, registering patients, verifying insurance..."
15,Central Baggage Agent,Virgin America,O Perform Baggage. O Following proper guiding principles in order to compensate guests for any misplaced baggage....
14,Residential Lawn Specialist 100889,TruGreen,As a Lawn Specialist with the #1 lawn care company you will be providing regularly scheduled landscape services within your route on a daily basis....
7,Legal Consultant,Softpath System LLC,Understanding and researching complex international legal and/or regulatory issues. Looking for an energetic and talented professional to join the International...
21,Blow Mold Machine Operator,Consolidated Container Company,"Blow Mold Machine Operators report directly to Maintenance/ Production Manager. The Blow Mold Machine Operator will operate blow-mold, grinders, trimmer..."
6,FAMILY COURT COUNSELOR,"Dallas County, TX","Must be independently licensed in the State of Texas as a Licensed Professional Counselor (LPC), Licensed Marriage and Family Therapist (LMFT), Licensed Master..."
13,Bartender / Barman / Mixologist,Ristorante Capellini,"Bartender, barman, barkeep, barmaid, and mixologist please apply. Bartenders are responsible for positive guest interaction while accurately mixing and serving..."
9,Play-by-Play Announcer,Pittsburgh Pirates,"This position is for a play-by-play announcer for the Pittsburgh Pirates. Plan, prepare, present and perform as a play-by-play announcer on Pirates television..."
5,Physical Therapy Aide,All Star Physical Therapy,Responsibilities include: setting up treatment areas cleaning up following treatment session aiding physical therapist during patient sessions Job Type:
13,Dishwasher and Busser,Jefferson Manor Health & Rehab,This is a full time dishwasher position in a nursing home facility. Prior experience preferred but not required....
3,IT and GxP Computer Systems Specialist,Booth Welsh Resources,"Automation, Computerized and Vision systems administrator. O Proceed to the validation of the automated and computerized systems (logic security, backup /..."
1,General Manager - Chesapeake Energy Arena -SMG,SMG,"Manages subordinate Directors and Managers who supervise employees in the Finance, Marketing, Operations, Food &amp; Beverage Departments or other facility..."
18,Forestry Technician (Lookout),Department Of Agriculture,Workers Compensation Separation:. A career with the Forest Service will challenge you to manage and care for more than 193 million acres of our nation's most...
5,Physical Science Technician,Department Of Agriculture,The Functional Foods Research Unit creates new processing technologies to enhance the performance of agricultural materials in existing applications and...
17,Banking Services Representative - Bakersfield,Rabobank,Knowledgeable regarding all bank products. Assists with reception and vault/merchant attendant duties. Ability to comprehend and interpret Bank policies and...
4,RET Engineer,Intel,"Scanning Electron Microscopy, Atomic Force Microscopy, etc.). The RET Design Engineer will deliver test masks, test patterns, sampling strategies, process..."
2,Senior Staff Accountant,MFA Oil Co.,Summary of Responsibilities: Job Responsibilities include but are not limited to: Ensuring the integrity of the general ledger and financial statements
22,School Bus Driver -aftercare program,Lake Forest Park Montessori,"Part time aftercare/ bus driver:. If CDL required for vehicle driver, driver is subject to NLCI and state/federal policies, procedures and requirements..."
12,BORDER PATROL AGENT,Department Of Homeland Security,Border Patrol Sectors. And pass the Border Patrol Agent Entrance Examination. Being a border patrol agent makes you a valuable member of the federal Law...
21,Product Manager,"Specialty Resources, Inc.","(SRI) is a global sourcing and inventory management company for precision components &amp; specialty products such as precision machined components, stampings,..."
15,Funeral Attendant,Service Corporation International,"The Funeral Attendant will set-up and assist with viewings, funeral services, memorial services, etc. Performs a variety of tasks during funerals and..."
16,Sales Representative,Cantium Sports,ADVERTISING SALES - Connect Golf Courses &amp Local Businesses*. NO Florida state sales tax!*. Manage ad space &amp cost to meet sales goal*.…
4,ARCHITECT/ENGINEER EAS,United States Postal Service,"Knowledge of architecture, engineering, and building construction sufficient to review and inspect repair and alteration...."
8,Assistant Professor,Oklahoma State University,"Applicants must have an appropriate earned doctorate in accounting, demonstrate instructional excellence, and be committed to active engagement in the life of..."
7,Legal Analyst,CP Homes,"The role of the Legal Analyst is to support, manage and administer the day-to-day functions of a corporate legal department...."
12,AIRPORT SECURITY SCREENER,Covenant Services Worldwide,Security Screeners are responsible for day-to-day security screening of airport employees and other individuals passing through Screening Locations....
3,Support Technician,Verizon,Fiber Cust Support Analyst SI. The Fiber Customer Support Analyst will serve as the initial point of contact for provisioning and/or maintenance customer...
7,District Court Clerk II - O'ahu,Hawaii State Judiciary,Authors the official court record in a court of limited jurisdiction for District Court trial proceedings  Prepares documents ordered by the court
13,Bartender - Toms River Chili's,Chili's,"You know how to manage the back bar. Providing an enjoyable bar experience for every Guest. A duck walks into a bar and – oh, wait...."
20,Truck/Trailer Mechanic,Snider Fleet Solutions,Truck/Trailer mechanic skills:. Perform valve and injector overhead adjustments according to OEM procedures. We have an immediate opening for a *Tractor Trailer...
23,Surface Warfare Officer (Nuclear Aircraft Carriers),U.S. Navy,"Managing shipboard vertical launch systems. For those going the Surface Warfare Officer (Nuclear) route, the first step is Officer Candidate School (OCS) – a 12..."
10,EXERCISE PHYSIOLOGIST,Duke University and Duke University Health System,Master's degree in Exercise Physiology or Exercise Science. Clinical oversight regarding exercise for all patients at all risk levels....
12,Security Guard,Bannerman,"Bannerman is looking for professional security guards, and bouncers. Must be self disciplined with a high level of customer service and professionalism...."
4,Mechanical Design Engineer,Hydra-Electric Company,Formulate conceptual design of aeronautical or aerospace products or systems to meet customer requirements. The Candidate will be responsible for product design...
21,Plastics Mold Maker,TERMAX CORPORATION,"Craft precision tools by studying specifications, engineering blueprints, tool orders, and shop data to make, alter, or repair tools, jigs, fixtures, molds, or..."
9,Morning Show Host,"iHeartMedia, Inc.",Radio talk show host. 3+ years of on-air radio experience required. Serves as ambassador for the radio station(s) when out in public....
1,Advertising Project Manager,Innocean USA,The position requires a minimum of 5 years of well-rounded project management experience in advertising or a related business....
7,Legal Liaison,"Maricopa County, AZ",High School diploma or GED and two (2) years of clerical experience in a legal and/or law enforcement setting with knowledge in legal preparations and legal...
4,Mechanical Engineer,GENERAL ATOMICS,Works with multiple interdisciplinary groups to transition equipment and processes from an engineering stage to repeatable productionized processes....
13,Cook - Banquet Kitchen,Hilton Hotels & Resorts,Banquets and Catering. A Cook with Hilton Hotels and Resorts is responsible for preparing food items in accordance with recipes and established standards....
23,Range Operations Specialist (PD D1134000),Department of the Army,"Officer, Not to Exceed O-3/ CPT, Warrant, Enlisted. Small arms, mortars and field artillery rockets or cannons...."
15,Dog Walker/Pet Sitter,Tina Pet Services,"You have to love animals, and feel comfortable around them.:. First impressions are important, so be sure to let your personality come through in your initial..."
7,Paralegal Specialist,Department Of Justice,Specialized experience is defined as experience performing paralegal or legal work which demonstrates a basic knowledge of legal research and the ability to...
4,Architectural Drafter,Glen & Co Architecture,We are a dynamic architectural and design group working on hotels and restaurants looking for an architect who can prepare construction documents and...
5,Animal Care Supervisor,University of Colorado,"Animal Facility, implementing the animal care procedures and policies. Care for a variety of species of small laboratory animals used by scientists...."
3,Technology Support Specialist,City of Durham,"Database management experience; Maintains, administers, monitors, and supervises departmental software database and application; Monday-Friday 8 am - 4:30 pm;..."
23,Senior Analyst - Ground,Scientific Research Corporation,USA Warrant Officer MOS 140E - Air and Missile Defense Tactician / Technician. USA MOS Air Defense Artillery Officer with air operations center experience or....
13,Food Service Attendant,Riverside Health System,"Formal training as a cook preferred. Performs duties related to therapeutic diets and meal services to include, aides in the preparation of preparation of hot..."
19,Painter/Blaster,CTR Group,"CTR is currently seeking 1st class Painters Location - Pascagoula, MS Industry - Marine Responsibilities: • Perform blasting and painting utilizing marine"
11,Physical Therapy Aide,All Star Physical Therapy,Responsibilities include: setting up treatment areas cleaning up following treatment sessions aiding physical therapist during patient sessions Job Type:
