job_field_id,title,company,description
7,Law Clerk,Colorado Office of the State Court Administrator,"There is an immediate opening for a law clerk in the 19th Judicial District. Judicial Branch Overview. Responsibilities of this position include legal research,..."
23,Logistics Management Specialist,Department of the Air Force,"Determines type &amp; number of aircraft required for mission deployment/redeployment. Identifies problems/discrepancies to Logistics Officer, unit, &amp; higher..."
16,Cashier,Stores - Kmart Hourly,"Responsible for providing excellent customer service, efficiently and accurately completing sales and service transactions at the cash wraps, as well as handle..."
19,Maintenance Worker - Road Maintenance,"Collier County, FL","Performs light construction projects; Operates a variety of machinery, equipment, and tools associated with division projects, which may include a utility truck..."
14,Housekeeping Tech,Brentwood Behavioral Health of Louisiana,"Patients, staff and visitors. The Housekeeping Tech will ensure. The maintenance of a clean, healthy, pleasant environment for...."
16,Marketing & Sales Representative - Level 5,BOEING,We are engineers and technicians. Defense Systems Division Sales &amp Marketing team. This is a senior sales and marketing analyst position.…
18,Park Officer,State of Ohio,Major Worker Characteristics:. Applicants can view the status of this position by logging into their user profile on the Ohio Hiring Management System [OHMS]...
3,"Quality Assurance Automation Tester at Phoenix ,AZ, Local Preferred",West Coast Consulting LLC,"Hello, Kindly go through the requirement and let me know if you are comfortable with this requirement mentioned below. Job Title : Quality Assurance"
6,Counselor (K-8),Grambling State University,Teach school developmental guidance curriculum to students. Plan school guidance and counseling programs to ensure that they meet identified needs....
22,Transportation Helper,United Airlines,"Now taking off: Your career Where do you want your career to take you? Chances are you can get there with United Airlines. Our environment is open, honest,..."
10,Cardiology Test Nurse,Lifespan,Conforms to the Code of Professional Nurses. Graduate from an accredited School of Nursing with current license to practice as a Registered Nurse in the State...
13,Server Assistant / Busser /Food Runner,Royal Docks Brewing Company,"It’s a place where the welcome is a little warmer, the room is a little cozier, the barkeep is a little friendlier and the crowd is somehow a wee bit more..."
1,Marketing Science@Scale – Project Manager,Facebook,"The Marketing Science team is seeking a Project Manager who is passionate about making business operations, tools, and processes more efficient and effective...."
17,Administrative Secretary RB # 15 - 102,Buffalo Public Schools,"Administrative Secretary – Permanent. The Administrative Secretary performs a wide variety of complex responsible clerical, secretarial and administrative tasks..."
10,Staff Nurse,South Shore Medical Center,Provide quality care to South Shore Medical Center patients. Administer prescribed medications and treatments. Prepare patient for office visit. Respond to
8,Assistant Teaching Professor,Worcester Polytechnic Institute,"The Mathematical Sciences Department currently has 28 tenured/tenure-track faculty members, 9 postdoctoral scholars, 5 teaching professors and features a..."
16,Customer Service Representative,We Insure Group,Our agents have access to over 100 Top Partner Companies and one of the best service and support personnel in the business....
8,Librarian/Archivst - Part Time,Native Hawaiian Veterans,"Native Hawaiian Veterans, LLC is a Native Hawaiian Owned, Service Disabled Veterans Owned Small Business (SDVOSB), SDB, SBA 8(a), MBE, UDBE, and EEO/W/M/Vet"
16,Sales Representative - Worcester,Commonwealth of Massachusetts,Instruct Sales Agents on the use of successful marketing and sales techniques. Provide motivation to Sales Agents and recommends incentive plans intended to...
23,Air Defense Artillery Officer (14A),U.S. Army,Job training for an air defense artillery officer includes completion of the Air Defense Artillery Officer Basic Course....
16,Cashier / Server Immediate Openings Available,Louis Pappas Fresh Greek,"Here are some keys to being a successful Cashier with us:. McMullen Booth Rd Clearwater, FL 33761, Monday through Friday from 3pm - 5pm...."
18,FORESTRY TECHNICIAN (TIMBER STAND IMPROVEMENT),Department Of Agriculture,USDA Forest Service. Forest Service Day Care facilities are not available. A career with the Forest Service will challenge you to manage and care for more than...
10,Medical Reviewer LPN,"Blue Cross Blue Shield of IL, MT, NM, OK & TX","3 years clinical experience in physician office, hospital or surgical setting. This position is responsible for pre-authorization reviews in accordance with the..."
20,Auto Glass Installer,Luther Automotive,"At least 1 year of mobile auto glass experience required. Install windshields in shop and mobile, perform rock chip repairs and pull and reinstall glass for the..."
8,7th & 8th Grade Social Studies Long Term Substitute Teacher,Willamette Leadership Academy,"We are looking for a dynamic and passionate social studies teacher to teach two periods of 8th grade US History, 2 periods of 7th grade Intro to Western..."
6,"Staff Therapist, Addictions Program",Chase Brexton Health Care,"Must have the ability to provide services that are relevant to the culture of the patient and their family. Provides a range of brief and longer-term, treatment..."
23,Field Artillery Officer (13A),U.S. Army,Job training for a field artillery officer requires completion of Basic Officer Leaders Course I &amp II and the Field Artillery Officer Basic Course.…
6,Spiritual Counselor,UPMC,"Knowledge of spiritual effects of terminal illness, grief, and loss. The hospice spiritual counselor provides counseling and guidance to patients, families and..."
12,Animal Control Officer,"City of Springfield, MO",Animal Control collaborates with many other community groups involved in animal welfare. Springfield Animal Control Officers enforce the ordinances of the city...
1,Advertising Project Manager,Innocean USA,Project Manager may support projects for Innocean projects across all U.S. The Project Manager may also lead process improvement initiatives assigned by the...
18,Mine Safety and Health Inspector (Coal),Department Of Labor,This position has promotion potential to GS-12 for Underground and Electrical Inspectors and the GS-11 for Surface Inspectors....
16,Sales Associate/Cashier (part-time),Bed Bath & Beyond,Currently hiring part time sales / cashiers / stock associates and bridal consultants. All shifts available....
23,Flight Support,U.S. Navy,"Operate and maintain hydraulic and steam catapults to launch aircraft. As an Officer, you can expect to:. Instead, she refuels fighter jets on aircraft carriers..."
9,Full Time Artist,Lisa Frank Inc,"When you were growing up, did all your school supplies HAVE to be Lisa Frank? Are you creative, energetic, and hardworking? This might be the job for you!"
11,Rehab Aide,Accelerated Rehabilitation Centers,Previous Clinical Aide experience preferred. The Rehabilitation Aide will assist the Office Coordinator and clinician by performing requested administrative and...
22,Hiring CDL-A Drivers for L/P,Network 1,"No commercial transportation related felony, theft or larceny conviction. LEASE OPERATORS NEEDED NOW!!*...."
