job_field_id,title,company,description
16,PT Sales Associate,Food Lion,"Responsible for maintaining standards according to the Front End Standard Practice Manual, maximizing sales through excellent customer service and minimizing..."
20,Plant Maintenance Mechanic - Night Shift,Vulcan Materials Company," Diagnose problems and perform mechanical repair. Assists plant personnel with repair and maintenance. Mechanical repairs to various types of crushers, screens..."
6,FAMILY COURT COUNSELOR,"Dallas County, TX","Must be independently licensed in the State of Texas as a Licensed Professional Counselor (LPC), Licensed Marriage and Family Therapist (LMFT), Licensed Master..."
20,Lead Technician,ServiceMaster by Simmons,Valid Driver’s license. Responds to emergency mitigation calls driving company vehicle to job site....
12,AIRPORT SECURITY SCREENER,Covenant Services Worldwide,Security Screeners are responsible for day-to-day security screening of airport employees and other individuals passing through Screening Locations....
1,"Senior Marketing Campaigns Manager, North America Hardware Marketing",Oracle,"Senior Marketing Campaigns Manager, North America Hardware Marketing. This will include demand generation, brand awareness, events, field marketing, web/online..."
14,Pest Route Technician,Ecolab,"Previous pest elimination industry or route experience preferred &quot;Certified Pest Control Technician, Commercial Pest Control Technician, Exterminator, Pest..."
3,Jr Systems Administrator,City of Rifle,"Systems Administrator, Full-time, 4 year degree required. This position will assists the Systems Administrator in the support of services provided to the user..."
3,SQL Application Developer - IS Analyst,NewYork-Presbyterian/Columbia University Medical Center,"Advanced proficiency in programming languages (Visual Basic, C, C++, C#, Perl, Java), Applications (Healthcare IS, Allscripts SCM, Enterprise) and/or Database..."
20,Diesel Mechanic/Technician III – PART TIME (PB),Penske,"A valid driver’s license is required, and, must either possess a CDL or have the ability to obtain a CDL license required...."
23,Surface Warfare Officer (Nuclear Aircraft Carriers),U.S. Navy,"Managing shipboard vertical launch systems. For those going the Surface Warfare Officer (Nuclear) route, the first step is Officer Candidate School (OCS) – a 12..."
20,Cabling Tech/WAP Installer,Airlie,"Must have own tools. Low voltage cabling contractor needed. Experience with installation of copper voice , data cable and Wireless Access Point installs...."
23,Range Operations Specialist (PD D1134000),Department of the Army,"Officer, Not to Exceed O-3/ CPT, Warrant, Enlisted. Small arms, mortars and field artillery rockets or cannons...."
6,Elementary Counselor 846 (2016-2017),"Kansas City, MO School District","The elementary counselor is a member of the district’s guidance function, charged with providing a comprehensive guidance program for students in grades K-6...."
13,Bartender,Longhorn Steakhouse,"Helping guests be aware of and choose menu items, taking orders and making guests feel taken care of during their visit...."
22,CDL-A Company Truck Drivers,Purdy Brothers Trucking,We offer a better driving career by asking YOU what you need and then doing whatever we can to meet those needs....
9,Visual Associate,Stage Stores,"Implement all major floor moves in quarterly floor plans. Maintain all visual elements (signs, mannequins, collateral, door signs, banners, etc.)...."
11,Health Care Assistant or Bilingual Health Care Assitant - LVN,Hanford Elementary School District,HEALTH CARE ASSISTANT. Certified Nursing Assistant (C.N.A.). See Health Care Assistant Job Description. Addendum to Health Care Assistant Job Description....
11,CNA-Tele/MedSurg Unit-Full Time-Nights,Fauquier Health System,Virginia State Certified Nursing Assistant License. The Certified Nursing Assistant assists with patient care throughout nursing areas under the direction of...
3,Senior Intelligence Technican Associate,Raytheon,Possess a valid driver license for delivering records using government transportation within WMA. Give presentations to visitors as required....
13,Pizza Hut Team Member,Pizza Hut,"It’s about being independent and having fun, making new friends and earning extra cash. And you’re at least 16 years old – 18 if you want to be a driver...."
22,PT Produce Associate,Food Lion,"Ability to analyze situations, identify problems and implement solutions. Ability to complete Computer Based Training (CBT) and Training Aid courses...."
20,Chrysler Certified Automotive Technician,SAFFORD AUTOMOTIVE GROUP,"The technician must understand, stays abreast of, and comply with federal, state, and local regulations such as hazardous waste disposal, OSHA Right-to-Know,..."
23,Field Artillery Officer (13A),U.S. Army,Job training for a field artillery officer requires completion of Basic Officer Leaders Course I &amp II and the Field Artillery Officer Basic Course.…
16,AP Clerk,Sheehy Auto Stores,"All applicants must have the ability to pass pre-employment testing to include background checks, MVR, drug test, and valid driver's license...."
17,Receptionist/Office Assistant,Countryside Family Practice,"Busy medical practice in Marshall, Virginia seeking full-time front office receptionist. To apply, contact Linda Spencer, Practice Administrator at email..."
10,Veterinary Technician,Middleburg Humane Foundation,Veterinary Technician will be responsible for overseeing medical care of shelter animals. PT Veterinary Technician/Assistant (license preferred) needed at the...
11,"MEDICAL ASSISTANT CLINIC- INOVA Cardiology Warrenton, VA",Inova Fairfax Hospital,Answering calls and providing pertinent information. Fulfills clerical responsibilities as assigned which may include:....
9,Head JV Boys Basketball Coach,Highland School,"A VISAA Division 2 Private High School, competing in the Delaney Athletic Conference (DAC). Lead the JV Boys Basketball Program at Highland School in Warrenton,..."
13,Full Time Cake Decorator-Northrock Shopping Center,Harris Teeter,"Technical Skills - Assesses own strengths and weaknesses; Answer telephones by saying &quot;Harris Teeter [store name], this is [name], may I help you?&quot;...."
4,ARCHITECT/ENGINEER EAS,United States Postal Service,"Knowledge of architecture, engineering, and building construction sufficient to review and inspect repair and alteration...."
1,Assistant Restaurant Manager,Dunkin' Donuts,Holds the guest as their highest priority and role models exceptional guest service. Manages cash over/short through effective cash control procedures....
16,Customer Service Associate,Wawa,Comply with federal and state laws by requesting personal identification from customers who are purchasing tobacco and/or alcohol....
20,General Service Technician,Merchants Tire,"Valid Drivers License. Required license or certification:. Possession of a valid motor vehicle license. The General Service Technician also unloads, checks-in..."
5,Biologist,Department Of Agriculture,"Participates as a team member, while also training, mentoring, and setting work priorities for a fluctuating team of Biological Science Technicians, students,..."
20,Service Technician (Mechanic),"Franklin Equipment, LLC","The individual will maintain and repair equipment offered by Franklin Equipment to include Construction and Agricultural (small equipment, aerial, dirt, farm,..."
21,Blow Mold Machine Operator,Consolidated Container Company,"Blow Mold Machine Operators report directly to Maintenance/ Production Manager. The Blow Mold Machine Operator will operate blow-mold, grinders, trimmer..."
13,Restaurant Manager,Ashby Inn & Restaurant,"Fauquier County high-end restaurant, seeks professional restaurant/front-of-the-house manager. The right applicant must be tactful;..."
10,Dental Assistant,Smile Time Kids,"We are opening our pediatric practice in Richmond, IN in April 2016. We are looking for dental assistants(part time) and business assistants(full time)...."
13,Food Service Attendant,Riverside Health System,"Formal training as a cook preferred. Performs duties related to therapeutic diets and meal services to include, aides in the preparation of preparation of hot..."
1,District Executive,Boy Scouts of America,Achieve net income and participation objectives for assigned camps and activities. Bachelor's degree from an accredited college or university (transcript with...
18,FORESTRY TECHNICIAN (TIMBER STAND IMPROVEMENT),Department Of Agriculture,USDA Forest Service. Forest Service Day Care facilities are not available. A career with the Forest Service will challenge you to manage and care for more than...
5,Animal Care Supervisor,University of Colorado,"Animal Facility, implementing the animal care procedures and policies. Care for a variety of species of small laboratory animals used by scientists...."
15,nanny,Ashlea H.,"My 3 children (Girl -11, Girl-9, Boy-7) are in need of a nanny as their current one is headed off to college. My son is often headed to soccer practice...."
10,Nursing Supervisor-FHRNC-Full Time Evenings-Mon-Fri,Fauquier Health System,Current Virginia State RN License. The Nursing Supervisor provides direction and supervision to staff to ascertain delivery of effective high quality patient...
10,Telemedicine Physician,"MeMD, Inc.",MeMD is seeking a Board-Certified Physician possessing a Florida medical license that is interested in joining our team of Telemedicine Providers....
22,Class A CDL Company Truck Driver (Teams),Super Service,"Super Service has dedicated team truck driving jobs available for drivers who live within a 50 mile radius of Tupelo, MS, Georgetown, KY, and San Antonio and..."
8,Librarian/Archivst - Part Time,Native Hawaiian Veterans,"Native Hawaiian Veterans, LLC is a Native Hawaiian Owned, Service Disabled Veterans Owned Small Business (SDVOSB), SDB, SBA 8(a), MBE, UDBE, and EEO/W/M/Vet"
14,Landscape and garden maintenance worker,Lawn Love,\*You must have at least one year of professional lawn care experience. \*You must have all the equipment needed to perform a full lawn care service....
13,Server Assistant / Busser /Food Runner,Royal Docks Brewing Company,"It’s a place where the welcome is a little warmer, the room is a little cozier, the barkeep is a little friendlier and the crowd is somehow a wee bit more..."
12,SHERIFF - DEPUTY SHERIFF,"Hidalgo County, TX","Serve as a bailiff in county and district courts. May be assigned to patrol, narcotics, civil process, warrants, courthouse security, criminal investigation or..."
1,Advertising Project Manager,Innocean USA,Project Manager may support projects for Innocean projects across all U.S. The Project Manager may also lead process improvement initiatives assigned by the...
5,Chemistry Technician - Life Sciences,Xylem,"Xylem’s analytics businesses are leading manufacturers of premium field, portable, laboratory and online analytical instruments used in water and wastewater,..."
13,Dishwasher and Busser,Jefferson Manor Health & Rehab,This is a full time dishwasher position in a nursing home facility. Prior experience preferred but not required....
14,Maintenance,McDonalds,"A self starting individual in charge of general cleanliness of the restaurant, to include windows, floors, restrooms, dining room, parking lot, filtering vats..."
8,Summer Technology Camp Staff - Lead & Assistant Instructors,Black Rocket Productions,"We have multiple locations in over 30 state states! Are you passionate about Video Games, App Design, Digital Movies, Robotics, or STEM?..."
13,Banquet Chef/Line Cook,Golf Course North Houston,"Preferred Banquet experience but not required. All kitchen staff must be able to cook high-quality balanced meals, cook from scratch and maintain proper food..."
3,Information Systems Security Analyst,TASC,"Must be familiar with NIST Certification &amp; Accreditation (C&amp;A) processes, NIST policies and documents, NIST Risk Management Framework, Federal Information..."
10,"Technician, Surgical Services-PRN",Fauquier Health System,Completed a formal Surgical Technician program with certification or equivalent training. The Surgical Services Technician assists with the total care given by...
16,Warrenton - Sprint Store by Adcomm Digitel Wireless Retail Sales Associate,Sprint Store by Adcomm Digitel,Making outgoing calls to warm leads representing companies and individuals in the area. The Retail Sales Consultant will help to build business and develop....
10,Surgical Technologist - Operating Room (OR),Accountable Healthcare Staffing,"Certified Surgical Tech needed; Operating Room Tech. Will work 4 ten hour weekdays with on-call evenings, weekends, holidays;..."
13,Pizza Hut Delivery Driver,Pizza Hut,"You’ll also need a valid driver’s license, insurance and reliable vehicle. That’s right, we’ll pay you to cruise around in your mobile office – your car –..."
16,Cashier,The Home Depot,"They provide first level escalation for customer issues and assist in the supervision, coaching and training of other Front End Associates by participating in..."
10,Cardiologist,U.S. Navy Reserve,*Cardiologist NEEDED* for part-time in Navy Reserve! Currently *1 position* open Nationwide! Your Benefits: * $75K Sign-on Bonus * All pay and allowances of
16,Sales Assistant - Northrock Shopping Center,Jos. A Bank,"Properly and accurately operate and capture customer information, including e-mail addresses, in the point-of-sale register system.Comply with all procedures..."
16,Retail Merchandiser - Warrenton/Culpeper/Marshall - VA,The Pet Firm,"Attend training calls; Implement and reset planograms, test planograms, IRC's point of sale materials,. Our expertise in the pet industry gives our vendor..."
17,Administrative Secretary RB # 15 - 102,Buffalo Public Schools,"Administrative Secretary – Permanent. The Administrative Secretary performs a wide variety of complex responsible clerical, secretarial and administrative tasks..."
2,Insurance and Financial Services Position - State Farm Agent Team Member (Sales experience preferred),Charles Robinson - State Farm Agent,"As a State Farm team member for Charles Robinson - State Farm Agent, you will build and develop customer relationships within the community to promote State..."
1,Restaurant Assistant General Manager - Taco Bell,BurgerBusters Inc,"Valid Drivers' License. You also assist the RGM with facility maintenance, finding, hiring and developing great Team Members and Shift Leads and making sure..."
17,Retail Store Shift Supervisor,CVS Health,Ensure compliance with all company policies and procedures (such as cash management) and federal and state....
1,Part time shift manager,Vocelli pizza,Must available to work two days a week 11am -10 pm. Answer phone calls and take orders and check out pick up customer. Help in the kitchen with the cook....
13,Crew,Dunkin' Donuts,Acknowledges all guests with a friendly smile and is highly responsive to needs and special requests. Issues a receipt with each order to provide guests with an...
10,Medical Reviewer LPN,"Blue Cross Blue Shield of IL, MT, NM, OK & TX","3 years clinical experience in physician office, hospital or surgical setting. This position is responsible for pre-authorization reviews in accordance with the..."
22,Bus Aide,Fauquier County Public Schools,Provides help to the school bus driver in maintaining discipline. Assists driver in preparing for and performing periodic emergency bus evacuation drills
17,Night Auditor,Poplar Springs Inn & Spa,"Night Audit, Front Desk:. Poplar Springs Inn &amp; Spa is looking for a dedicated individual to perform the tasks and duties of a Night Auditor...."
2,Marketing Internship Latin America,Cosmetics of France,Provide customer service to the agent zone in terms of material &amp information needed for events trough com. Consolidate and update the Local Makeup Experts &amp
3,Hadoop Administrator,General Dynamics Information Technology,"Bachelors Degree in Computer Science or a related technical discipline, or the equivalent combination of education, technical certifications or training, or..."
5,Veterinary Medical Officer,Department Of Agriculture,"Masters degree in an area of specialization, including but not limited to, animal science, avian medicine, food safety, infectious diseases, veterinary clinical..."
16,LEAD SALES ASSOC-PT,Dollar General,Operate cash register and flatbed scanner to itemize and total customer's purchase
17,Retail Banker/ Teller - Center,Woodforest National Bank,"WOODFOREST NATIONAL BANK. Performs opening, closing, and other branch servicing duties such as cash and vault balancing;..."
3,"Quality Assurance Automation Tester at Phoenix ,AZ, Local Preferred",West Coast Consulting LLC,"Hello, Kindly go through the requirement and let me know if you are comfortable with this requirement mentioned below. Job Title : Quality Assurance"
16,VA Assistant Store Manager,Family Dollar,"Assists Store Manager in ordering merchandise and record keeping to include payroll, scheduling and cash register deposits and receipts...."
2,Athletics Business Manager,University of Indianapolis,"Interpersonal skills to work with internal groups (coaches, students-athletes, faculty, and staff) as well as external groups (officials, bus and rental car..."
21,Tailor - Northrock Shopping Center,Jos. A Bank,Listen to the wants and requests of the customer and answer the customer’s questions.Communicate to the customer and/or sales executive in a professional manner...
10,Registered Dietitian,Blue Ridge Orthopaedic & Spine Center,"Assessing patient’s nutritional status and provide appropriate education and information in order to promote disease or condition control/prevention, provide..."
16,Detailer,Frito Lay,The Part-Time Detailer is a part-time position that is responsible for merchandising Frito-Lay's complete line of quality products to existing accounts while...
17,Inpatient Medical Records Coder II-Part Time,Fauquier Health System,"Registered Health Information Administrator certification(RHIA), or Registered Health Information Technician certification(RHIT), or Certified Coding Specialist..."
13,Line Cook,Longhorn Steakhouse,"Work in a team-oriented, high-volume, fast-paced, guest-centric environment to deliver Genuine Western Hospitality to our guests by:...."
20,Mechanic Helper,Pace Bus,Qualified candidate must possess at least one (1) years previous diesel/gas experience and/or technical training and meet the criteria of Pace's Mechanic...
14,"Custodian Part-Time (Warrenton, VA 20187)",Children of America,"Meets state age requirement. As a Leader is child care, Children of America's commitment is to provide a safe, and sanitary environment for all Children in our..."
11,DENTAL ASSISTANT,Department of Veterans Affairs,Dental Assistant/ Functional Statement. Sets up operatory for planned dental procedure and cleans dental unit for timely turnover....
21,"Machine Operator-Remington, Virginia",U.S. Pipe,Must have at least one to three years of previous fabrication or manufacturing assembly or production work experience in a fast paced manufacturing or...
17,Bookkeeping Clerk,John Q. Hammons Hotels & Resorts,"Must have 1-2 years in accounting , customer service and/or bookkeeping experience or equivalent. Perform any combination of routine calculating, posting, and..."
14,Custodian,Fauquier County Public Schools,"Checks play areas and around school building for trash, debris or hazards. Delivers copy paper to rooms. Empties trash receptacles and deposits collected refuse..."
19,Maintenance Worker - Road Maintenance,"Collier County, FL","Performs light construction projects; Operates a variety of machinery, equipment, and tools associated with division projects, which may include a utility truck..."
14,Residential Lawn Specialist 100889,TruGreen,As a Lawn Specialist with the #1 lawn care company you will be providing regularly scheduled landscape services within your route on a daily basis....
2,Entry Level Quality Assurance Analyst,National Software Management,"*Entry Level Quality Assurance Analyst* Under direct supervision, the Quality Assurance Analyst verifies that software changes submitted by developers"
21,Sewing Machine Operator,"DI, LLC","This individual will operate machines that are either single or double needle, perform blind stitch, serge, or other specialized operations...."
17,Shift Supervisor (US),Starbucks,Follows all cash management and cash register policies and ensures proper cash management practices are followed by shift team....
6,Social Worker-MSW-PRN Weekday & Weekends,Fauquier Health System,Masters of Science in Social Work. Experience in health–related field or setting. The Social Worker-MSW provides general social work services and participates...
10,Family Practitioner,Fauquier Health System,Family Practitioner to provide the full spectrum of primary care. This position is for a BC/BEFamily Practitioner to join an outpatient-only practice with
3,"Network Deployment and Operations (NDO) Lead, Google Fiber, Midwest",Google,"Familiarity with other network transmission protocols and in-home network architecture. Ensure the best local network is designed, built, and maintained with..."
13,Bartender - Toms River Chili's,Chili's,"You know how to manage the back bar. Providing an enjoyable bar experience for every Guest. A duck walks into a bar and – oh, wait...."
11,CNA-FHRNC-Full Time-Evenings,Fauquier Health System,Certified Nursing Assistant License. The Certified Nursing Assistant assists with patient care throughout nursing areas under the direction of licensed...
2,Small Business Specialist II,BB&T,"Possess an understanding of major technical aspects of small business underwriting, loan structure and deposits, and have a clear understanding of credit and..."
22,Flatbed Company Driver - CDL-A,P & S Transportation,"Drivers must also have a current CDL-A license. Life Insurance/$10,000 policy at no charge to the driver. P&amp;S drivers must be at least 23 years old with at..."
8,Substitute,Bright Horizons Family Solutions,"Individual state and center requirements may apply. Bright Horizons offers an excellent benefits package including a competitive salary, career path..."
17,020 - 5600 - OFFICE ASSISTANT,Harris Teeter,"New hire orientation, customer service network, safety, customer service clerk technical skills, floor monitor technical skills...."
2,Senior Staff Accountant,MFA Oil Co.,Summary of Responsibilities: Job Responsibilities include but are not limited to: Ensuring the integrity of the general ledger and financial statements
7,Legal Assistant,"Warrenton, Virginia Law Firm","Case management and litigation support, preparation of trial exhibits; Drafting basic legal documents, cite checking and proofreading court pleadings...."
13,Crew Person,McDonalds,"Greeting customers with a smile. It's time you worked for someone who will give you the tools to learn, grow and be what you want to be - both personally and..."
1,Advertising Project Manager,Innocean USA,The position requires a minimum of 5 years of well-rounded project management experience in advertising or a related business....
16,Part-Time Teller - Northrock Shopping Center,Capital One,Live the company values of Excellence and Do the Right Thing - Act as a Customer Advocate - Take an active role in educating customers on other banking channel...
17,Clinical & Secretarial Services Technician-ER-Part Time-Days,Fauquier Health System,"The Clinical &amp; Secretarial Services Technician also coordinates the activities of the department through communication, requisitioning and management of..."
17,"Warrenton, VA - Furniture Assembler/Merchandiser",Spar Business Services,"Required license or certification:. As an Independent Contractor with SPAR Business Services, Inc. Have own tools...."
13,Bar Manager/Bartender,Poplar Springs Inn and Spa,"Fantastic oppurtunity to progress within the company. To oversee, maintain and elevate the bar and lounge to the high end status it is to further heights...."
1,Proposal and Marketing Manager,Eat'n Park Hospitality Group,Marketing and digital marketing. Effective marketing materials. Marketing promotions that strengthen client. Create marketing campaigns and collaterals to....
16,Cashier,Stores - Kmart Hourly,"Responsible for providing excellent customer service, efficiently and accurately completing sales and service transactions at the cash wraps, as well as handle..."
10,Hospitalist- NP/PA,Virginia Emergency Medicine Associates,A minimum of one year of post-grad clinical experience in hospital medicine• Valid Virginia license • Current ACLS/BLS certificates through AHA• Ability to...
17,Teller,The Fauquier Bank,"Accepts deposits, loan payments, credit card deposits and payments. Job requires a higher level of problem solving abilities to find solutions to difficult..."
22,CDL-A Company Truck Drivers,Mesilla Valley Transportation East,"Mesilla Valley Transportation, a 48-state motor carrier, is now hiring company truck driving teams for OTR, Shuttle and Super Local runs...."
13,Cook-Full-Time-Hours Evenings 12p-8p,Fauquier Health System,Ability to perform complex math calculations and verify cash handling and reporting. The Cook prepares food items needed for meal service using institutional...
17,LPNs and RNs Needed!,WRB Communications,Active LPN/ RN license. Our LPN/ RN Communicators will take calls from consumers and health care providers and document product complaints or adverse events...
22,Part Time Produce Clerk North Rock,Harris Teeter,"While performing the duties of this job, the associate constantly works in a cool environment with an average temperature range of 55-60 degrees Fahrenheit and..."
