job_field_id,title,company,description
8,Tutor or Teacher - Elementary Math,,"We are looking for math tutoring for our 4th grader. Improve grades, get ahead and increase confidence. Elementary math Tutoring &amp; Teaching opportunities..."
19,Drywall Hanger/Installer,EncoreHR Staffing,"Includes lathers who fasten wooden, metal, or rockboard lath to walls, ceilings or partitions of buildings to provide support base for plaster, fire-proofing,..."
6,Senior Addiction Counselor,NYC Health + Hospitals,The Senior Addiction Counselor will be responsible for assisting the consumer with activities relevant to an individual's rehabilitation goals....
3,Data Scientist,Humana,"Bachelor’s Degree in Mathematics, Computer Science, Actuarial Science or related field. Collaborate with other professionals including Actuaries, Mathematicians..."
12,Transportation Security Officer (TSO),Trinity Technology Group,TSOs must take the computerized Screener Assessment Battery. Repeatedly lift and carry baggage weighing up to 70 pounds…
16,Digital Sales Account Executive,The Morning Call Media Group,"Manages advertising sales revenue and account management targets. Our digital sales account executives are responsible for selling advertising banners, programs..."
4,Mid-Level Ground Control Station Engineer,GENERAL ATOMICS,Job ID# 6452BR Company General Atomics Aeronautical Systems Title Mid-Level Ground Control Station Engineer Job Category Engineering City San Diego State...
5,NATURAL RESOURCES PROGRAM TECHNICIAN,Arkansas Game & Fish Commission,"Knowledge of agricultural methods and basic land laws. Conducts agricultural and forest management activities on wildlife management areas, including preparing..."
17,Telephone Operator,The Broadmoor,"Monitors 911 Alert System. Operates the switchboard to relay incoming, outgoing, and interoffice calls by performing the following duties:...."
9,Graphic Artist,IGT,"Maya, Autodesk 3D Studio Max). This position is the development and timely delivery of high quality 2D and 3D game...."
20,HVAC Installer/Technician,Express Air Sytems,Basic knowledge of standard code requirements of air conditioning systems. \*\*\*\*\*Minimum requirements for Installers\*\*\*\*\*....
23,"Analyst, Operations",General Dynamics Information Technology,Extended Air Defense Simulation (EADSIM). Battle Command Sustainment Support System (BCS3). Air and Missile Defense Work Station (AMDWS)....
1,Regional Marketing Manager,Vishay,Develops a formal marketing plan outlining an appropriate marketing strategy for selling to key accounts. Coordinates the marketing efforts for a product group....
15,Lobby Concierge,Beach Activities of Maui,"The Concierge is knowledgeable about the local area and is the expert on the attractions, tours and activities that we sell.Must be flexible with scheduling and..."
22,Air Traffic Control Operator,National Guard,The skills you learn as an Air Traffic Control Operator will qualify you to work in civilian air traffic control towers and centers at airports and airfields....
11,2 Med/Peds Certified Nursing Assistant,Riverside Medical Center,Reports changes in patients' condition to the professional nurse. The 2 Med/Peds Certified Nursing Assitant (CNA) assists with the care of patients ranging from...
10,Anesthesiologist,"UF, Department of Anesthesiology","Department anesthesiologists practice at UF Health hospitals in Gainesville, FL at the University of Florida alongside 62 faculty anesthesiologists, 78..."
13,Kitchen Cook,SMG World - Tucson Convention Center,Banquet facility preparing meals for large events:. Fulfilling the service per each Banquet Event Orders (BEO)....
7,Administrative Law Judge,New Mexico State Personnel Office,"Administrative Law Judge, Adjudicator Advanced. This position will conduct administrative hearings on behalf of the State Personnel Board concerning..."
14,Janitor - Cleaning Technician - FULL TIME - 84095,Wingfoot Services,"Janitorial, janitor, cleaning specialist, carpet cleaning, floor care technician, buffing, part time, supplemental income, laborers, landscaping, supervisor,..."
18,Agricultural & Standards Inspector - I,Placer County,"Recruitments for Agricultural and Standards Inspector I, Agricultural and Standards Inspector II, and Agricultural and Standards Inspector, Senior are being..."
2,Cost Accountant III,Weatherford,JOB DESCRIPTION JOB SCOPE: This position will be responsible for the day to day understanding of the plant’s financial performance. The position will also be
21,Production Operator - 2nd shift,Bostik Inc.,About Bostik - Smart Adhesives. As a production operator at Bostik you will be in a batch making/mixer operator position for a competitive manufacturing...
16,Salesperson,Sheetz,"Ring accurate register transactions. The perfect fit for our Sheetz team would be someone who is people oriented, self-motivated, dependable, able to work..."
10,"Optometrist needed in Fauquier County, VA",ETS Vision,Licensed in VA. Beautiful region less than an hour from the DC area- lower cost of living and far less traffic hassles....
2,"Commercial Account Manager - Bealeton, VA",Advance Auto Parts,"Valid Drivers License and ability to meet our MVR Requirements. State of the Art Technology- laptop, CRM software, BlackBerry...."
16,PT Grocery Associate,Food Lion,Provide quality customer service to our customers through the Grocery Department. Engage and interact with customers to create a positive shopping experience....
2,Seasonal Tax Preparer,Jackson Hewitt,"Jackson Hewitt is seeking a seasonal Tax Preparer to perform a variety of activities related to income tax preparation, sales and the delivery of excellent..."
16,Sales Associate,Lands' End,"Including courteously, conversationally greeting customers, adjusting individual customer attention based on store traffic, suggesting solutions based on..."
8,Adjunct Instructor- Computer Science,Lord Fairfax Community College,Master's degree in Computer Science or Computer Engineering from an accredited college/university. The Computer Science Department is seeking qualified...
23,Senior Analyst - Ground,Scientific Research Corporation,USA Warrant Officer MOS 140E - Air and Missile Defense Tactician / Technician. USA MOS Air Defense Artillery Officer with air operations center experience or....
14,Maintenance Worker II - PUBLIC WORKS,City of Port Orange,Clean grounds and remove litter. Experience in operating automotive or maintenance equipment. Provide routine and basic maintenance and repair to small...
3,Senior II Security Analyst,Kforce,"Engineering, Math, or Science degree or equivalent. Contractor counterpart to FAA cyber operations manager...."
20,"Automotive Body Repairer, Fiberglass/Welder",The Logistics Company,The Repairer applies and spreads body filler manually to reestablish surface. Two years related experience. The Automobile Body Repairer mixes polyester resin...
13,Pizza Hut Delivery Driver,Pizza Hut,"You’ll also need a valid driver’s license, insurance and reliable vehicle. That’s right, we’ll pay you to cruise around in your mobile office – your car –..."
10,Telemedicine Physician,"MeMD, Inc.",MeMD is seeking a Board-Certified Physician possessing a Florida medical license that is interested in joining our team of Telemedicine Providers....
3,"(CSITO) Close Support/Systems Administrator - Warrenton, VA Job",CACI International Inc,"Answer users' inquiries regarding computer software and hardware operation to resolve problems, including requirements originating from a field location...."
15,Beauty Artist,Benefit Cosmetics,Essential Duties and Responsibilities -Customer Service- · Customer is the number one focus · Greet customers in 30 seconds or less · Follow the 8 Step
17,Receptionist/Office Assistant,Countryside Family Practice,"Busy medical practice in Marshall, Virginia seeking full-time front office receptionist. To apply, contact Linda Spencer, Practice Administrator at email..."
13,Restaurant Manager,Denny's-Little Apple Properties,"Must have the ability to work a flexible and-or irregular schedule. Individual will manage a sit-down restaurant wit daily operations including recruiting,..."
22,CDL-A Refriegerated OTR Company Truck Driver,J.S. Helwig & Son,Minimum age 25 years Valid commercial license Safe driving record meeting our minimum requirements One (1) year verifiable over the road experience in the past...
9,Actor/Actress,Nine30 Media,"We are looking for actors to become a member of our marketing team. Our ideal candidates would have a strong portfolio, a heavy social media presence, and a..."
12,Surveillance Officer Full Time,Harrah's Ak-Chin,"The Surveillance Officer assures the overall safety of guests, employees and the property as a whole. Conducts surveillance observation on designated areas both..."
6,Staff Development Coordinator,Sayre Christain Village,"Conductscertification or training programs for Nursing Assistants. Frequentlycommunicates with employees, residents, family members, physicians etc...."
3,Information Sec Spec,"Greystone & Co., Inc.","IT related college degree, technical school degree, or Microsoft certification such as MCSE, MCITP, etc...."
1,Practice Manager,HCI-EBS,Design and implementation of a strategic marketing program. Candidates are expected to be comfortable acting as a managerial liaison between physician and staff...
18,Forestry Technician (Lookout),Department Of Agriculture,Workers Compensation Separation:. A career with the Forest Service will challenge you to manage and care for more than 193 million acres of our nation's most...
13,Food Service Worker,TrustHouse Service Group,"Such as tray line, dish room, cafeteria and storeroom. The Food Service Worker is responsible for routine food service tasks in the kitchen, cafeteria, dining..."
18,Climbers,Bartlett Tree Experts,Having a CDL is a big plus!! Great Benefits and competitive compensation AND we will assist with relocation for the right candidates!!...
12,Police Officer,Lord Fairfax Community College,Applicants must be able to successfully qualify with the service weapon (initially and annually) and possess a valid Virginia driver's license with an...
13,Expeditor,Potomac Family Dining,"As an Expeditor, you will be responsible for coordination and consolidation of all outgoing food items from the kitchen assuring high standards of plate..."
18,Wood Mill Operator 2,The AMES Companies,"The Wood Mill Operator 2 works under supervision of foreman encompassing the skills of Equalizer, Paint Line Operator, Stacker and Inspector...."
13,Pizza Hut Team Member,Pizza Hut,"It’s about being independent and having fun, making new friends and earning extra cash. And you’re at least 16 years old – 18 if you want to be a driver...."
8,Librarian/Archivst - Part Time,Native Hawaiian Veterans,"Native Hawaiian Veterans, LLC is a Native Hawaiian Owned, Service Disabled Veterans Owned Small Business (SDVOSB), SDB, SBA 8(a), MBE, UDBE, and EEO/W/M/Vet"
1,Assistant Project Manager,Bohler Engineering,"Local Professional Engineer License, majority of work experience conducted in the local area. Design of Utility Systems, including stormwater conveyance,..."
8,Substitute/Floater Teacher,Children of America,"From infants to toddlers, preschoolers to kindergarteners, our highly trained teachers lead each child to reach developmental milestones, preparing the children..."
13,Bar Manager/Bartender,Poplar Springs Inn and Spa,"Fantastic oppurtunity to progress within the company. To oversee, maintain and elevate the bar and lounge to the high end status it is to further heights...."
10,Mammography Technologist-Part Time-Days,Fauquier Health System,Must be able to utilize independent decision making skills in a wide variety of situations. 1+ years of experience as a registered technologist in the...
11,Home Health and Hospice Aide Job,HCR ManorCare,"Minimum of one year experience as a Home Health or Hospice Aide, or is currently enrolled as a nursing student who has had a minimum of 6 months clinical..."
16,Sales Comfort Consultant,TLC Services LLC,Realize Your Maximum Potential And Income Possibilities. No overnight travel – Sell at the customer’s kitchen table on leads from the immediate area....
23,Intelligence Operations Specialist,Department of the Air Force,"Trains, educates, and tests aircrew on worldwide threats, to include surface-to-air missile (SAM), air-to-air missile (AAM), anti-aircraft artillery (AAA), and..."
5,Animal Care Supervisor,University of Colorado,"Animal Facility, implementing the animal care procedures and policies. Care for a variety of species of small laboratory animals used by scientists...."
2,Marketing Internship Latin America,Cosmetics of France,Provide customer service to the agent zone in terms of material &amp information needed for events trough com. Consolidate and update the Local Makeup Experts &amp
11,Physical Therapist or Physical Therapy Assistant,Accelerated Rehabilitation Centers,Athletico is looking for a dedicated and compassionate Physical Therapist Assistant to provide a hands-on approach to rehabilitation....
11,CNA/Medication Aide-PRN-7a-3p,Fauquier Health System,Virginia State Certified Nursing Assistant License. Virginia Registered Medication Aide License. The Certified Nursing Assistant/Medication Aide assists with...
10,Pharmacy Technician,Family Care Pharmacy Remington,Required license or certification:. This is a family owned business that is looking for a full time pharmacy technician who can perform data entry as well as...
3,Intelligence Analyst / Sr. Intelligence Analyst with Security Clearance,"TekStream Solutions, LLC","Bachelor’s Degree in Computer Science or a related technical discipline or military discipline, or the equivalent combination of education, professional..."
17,Asset Protection/Loss Prevention,The Home Depot,"They utilize tools to minimize loss to the Company, including but not limited to identifying incidents of theft and fraud, reviewing CCTV and exception reports,..."
8,Substitute Instructional Aide,San Mateo Union High School District,"Assist the classroom teacher to set up materials or education lessons; Under general supervision, reinforce lessons presented by the classroom teacher by..."
16,Retail Merchandiser- Part Time,TNG Retail Services,"Or person’s looking for permanent part time work. Clients' products, developing strong relationships with store personnel, accurately reporting time worked,..."
6,Social Worker-MSW-PRN Weekday & Weekends,Fauquier Health System,Masters of Science in Social Work. Experience in health–related field or setting. The Social Worker-MSW provides general social work services and participates...
13,Server Assistant / Busser /Food Runner,Royal Docks Brewing Company,"It’s a place where the welcome is a little warmer, the room is a little cozier, the barkeep is a little friendlier and the crowd is somehow a wee bit more..."
10,Surgical Tech,trustaff,Must have valid BLS certification. This assignment is for an immediate start with a reputable facility seeking an experienced Surgical Technician to fill a 13...
2,Account Manager / Estimator,Five Star Painting - Manassas,Be available to answer any questions regarding the job while the project is in progress. Use the proper tools to estimate the job accurately....
6,FAMILY COURT COUNSELOR,"Dallas County, TX","Must be independently licensed in the State of Texas as a Licensed Professional Counselor (LPC), Licensed Marriage and Family Therapist (LMFT), Licensed Master..."
13,Crew Person,McDonalds,"This position is for a friendly,enthusiastic person who can deliver prompt and accurate service with a smile...."
6,Resident Camp Counselor,Busch Gardens Tampa,Provide guidance to campers keeping them on task and behaving appropriately. Must be at least 21 years old in order to drive camp rental vehicles....
11,CNA - Certified Nursing Assistant,"Blue Ridge Caregivers, Inc",Drive/operate a motor vehicle (valid driver's license required). Current Certified Nursing Assistant or Personal Care Aide Certification....
5,Physical Science Technician,Department Of Agriculture,The Functional Foods Research Unit creates new processing technologies to enhance the performance of agricultural materials in existing applications and...
19,Plumber,Los Angeles Unified School District,A Los Angeles City Journeyman Plumber License OR a Los Angeles County Certificate of Registration as a Journeyman Plumber....
22,Owner Operator CDL-A Truck Driver - Regional Dedicated Opportunities,NFI,"Class A CDL Owner Operators, NFI understands the reward of business ownership and the importance of a valued partnership. Class A CDL...."
15,Companion Care / Personal Care - Waukesha,"FirstLight Home Care, Brookfield, WI","Companion Care/ Home Health Aide*. In addition to providing a flexible schedule, we offer potential for advancement, award programs, and opportunity for..."
11,CNA-Tele/MedSurg Unit-Full Time-Nights,Fauquier Health System,Virginia State Certified Nursing Assistant License. The Certified Nursing Assistant assists with patient care throughout nursing areas under the direction of...
22,Hiring CDL Student Drivers - We WIll Pick up the tab,American Professional Truck Driving Academy,"Student Requirements are the following Candidates Must Have CDL Learners Permit in State of Residency, Prospects Must Have Valid DOT Medical Card, Candidates..."
8,High School Math,Fauquier County Public Schools,"Plans, coordinates, attends, and chaperones field trips as appropriate. Motivates students to develop an interest in and an appreciation of math;..."
16,Insurance Sales CSR (Member Service Specialist)-Fauquier,Virginia Farm Bureau Mutual Insurance,"Property and Casualty and Life &amp; Health License- Must obtain P&amp;C and L&amp;H licenses within six months of employment,...."
15,Beauty Advisor,Stage Stores,Develop relationships with customers to insure future sales. Polite and courteous to customers and co-workers....
17,Retail Banker/ Teller - Center,Woodforest National Bank,"WOODFOREST NATIONAL BANK. Performs opening, closing, and other branch servicing duties such as cash and vault balancing;..."
17,"Warrenton, VA - Furniture Assembler/Merchandiser",Spar Business Services,"Required license or certification:. As an Independent Contractor with SPAR Business Services, Inc. Have own tools...."
2,Controller/Accounting Manager,Poplar Springs Inn and Spa,Advanced Degree or CPA license preferred. Design and maintain detailed financial analysis spreadsheets/tools to measure operational performance and aid with...
6,Juvenile Probation Officer - Court,Williamson County,Constant contact with juvenile offenders and their families. Performs complex social service work in interviewing and counseling....
8,Assistant Professor,Oklahoma State University,"Applicants must have an appropriate earned doctorate in accounting, demonstrate instructional excellence, and be committed to active engagement in the life of..."
22,Delivery Driver,Domino's,"Valid Driver's license. So if you're looking for casual work or maybe something more permanent, our Delivery Driver position is the perfect way in...."
2,Portfolio Administrator,"Greystone & Co., Inc.","Transfer incoming mortgage payments to various custodial accounts in compliance with agency requirements. We are seeking a Portfolio Operations Specialist, for..."
22,CDL-A Company Truck Drivers,Mesilla Valley Transportation East,"Mesilla Valley Transportation, a 48-state motor carrier, is now hiring company truck driving teams for OTR, Shuttle and Super Local runs...."
9,Morning Show Host,"iHeartMedia, Inc.",Radio talk show host. 3+ years of on-air radio experience required. Serves as ambassador for the radio station(s) when out in public....
13,Chef de Cuisine,Claire's at the Depot Restaurant,"Must be detail oriented and proficient in a high volume kitchen. Claire's at the Depot, a fine dining restaurant located in historic Old Town Warrenton, is..."
9,TV Line Producer,zulily,"This will include partnering with various production companies to create new scripts, select footage and music and hire freela nce voice over artists...."
22,Flight Attendant,Compass Airlines,Flight Attendant - LAX. One year previous flight attendant experience preferred The Flight Attendant will demonstrate the Compass Airlines' core values and…
7,Legal Consultant,Softpath System LLC,Understanding and researching complex international legal and/or regulatory issues. Looking for an energetic and talented professional to join the International...
16,Consultative Sales Associate – Home Appliances,Stores - Sears Hourly,The Consultative Sales Associate is responsible for enhancing the experience of members and driving profitable sales of Home Appliance area by providing...
17,Front Desk Agent,Poplar Springs Inn & Spa,"Customer Service, Hotel Front Desk:. Prior hotel experience is preferred. Poplar Springs Inn &amp; Spa is looking for a dedicated individual to fill the need of a..."
15,Dog Walker/Pet Sitter,Tina Pet Services,"You have to love animals, and feel comfortable around them.:. First impressions are important, so be sure to let your personality come through in your initial..."
15,Dog Trainer / Apprentice,Petco,Our Petco family is made up of pet lovers who unselfishly put the needs of others before their own. Previous experience teaching positive reinforcement dog...
3,Data Management Support w/TS/SCI w/Polygraph,"TekStream Solutions, LLC","Performs a variety of general administrative tasks, such as preparing reports and correspondence, coordinating travel and meeting arrangements, answering phones..."
8,Pharmacy Technician Instructor,Lord Fairfax Community College,The Pharmacy Technician instructor will teach the LFCC Workforce Solutions Pharmacy Technician class. Instructor must have experience as a licensed Pharmacist....
3,Intelligence Tech Specialist,Raytheon,Other responsibilities include data entry and tracking of documents. Ability to manipulate data using various formats and tools with a serious commitment to...
3,Mid-Level Cyber Security Consultant ( IRS Clearance),Seneca Resources,"Level Cyber Security Consultant to support Cyber Security Program based in Reston, VA. Knowledge of security principles, best practices, conducting security..."
2,Insurance and Financial Services Position - State Farm Agent Team Member (Sales experience preferred),Charles Robinson - State Farm Agent,"As a State Farm team member for Charles Robinson - State Farm Agent, you will build and develop customer relationships within the community to promote State..."
8,Assistant Teaching Professor,Worcester Polytechnic Institute,"The Mathematical Sciences Department currently has 28 tenured/tenure-track faculty members, 9 postdoctoral scholars, 5 teaching professors and features a..."
23,Air Defense Artillery Officer (14A),U.S. Army,Job training for an air defense artillery officer includes completion of the Air Defense Artillery Officer Basic Course....
17,STORE CLERK - TEMPORARY,Dollar General,"This temporary position will be supporting new store openings, remodels and/or relocations of Dollar General stores by setting the store merchandise, organizing..."
10,Health Technician,Department of Veterans Affairs,Assists the audiologist in various procedures of the program including:. Utilizes electro-acoustical diagnostic equipment to assess the electronic functioning...
3,"Quality Assurance Automation Tester at Phoenix ,AZ, Local Preferred",West Coast Consulting LLC,"Hello, Kindly go through the requirement and let me know if you are comfortable with this requirement mentioned below. Job Title : Quality Assurance"
13,Catering Coordinator,Panera Bread Franchise (Blue Ridge Bread),Our bakery-cafes are focused on taking care of our guests. Must Have Own Vehicle. Perfect Driving Record. Please apply online and a Manager may be in touch if...
16,LEAD SALES ASSOC-PT,Dollar General,Operate cash register and flatbed scanner to itemize and total customer's purchase
16,Marketing & Sales Representative - Level 5,BOEING,We are engineers and technicians. Defense Systems Division Sales &amp Marketing team. This is a senior sales and marketing analyst position.…
1,Proposal and Marketing Manager,Eat'n Park Hospitality Group,Marketing and digital marketing. Effective marketing materials. Marketing promotions that strengthen client. Create marketing campaigns and collaterals to....
13,Pizza Hut Server,Pizza Hut,"It’s about being independent and having fun, making new friends and earning extra cash. And independently-owned franchised or licensed locations may have..."
14,Greenskeeper,Heritage Palms Golf Club,*Summary* Assists in a general range of activities involved in golf course maintenance and construction. The individual should be able to perform semi-skilled
3,Support Technician,Verizon,Fiber Cust Support Analyst SI. The Fiber Customer Support Analyst will serve as the initial point of contact for provisioning and/or maintenance customer...
3,Jr Systems Administrator,City of Rifle,"Systems Administrator, Full-time, 4 year degree required. This position will assists the Systems Administrator in the support of services provided to the user..."
2,"Account Executive - Norfolk/Virginia Beach - Base salary, commission, car allowance, tuiton",Western Union,"Together with our Agents, we speak our consumers' languages and live in our consumers' neighborhoods. Maximize same store sales, selling new services and..."
17,Inpatient Medical Records Coder II-Part Time,Fauquier Health System,"Registered Health Information Administrator certification(RHIA), or Registered Health Information Technician certification(RHIT), or Certified Coding Specialist..."
16,Sales Representative,Verizon,Analyze customer needs and present value-added solutions Inspire and excite customers about how our solutions can impact their lives Ensure that our customers...
