job_field_id,title,company,description
13,Restaurant Team Member,RubyTuesday,"Whether its part-time or an entire career, we want to make sure you get everything you want out of your Ruby Tuesday experience...."
10,Ophthalmic Technician,The Virginia Retina Center,Busy ophthalmic practice has an immediate opening for a full time Ophthalmic Technician. Applicant should have strong communication and interpersonal skills and...
22,AMBULANCE DRIVER,Catholic Health Initiatives,"Job Summary: Provides transportation for patients, visitors, employees and students. Essential Duties: Picks up and delivers patients, visitors, employees"
8,Library Para Educator,Blue Valley School District,Attachment(s): job description Hourly Rate: $10.25 (PA/Col 3/01) Hours per Day: 7.5 (Monday - Friday) Days per Year: 200 (less than 12-month position)
16,Part-Time Teller - Northrock Shopping Center,Capital One,Live the company values of Excellence and Do the Right Thing - Act as a Customer Advocate - Take an active role in educating customers on other banking channel...
14,Custodian,Fauquier County Public Schools,"Checks play areas and around school building for trash, debris or hazards. Delivers copy paper to rooms. Empties trash receptacles and deposits collected refuse..."
17,LPNs and RNs Needed!,WRB Communications,Active LPN/ RN license. Our LPN/ RN Communicators will take calls from consumers and health care providers and document product complaints or adverse events...
3,IT Support Supervisor (Level 2 & 3),TransTech LLC,"IT related college degree, technical school degree or Microsoft certification preferred. Strong technical knowledge of MS Windows, desktop support and PC..."
1,Program Manager of Operations,"Amazon Fulfillment Svcs, Inc","Advanced degree (MS,MBA) from an accredited university with focus on Industrial Engineering, Operations, Management, Economics, or related areas...."
16,Part Time Deli Bakery Clerk North Rock,Harris Teeter,"Ability to read and comprehend simple instructions, short correspondence, and memos [in English]. Ability to write simple correspondence [in English]...."
22,Delivery Driver/Garbage Truck Driver,Waste Connections,In this position you will be delivering garbage and recycling container to commercial and residential customers in and around anchorage....
8,Instructor I - PCT Job,SAIC,"SAIC is a premier technology integrator providing full life cycle services and solutions in the technical, engineering, intelligence, and enterprise information..."
19,Maintenance Worker - Road Maintenance,"Collier County, FL","Performs light construction projects; Operates a variety of machinery, equipment, and tools associated with division projects, which may include a utility truck..."
17,Shift Leader,Dunkin' Donuts,Holds the guest as their highest priority and role models exceptional guest service. Acknowledges all guests with a friendly smile and is highly responsive to...
20,Custom Window Treatment Installer,Budget Blinds of Warrenton,Valid drivers and a good driving record. No phone calls please!!! Time Management You must have a good driving record and are able to navigate your way from...
19,Painter/Blaster,CTR Group,"CTR is currently seeking 1st class Painters Location - Pascagoula, MS Industry - Marine Responsibilities: • Perform blasting and painting utilizing marine"
16,Customer Relations Representative,AmeriGas,"Make credit calls to delinquent customers and perform credit checks on new customers. Answers phone calls and responds to all customer inquiries including, but..."
21,eCommerce Fulfillment Associate,Stage Stores,Willingness to consult multiple resources to obtain answers. Troubleshoot and problem solve when necessary....
19,Metal Mechanic,Spencer-Ogden Energy,"Distribute insulating materials evenly into small spaces within floors, ceilings, or walls, using blowers and hose attachments or cement mortar...."
11,Personal Care Aide,Archangel Personal Home Care,Immediate needs for LIVE-IN aides located in Lackawanna County. Please call 570-507-9420 to schedule interviews....
12,Animal Control Officer,"City of Springfield, MO",Animal Control collaborates with many other community groups involved in animal welfare. Springfield Animal Control Officers enforce the ordinances of the city...
17,"Front Office Team Member - Business Assistant, Warrenton","Heartland Dental, LLC","The Dental Business Office Assistant will maintain and organize all administrative functions in the front office, including reception tasks – receiving and..."
16,Detailer,Frito Lay,The Part-Time Detailer is a part-time position that is responsible for merchandising Frito-Lay's complete line of quality products to existing accounts while...
8,Talent and Workforce Skills Trainer,Shangri-La,Ø Education and Experience. Requires a basic understanding of alpha numeric filing. 1.3.2 Utilize multiple adult learning styles for maximum information...
14,Maintenance Worker,Marsh Run MHC,"Valid driver’s license and good driving record. Required license or certification:. General knowledge of electrical, plumbing, and grounds maintenance...."
16,Customer Service Associate,Wawa,Comply with federal and state laws by requesting personal identification from customers who are purchasing tobacco and/or alcohol....
17,Reimbursement Specialist,WRB Communications,Complete accurate entry of billing information to ensure timely payment and avoid delay in patient therapy....
18,Arborist Climber Trainee,Bartlett Tree Experts,The ideal candidate will have experience working on a tree crew as a Ground Man OR a 2/4 year degree in Forestry or a related field....
14,Custodial Worker (Janitor) MWR 03-16,"Naval Air Station - JAX, MWR","Deep cleaning may include defrosting refrigerators and freezers, cleaning windows (interior and exterior), replacing and/or cleaning drapes/curtains, moving..."
16,Sales Representative - Worcester,Commonwealth of Massachusetts,Instruct Sales Agents on the use of successful marketing and sales techniques. Provide motivation to Sales Agents and recommends incentive plans intended to...
13,Restaurant Team Member - Crew (1628 - Warrenton),CHIPOTLE,Have the ability to develop positive working relationships with all restaurant employees and work as part of a team by helping others as needed or requested •...
1,District Executive,Boy Scouts of America,Achieve net income and participation objectives for assigned camps and activities. Bachelor's degree from an accredited college or university (transcript with...
13,Crew Person,McDonalds,"Greeting customers with a smile. It's time you worked for someone who will give you the tools to learn, grow and be what you want to be - both personally and..."
20,Auto Glass Installer,Luther Automotive,"At least 1 year of mobile auto glass experience required. Install windshields in shop and mobile, perform rock chip repairs and pull and reinstall glass for the..."
2,Senior Staff Accountant,MFA Oil Co.,Summary of Responsibilities: Job Responsibilities include but are not limited to: Ensuring the integrity of the general ledger and financial statements
15,Hair Stylist,Sport Clips - VA114,"We're interviewing motivated, positive, reliable, upbeat stylists to help grow and be one of our winning team members...."
11,Massage Therapist/Chiropractic Assistant,Physicians Plus Spine and Rehab Center,Chiropractic office is seeking a full time massage therapist/chiropractic assistant. This position offers great opportunity for the right person....
1,Assistant Manager,Domino's,"Occasionally, pizza sauce weighing 30 pounds is carried from the storage room to the front of the store. If you like the thought of managing your own million..."
1,"General Manager - Store 2705 - Warrenton, VA",Petco,"Responsible for handling cash counting, supervision of cashiers and cash register service to maximize customer service and minimize loss of assets...."
3,Software Specialist,TransTech LLC,"Where appropriate, lead implementation of innovative technical solutions. Continuously consider ways to implement technical solutions to improve Greystone..."
4,CAD Drafter,Raytheon,"Architectural, mechanical, civil, security, structural, and electrical engineering. This drafter position is that of a contributor and will be in direct support..."
16,Technology Sales Associate,Staples,"All qualified applicants will receive consideration for employment without regard to race, color, religion, sex, national origin, protected veteran status,..."
11,Residential Care Aide,Westminster Village.Spanish Fort AL,RESIDENTIAL CARE AIDE*. Must be registered and in good standing with the Alabama Nurse Aide Registry or currently enlisted in an approved nursing assistant...
13,Pizza Hut Restaurant General Manager,Pizza Hut,"And, you’re at least 18 years old with a valid driver’s license, reliable transportation (not public transportation – you may need to drive to make deposits for..."
14,Pest Route Technician,Ecolab,"Previous pest elimination industry or route experience preferred &quot;Certified Pest Control Technician, Commercial Pest Control Technician, Exterminator, Pest..."
18,Log Yard Scaler,Church & Church Lumber Company,Must be experienced with running equipment such as a log loader. Good people person with management and communication skills....
13,Cook-Full-Time-Hours Evenings 12p-8p,Fauquier Health System,Ability to perform complex math calculations and verify cash handling and reporting. The Cook prepares food items needed for meal service using institutional...
8,Basic Skills/Learning Center Non-Credit Instructor,North Orange County Community College District,"Teach pre-college courses in class and lab settings including, but not limited to, adult basic education (ABE), career technical education, adult secondary..."
10,Hospitalist- NP/PA,Virginia Emergency Medicine Associates,A minimum of one year of post-grad clinical experience in hospital medicine• Valid Virginia license • Current ACLS/BLS certificates through AHA• Ability to...
3,Technology Support Specialist,City of Durham,"Database management experience; Maintains, administers, monitors, and supervises departmental software database and application; Monday-Friday 8 am - 4:30 pm;..."
8,Teacher- Elementary Art,Fauquier County Public Schools,Arranges opportunities for students to attend enriching field trips both during and after school hours. Motivates students to develop an interest in and an...
3,Senior Intelligence Technican Associate,Raytheon,Possess a valid driver license for delivering records using government transportation within WMA. Give presentations to visitors as required....
20,"Maintenance Mechanic-Remington, Virginia",U.S. Pipe,"Directs and performs complex mechanical repair work &amp; is responsible for the more intricate repair assignments, including hydraulic and pneumatic systems...."
16,Consultative Sales- Home Improvement,Stores - Sears Hourly,"Selling and servicing customers within one or more departments including Home Improvement, Lawn and Garden, Tools, Sporting Goods;..."
12,AIRPORT SECURITY SCREENER,Covenant Services Worldwide,Security Screeners are responsible for day-to-day security screening of airport employees and other individuals passing through Screening Locations....
8,Substitute,Bright Horizons Family Solutions,"Individual state and center requirements may apply. Bright Horizons offers an excellent benefits package including a competitive salary, career path..."
3,Senior IT Support Specialist,Greystone,"Strong technical knowledge of MS Windows, desktop support and PC hardware, setup and configuration - People management experience and demonstrated leadership..."
4,Navy Logistician,LinQuest Corporation,"Review technical studies, reports, and white papers on new enhanced system capability designs, system design requirements, and system failure investigation..."
19,Construction Laborer,Austin Materials,Summary/Objective The construction laborer performs tasks involving physical labor at highway and heavy construction projects....
2,Small Business Specialist II,BB&T,"Possess an understanding of major technical aspects of small business underwriting, loan structure and deposits, and have a clear understanding of credit and..."
17,Supervisor,Stage Stores,Interrupt store tasks to assist and answer questions for customers in a pleasant and courteous manner. O Key in telephone number and e-mail address when...
17,Front Desk Agent,Holiday Inn & Suites - Tulsa,At *Holiday Inn® Hotels* our job is to bring the joy of travel to everyone. That’s where you come in. When you’re part of the Holiday Inn Hotels brand you’re
23,Intelligence Analyst - Junior,"Streamline Defense, LLC","The Intelligence Analyst will perform intelligence analysis, analyst-driven data extraction and processing, dissemination of applicable reporting products, and..."
5,Veterinary Medical Officer,Department Of Agriculture,"Masters degree in an area of specialization, including but not limited to, animal science, avian medicine, food safety, infectious diseases, veterinary clinical..."
17,Clinical & Secretarial Services Technician-ER-Part Time-Days,Fauquier Health System,"The Clinical &amp; Secretarial Services Technician also coordinates the activities of the department through communication, requisitioning and management of..."
15,Grooming Assistant,Petco,Assist in booking grooming appointments and performing follow-up phone calls and reminders to customers....
16,Sales Consultant,K. Hovnanian Companies,"Successful candidate must maintain a valid driver's license. The ability to provide the highest level of customer service, including exceptional communication..."
20,Crew chief,SERVPRO of Culpeper & Fauquier Counties,High School Diploma or equivalentRestoration industry experience required.IICRC certificate required and ASD certification a plus.Ability to pass a criminal...
13,Banquet Chef/Line Cook,Golf Course North Houston,"Preferred Banquet experience but not required. All kitchen staff must be able to cook high-quality balanced meals, cook from scratch and maintain proper food..."
10,Pharmacy Technician,Rite Aid,"Pharmacy Technician certification where required by state law. Rite Aid Technician Training Program certification in all modules, job class/codes up to and..."
13,Bartender / Barman / Mixologist,Ristorante Capellini,"Bartender, barman, barkeep, barmaid, and mixologist please apply. Bartenders are responsible for positive guest interaction while accurately mixing and serving..."
22,Regional / OTR Class A CDL Truck Driver,Marten Transport,Then now is the time for experienced Class-A CDL truck drivers who want Regional and OTR runs to join Marten!...
17,Administrative Assistant to the Provost/Vice President of Academic Affairs,East Central University,"The Administrative Assistant coordinates the Provost’s appointments and travel arrangements. East Central University invites applications for a twelve-month,..."
15,Funeral Attendant,Service Corporation International,"The Funeral Attendant will set-up and assist with viewings, funeral services, memorial services, etc. Performs a variety of tasks during funerals and..."
14,Exterminator,University City Housing Company,University City Housing (UCH) is a Philadelphia-based property management company with significant real estate holdings in and around the Philadelphia
3,IT and GxP Computer Systems Specialist,Booth Welsh Resources,"Automation, Computerized and Vision systems administrator. O Proceed to the validation of the automated and computerized systems (logic security, backup /..."
8,LANGUAGE ARTS TEACHER,Academy of Hope Adult PCS,"Bachelor's degree and secondary or adult education experience required. Teach a course load of at least 2 classes per day of adult literacy, basic education,..."
22,Roadtrak / Highway - Experienced Regional CDL-A Truck Driver,Hub Group Trucking,HGT’s Roadtrak truck driving opportunities take your career the extra mile! Hub Group Trucking has unique regional driving opportunities available to CDL-A...
22,CDL-A Company Truck Drivers,Purdy Brothers Trucking,We offer a better driving career by asking YOU what you need and then doing whatever we can to meet those needs....
7,Legal Analyst,CP Homes,"The role of the Legal Analyst is to support, manage and administer the day-to-day functions of a corporate legal department...."
17,Office Manager and Billing Specialist,"Fauquier Neurological Associates, Limited",Looking to hire a medical office manager with medical coding/billing experience. Must have knowledge of Quickbooks payroll program
11,Environmental Services Associate-PRN-7a-3p,Fauquier Health System,"The Environmental Services Associate is responsible for cleaning all patient rooms, nurses’ station, bathrooms, waiting areas, departmental areas, offices,..."
13,Restaurant Manager,Ashby Inn & Restaurant,"Fauquier County high-end restaurant, seeks professional restaurant/front-of-the-house manager. The right applicant must be tactful;..."
9,Sports Broadcaster (Basketball),The College of St. Scholastica,"To serve as play-by-play announcers, analysts, and commentators at home basketball games streamed over the Internet...."
6,Police Officer,Virginia Association of Chiefs of Police (VACP),"Applicants must be at least 21 years old, in good physical health, possess a high school diploma or G.E.D, valid Virginia driver’s license, and be able to deal..."
18,Animal Agriculture Management Associate 2016,Cargill,"The Animal Agriculture Management Associate role enables the individual to become familiar with the workflow of animal agriculture operations, and to develop..."
21,Blow Mold Machine Operator,Consolidated Container Company,"Blow Mold Machine Operators report directly to Maintenance/ Production Manager. The Blow Mold Machine Operator will operate blow-mold, grinders, trimmer..."
23,Range Operations Specialist (PD D1134000),Department of the Army,"Officer, Not to Exceed O-3/ CPT, Warrant, Enlisted. Small arms, mortars and field artillery rockets or cannons...."
4,Civil Engineer EI (Entry Level),Banning Engineering,"BS in Civil or Agricultural Engineering is required. Located in Plainfield, Indiana, Banning Engineering is a Civil Engineering and Surveying firm that offers a..."
16,VA Customer Service Representative,Family Dollar,"Key priorities include greeting customers, assisting them with selection of merchandise, completing transactions, and answering questions regarding the store..."
2,Community Banking Branch Banker III Full Time,BB&T,"Perform basic teller transaction such as accepting deposits and loan payments, verifying cash and endorsements, cashing checks within limits and obtaining..."
22,School Bus Driver -aftercare program,Lake Forest Park Montessori,"Part time aftercare/ bus driver:. If CDL required for vehicle driver, driver is subject to NLCI and state/federal policies, procedures and requirements..."
10,Staff Nurse,South Shore Medical Center,Provide quality care to South Shore Medical Center patients. Administer prescribed medications and treatments. Prepare patient for office visit. Respond to
3,"Database Specialist, Master",OBXtek,"Performs database programming and supports systems design. (h) Includes maintenance of database dictionaries, overall monitoring of standards and procedures,..."
22,Class-A CDL Flatbed Company Truck Drivers,E. W. Wylie,"With annual earnings of up to $65K, consistent OTR miles that offer frequent home time, a generous sign-on bonus, a pay raise every 60K miles and more,..."
22,Hiring CDL-A Drivers for L/P,Network 1,"No commercial transportation related felony, theft or larceny conviction. LEASE OPERATORS NEEDED NOW!!*...."
22,CDL Class A Drivers wanted Immediately!,"Champion Materials, Inc.","Now hiring CDL Class A Truck Drivers to haul bulk cement products across the Northeast, Mid Atlantic region, and Ontario...."
16,"Rental Sales Representative- Warrenton, VA",H&E Equipment Services,A Bachelor’s degree is a plus• 2 years of business to business sales experience in Construction Equipment and/ or Construction related field is preferred•...
18,Plant Health Care Specialist,Bartlett Tree Experts,Certified Pesticide Applicator License is preferred. The ideal candidates will have 1+ yrs experience working in Plant Health Care OR a 2/4 year degree in...
10,Recreational Therapist - Full Time - Baylor Rehab - downtown Dallas,Baylor Institute for Rehabilitation,Current national certification from NCTRC as a Certified Therapeutic Recreation Specialist (CTRS). The Therapeutic Recreation Specialist/Recreational Therapist...
20,Aquatic Scientist/Customer Service Manager,"Virginia Waters and Wetlands, Inc.",Required license or certification:. Valid driver’s license required. Commercial Herbicide Applicator License – Category 5A preferred• Arborist certificate - a...
21,Tailor - Northrock Shopping Center,Jos. A Bank,Listen to the wants and requests of the customer and answer the customer’s questions.Communicate to the customer and/or sales executive in a professional manner...
22,CDL-A Dry Van & Refrigerated Drivers,RWH Trucking,Why do so many CDL professionals come to RWH for truck driving jobs? CDL professionals know RWH has the driving opportunities to keep their wheels moving and...
13,Bartender,Longhorn Steakhouse,"Helping guests be aware of and choose menu items, taking orders and making guests feel taken care of during their visit...."
2,Account Liaison- Hospice Job,HCR ManorCare,"Bachelors degree in marketing, business, communications or related health field from an accredited institution required or RN,...."
22,Part Time Produce Clerk North Rock,Harris Teeter,"While performing the duties of this job, the associate constantly works in a cool environment with an average temperature range of 55-60 degrees Fahrenheit and..."
19,Fabricator/Welder Helper,Kooks Custom Headers Inc,Pass off parts to helper for grinding and straightening flanges. Receive parts back from helper for final assembly and inspection for quality control....
6,Counselor (K-8),Grambling State University,Teach school developmental guidance curriculum to students. Plan school guidance and counseling programs to ensure that they meet identified needs....
11,CNA Assisted Living & Memory Support-PRN-Hours vary,Fauquier Health System,VA State Certified Nursing Assistant license. The Certified Nursing Assistant at our assisted living facility assists with patient care throughout nursing areas...
16,Merchandising,The Home Depot,"Must have a valid state driver s license and proof of insurance. Requires listening for customer service calls, personal pages and general information..."
16,Sales and Service Associate,Staples,Develop and sell a Total Solution to address customers’ immediate and ongoing needs through the Omni Kiosk. This person will own all Omni Channel and shipping...
17,Bookkeeping Clerk,John Q. Hammons Hotels & Resorts,"Must have 1-2 years in accounting , customer service and/or bookkeeping experience or equivalent. Perform any combination of routine calculating, posting, and..."
22,Freight Broker,Sunbreak Logistics,Supply Chain / Freight Brokerage:. A new logistics company is looking for a motivated and experienced freight broker to join and to grow in a great team....
1,Advertising Project Manager,Innocean USA,Project Manager may support projects for Innocean projects across all U.S. The Project Manager may also lead process improvement initiatives assigned by the...
8,Pre-School F/T Assistant Teacher,Children of America,Is working towards the completion a Child Development Associate credential (CDA) and meets the licensing requirements of the state in which they work....
22,Hiring Class A Truckers - OTR & Regional Positions,Barr-Nunn Transportation,Valid Class A CDL. Barr-Nunn has a reputation for respecting its truck drivers and working diligently to anticipate and meet our drivers needs....
13,Baker/Finisher,Dunkin' Donuts,Guest Focus – deliver high quality finished products for guest satisfaction. Ensure the safety and security of team and guests through a focus on food safety...
22,CDL-A OTR Solo and Team Truck Drivers - Owner Operators,Titan Transfer,"Titan Transfer is seeking professional Class A CDL truck drivers to join our team! At Titan Transfer, responsible, motivated professional truck drivers can have..."
1,Site Manager,Capitol Tents,"Required license or certification:. Looking for hard working manager overseeing startup and continued success of new tent rental company near Warrenton Va,..."
13,PT Market Associate,Food Lion,"Provide friendly, courteous and prompt customer service. Ability to complete Computer Based Training (CBT) and Training Aid courses...."
16,Retail Floater,The Fauquier Bank,"Accepts deposits, loan payments, TT&amp;L Payments, VISA deposits and payments. Processes requests for cash advances, gift and travel cards, and transfer of funds.*..."
4,Mechanical Engineer,GENERAL ATOMICS,Works with multiple interdisciplinary groups to transition equipment and processes from an engineering stage to repeatable productionized processes....
20,Utility Systems Repairer-Operator,Department of Defense, Operate an Energy Management and Control System (EMCS) used to monitor and control all HVAC systems within the facility....
7,District Court Clerk II - O'ahu,Hawaii State Judiciary,Authors the official court record in a court of limited jurisdiction for District Court trial proceedings  Prepares documents ordered by the court
1,Shift Supervisor,Rite Aid,"Accountable for store cash and other financial assets, reconciling cash register drawers, preparing deposits, and ordering changes from the bank as directed by..."
1,Store Manager,Stage Stores,"Work with district manager to develop and execute plans for store to improve profitability, greater productivity and efficiency...."
