job_field_id,title,company,description
10,Ophthalmic Technician,The Virginia Retina Center,Busy ophthalmic practice has an immediate opening for a full time Ophthalmic Technician. Applicant should have strong communication and interpersonal skills and...
20,Aquatic Scientist/Customer Service Manager,"Virginia Waters and Wetlands, Inc.",Required license or certification:. Valid driver’s license required. Commercial Herbicide Applicator License – Category 5A preferred• Arborist certificate - a...
11,CNA - Certified Nursing Assistant,Oak Springs of Warrenton,Seeking Licensed CNA's for all shifts. Participate in assessments and development of treatment plans. Full or Part Time shifts are available to provide direct...
16,Consultative Sales Associate – Home Appliances,Stores - Sears Hourly,The Consultative Sales Associate is responsible for enhancing the experience of members and driving profitable sales of Home Appliance area by providing...
23,Flight Support,U.S. Navy,"Operate and maintain hydraulic and steam catapults to launch aircraft. As an Officer, you can expect to:. Instead, she refuels fighter jets on aircraft carriers..."
8,Teacher- Spanish (Part-Time),Fauquier County Public Schools,"Plans, coordinates, attends, and chaperones field trips as appropriate. Motivates students to develop an interest in and an appreciation of language (French and..."
3,"Database Specialist, Master",OBXtek,"Performs database programming and supports systems design. (h) Includes maintenance of database dictionaries, overall monitoring of standards and procedures,..."
15,Barber,GoodBuddyz BarberShop,Chairs available for registered and apprentice barbers at 3-chain barbershop. Build your own clientele or bring your own....
15,Funeral Attendant,Service Corporation International,"The Funeral Attendant will set-up and assist with viewings, funeral services, memorial services, etc. Performs a variety of tasks during funerals and..."
4,Navy Logistician,LinQuest Corporation,"Review technical studies, reports, and white papers on new enhanced system capability designs, system design requirements, and system failure investigation..."
8,Basic Skills/Learning Center Non-Credit Instructor,North Orange County Community College District,"Teach pre-college courses in class and lab settings including, but not limited to, adult basic education (ABE), career technical education, adult secondary..."
22,Hiring CDL-A Drivers for L/P,Network 1,"No commercial transportation related felony, theft or larceny conviction. LEASE OPERATORS NEEDED NOW!!*...."
16,"Part Time Merchandiser-Warrenton, VA",American Greetings,EOE M/F/disability/vet VEVRAA Federal Contractor&quot
4,Level 1 Systems Technician,Raytheon,"Successful incumbents are self-motivated, independent workers who are also team contributors. Raytheon has an immediate need for a Technician Level 1 to provide..."
15,Dog Walker/Pet Sitter,Tina Pet Services,"You have to love animals, and feel comfortable around them.:. First impressions are important, so be sure to let your personality come through in your initial..."
3,Information Sec Spec,"Greystone & Co., Inc.","IT related college degree, technical school degree, or Microsoft certification such as MCSE, MCITP, etc...."
13,Experienced Culinary Professionals,The Orlean Market,Local Market/Restaurant is rapidly changing! We are in search of experienced and responsible culinary professionals who want to be a part of our unique and
16,VA Customer Service Representative,Family Dollar,"Key priorities include greeting customers, assisting them with selection of merchandise, completing transactions, and answering questions regarding the store..."
15,Grooming Assistant,Petco,Assist in booking grooming appointments and performing follow-up phone calls and reminders to customers....
22,CDL-A Refriegerated OTR Company Truck Driver,J.S. Helwig & Son,Minimum age 25 years Valid commercial license Safe driving record meeting our minimum requirements One (1) year verifiable over the road experience in the past...
9,Audio/Video Installer,Wilshire Media Systems Inc,"Wilshire Media System’s is Southern California’s premier source for home theater, high performance audio, home automation and lighting control...."
13,Teller - On Call for the Warrenton/Fauquier County area,BB&T,"Perform the basic transactions of a paying and receiving teller such as accepting deposits and loan payments, verifying cash and endorsements, cashing checks..."
22,Railroad Openings- Now Hiring,JNI,*RAILROAD OPENINGS- NOW HIRING* *Trainees & Experience Welcome* *Call 205-536-7500 FOR IMMEDIATE ATTENTION* * Fireman/ Oiler – Forklift Operator…..$-23/HR *...
10,EXERCISE PHYSIOLOGIST,Duke University and Duke University Health System,Master's degree in Exercise Physiology or Exercise Science. Clinical oversight regarding exercise for all patients at all risk levels....
16,Brand Ambassador Sales Part Time,Advantage Sales and Marketing,Participate in mandatory on-line training and conference calls (paid). Field of Study/Area of Experience:....
22,Part Time 3rd Shift Stocker North Rock,Harris Teeter,"While performing the duties of this job, the associate is frequently exposed to wet, hot, or cold conditions and moving mechanical parts...."
22,Hiring Company Drivers & Contracting Owner Operators,Prime Inc.,We are hiring Class A CDL Company Drivers and Contracting Owner Operators. Find the Lifestyle You're Looking for as a Prime Truck Driver....
9,Play-by-Play Announcer,Pittsburgh Pirates,"This position is for a play-by-play announcer for the Pittsburgh Pirates. Plan, prepare, present and perform as a play-by-play announcer on Pirates television..."
6,Resident Camp Counselor,Busch Gardens Tampa,Provide guidance to campers keeping them on task and behaving appropriately. Must be at least 21 years old in order to drive camp rental vehicles....
16,"Rental Sales Representative- Warrenton, VA",H&E Equipment Services,A Bachelor’s degree is a plus• 2 years of business to business sales experience in Construction Equipment and/ or Construction related field is preferred•...
22,Traffic Flagger - Warrenton VA,Flagger Force Traffic Control Services,"No experience is required, but you must have a valid driver’s license, reliable transportation and a cell phone...."
