job_field_id,title,company,description
1,Regional Marketing Manager,Vishay,Develops a formal marketing plan outlining an appropriate marketing strategy for selling to key accounts. Coordinates the marketing efforts for a product group....
3,Data Scientist,Humana,"Bachelor’s Degree in Mathematics, Computer Science, Actuarial Science or related field. Collaborate with other professionals including Actuaries, Mathematicians..."
20,HVAC Installer/Technician,Express Air Sytems,Basic knowledge of standard code requirements of air conditioning systems. \*\*\*\*\*Minimum requirements for Installers\*\*\*\*\*....
11,2 Med/Peds Certified Nursing Assistant,Riverside Medical Center,Reports changes in patients' condition to the professional nurse. The 2 Med/Peds Certified Nursing Assitant (CNA) assists with the care of patients ranging from...
5,NATURAL RESOURCES PROGRAM TECHNICIAN,Arkansas Game & Fish Commission,"Knowledge of agricultural methods and basic land laws. Conducts agricultural and forest management activities on wildlife management areas, including preparing..."
14,Janitor - Cleaning Technician - FULL TIME - 84095,Wingfoot Services,"Janitorial, janitor, cleaning specialist, carpet cleaning, floor care technician, buffing, part time, supplemental income, laborers, landscaping, supervisor,..."
16,Digital Sales Account Executive,The Morning Call Media Group,"Manages advertising sales revenue and account management targets. Our digital sales account executives are responsible for selling advertising banners, programs..."
8,Tutor or Teacher - Elementary Math,,"We are looking for math tutoring for our 4th grader. Improve grades, get ahead and increase confidence. Elementary math Tutoring &amp; Teaching opportunities..."
17,Telephone Operator,The Broadmoor,"Monitors 911 Alert System. Operates the switchboard to relay incoming, outgoing, and interoffice calls by performing the following duties:...."
9,Graphic Artist,IGT,"Maya, Autodesk 3D Studio Max). This position is the development and timely delivery of high quality 2D and 3D game...."
22,Air Traffic Control Operator,National Guard,The skills you learn as an Air Traffic Control Operator will qualify you to work in civilian air traffic control towers and centers at airports and airfields....
12,Transportation Security Officer (TSO),Trinity Technology Group,TSOs must take the computerized Screener Assessment Battery. Repeatedly lift and carry baggage weighing up to 70 pounds…
13,Kitchen Cook,SMG World - Tucson Convention Center,Banquet facility preparing meals for large events:. Fulfilling the service per each Banquet Event Orders (BEO)....
19,Drywall Hanger/Installer,EncoreHR Staffing,"Includes lathers who fasten wooden, metal, or rockboard lath to walls, ceilings or partitions of buildings to provide support base for plaster, fire-proofing,..."
7,Administrative Law Judge,New Mexico State Personnel Office,"Administrative Law Judge, Adjudicator Advanced. This position will conduct administrative hearings on behalf of the State Personnel Board concerning..."
15,Lobby Concierge,Beach Activities of Maui,"The Concierge is knowledgeable about the local area and is the expert on the attractions, tours and activities that we sell.Must be flexible with scheduling and..."
10,Anesthesiologist,"UF, Department of Anesthesiology","Department anesthesiologists practice at UF Health hospitals in Gainesville, FL at the University of Florida alongside 62 faculty anesthesiologists, 78..."
18,Agricultural & Standards Inspector - I,Placer County,"Recruitments for Agricultural and Standards Inspector I, Agricultural and Standards Inspector II, and Agricultural and Standards Inspector, Senior are being..."
6,Senior Addiction Counselor,NYC Health + Hospitals,The Senior Addiction Counselor will be responsible for assisting the consumer with activities relevant to an individual's rehabilitation goals....
2,Cost Accountant III,Weatherford,JOB DESCRIPTION JOB SCOPE: This position will be responsible for the day to day understanding of the plant’s financial performance. The position will also be
21,Production Operator - 2nd shift,Bostik Inc.,About Bostik - Smart Adhesives. As a production operator at Bostik you will be in a batch making/mixer operator position for a competitive manufacturing...
4,Mid-Level Ground Control Station Engineer,GENERAL ATOMICS,Job ID# 6452BR Company General Atomics Aeronautical Systems Title Mid-Level Ground Control Station Engineer Job Category Engineering City San Diego State...
23,"Analyst, Operations",General Dynamics Information Technology,Extended Air Defense Simulation (EADSIM). Battle Command Sustainment Support System (BCS3). Air and Missile Defense Work Station (AMDWS)....
17,Banking Services Representative - Bakersfield,Rabobank,Knowledgeable regarding all bank products. Assists with reception and vault/merchant attendant duties. Ability to comprehend and interpret Bank policies and...
1,Marketing Science@Scale – Project Manager,Facebook,"The Marketing Science team is seeking a Project Manager who is passionate about making business operations, tools, and processes more efficient and effective...."
5,Environmental Specialist I,PeopleFirst Florida HR,"ENVIRONMENTAL SCIENTISTS AND SPECIALISTS, INCLUDING HEALTH. Knowledge of plant and animal living tissue, cells, organisms, and entities, including their..."
21,Manufacturing Assembler,Manufacturing Supplier,Ideal candidates will have some mechanical aptitude for assembling plastic or metal parts by hand. Advantage Resourcing is currently seeking Manufacturing...
8,Instructor I - PCT Job,SAIC,"SAIC is a premier technology integrator providing full life cycle services and solutions in the technical, engineering, intelligence, and enterprise information..."
19,Industrial Electrician,Novelis,"Novelis Corporation, the global leader in rolled aluminum and can recycling, has an opportunity at its Fairmont, WV plant for an experienced Industrial..."
11,Physical Therapist or Physical Therapy Assistant,Accelerated Rehabilitation Centers,Athletico is looking for a dedicated and compassionate Physical Therapist Assistant to provide a hands-on approach to rehabilitation....
22,Part Time Produce Clerk North Rock,Harris Teeter,"While performing the duties of this job, the associate constantly works in a cool environment with an average temperature range of 55-60 degrees Fahrenheit and..."
3,Junior Software Tester,"FEi Systems, Inc.","FEi Systems provides extensive IT services for multiple federal agencies and state governments in the areas of Medicare management, Health Information Exchanges..."
8,LANGUAGE ARTS TEACHER,Academy of Hope Adult PCS,"Bachelor's degree and secondary or adult education experience required. Teach a course load of at least 2 classes per day of adult literacy, basic education,..."
6,Juvenile Probation Officer - Court,Williamson County,Constant contact with juvenile offenders and their families. Performs complex social service work in interviewing and counseling....
22,Owner Operator CDL-A Truck Driver - Regional Dedicated Opportunities,NFI,"Class A CDL Owner Operators, NFI understands the reward of business ownership and the importance of a valued partnership. Class A CDL...."
22,Parts Specialist,Auto Plus Auto Parts,"Must maintain a clean and valid driver’s license in the state of operation. The candidate will complete cash balance sheets accurately, practice option and add..."
10,Mammography Technologist-Part Time-Days,Fauquier Health System,Must be able to utilize independent decision making skills in a wide variety of situations. 1+ years of experience as a registered technologist in the...
3,Support Technician,Verizon,Fiber Cust Support Analyst SI. The Fiber Customer Support Analyst will serve as the initial point of contact for provisioning and/or maintenance customer...
17,"Clerk, Front Desk (Great Beginnings)",La Clinica,"As a Clerk, working in a fast pace environment, some of your typical job responsibilities will include greeting, registering patients, verifying insurance..."
9,Play-by-Play Announcer,Pittsburgh Pirates,"This position is for a play-by-play announcer for the Pittsburgh Pirates. Plan, prepare, present and perform as a play-by-play announcer on Pirates television..."
20,Aquatic Scientist/Customer Service Manager,"Virginia Waters and Wetlands, Inc.",Required license or certification:. Valid driver’s license required. Commercial Herbicide Applicator License – Category 5A preferred• Arborist certificate - a...
2,Insurance and Financial Services Position - State Farm Agent Team Member (Sales experience preferred),Charles Robinson - State Farm Agent,"As a State Farm team member for Charles Robinson - State Farm Agent, you will build and develop customer relationships within the community to promote State..."
13,Restaurant Manager,Ashby Inn & Restaurant,"Fauquier County high-end restaurant, seeks professional restaurant/front-of-the-house manager. The right applicant must be tactful;..."
20,"Automotive Body Repairer, Fiberglass/Welder",The Logistics Company,The Repairer applies and spreads body filler manually to reestablish surface. Two years related experience. The Automobile Body Repairer mixes polyester resin...
3,"Network Deployment and Operations (NDO) Lead, Google Fiber, Midwest",Google,"Familiarity with other network transmission protocols and in-home network architecture. Ensure the best local network is designed, built, and maintained with..."
16,Rental Sales Agent,Sixt Rent a Car LLC,"The Rental Sales Agent is responsible for optimizing the rental experience by selling extras based on the customer’s needs, drafting rental agreements, and..."
19,Metal Mechanic,Spencer-Ogden Energy,"Distribute insulating materials evenly into small spaces within floors, ceilings, or walls, using blowers and hose attachments or cement mortar...."
22,Part Time 3rd Shift Stocker North Rock,Harris Teeter,"While performing the duties of this job, the associate is frequently exposed to wet, hot, or cold conditions and moving mechanical parts...."
4,CAD Drafter,Raytheon,"Architectural, mechanical, civil, security, structural, and electrical engineering. This drafter position is that of a contributor and will be in direct support..."
17,SCHEDULING/REGISTRATION REPRESENTATIVE II,Inova Fairfax Hospital,"Medical terminology class; Bachelors Degree = 2 years). Obtains medical case information including diagnosis(es), ICD-9 and CPT codes, anesthesia type, ordering..."
16,Warrenton - Sprint Store by Adcomm Digitel Wireless Retail Sales Associate,Sprint Store by Adcomm Digitel,Making outgoing calls to warm leads representing companies and individuals in the area. The Retail Sales Consultant will help to build business and develop....
1,Restaurant General Manager - Taco Bell,BurgerBusters Inc,"Valid Drivers' License. Key responsibilities include finding, hiring and developing Taco Bell Restaurant Team Members and Shift Leads, conducting new hire..."
17,Administrative Associate Round Rock TX,Dell,The Administrative Sr. Coordinates office functions with other departments. We are currently seeking an Administrative Sr....
13,Banquet Chef/Line Cook,Golf Course North Houston,"Preferred Banquet experience but not required. All kitchen staff must be able to cook high-quality balanced meals, cook from scratch and maintain proper food..."
3,"(CSITO) Close Support/Systems Administrator - Warrenton, VA Job",CACI International Inc,"Answer users' inquiries regarding computer software and hardware operation to resolve problems, including requirements originating from a field location...."
8,Talent and Workforce Skills Trainer,Shangri-La,Ø Education and Experience. Requires a basic understanding of alpha numeric filing. 1.3.2 Utilize multiple adult learning styles for maximum information...
22,Hiring Company Truck Drivers,Transport America,Company Truck Driver Benefits:. Transport America's fleet of company truck drivers is the best and most experienced on the road....
2,Claims Auditor,Broadpath,Medical Claims Auditors perform routine and complex audits to identify inaccurate claims adjudication. Knowledge of claims and the ability to recognize patterns...
16,Counter Manager,Stage Stores,"Scheduling, inviting by telephone and cards, displays at counter and throughout exchange. Maintain standards for counter cleanliness...."
4,Agricultural Engineer,Department Of Agriculture,"Or equivalent doctoral degree in Agricultural Engineering, Biological Engineering, or Agricultural and Biological Engineering...."
14,Custodian,Fauquier County Public Schools,"Checks play areas and around school building for trash, debris or hazards. Delivers copy paper to rooms. Empties trash receptacles and deposits collected refuse..."
15,Hair Stylist,Sport Clips - VA114,"We're interviewing motivated, positive, reliable, upbeat stylists to help grow and be one of our winning team members...."
16,Sales Associate,Petco,This role also involves completing cash register transactions as well as providing customer carry-out service....
13,Full Time Saute Cook,Claire's at the Depot Restaurant,"Must be able to execute recipes with consistency and accuracy in a busy kitchen. Claire's at the Depot, a fine dining restaurant located in Old Town Warrenton..."
10,Ophthalmic Technician,The Virginia Retina Center,Busy ophthalmic practice has an immediate opening for a full time Ophthalmic Technician. Applicant should have strong communication and interpersonal skills and...
19,Carpenter,Chicago Bridge & Iron Company,"Fits and nails sheathing on outer walls and roofs of buildings. Erects scaffolding for buildings and other structures and installs ladders, handrails, walkways,..."
22,Bus Driver,Fauquier County Public Schools,"Performs driving functions safely and efficiently in various weather conditions; Performs general maintenance tasks necessary to keep vehicles, equipment and..."
14,Greenskeeper,Heritage Palms Golf Club,*Summary* Assists in a general range of activities involved in golf course maintenance and construction. The individual should be able to perform semi-skilled
9,Animator,National Center for Missing & Exploited Children (NCMEC),"The Animator is responsible for designing and developing 2D and 3D content for web, television, interactive and print projects...."
22,CDL-A Truck Driver - Dedicated Runs,Marten Transport,"Our dedicated truck driving opportunities are open to drivers at least 22 years old with a current CDL-A, at least 1 year of recent OTR experience...."
13,Food Service Attendant,Riverside Health System,"Formal training as a cook preferred. Performs duties related to therapeutic diets and meal services to include, aides in the preparation of preparation of hot..."
22,PT Produce Associate,Food Lion,"Ability to analyze situations, identify problems and implement solutions. Ability to complete Computer Based Training (CBT) and Training Aid courses...."
1,"General Manager - Store 2705 - Warrenton, VA",Petco,"Responsible for handling cash counting, supervision of cashiers and cash register service to maximize customer service and minimize loss of assets...."
22,Regional CDL-A Company Truck Driver - Mid-Atlantic Region,Celadon Trucking Services,Celadon has a variety of regional truck driving jobs for those who want consistent miles and pay paired with frequent home time....
23,Intelligence Operations Specialist,Department of the Air Force,"Trains, educates, and tests aircrew on worldwide threats, to include surface-to-air missile (SAM), air-to-air missile (AAM), anti-aircraft artillery (AAA), and..."
3,Mid-Level Cyber Security Consultant ( IRS Clearance),Seneca Resources,"Level Cyber Security Consultant to support Cyber Security Program based in Reston, VA. Knowledge of security principles, best practices, conducting security..."
3,Information Systems Security Analyst,TASC,"Must be familiar with NIST Certification &amp; Accreditation (C&amp;A) processes, NIST policies and documents, NIST Risk Management Framework, Federal Information..."
1,Knight Transportion - Hiring Company Truck Drivers,Knight Transportation,We also pair each truck driver with a dedicated and caring driver manager who learns about your lifestyle and needs to help you find the trucking position that...
22,CDL-A Company Truck Drivers,Mesilla Valley Transportation East,"Mesilla Valley Transportation, a 48-state motor carrier, is now hiring company truck driving teams for OTR, Shuttle and Super Local runs...."
13,Evening Server,Denny's,"Looking for an individual with a positive attitude to provide friendly, fast, accurate service to guests dining in our restaurant...."
11,"MEDICAL ASSISTANT CLINIC- INOVA Cardiology Warrenton, VA",Inova Fairfax Hospital,Answering calls and providing pertinent information. Fulfills clerical responsibilities as assigned which may include:....
2,Athletics Business Manager,University of Indianapolis,"Interpersonal skills to work with internal groups (coaches, students-athletes, faculty, and staff) as well as external groups (officials, bus and rental car..."
9,Freelance Production Coordinator,"JPL Integrated Communications, Inc.","You will interact with talented Project Managers, Event Producers, Production Managers, Creative Directors, Graphic Artists, Editors, and so many others!..."
22,Railroad Openings- Now Hiring,JNI,*RAILROAD OPENINGS- NOW HIRING* *Trainees & Experience Welcome* *Call 205-536-7500 FOR IMMEDIATE ATTENTION* * Fireman/ Oiler – Forklift Operator…..$-23/HR *...
19,Heavy Equipment Operator,,"Must operate loaders, trucks, rollers, backhoes, mowers, graders, and other. Loads and unloads sand, dirt, asphalt, rock, and other materials as needed;..."
12,BORDER PATROL AGENT,Department Of Homeland Security,Border Patrol Sectors. And pass the Border Patrol Agent Entrance Examination. Being a border patrol agent makes you a valuable member of the federal Law...
11,Massage Therapist/Chiropractic Assistant,Physicians Plus Spine and Rehab Center,Chiropractic office is seeking a full time massage therapist/chiropractic assistant. This position offers great opportunity for the right person....
8,Assistant Teacher,Children of America,Has obtained a Child Development Associate credential (CDA) and meets the licensing requirements of the state in which they work....
18,Arborist Climber Trainee,Bartlett Tree Experts,The ideal candidate will have experience working on a tree crew as a Ground Man OR a 2/4 year degree in Forestry or a related field....
23,Cavalry Scout,National Guard,"Cavalry Scout training never really stops, though. This enables the officer to make informed decisions. As a Cavalry Scout, you are the eyes and ears of the..."
8,Assistant Professor,Oklahoma State University,"Applicants must have an appropriate earned doctorate in accounting, demonstrate instructional excellence, and be committed to active engagement in the life of..."
18,FORESTRY TECHNICIAN (TIMBER STAND IMPROVEMENT),Department Of Agriculture,USDA Forest Service. Forest Service Day Care facilities are not available. A career with the Forest Service will challenge you to manage and care for more than...
16,Sales Associate/Cashier (part-time),Bed Bath & Beyond,Currently hiring part time sales / cashiers / stock associates and bridal consultants. All shifts available....
1,Technical Training Manager Job,CACI International Inc,The desired candidate must apply technical knowledge and experience to continually monitor the current training objectives as well as provide intuitive input to...
9,TV Line Producer,zulily,"This will include partnering with various production companies to create new scripts, select footage and music and hire freela nce voice over artists...."
4,Continuity SME,Booz Allen Hamilton,"BS degree in Science, Mathematics, Engineering, or a related field. FEMA Continuity or Associate Business Continuity Professional (ABCP) or higher Certification..."
10,Family Practitioner,Fauquier Health System,Family Practitioner to provide the full spectrum of primary care. This position is for a BC/BEFamily Practitioner to join an outpatient-only practice with
7,Legal Analyst,CP Homes,"The role of the Legal Analyst is to support, manage and administer the day-to-day functions of a corporate legal department...."
7,District Court Clerk II - O'ahu,Hawaii State Judiciary,Authors the official court record in a court of limited jurisdiction for District Court trial proceedings  Prepares documents ordered by the court
17,Help Desk / Support Specialist,Raytheon,Provide on-demand and scheduled training to individuals and groups in the use of Maximo and other technical support tools....
22,Flight Attendant,Compass Airlines,Flight Attendant - LAX. One year previous flight attendant experience preferred The Flight Attendant will demonstrate the Compass Airlines' core values and…
20,HVAC Service Manager,AireServ - Bull City,"Pre-employment drug screening, background check and valid driver's license with a clean record. CFC Certification REQUIREDMINIMUM 5 years recent experience in..."
18,Lead Fish Technician,Hubbs-SeaWorld Research Institute,Hatchery building is a damp environment. Stay current with latest technologies related to fish rearing. Assist in all other aspects of fish husbandry as needed....
16,Sales Comfort Consultant,TLC Services LLC,Realize Your Maximum Potential And Income Possibilities. No overnight travel – Sell at the customer’s kitchen table on leads from the immediate area....
22,Class A CDL Flatbed Company Truck Driver,Builders Transportation Company,EXPERIENCED FLATBED COMPANY TRUCK DRIVING JOBS AT BTC. A flatbed truck driver with 2 years of experience can start off making 50 CPM or 29% Freight Revenue and...
1,Assistant Manager,Domino's,"Occasionally, pizza sauce weighing 30 pounds is carried from the storage room to the front of the store. If you like the thought of managing your own million..."
13,Restaurant General Manager,Taco Bell,"It is not all-inclusive, and a similar job at other Brands, Franchise or License locations may be different...."
4,Field Service Engineer / PLC / Machinery / service,Randstad Engineering,"Provide technical support to customers and field technicians to install and maintain equipment. Provide telephone support for installation, troubleshooting, and..."
7,Court Clerk IV - Pos. #292,St. Louis County Circuit Court,"Work is performed under the general supervision of a judge, circuit clerk, higher level court clerk and unit manager...."
16,Sales Associate,Stage Stores,"Interrupt store tasks to greet, assist, and answer questions for customers. Smile and greet each customer promptly...."
18,Mine Safety and Health Inspector (Coal),Department Of Labor,This position has promotion potential to GS-12 for Underground and Electrical Inspectors and the GS-11 for Surface Inspectors....
1,Dog and Cat Dept Manager,Petco,"Accountable for driving sales and for the overall effective operations within the area of dog and cat food, litter, supplies, toys, treats, rawhide, containment..."
17,Retail Banker/ Teller - Center,Woodforest National Bank,"WOODFOREST NATIONAL BANK. Performs opening, closing, and other branch servicing duties such as cash and vault balancing;..."
2,Earthwork Estimator/Project Manager,"Monomoy Services, Inc.",Ability to do earthwork analysis and pricing with some project management. Must have good communication and computer skills....
13,"Host - 7982 - West Lee Highway - Warrenton, VA (Warrenton, VA)",Applebee's,Our Hosts greet and seat all arriving guests and acknowledge all departing guests in a friendly manner and assist in maintaining the overall guest flow of the...
13,PT Quality Assurance Associate,Food Lion,Clean and organize the store mop room. Is courteous and helpful to customers. Ability to complete Computer Based Training (CBT) and Training Aid courses when...
23,Intelligence Analyst - Junior,"Streamline Defense, LLC","The Intelligence Analyst will perform intelligence analysis, analyst-driven data extraction and processing, dissemination of applicable reporting products, and..."
4,Mechanical Design Engineer,Hydra-Electric Company,Formulate conceptual design of aeronautical or aerospace products or systems to meet customer requirements. The Candidate will be responsible for product design...
22,Regional / OTR Class A CDL Truck Driver,Marten Transport,Then now is the time for experienced Class-A CDL truck drivers who want Regional and OTR runs to join Marten!...
19,Lead Carpenter,Genesis Home Improvement,"Required license or certification:. Have a driver’s license and reliable transportation. Must have own tools. Utilize chisels, planes, saws, drills, and sanders..."
16,Customer Service Representative,We Insure Group,Our agents have access to over 100 Top Partner Companies and one of the best service and support personnel in the business....
11,Certified Nursing Assistant,"Quadrant, Inc.",Must have a valid License. Certified Nursing Assistant. Cleaning resident's rooms. Has an immediate need for a CNA for a Major Medical Facility located in...
12,Chief of Police,City of Andrews,"The department consists of 19 sworn peace officers, 9 full-time paramedics, an Animal Warden and Executive Assistant, with combined budgets totaling over $3M...."
16,Sales Associate,Lands' End,"Including courteously, conversationally greeting customers, adjusting individual customer attention based on store traffic, suggesting solutions based on..."
7,Paralegal Specialist,Department Of Justice,Specialized experience is defined as experience performing paralegal or legal work which demonstrates a basic knowledge of legal research and the ability to...
12,Surveillance Officer Full Time,Harrah's Ak-Chin,"The Surveillance Officer assures the overall safety of guests, employees and the property as a whole. Conducts surveillance observation on designated areas both..."
