job_field_id,title,company,description
21,Production Operator - 2nd shift,Bostik Inc.,About Bostik - Smart Adhesives. As a production operator at Bostik you will be in a batch making/mixer operator position for a competitive manufacturing...
6,Senior Addiction Counselor,NYC Health + Hospitals,The Senior Addiction Counselor will be responsible for assisting the consumer with activities relevant to an individual's rehabilitation goals....
14,Janitor - Cleaning Technician - FULL TIME - 84095,Wingfoot Services,"Janitorial, janitor, cleaning specialist, carpet cleaning, floor care technician, buffing, part time, supplemental income, laborers, landscaping, supervisor,..."
20,HVAC Installer/Technician,Express Air Sytems,Basic knowledge of standard code requirements of air conditioning systems. \*\*\*\*\*Minimum requirements for Installers\*\*\*\*\*....
13,Kitchen Cook,SMG World - Tucson Convention Center,Banquet facility preparing meals for large events:. Fulfilling the service per each Banquet Event Orders (BEO)....
15,Lobby Concierge,Beach Activities of Maui,"The Concierge is knowledgeable about the local area and is the expert on the attractions, tours and activities that we sell.Must be flexible with scheduling and..."
11,2 Med/Peds Certified Nursing Assistant,Riverside Medical Center,Reports changes in patients' condition to the professional nurse. The 2 Med/Peds Certified Nursing Assitant (CNA) assists with the care of patients ranging from...
18,Agricultural & Standards Inspector - I,Placer County,"Recruitments for Agricultural and Standards Inspector I, Agricultural and Standards Inspector II, and Agricultural and Standards Inspector, Senior are being..."
10,Anesthesiologist,"UF, Department of Anesthesiology","Department anesthesiologists practice at UF Health hospitals in Gainesville, FL at the University of Florida alongside 62 faculty anesthesiologists, 78..."
17,Telephone Operator,The Broadmoor,"Monitors 911 Alert System. Operates the switchboard to relay incoming, outgoing, and interoffice calls by performing the following duties:...."
2,Cost Accountant III,Weatherford,JOB DESCRIPTION JOB SCOPE: This position will be responsible for the day to day understanding of the plant’s financial performance. The position will also be
1,Regional Marketing Manager,Vishay,Develops a formal marketing plan outlining an appropriate marketing strategy for selling to key accounts. Coordinates the marketing efforts for a product group....
23,"Analyst, Operations",General Dynamics Information Technology,Extended Air Defense Simulation (EADSIM). Battle Command Sustainment Support System (BCS3). Air and Missile Defense Work Station (AMDWS)....
7,Administrative Law Judge,New Mexico State Personnel Office,"Administrative Law Judge, Adjudicator Advanced. This position will conduct administrative hearings on behalf of the State Personnel Board concerning..."
4,Mid-Level Ground Control Station Engineer,GENERAL ATOMICS,Job ID# 6452BR Company General Atomics Aeronautical Systems Title Mid-Level Ground Control Station Engineer Job Category Engineering City San Diego State...
22,Air Traffic Control Operator,National Guard,The skills you learn as an Air Traffic Control Operator will qualify you to work in civilian air traffic control towers and centers at airports and airfields....
9,Graphic Artist,IGT,"Maya, Autodesk 3D Studio Max). This position is the development and timely delivery of high quality 2D and 3D game...."
12,Transportation Security Officer (TSO),Trinity Technology Group,TSOs must take the computerized Screener Assessment Battery. Repeatedly lift and carry baggage weighing up to 70 pounds…
16,Digital Sales Account Executive,The Morning Call Media Group,"Manages advertising sales revenue and account management targets. Our digital sales account executives are responsible for selling advertising banners, programs..."
19,Drywall Hanger/Installer,EncoreHR Staffing,"Includes lathers who fasten wooden, metal, or rockboard lath to walls, ceilings or partitions of buildings to provide support base for plaster, fire-proofing,..."
5,NATURAL RESOURCES PROGRAM TECHNICIAN,Arkansas Game & Fish Commission,"Knowledge of agricultural methods and basic land laws. Conducts agricultural and forest management activities on wildlife management areas, including preparing..."
3,Data Scientist,Humana,"Bachelor’s Degree in Mathematics, Computer Science, Actuarial Science or related field. Collaborate with other professionals including Actuaries, Mathematicians..."
8,Tutor or Teacher - Elementary Math,,"We are looking for math tutoring for our 4th grader. Improve grades, get ahead and increase confidence. Elementary math Tutoring &amp; Teaching opportunities..."
17,Hotel Front Desk Receptionist,HOLIDAY INN EXPRESS AND SUITES,No phone calls. Processing payment from Guests. Responding to Guests request for assistance and information about the local area (i.e....
22,CDL Class A Drivers wanted Immediately!,"Champion Materials, Inc.","Now hiring CDL Class A Truck Drivers to haul bulk cement products across the Northeast, Mid Atlantic region, and Ontario...."
10,Surgical Technologist - Operating Room (OR),Accountable Healthcare Staffing,"Certified Surgical Tech needed; Operating Room Tech. Will work 4 ten hour weekdays with on-call evenings, weekends, holidays;..."
3,Support Technician,Verizon,Fiber Cust Support Analyst SI. The Fiber Customer Support Analyst will serve as the initial point of contact for provisioning and/or maintenance customer...
2,Entry Level Quality Assurance Analyst,National Software Management,"*Entry Level Quality Assurance Analyst* Under direct supervision, the Quality Assurance Analyst verifies that software changes submitted by developers"
15,Beauty Advisor,Stage Stores,Develop relationships with customers to insure future sales. Polite and courteous to customers and co-workers....
8,Teacher- Spanish (Part-Time),Fauquier County Public Schools,"Plans, coordinates, attends, and chaperones field trips as appropriate. Motivates students to develop an interest in and an appreciation of language (French and..."
10,Nursing Supervisor-FHRNC-Full Time Evenings-Mon-Fri,Fauquier Health System,Current Virginia State RN License. The Nursing Supervisor provides direction and supervision to staff to ascertain delivery of effective high quality patient...
10,"Dental Hygienist, Warrenton, VA","Heartland Dental, LLC",Valid Dental Hygienist license in the state for which you apply. Potentially out of state. Applying fluorides and other cavity preventing agents to prevent...
9,Sports Broadcaster (Basketball),The College of St. Scholastica,"To serve as play-by-play announcers, analysts, and commentators at home basketball games streamed over the Internet...."
8,Assistant Professor,Oklahoma State University,"Applicants must have an appropriate earned doctorate in accounting, demonstrate instructional excellence, and be committed to active engagement in the life of..."
17,Medical Office Asst VA,Novant Health,Graduate of an accredited medical assistant program preferred. The team member's number one job responsibility is to deliver the most remarkable patient...
4,Design Engineer Intern,Bohler Engineering,"Bohler Engineering is an equal opportunity employer and affords equal opportunity to all applicants and employees for all positions without regard to race,..."
2,Claims Auditor,Broadpath,Medical Claims Auditors perform routine and complex audits to identify inaccurate claims adjudication. Knowledge of claims and the ability to recognize patterns...
16,Cashier,Stores - Kmart Hourly,"Responsible for providing excellent customer service, efficiently and accurately completing sales and service transactions at the cash wraps, as well as handle..."
2,Business Operations Associate/Sr. Associate,Lending Club,"You’re both comfortable conversing with our front-line agents to truly understand how our operations work, as well as making a convincing case to our executive..."
10,"Technician, Surgical Services-PRN",Fauquier Health System,Completed a formal Surgical Technician program with certification or equivalent training. The Surgical Services Technician assists with the total care given by...
13,Cook-Full-Time-Hours Evenings 12p-8p,Fauquier Health System,Ability to perform complex math calculations and verify cash handling and reporting. The Cook prepares food items needed for meal service using institutional...
16,Keyholder - Commissioned - Northrock Shopping Center,Jos. A Bank,"Understanding merchandise features, marking and fitting techniques and fashion trends to determine what type of garments are desired and advise customers about..."
5,Animal Care Supervisor,University of Colorado,"Animal Facility, implementing the animal care procedures and policies. Care for a variety of species of small laboratory animals used by scientists...."
6,Juvenile Probation Officer - Court,Williamson County,Constant contact with juvenile offenders and their families. Performs complex social service work in interviewing and counseling....
12,Security Guard,Bannerman,"Bannerman is looking for professional security guards, and bouncers. Must be self disciplined with a high level of customer service and professionalism...."
1,Assistant Manager - Commissioned - Northrock Shopping Center,Jos. A Bank,Ensure all customer complaints are resolved immediately or as soon as possible if not remedied during store visit.Handle all Company assets according to...
10,Health Technician,Department of Veterans Affairs,Assists the audiologist in various procedures of the program including:. Utilizes electro-acoustical diagnostic equipment to assess the electronic functioning...
8,Toddler Teacher,Children of America,Has experience with two year olds and state credentials and MUST have the state required registry.*. This approach concentrates on allowing each child to learn...
3,Network Controller with TS + Clearance,ManTech International Corporation,"Requires Bachelor’s degree (in Computer Science, Math or Engineering) or equivalent, and zero to two years of related experience...."
17,Clinical & Secretarial Services Technician-ER-Part Time-Days,Fauquier Health System,"The Clinical &amp; Secretarial Services Technician also coordinates the activities of the department through communication, requisitioning and management of..."
6,Staff Development Coordinator,Sayre Christain Village,"Conductscertification or training programs for Nursing Assistants. Frequentlycommunicates with employees, residents, family members, physicians etc...."
17,"Clerk, Front Desk (Great Beginnings)",La Clinica,"As a Clerk, working in a fast pace environment, some of your typical job responsibilities will include greeting, registering patients, verifying insurance..."
3,Configuration Manager/Specialist,ManTech International Corporation,An additional four years of relevant technical experience may be substituted for the Bachelor’s Degree....
15,Funeral Attendant,Service Corporation International,"The Funeral Attendant will set-up and assist with viewings, funeral services, memorial services, etc. Performs a variety of tasks during funerals and..."
10,Mammography Technologist-Part Time-Days,Fauquier Health System,Must be able to utilize independent decision making skills in a wide variety of situations. 1+ years of experience as a registered technologist in the...
17,Administrative Assistant to the Provost/Vice President of Academic Affairs,East Central University,"The Administrative Assistant coordinates the Provost’s appointments and travel arrangements. East Central University invites applications for a twelve-month,..."
7,Law Clerk,Colorado Office of the State Court Administrator,"There is an immediate opening for a law clerk in the 19th Judicial District. Judicial Branch Overview. Responsibilities of this position include legal research,..."
1,Assistant Restaurant Manager,Dunkin' Donuts,Holds the guest as their highest priority and role models exceptional guest service. Manages cash over/short through effective cash control procedures....
8,Basic Skills/Learning Center Non-Credit Instructor,North Orange County Community College District,"Teach pre-college courses in class and lab settings including, but not limited to, adult basic education (ABE), career technical education, adult secondary..."
22,Owner Operator CDL-A Truck Driver - Regional Dedicated Opportunities,NFI,"Class A CDL Owner Operators, NFI understands the reward of business ownership and the importance of a valued partnership. Class A CDL...."
11,School Nutrition Worker,Fauquier County Public Schools,"The omission of specific duties does not exclude them from the position if the work is similar, related, or a logical assignment to the position.)...."
14,Maintenance,McDonalds,"A self starting individual in charge of general cleanliness of the restaurant, to include windows, floors, restrooms, dining room, parking lot, filtering vats..."
22,Bus Driver,Fauquier County Public Schools,"Performs driving functions safely and efficiently in various weather conditions; Performs general maintenance tasks necessary to keep vehicles, equipment and..."
15,Dog Walker/Pet Sitter,Tina Pet Services,"You have to love animals, and feel comfortable around them.:. First impressions are important, so be sure to let your personality come through in your initial..."
15,Barber,GoodBuddyz BarberShop,Chairs available for registered and apprentice barbers at 3-chain barbershop. Build your own clientele or bring your own....
13,Bartender - Toms River Chili's,Chili's,"You know how to manage the back bar. Providing an enjoyable bar experience for every Guest. A duck walks into a bar and – oh, wait...."
14,Custodian/Freight Associate,Stage Stores,"Assist freight carrier driver with properly staging cartons by colored label. Clean restrooms, store entrance, associate break room, Team-One area and fitting..."
19,Lead Carpenter,Genesis Home Improvement,"Required license or certification:. Have a driver’s license and reliable transportation. Must have own tools. Utilize chisels, planes, saws, drills, and sanders..."
23,Range Operations Specialist (PD D1134000),Department of the Army,"Officer, Not to Exceed O-3/ CPT, Warrant, Enlisted. Small arms, mortars and field artillery rockets or cannons...."
5,Public Health Specialist III,State of Oklahoma,"A bachelor’s degree with a major in public health, environmental health, environmental science, physical science, natural science, biological science,..."
17,Office Manager,Titan Restoration,"Responsibilities include but are not limited to managing the day to day functions of the office, prescreening and interviewing all applicants for office..."
8,"TUTORS - Academic Center for Excellence - Fauquier Campus, Vint Hill Site",Lord Fairfax Community College,Completed LFCC faculty recommendation form(s) for each desired course to tutor OR documented evidence of tutoring/instructional experience in an academic...
19,Carpenter,Chicago Bridge & Iron Company,"Fits and nails sheathing on outer walls and roofs of buildings. Erects scaffolding for buildings and other structures and installs ladders, handrails, walkways,..."
10,Veterinary Technician,Middleburg Humane Foundation,Veterinary Technician will be responsible for overseeing medical care of shelter animals. PT Veterinary Technician/Assistant (license preferred) needed at the...
14,Custodian,Fauquier County Public Schools,"Checks play areas and around school building for trash, debris or hazards. Delivers copy paper to rooms. Empties trash receptacles and deposits collected refuse..."
13,PT Frozen Food/Dairy Associate,Food Lion,Provide total customer satisfaction. Ability to complete Computer Based Training (CBT) and Training Aid courses....
20,Chrysler Certified Automotive Technician,SAFFORD AUTOMOTIVE GROUP,"The technician must understand, stays abreast of, and comply with federal, state, and local regulations such as hazardous waste disposal, OSHA Right-to-Know,..."
21,eCommerce Fulfillment Associate,Stage Stores,Willingness to consult multiple resources to obtain answers. Troubleshoot and problem solve when necessary....
9,TV Line Producer,zulily,"This will include partnering with various production companies to create new scripts, select footage and music and hire freela nce voice over artists...."
13,$10.00 Hr Dishwasher,Ruby Tuesday,As soon as you join the team you'll notice the friendly working environment and the variety of experience that comes with working at Ruby Tuesday.Apply at:....
10,Cardiologist,U.S. Navy Reserve,*Cardiologist NEEDED* for part-time in Navy Reserve! Currently *1 position* open Nationwide! Your Benefits: * $75K Sign-on Bonus * All pay and allowances of
11,Health Center Associate - Mobile,Planned Parenthood Southeast,Documents ultrasound in medical record. Assures lobby is neat and orderly throughout the day Explains medical tests and procedures and obtain informed consent...
2,Account Manager / Estimator,Five Star Painting - Manassas,Be available to answer any questions regarding the job while the project is in progress. Use the proper tools to estimate the job accurately....
21,Shop Assembly and Fabrication,Western Window Systems,*Western Window Systems* is one of the fastest growing and most successful Window Manufacturing Companies in the nation. *Overview* The Warehouse Shop
1,Store Manager (or Manager in Training) - Northrock Shopping Center,Jos. A Bank,"They are effective communicators and interact professionally whether they are assisting customers with issue resolution, coaching associates on selling..."
2,Analyst,Employment Enterprises Inc.,"Temporary Solutions is currently seeking an Analyst for a position in Warrenton, Virginia. We would ideally like someone with a property insurance background...."
17,Inpatient Medical Records Coder II-Part Time,Fauquier Health System,"Registered Health Information Administrator certification(RHIA), or Registered Health Information Technician certification(RHIT), or Certified Coding Specialist..."
17,Reimbursement Specialist,WRB Communications,Complete accurate entry of billing information to ensure timely payment and avoid delay in patient therapy....
5,Veterinary Medical Officer,Department Of Agriculture,"Masters degree in an area of specialization, including but not limited to, animal science, avian medicine, food safety, infectious diseases, veterinary clinical..."
1,Management,Panera Bread Franchise (Blue Ridge Bread),Our bakery-cafes are focused on taking care of our guests. Please apply online and a Manager may be in touch if an opportunity matching your qualifications...
18,FORESTRY TECHNICIAN (TIMBER STAND IMPROVEMENT),Department Of Agriculture,USDA Forest Service. Forest Service Day Care facilities are not available. A career with the Forest Service will challenge you to manage and care for more than...
22,CDL-A Company Truck Drivers,Purdy Brothers Trucking,We offer a better driving career by asking YOU what you need and then doing whatever we can to meet those needs....
16,Clerk\Cashier,CVS Health,"Answer the telephone using the appropriate greeting. Operate a cash register including cash transactions, checks, charges...."
2,Senior Staff Accountant,MFA Oil Co.,Summary of Responsibilities: Job Responsibilities include but are not limited to: Ensuring the integrity of the general ledger and financial statements
7,Legal Analyst,CP Homes,"The role of the Legal Analyst is to support, manage and administer the day-to-day functions of a corporate legal department...."
16,Sales and Service Associate,Staples,Develop and sell a Total Solution to address customers’ immediate and ongoing needs through the Omni Kiosk. This person will own all Omni Channel and shipping...
22,Class A CDL Company Truck Driver (Teams),Super Service,"Super Service has dedicated team truck driving jobs available for drivers who live within a 50 mile radius of Tupelo, MS, Georgetown, KY, and San Antonio and..."
6,School Psychologist-Full Time-Warrenton Virginia-Upcoming School Year,ProCare Therapy,"School Psychologists will need to be able to work with and provide services including, but not limited to performing assessments and evaluations...."
14,Pest Route Technician,Ecolab,"Previous pest elimination industry or route experience preferred &quot;Certified Pest Control Technician, Commercial Pest Control Technician, Exterminator, Pest..."
2,"Commercial Account Manager - Bealeton, VA",Advance Auto Parts,"Valid Drivers License and ability to meet our MVR Requirements. State of the Art Technology- laptop, CRM software, BlackBerry...."
11,CNA - Certified Nursing Assistant,Oak Springs of Warrenton,Seeking Licensed CNA's for all shifts. Participate in assessments and development of treatment plans. Full or Part Time shifts are available to provide direct...
13,Cook - PRN - Hours vary,Fauquier Health System,"SERVE SAFE certification. Course work/completion from an accredited culinary school. In the absence of the team leader, the cook will supervise the operations..."
20,Cabling Tech/WAP Installer,Airlie,"Must have own tools. Low voltage cabling contractor needed. Experience with installation of copper voice , data cable and Wireless Access Point installs...."
13,Pizza Hut Delivery Driver,Pizza Hut,"You’ll also need a valid driver’s license, insurance and reliable vehicle. That’s right, we’ll pay you to cruise around in your mobile office – your car –..."
19,Carpenter Assistant,Genesis Home Improvement,"Required license or certification:. Entry level or 1+ years of experience in the construction field, willing to train the right candidate...."
11,Residential Care Aide,Westminster Village.Spanish Fort AL,RESIDENTIAL CARE AIDE*. Must be registered and in good standing with the Alabama Nurse Aide Registry or currently enlisted in an approved nursing assistant...
2,"Account Executive - Norfolk/Virginia Beach - Base salary, commission, car allowance, tuiton",Western Union,"Together with our Agents, we speak our consumers' languages and live in our consumers' neighborhoods. Maximize same store sales, selling new services and..."
20,Heavy Equipment Shop Technician,"Carter Machinery Co., Inc.","This position is responsible for diagnosing problems, performing repairs, reconditioning and servicing heavy equipment and components in a shop environment...."
20,Photo Lab Technician,CVS Health,Follow Federal and State laws and OSHA regulations. Actively participate in the Photo Lab Training and Certification Program by certifying in all necessary...
8,Substitute,Bright Horizons Family Solutions,"Individual state and center requirements may apply. Bright Horizons offers an excellent benefits package including a competitive salary, career path..."
9,Audio/Video Installer,Wilshire Media Systems Inc,"Wilshire Media System’s is Southern California’s premier source for home theater, high performance audio, home automation and lighting control...."
10,Staff Nurse,South Shore Medical Center,Provide quality care to South Shore Medical Center patients. Administer prescribed medications and treatments. Prepare patient for office visit. Respond to
8,Assistant Teacher,Children of America,Has obtained a Child Development Associate credential (CDA) and meets the licensing requirements of the state in which they work....
4,Mechanical Design Engineer,Hydra-Electric Company,Formulate conceptual design of aeronautical or aerospace products or systems to meet customer requirements. The Candidate will be responsible for product design...
23,Logistics Management Specialist,Department of the Air Force,"Determines type &amp; number of aircraft required for mission deployment/redeployment. Identifies problems/discrepancies to Logistics Officer, unit, &amp; higher..."
1,Store Manager,Stage Stores,"Work with district manager to develop and execute plans for store to improve profitability, greater productivity and efficiency...."
16,VA Customer Service Representative,Family Dollar,"Key priorities include greeting customers, assisting them with selection of merchandise, completing transactions, and answering questions regarding the store..."
16,Sales Representative,Verizon,Analyze customer needs and present value-added solutions Inspire and excite customers about how our solutions can impact their lives Ensure that our customers...
12,Firefighter-2016,City of Mesquite,"Possession of or ability to obtain certification/licensing as an Arson Investigator and Peace Officer, as assigned...."
4,Production Technician,SERVPRO of Culpeper & Fauquier Counties,A valid driver's license with a clean driving record.. Develop production expertise:. Having a cell phone that can be reached at all times to respond to...
10,Hospitalist- NP/PA,Virginia Emergency Medicine Associates,A minimum of one year of post-grad clinical experience in hospital medicine• Valid Virginia license • Current ACLS/BLS certificates through AHA• Ability to...
13,Dishwasher and Busser,Jefferson Manor Health & Rehab,This is a full time dishwasher position in a nursing home facility. Prior experience preferred but not required....
16,Salesperson,Sheetz,"Ring accurate register transactions. The perfect fit for our Sheetz team would be someone who is people oriented, self-motivated, dependable, able to work..."
23,Flight Support,U.S. Navy,"Operate and maintain hydraulic and steam catapults to launch aircraft. As an Officer, you can expect to:. Instead, she refuels fighter jets on aircraft carriers..."
16,Retail Merchandiser - Warrenton/Culpeper/Marshall - VA,The Pet Firm,"Attend training calls; Implement and reset planograms, test planograms, IRC's point of sale materials,. Our expertise in the pet industry gives our vendor..."
11,Physical Therapy Aide,All Star Physical Therapy,Responsibilities include: setting up treatment areas cleaning up following treatment sessions aiding physical therapist during patient sessions Job Type:
