job_field_id,title,company,description
11,Massage Therapist/Chiropractic Assistant,Physicians Plus Spine and Rehab Center,Chiropractic office is seeking a full time massage therapist/chiropractic assistant. This position offers great opportunity for the right person....
2,Seasonal Tax Preparer,Jackson Hewitt,"Jackson Hewitt is seeking a seasonal Tax Preparer to perform a variety of activities related to income tax preparation, sales and the delivery of excellent..."
11,DENTAL ASSISTANT,Department of Veterans Affairs,Dental Assistant/ Functional Statement. Sets up operatory for planned dental procedure and cleans dental unit for timely turnover....
11,"MEDICAL ASSISTANT CLINIC- INOVA Cardiology Warrenton, VA",Inova Fairfax Hospital,Answering calls and providing pertinent information. Fulfills clerical responsibilities as assigned which may include:....
17,Retail Store Shift Supervisor,CVS Health,Ensure compliance with all company policies and procedures (such as cash management) and federal and state....
22,Class A CDL Company Truck Drivers,First Fleet,Drivers at FirstFleet enjoy a full set of online tools to manage their employment experience. We are proud to employ and recognize individuals who demonstrate...
13,Experienced Culinary Professionals,The Orlean Market,Local Market/Restaurant is rapidly changing! We are in search of experienced and responsible culinary professionals who want to be a part of our unique and
3,Senior Certified Security Analyst,Kforce,"Coordinate with applicable stakeholders to develop security event remediation strategies and timelines. Engineering, Math, or Science Degree...."
13,Pizza Hut Server,Pizza Hut,"It’s about being independent and having fun, making new friends and earning extra cash. And independently-owned franchised or licensed locations may have..."
12,Security Operations Manager,Google,You believe that providing effective security doesn't come at the expense of customer service - you will be our bodyguard (and our long lost pal)....
8,Instructor I - PCT Job,SAIC,"SAIC is a premier technology integrator providing full life cycle services and solutions in the technical, engineering, intelligence, and enterprise information..."
13,Chef de Cuisine,Claire's at the Depot Restaurant,"Must be detail oriented and proficient in a high volume kitchen. Claire's at the Depot, a fine dining restaurant located in historic Old Town Warrenton, is..."
17,Teller,The Fauquier Bank,"Accepts deposits, loan payments, credit card deposits and payments. Job requires a higher level of problem solving abilities to find solutions to difficult..."
14,Housekeeping Staff (Part-Time),Poplar Springs Inn & Spa,"Poplar Springs - 21 Room Inn, Fine Dining Restaurant and full service Spa is seeking cleaning staff to perform general housekeeping duties to include, but not..."
2,Marketing Internship Latin America,Cosmetics of France,Provide customer service to the agent zone in terms of material &amp information needed for events trough com. Consolidate and update the Local Makeup Experts &amp
4,Mechanical Engineer,GENERAL ATOMICS,Works with multiple interdisciplinary groups to transition equipment and processes from an engineering stage to repeatable productionized processes....
13,Catering Coordinator,Panera Bread Franchise (Blue Ridge Bread),Our bakery-cafes are focused on taking care of our guests. Must Have Own Vehicle. Perfect Driving Record. Please apply online and a Manager may be in touch if...
13,Restaurant Manager,Denny's-Little Apple Properties,"Must have the ability to work a flexible and-or irregular schedule. Individual will manage a sit-down restaurant wit daily operations including recruiting,..."
2,Junior-Staff Accountant,Poplar Springs Inn and Spa,"Prepared recurring tax reports and other filings, to include sales and occupancy tax returns, personal property tax returns, business license applications..."
20,MAINTENANCE MECHANIC,United States Postal Service,"United States Postal Service External Publication for Job Posting 94976393 If this job requires qualification on an examination, the number of applicants who"
18,Arborist Climber,Bartlett Tree Expert Co.,"Having a CDL is. Assists with driving, backing, dumping, and parking duties. Strives to improve job skills and develop the potential for upward mobility...."
14,Housekeeping/Laundry Aide,Safire Care,"Description Position: Housekeeping/Laundry Aide Hours: FT, PT Available Shift: Day and Evening Shifts Sheridan Manor provides a range of services,"
17,Administrative Associate Round Rock TX,Dell,The Administrative Sr. Coordinates office functions with other departments. We are currently seeking an Administrative Sr....
17,Department Supervisor,The Home Depot,"Specific store departments may include Building Materials, Décor, Electrical, Flooring, Gardening, Hardware, Kitchen &amp; Bath, Lumber, Millwork, Paint, Plumbing,..."
16,Detailer,Frito Lay,The Part-Time Detailer is a part-time position that is responsible for merchandising Frito-Lay's complete line of quality products to existing accounts while...
16,Sales Representative,Cantium Sports,ADVERTISING SALES - Connect Golf Courses &amp Local Businesses*. NO Florida state sales tax!*. Manage ad space &amp cost to meet sales goal*.…
21,Manufacturing Assembler,Manufacturing Supplier,Ideal candidates will have some mechanical aptitude for assembling plastic or metal parts by hand. Advantage Resourcing is currently seeking Manufacturing...
1,Restaurant Shift Manager - Taco Bell,BurgerBusters Inc,"Valid Drivers' License. Following cash, security, inventory and labor policies and procedures. Solving customer complaints quickly and with a smile...."
18,Farm Worker,Meadowview Farms,We are looking for an independent employee with leadership and problem solving skills for our grain and cattle operation....
4,Architectural Drafter,Glen & Co Architecture,We are a dynamic architectural and design group working on hotels and restaurants looking for an architect who can prepare construction documents and...
20,Custom Window Treatment Installer,Budget Blinds of Warrenton,Valid drivers and a good driving record. No phone calls please!!! Time Management You must have a good driving record and are able to navigate your way from...
19,Plumber,Los Angeles Unified School District,A Los Angeles City Journeyman Plumber License OR a Los Angeles County Certificate of Registration as a Journeyman Plumber....
22,Decker is Hiring CDL A Company Drivers Now,Decker,Class A CDL. Decker offers great pay and the best equipment as a truck driver to help you get more miles and more money in your job....
20,Plant Maintenance Mechanic - Night Shift,Vulcan Materials Company," Diagnose problems and perform mechanical repair. Assists plant personnel with repair and maintenance. Mechanical repairs to various types of crushers, screens..."
3,Senior II Security Analyst,Kforce,"Engineering, Math, or Science degree or equivalent. Contractor counterpart to FAA cyber operations manager...."
16,Team Member (Part-Time)0820,Jo-Ann Stores,May use 2-way radios (hear incoming messages and provide verbal response). Processes customer transactions in an efficient and friendly manner at the cash...
17,Office/Store Support,The Home Depot,"Facilitating the maintenance and repair of certain computer system related equipment such as cash registers, scanners, scan guns, monitors, signature capture..."
12,Chief of Police,City of Andrews,"The department consists of 19 sworn peace officers, 9 full-time paramedics, an Animal Warden and Executive Assistant, with combined budgets totaling over $3M...."
5,Physical Science Technician,Department Of Agriculture,The Functional Foods Research Unit creates new processing technologies to enhance the performance of agricultural materials in existing applications and...
16,Retail Merchandiser- Part Time,TNG Retail Services,"Or person’s looking for permanent part time work. Clients' products, developing strong relationships with store personnel, accurately reporting time worked,..."
19,Metal Mechanic,Spencer-Ogden Energy,"Distribute insulating materials evenly into small spaces within floors, ceilings, or walls, using blowers and hose attachments or cement mortar...."
13,Part Time Starbucks Clerk Northrock Shopping Center,Harris Teeter,"Must be IST or AST certified. Exposed to hot, cool, and extreme cold, moving mechanical parts, fumes or airborne particles, and toxic or caustic chemicals...."
6,Social Worker-MSW-PRN Weekday & Weekends,Fauquier Health System,Masters of Science in Social Work. Experience in health–related field or setting. The Social Worker-MSW provides general social work services and participates...
10,Ophthalmic Technician,The Virginia Retina Center,Busy ophthalmic practice has an immediate opening for a full time Ophthalmic Technician. Applicant should have strong communication and interpersonal skills and...
13,Cook - Banquet Kitchen,Hilton Hotels & Resorts,Banquets and Catering. A Cook with Hilton Hotels and Resorts is responsible for preparing food items in accordance with recipes and established standards....
17,Shift Leader,Dunkin' Donuts,Holds the guest as their highest priority and role models exceptional guest service. Acknowledges all guests with a friendly smile and is highly responsive to...
13,Line Cook/Prep Cook,Poplar Springs Inn and Spa,Looking for someone passionate about food and wants to learn or is already seasoned in the kitchen. Poplar Springs is making exciting food!!!...
3,Senior IT Support Specialist,Greystone,"Strong technical knowledge of MS Windows, desktop support and PC hardware, setup and configuration - People management experience and demonstrated leadership..."
1,Sr. Assistant Store Manager,Stage Stores,"Work with Store Manager and District Manager to develop and execute plans for store to improve profitability, greater productivity and efficiency...."
10,"Biometric Screener - Warrenton, VA",Provant,"Medical license or certification required. Provant Health Solutions hires individuals on a contract/per diem basis, provides excellent hourly wages, and further..."
16,PT Grocery Associate,Food Lion,Provide quality customer service to our customers through the Grocery Department. Engage and interact with customers to create a positive shopping experience....
15,Pet Stylist (Dog Groomer) - Apprentice,Petco,"To receive technical training from Petco’s Professional Pet Stylist Program. We’re making things better for pets, people and the planet through our Think..."
22,Regional / OTR Class A CDL Truck Driver,Marten Transport,Then now is the time for experienced Class-A CDL truck drivers who want Regional and OTR runs to join Marten!...
22,CDL-A Truck Driver - Dedicated Runs,Marten Transport,"Our dedicated truck driving opportunities are open to drivers at least 22 years old with a current CDL-A, at least 1 year of recent OTR experience...."
22,"Traffic Control Specialist - Flagger - Warrenton, VA",Area Wide Protective,Must possess a valid driver's license and maintain an acceptable driving record by complying with standards established by AWP policy....
18,Log Yard Scaler,Church & Church Lumber Company,Must be experienced with running equipment such as a log loader. Good people person with management and communication skills....
9,Freelance Production Coordinator,"JPL Integrated Communications, Inc.","You will interact with talented Project Managers, Event Producers, Production Managers, Creative Directors, Graphic Artists, Editors, and so many others!..."
17,Bookkeeping Clerk,John Q. Hammons Hotels & Resorts,"Must have 1-2 years in accounting , customer service and/or bookkeeping experience or equivalent. Perform any combination of routine calculating, posting, and..."
16,Customer Service/Deliveries,The Home Depot,"A valid drivers license and proof of insurance is required for driving. Whether directing customers to store departments or merchandise, answering customer..."
1,District Executive,Boy Scouts of America,Achieve net income and participation objectives for assigned camps and activities. Bachelor's degree from an accredited college or university (transcript with...
16,Kitchen/Bath Designer,The Home Depot,"Requires listening for customer service calls, personal pages and general information announcements. Answer questions about merchandise for the customer's level..."
1,Advertising Project Manager,Innocean USA,The position requires a minimum of 5 years of well-rounded project management experience in advertising or a related business....
7,Court Clerk IV - Pos. #292,St. Louis County Circuit Court,"Work is performed under the general supervision of a judge, circuit clerk, higher level court clerk and unit manager...."
15,Fitness Instructors,Woodlake Swim and Racquet Club,"Woodlake Swim and Racquet Club is currently looking to hire certified Water aerobics, Pilates, Meditation, Tai Chi, and Les Mills instructors...."
17,Purchasing & Inven. Spec,"Greystone & Co., Inc.",Strong data entry skills. This role is responsible for responding to and processing customer requests for new hardware or software in an IT help desk...
13,Taco Bell Restaurant Jobs,Taco Bell-BurgerBusters Inc.,"Key responsibilities include greeting customers in the restaurant or drive-thru, taking and ringing up orders, handling payment and thanking customers...."
5,Chemistry Technician - Life Sciences,Xylem,"Xylem’s analytics businesses are leading manufacturers of premium field, portable, laboratory and online analytical instruments used in water and wastewater,..."
16,Customer Advisor Specialist,Petco,"Knowledge of the grooming salon program certification (Petco Promise, Pet Stylist Mentor Program, Canine Heritage Breed Test, Pet First Aid.)...."
6,Counselor (K-8),Grambling State University,Teach school developmental guidance curriculum to students. Plan school guidance and counseling programs to ensure that they meet identified needs....
14,Custodial Worker (Janitor) MWR 03-16,"Naval Air Station - JAX, MWR","Deep cleaning may include defrosting refrigerators and freezers, cleaning windows (interior and exterior), replacing and/or cleaning drapes/curtains, moving..."
3,IT and GxP Computer Systems Specialist,Booth Welsh Resources,"Automation, Computerized and Vision systems administrator. O Proceed to the validation of the automated and computerized systems (logic security, backup /..."
16,Part Time Deli Bakery Clerk North Rock,Harris Teeter,"Ability to read and comprehend simple instructions, short correspondence, and memos [in English]. Ability to write simple correspondence [in English]...."
14,"Custodian Part-Time (Warrenton, VA 20187)",Children of America,"Meets state age requirement. As a Leader is child care, Children of America's commitment is to provide a safe, and sanitary environment for all Children in our..."
22,Class-A CDL Flatbed Company Truck Drivers,E. W. Wylie,"With annual earnings of up to $65K, consistent OTR miles that offer frequent home time, a generous sign-on bonus, a pay raise every 60K miles and more,..."
10,Phlebotomist I or II-PRN,Fauquier Health System,6 months full-time equivalent general phlebotomy experience or Clinical internship including minimum of 100 venipunctures....
22,Driver Patient Services Technician,Advanced Home Care,"Must have a valid driver's license, and be able to operate manual transmission vehicle. Health care technician (EMT, Lab Tech, etc), customer support or service..."
1,Assistant Manager,Domino's,"Occasionally, pizza sauce weighing 30 pounds is carried from the storage room to the front of the store. If you like the thought of managing your own million..."
22,Freight Broker,Sunbreak Logistics,Supply Chain / Freight Brokerage:. A new logistics company is looking for a motivated and experienced freight broker to join and to grow in a great team....
12,Surveillance Officer Full Time,Harrah's Ak-Chin,"The Surveillance Officer assures the overall safety of guests, employees and the property as a whole. Conducts surveillance observation on designated areas both..."
21,Blow Mold Machine Operator,Consolidated Container Company,"Blow Mold Machine Operators report directly to Maintenance/ Production Manager. The Blow Mold Machine Operator will operate blow-mold, grinders, trimmer..."
13,Crew Person,McDonalds,"Greeting customers with a smile. It's time you worked for someone who will give you the tools to learn, grow and be what you want to be - both personally and..."
16,Retail Floater,The Fauquier Bank,"Accepts deposits, loan payments, TT&amp;L Payments, VISA deposits and payments. Processes requests for cash advances, gift and travel cards, and transfer of funds.*..."
15,Beauty Artist,Benefit Cosmetics,Essential Duties and Responsibilities -Customer Service- · Customer is the number one focus · Greet customers in 30 seconds or less · Follow the 8 Step
10,Medical Reviewer LPN,"Blue Cross Blue Shield of IL, MT, NM, OK & TX","3 years clinical experience in physician office, hospital or surgical setting. This position is responsible for pre-authorization reviews in accordance with the..."
15,Grooming Assistant,Petco,Assist in booking grooming appointments and performing follow-up phone calls and reminders to customers....
3,Data Management Support w/TS/SCI w/Polygraph,"TekStream Solutions, LLC","Performs a variety of general administrative tasks, such as preparing reports and correspondence, coordinating travel and meeting arrangements, answering phones..."
9,Morning Show Host,"iHeartMedia, Inc.",Radio talk show host. 3+ years of on-air radio experience required. Serves as ambassador for the radio station(s) when out in public....
18,Forestry Technician (Lookout),Department Of Agriculture,Workers Compensation Separation:. A career with the Forest Service will challenge you to manage and care for more than 193 million acres of our nation's most...
13,Clerk-Service (11195) Deli,Safeway,"Greet customers and take orders, in person and over telephone, in a friendly manner. Maintain area and conduct business in accordance with all federal, state..."
2,Business Process Analyst,U.S. Pipe,"Handles incoming questions on invoices, handling discrepancies and resolving any issues. Answers the phones, prepares quotes for customers, assists customer..."
11,Physical Therapist or Physical Therapy Assistant,Accelerated Rehabilitation Centers,Athletico is looking for a dedicated and compassionate Physical Therapist Assistant to provide a hands-on approach to rehabilitation....
16,AP Clerk,Sheehy Auto Stores,"All applicants must have the ability to pass pre-employment testing to include background checks, MVR, drug test, and valid driver's license...."
22,CDL-A OTR Solo and Team Truck Drivers - Owner Operators,Titan Transfer,"Titan Transfer is seeking professional Class A CDL truck drivers to join our team! At Titan Transfer, responsible, motivated professional truck drivers can have..."
13,"Associate, Food Services-PRN-Hours vary",Fauquier Health System,"These functions include, but are not limited to, portion control, delivery and pick up of trays, equipment operation, washing and sanitizing dishware, and cash..."
18,Lead Fish Technician,Hubbs-SeaWorld Research Institute,Hatchery building is a damp environment. Stay current with latest technologies related to fish rearing. Assist in all other aspects of fish husbandry as needed....
2,Portfolio Administrator,"Greystone & Co., Inc.","Transfer incoming mortgage payments to various custodial accounts in compliance with agency requirements. We are seeking a Portfolio Operations Specialist, for..."
20,Mechanic Helper,Pace Bus,Qualified candidate must possess at least one (1) years previous diesel/gas experience and/or technical training and meet the criteria of Pace's Mechanic...
13,Pizza Hut Team Member,Pizza Hut,"It’s about being independent and having fun, making new friends and earning extra cash. And you’re at least 16 years old – 18 if you want to be a driver...."
22,Experienced Owner Operator Flatbed Truck Driver - CDL-A,Carrier One,"Our owner operator truck driving opportunities offer higher percentage rates, flexible home time and exceptional company support—so your flatbed driving..."
6,LCSW Child/Family,Kaiser Permanente,"Experience working with chidlren, adolescents and their families in individual, family, and group psychotherapy...."
20,Auto Body Painter,DriveTime,What Drives You? Making your mark with a company known for excellence? A Chance for real work/life balance? Collaborating and thriving as part of a team?
17,020 - 5600 - OFFICE ASSISTANT,Harris Teeter,"New hire orientation, customer service network, safety, customer service clerk technical skills, floor monitor technical skills...."
13,Baker/Finisher,Dunkin' Donuts,Guest Focus – deliver high quality finished products for guest satisfaction. Ensure the safety and security of team and guests through a focus on food safety...
11,CNA-FHRNC-Full Time-Evenings,Fauquier Health System,Certified Nursing Assistant License. The Certified Nursing Assistant assists with patient care throughout nursing areas under the direction of licensed...
13,Day Baker,Panera Bread Franchise (Blue Ridge Bread),Our bakery-cafes are focused on taking care of our guests. We work diligently and with flexibility to coordinate our daily responsibilities and uphold the...
22,Traffic Flagger - Warrenton VA,Flagger Force Traffic Control Services,"No experience is required, but you must have a valid driver’s license, reliable transportation and a cell phone...."
3,Senior Intelligence Technican Associate,Raytheon,Possess a valid driver license for delivering records using government transportation within WMA. Give presentations to visitors as required....
4,Agricultural Engineer,Department Of Agriculture,"Or equivalent doctoral degree in Agricultural Engineering, Biological Engineering, or Agricultural and Biological Engineering...."
17,"Warrenton, VA - Furniture Assembler/Merchandiser",Spar Business Services,"Required license or certification:. As an Independent Contractor with SPAR Business Services, Inc. Have own tools...."
21,"Machine Operator-Remington, Virginia",U.S. Pipe,Must have at least one to three years of previous fabrication or manufacturing assembly or production work experience in a fast paced manufacturing or...
10,Recreational Therapist - Full Time - Baylor Rehab - downtown Dallas,Baylor Institute for Rehabilitation,Current national certification from NCTRC as a Certified Therapeutic Recreation Specialist (CTRS). The Therapeutic Recreation Specialist/Recreational Therapist...
10,Telemedicine Physician,"MeMD, Inc.",MeMD is seeking a Board-Certified Physician possessing a Florida medical license that is interested in joining our team of Telemedicine Providers....
20,Automotive Technician,SAFFORD AUTOMOTIVE GROUP,State Inspection license a plus. We want you to grow within our organization and will give you the chance and tools to succeed!...
13,Food Service Worker,TrustHouse Service Group,"Such as tray line, dish room, cafeteria and storeroom. The Food Service Worker is responsible for routine food service tasks in the kitchen, cafeteria, dining..."
