job_field_id,title,company,description
21,Production Operator - 2nd shift,Bostik Inc.,About Bostik - Smart Adhesives. As a production operator at Bostik you will be in a batch making/mixer operator position for a competitive manufacturing...
6,Senior Addiction Counselor,NYC Health + Hospitals,The Senior Addiction Counselor will be responsible for assisting the consumer with activities relevant to an individual's rehabilitation goals....
14,Janitor - Cleaning Technician - FULL TIME - 84095,Wingfoot Services,"Janitorial, janitor, cleaning specialist, carpet cleaning, floor care technician, buffing, part time, supplemental income, laborers, landscaping, supervisor,..."
20,HVAC Installer/Technician,Express Air Sytems,Basic knowledge of standard code requirements of air conditioning systems. \*\*\*\*\*Minimum requirements for Installers\*\*\*\*\*....
13,Kitchen Cook,SMG World - Tucson Convention Center,Banquet facility preparing meals for large events:. Fulfilling the service per each Banquet Event Orders (BEO)....
15,Lobby Concierge,Beach Activities of Maui,"The Concierge is knowledgeable about the local area and is the expert on the attractions, tours and activities that we sell.Must be flexible with scheduling and..."
11,2 Med/Peds Certified Nursing Assistant,Riverside Medical Center,Reports changes in patients' condition to the professional nurse. The 2 Med/Peds Certified Nursing Assitant (CNA) assists with the care of patients ranging from...
18,Agricultural & Standards Inspector - I,Placer County,"Recruitments for Agricultural and Standards Inspector I, Agricultural and Standards Inspector II, and Agricultural and Standards Inspector, Senior are being..."
10,Anesthesiologist,"UF, Department of Anesthesiology","Department anesthesiologists practice at UF Health hospitals in Gainesville, FL at the University of Florida alongside 62 faculty anesthesiologists, 78..."
17,Telephone Operator,The Broadmoor,"Monitors 911 Alert System. Operates the switchboard to relay incoming, outgoing, and interoffice calls by performing the following duties:...."
2,Cost Accountant III,Weatherford,JOB DESCRIPTION JOB SCOPE: This position will be responsible for the day to day understanding of the plant’s financial performance. The position will also be
1,Regional Marketing Manager,Vishay,Develops a formal marketing plan outlining an appropriate marketing strategy for selling to key accounts. Coordinates the marketing efforts for a product group....
23,"Analyst, Operations",General Dynamics Information Technology,Extended Air Defense Simulation (EADSIM). Battle Command Sustainment Support System (BCS3). Air and Missile Defense Work Station (AMDWS)....
7,Administrative Law Judge,New Mexico State Personnel Office,"Administrative Law Judge, Adjudicator Advanced. This position will conduct administrative hearings on behalf of the State Personnel Board concerning..."
4,Mid-Level Ground Control Station Engineer,GENERAL ATOMICS,Job ID# 6452BR Company General Atomics Aeronautical Systems Title Mid-Level Ground Control Station Engineer Job Category Engineering City San Diego State...
22,Air Traffic Control Operator,National Guard,The skills you learn as an Air Traffic Control Operator will qualify you to work in civilian air traffic control towers and centers at airports and airfields....
9,Graphic Artist,IGT,"Maya, Autodesk 3D Studio Max). This position is the development and timely delivery of high quality 2D and 3D game...."
12,Transportation Security Officer (TSO),Trinity Technology Group,TSOs must take the computerized Screener Assessment Battery. Repeatedly lift and carry baggage weighing up to 70 pounds…
16,Digital Sales Account Executive,The Morning Call Media Group,"Manages advertising sales revenue and account management targets. Our digital sales account executives are responsible for selling advertising banners, programs..."
19,Drywall Hanger/Installer,EncoreHR Staffing,"Includes lathers who fasten wooden, metal, or rockboard lath to walls, ceilings or partitions of buildings to provide support base for plaster, fire-proofing,..."
5,NATURAL RESOURCES PROGRAM TECHNICIAN,Arkansas Game & Fish Commission,"Knowledge of agricultural methods and basic land laws. Conducts agricultural and forest management activities on wildlife management areas, including preparing..."
3,Data Scientist,Humana,"Bachelor’s Degree in Mathematics, Computer Science, Actuarial Science or related field. Collaborate with other professionals including Actuaries, Mathematicians..."
8,Tutor or Teacher - Elementary Math,,"We are looking for math tutoring for our 4th grader. Improve grades, get ahead and increase confidence. Elementary math Tutoring &amp; Teaching opportunities..."
20,Master Mechanic / Technician Auto Repair,YourMechanic,Excellent customer service skills. Complete set of basic automotive tools. Earn up to $55/hr as a mobile mechanic*....
13,House Cook/Chef,Delta Zeta at Univ. of Northern Colorado,"Cook, Prep Cook, Chef, Line Cook, Nutritional Services, Cafeteria:. Responsible for preparing meals taking into consideration nutrition, food availability and..."
9,Sports Broadcaster (Basketball),The College of St. Scholastica,"To serve as play-by-play announcers, analysts, and commentators at home basketball games streamed over the Internet...."
6,FAMILY COURT COUNSELOR,"Dallas County, TX","Must be independently licensed in the State of Texas as a Licensed Professional Counselor (LPC), Licensed Marriage and Family Therapist (LMFT), Licensed Master..."
1,Program Manager of Operations,"Amazon Fulfillment Svcs, Inc","Advanced degree (MS,MBA) from an accredited university with focus on Industrial Engineering, Operations, Management, Economics, or related areas...."
8,7th & 8th Grade Social Studies Long Term Substitute Teacher,Willamette Leadership Academy,"We are looking for a dynamic and passionate social studies teacher to teach two periods of 8th grade US History, 2 periods of 7th grade Intro to Western..."
21,Blow Mold Machine Operator,Consolidated Container Company,"Blow Mold Machine Operators report directly to Maintenance/ Production Manager. The Blow Mold Machine Operator will operate blow-mold, grinders, trimmer..."
17,Retail Banker/ Teller - Center,Woodforest National Bank,"WOODFOREST NATIONAL BANK. Performs opening, closing, and other branch servicing duties such as cash and vault balancing;..."
6,Counselor (K-8),Grambling State University,Teach school developmental guidance curriculum to students. Plan school guidance and counseling programs to ensure that they meet identified needs....
3,"Database Specialist, Master",OBXtek,"Performs database programming and supports systems design. (h) Includes maintenance of database dictionaries, overall monitoring of standards and procedures,..."
9,Freelance Production Coordinator,"JPL Integrated Communications, Inc.","You will interact with talented Project Managers, Event Producers, Production Managers, Creative Directors, Graphic Artists, Editors, and so many others!..."
9,Morning Show Host,"iHeartMedia, Inc.",Radio talk show host. 3+ years of on-air radio experience required. Serves as ambassador for the radio station(s) when out in public....
4,Agricultural Engineer,Department Of Agriculture,"Or equivalent doctoral degree in Agricultural Engineering, Biological Engineering, or Agricultural and Biological Engineering...."
5,Public Health Specialist III,State of Oklahoma,"A bachelor’s degree with a major in public health, environmental health, environmental science, physical science, natural science, biological science,..."
10,EXERCISE PHYSIOLOGIST,Duke University and Duke University Health System,Master's degree in Exercise Physiology or Exercise Science. Clinical oversight regarding exercise for all patients at all risk levels....
17,Bookkeeping Clerk,John Q. Hammons Hotels & Resorts,"Must have 1-2 years in accounting , customer service and/or bookkeeping experience or equivalent. Perform any combination of routine calculating, posting, and..."
4,ARCHITECT/ENGINEER EAS,United States Postal Service,"Knowledge of architecture, engineering, and building construction sufficient to review and inspect repair and alteration...."
20,Truck/Trailer Mechanic,Snider Fleet Solutions,Truck/Trailer mechanic skills:. Perform valve and injector overhead adjustments according to OEM procedures. We have an immediate opening for a *Tractor Trailer...
23,Range Operations Specialist (PD D1134000),Department of the Army,"Officer, Not to Exceed O-3/ CPT, Warrant, Enlisted. Small arms, mortars and field artillery rockets or cannons...."
6,Elementary Counselor 846 (2016-2017),"Kansas City, MO School District","The elementary counselor is a member of the district’s guidance function, charged with providing a comprehensive guidance program for students in grades K-6...."
2,Seasonal Tax Preparer,Jackson Hewitt,"Jackson Hewitt is seeking a seasonal Tax Preparer to perform a variety of activities related to income tax preparation, sales and the delivery of excellent..."
4,Mechanical Engineer,GENERAL ATOMICS,Works with multiple interdisciplinary groups to transition equipment and processes from an engineering stage to repeatable productionized processes....
10,Telemedicine Physician,"MeMD, Inc.",MeMD is seeking a Board-Certified Physician possessing a Florida medical license that is interested in joining our team of Telemedicine Providers....
16,Cashier / Server Immediate Openings Available,Louis Pappas Fresh Greek,"Here are some keys to being a successful Cashier with us:. McMullen Booth Rd Clearwater, FL 33761, Monday through Friday from 3pm - 5pm...."
2,Fraud Risk Agent,Best Buy,Fraud Risk Agent. The Fraud Agent will support the efforts of BestBuy.com to provide timely service to our customers while controlling risk associated with...
13,Cook - Banquet Kitchen,Hilton Hotels & Resorts,Banquets and Catering. A Cook with Hilton Hotels and Resorts is responsible for preparing food items in accordance with recipes and established standards....
2,Athletics Business Manager,University of Indianapolis,"Interpersonal skills to work with internal groups (coaches, students-athletes, faculty, and staff) as well as external groups (officials, bus and rental car..."
4,Mechanical Design Engineer,Hydra-Electric Company,Formulate conceptual design of aeronautical or aerospace products or systems to meet customer requirements. The Candidate will be responsible for product design...
4,Civil Engineer EI (Entry Level),Banning Engineering,"BS in Civil or Agricultural Engineering is required. Located in Plainfield, Indiana, Banning Engineering is a Civil Engineering and Surveying firm that offers a..."
21,"Lead, Upholstery",StandardAero,"The Senior Tech Upholsterer is technically competent in aircraft upholstery, and is technically competent to accomplish all of his/her duties with little or no..."
22,Flight Attendant,Compass Airlines,Flight Attendant - LAX. One year previous flight attendant experience preferred The Flight Attendant will demonstrate the Compass Airlines' core values and…
12,Animal Control Officer,"City of Springfield, MO",Animal Control collaborates with many other community groups involved in animal welfare. Springfield Animal Control Officers enforce the ordinances of the city...
9,Audio/Video Installer,Wilshire Media Systems Inc,"Wilshire Media System’s is Southern California’s premier source for home theater, high performance audio, home automation and lighting control...."
21,Sheet Metal Fabricator,Arktura LLC,"Ability operate fabrication equipment, Drill presses, Shears, riveters etc. • Attention to detail a must...."
11,Health Care Assistant or Bilingual Health Care Assitant - LVN,Hanford Elementary School District,HEALTH CARE ASSISTANT. Certified Nursing Assistant (C.N.A.). See Health Care Assistant Job Description. Addendum to Health Care Assistant Job Description....
11,Physical Therapy Aide,All Star Physical Therapy,Responsibilities include: setting up treatment areas cleaning up following treatment sessions aiding physical therapist during patient sessions Job Type:
17,"Clerk, Front Desk (Great Beginnings)",La Clinica,"As a Clerk, working in a fast pace environment, some of your typical job responsibilities will include greeting, registering patients, verifying insurance..."
16,PT Grocery Associate,Food Lion,Provide quality customer service to our customers through the Grocery Department. Engage and interact with customers to create a positive shopping experience....
1,"Senior Marketing Campaigns Manager, North America Hardware Marketing",Oracle,"Senior Marketing Campaigns Manager, North America Hardware Marketing. This will include demand generation, brand awareness, events, field marketing, web/online..."
18,Lead Fish Technician,Hubbs-SeaWorld Research Institute,Hatchery building is a damp environment. Stay current with latest technologies related to fish rearing. Assist in all other aspects of fish husbandry as needed....
18,Park Officer,State of Ohio,Major Worker Characteristics:. Applicants can view the status of this position by logging into their user profile on the Ohio Hiring Management System [OHMS]...
1,Advertising Project Manager,Innocean USA,The position requires a minimum of 5 years of well-rounded project management experience in advertising or a related business....
12,BORDER PATROL AGENT,Department Of Homeland Security,Border Patrol Sectors. And pass the Border Patrol Agent Entrance Examination. Being a border patrol agent makes you a valuable member of the federal Law...
15,Dog Trainer / Apprentice,Petco,Our Dog Trainer Apprenticeship is a comprehensive training program to prepare you for the role of Dog Trainer in your store....
5,Environmental Specialist I,PeopleFirst Florida HR,"ENVIRONMENTAL SCIENTISTS AND SPECIALISTS, INCLUDING HEALTH. Knowledge of plant and animal living tissue, cells, organisms, and entities, including their..."
16,Cashier,Stores - Kmart Hourly,"Responsible for providing excellent customer service, efficiently and accurately completing sales and service transactions at the cash wraps, as well as handle..."
16,Marketing & Sales Representative - Level 5,BOEING,We are engineers and technicians. Defense Systems Division Sales &amp Marketing team. This is a senior sales and marketing analyst position.…
6,Staff Development Coordinator,Sayre Christain Village,"Conductscertification or training programs for Nursing Assistants. Frequentlycommunicates with employees, residents, family members, physicians etc...."
8,Basic Skills/Learning Center Non-Credit Instructor,North Orange County Community College District,"Teach pre-college courses in class and lab settings including, but not limited to, adult basic education (ABE), career technical education, adult secondary..."
5,Seafood Innovation Scientist,Oregon State University,"80% AGRICULTURAL EXPERIMENT STATION. Serve on Coastal Oregon Marine Experiment Station, College of Agricultural Sciences, Department of Food Science and..."
3,Technology Support Specialist,City of Durham,"Database management experience; Maintains, administers, monitors, and supervises departmental software database and application; Monday-Friday 8 am - 4:30 pm;..."
17,Administrative Associate Round Rock TX,Dell,The Administrative Sr. Coordinates office functions with other departments. We are currently seeking an Administrative Sr....
21,Processing Operator I - 3rd Shift,"SOFTPATH SYSTEM LLC in Sturgis, MI",Processing Operator I - 3rd Shift. Production or manufacturing and machine or forklift experience:. Primary responsibility will be to support the Dry blending...
19,Fabricator/Welder Helper,Kooks Custom Headers Inc,Pass off parts to helper for grinding and straightening flanges. Receive parts back from helper for final assembly and inspection for quality control....
9,Play-by-Play Announcer,Pittsburgh Pirates,"This position is for a play-by-play announcer for the Pittsburgh Pirates. Plan, prepare, present and perform as a play-by-play announcer on Pirates television..."
18,Log Yard Scaler,Church & Church Lumber Company,Must be experienced with running equipment such as a log loader. Good people person with management and communication skills....
16,Rental Sales Agent,Sixt Rent a Car LLC,"The Rental Sales Agent is responsible for optimizing the rental experience by selling extras based on the customer’s needs, drafting rental agreements, and..."
3,IT and GxP Computer Systems Specialist,Booth Welsh Resources,"Automation, Computerized and Vision systems administrator. O Proceed to the validation of the automated and computerized systems (logic security, backup /..."
10,Staff Nurse,South Shore Medical Center,Provide quality care to South Shore Medical Center patients. Administer prescribed medications and treatments. Prepare patient for office visit. Respond to
14,Housekeeping Tech,Brentwood Behavioral Health of Louisiana,"Patients, staff and visitors. The Housekeeping Tech will ensure. The maintenance of a clean, healthy, pleasant environment for...."
8,Librarian/Archivst - Part Time,Native Hawaiian Veterans,"Native Hawaiian Veterans, LLC is a Native Hawaiian Owned, Service Disabled Veterans Owned Small Business (SDVOSB), SDB, SBA 8(a), MBE, UDBE, and EEO/W/M/Vet"
13,Banquet Chef/Line Cook,Golf Course North Houston,"Preferred Banquet experience but not required. All kitchen staff must be able to cook high-quality balanced meals, cook from scratch and maintain proper food..."
14,Pest Route Technician,Ecolab,"Previous pest elimination industry or route experience preferred &quot;Certified Pest Control Technician, Commercial Pest Control Technician, Exterminator, Pest..."
7,Legal Consultant,Softpath System LLC,Understanding and researching complex international legal and/or regulatory issues. Looking for an energetic and talented professional to join the International...
18,Farm Worker,Meadowview Farms,We are looking for an independent employee with leadership and problem solving skills for our grain and cattle operation....
20,"Automotive Body Repairer, Fiberglass/Welder",The Logistics Company,The Repairer applies and spreads body filler manually to reestablish surface. Two years related experience. The Automobile Body Repairer mixes polyester resin...
22,Freight Broker,Sunbreak Logistics,Supply Chain / Freight Brokerage:. A new logistics company is looking for a motivated and experienced freight broker to join and to grow in a great team....
22,CDL Class A Drivers wanted Immediately!,"Champion Materials, Inc.","Now hiring CDL Class A Truck Drivers to haul bulk cement products across the Northeast, Mid Atlantic region, and Ontario...."
2,Business Operations Associate/Sr. Associate,Lending Club,"You’re both comfortable conversing with our front-line agents to truly understand how our operations work, as well as making a convincing case to our executive..."
1,General Manager - Chesapeake Energy Arena -SMG,SMG,"Manages subordinate Directors and Managers who supervise employees in the Finance, Marketing, Operations, Food &amp; Beverage Departments or other facility..."
18,Forestry Technician (Lookout),Department Of Agriculture,Workers Compensation Separation:. A career with the Forest Service will challenge you to manage and care for more than 193 million acres of our nation's most...
13,Food Service Attendant,Riverside Health System,"Formal training as a cook preferred. Performs duties related to therapeutic diets and meal services to include, aides in the preparation of preparation of hot..."
1,Proposal and Marketing Manager,Eat'n Park Hospitality Group,Marketing and digital marketing. Effective marketing materials. Marketing promotions that strengthen client. Create marketing campaigns and collaterals to....
4,Architectural Drafter,Glen & Co Architecture,We are a dynamic architectural and design group working on hotels and restaurants looking for an architect who can prepare construction documents and...
20,Mechanic Helper,Pace Bus,Qualified candidate must possess at least one (1) years previous diesel/gas experience and/or technical training and meet the criteria of Pace's Mechanic...
20,Auto Glass Installer,Luther Automotive,"At least 1 year of mobile auto glass experience required. Install windshields in shop and mobile, perform rock chip repairs and pull and reinstall glass for the..."
6,"Staff Therapist, Addictions Program",Chase Brexton Health Care,"Must have the ability to provide services that are relevant to the culture of the patient and their family. Provides a range of brief and longer-term, treatment..."
17,Banking Services Representative - Bakersfield,Rabobank,Knowledgeable regarding all bank products. Assists with reception and vault/merchant attendant duties. Ability to comprehend and interpret Bank policies and...
23,Air Defense Artillery Officer (14A),U.S. Army,Job training for an air defense artillery officer includes completion of the Air Defense Artillery Officer Basic Course....
19,Maintenance Worker - Road Maintenance,"Collier County, FL","Performs light construction projects; Operates a variety of machinery, equipment, and tools associated with division projects, which may include a utility truck..."
1,Marketing Science@Scale – Project Manager,Facebook,"The Marketing Science team is seeking a Project Manager who is passionate about making business operations, tools, and processes more efficient and effective...."
22,AMBULANCE DRIVER,Catholic Health Initiatives,"Job Summary: Provides transportation for patients, visitors, employees and students. Essential Duties: Picks up and delivers patients, visitors, employees"
1,"Sales Strategy and Operations Manager, Google Fiber",Google,"Working with them, you set the vision and the strategy for how their advertising can reach thousands of users...."
7,Senior Appellate Law Stenographer,NYS Unified Court System,"Acting as liaison with Justices, court attorneys and administrative personnel with regard to assignments; Responsible for training and supervising Appellate Law..."
8,LANGUAGE ARTS TEACHER,Academy of Hope Adult PCS,"Bachelor's degree and secondary or adult education experience required. Teach a course load of at least 2 classes per day of adult literacy, basic education,..."
10,Medical Reviewer LPN,"Blue Cross Blue Shield of IL, MT, NM, OK & TX","3 years clinical experience in physician office, hospital or surgical setting. This position is responsible for pre-authorization reviews in accordance with the..."
12,Firefighter-2016,City of Mesquite,"Possession of or ability to obtain certification/licensing as an Arson Investigator and Peace Officer, as assigned...."
8,Talent and Workforce Skills Trainer,Shangri-La,Ø Education and Experience. Requires a basic understanding of alpha numeric filing. 1.3.2 Utilize multiple adult learning styles for maximum information...
15,Fitness Instructors,Woodlake Swim and Racquet Club,"Woodlake Swim and Racquet Club is currently looking to hire certified Water aerobics, Pilates, Meditation, Tai Chi, and Les Mills instructors...."
13,Dishwasher and Busser,Jefferson Manor Health & Rehab,This is a full time dishwasher position in a nursing home facility. Prior experience preferred but not required....
