job_field_id,title,company,description
16,Sales Representative,Cantium Sports,ADVERTISING SALES - Connect Golf Courses &amp Local Businesses*. NO Florida state sales tax!*. Manage ad space &amp cost to meet sales goal*.…
8,Pre-School F/T Assistant Teacher,Children of America,Is working towards the completion a Child Development Associate credential (CDA) and meets the licensing requirements of the state in which they work....
13,Restaurant Shift Leaders - Bealton,"Five Guys Enterprises, LLC",Come join the Five Guys team!Five Guys is a family owned business that really cares about the growth and success of their employees....
4,Production Technician,SERVPRO of Culpeper & Fauquier Counties,A valid driver's license with a clean driving record.. Develop production expertise:. Having a cell phone that can be reached at all times to respond to...
2,Account Manager / Estimator,Five Star Painting - Manassas,Be available to answer any questions regarding the job while the project is in progress. Use the proper tools to estimate the job accurately....
13,Crew Person,McDonalds,"Greeting customers with a smile. It's time you worked for someone who will give you the tools to learn, grow and be what you want to be - both personally and..."
14,Housekeeping Staff (Part-Time),Poplar Springs Inn & Spa,"Poplar Springs - 21 Room Inn, Fine Dining Restaurant and full service Spa is seeking cleaning staff to perform general housekeeping duties to include, but not..."
11,Health Center Associate - Mobile,Planned Parenthood Southeast,Documents ultrasound in medical record. Assures lobby is neat and orderly throughout the day Explains medical tests and procedures and obtain informed consent...
13,Pizza Hut Delivery Driver,Pizza Hut,"You’ll also need a valid driver’s license, insurance and reliable vehicle. That’s right, we’ll pay you to cruise around in your mobile office – your car –..."
3,Junior Software Tester,"FEi Systems, Inc.","FEi Systems provides extensive IT services for multiple federal agencies and state governments in the areas of Medicare management, Health Information Exchanges..."
17,Reimbursement Specialist,WRB Communications,Complete accurate entry of billing information to ensure timely payment and avoid delay in patient therapy....
22,AMBULANCE DRIVER,Catholic Health Initiatives,"Job Summary: Provides transportation for patients, visitors, employees and students. Essential Duties: Picks up and delivers patients, visitors, employees"
13,Catering Coordinator,Panera Bread Franchise (Blue Ridge Bread),Our bakery-cafes are focused on taking care of our guests. Must Have Own Vehicle. Perfect Driving Record. Please apply online and a Manager may be in touch if...
2,Claims Auditor,Broadpath,Medical Claims Auditors perform routine and complex audits to identify inaccurate claims adjudication. Knowledge of claims and the ability to recognize patterns...
16,Cashier,Stores - Kmart Hourly,"Responsible for providing excellent customer service, efficiently and accurately completing sales and service transactions at the cash wraps, as well as handle..."
2,"Commercial Account Manager - Bealeton, VA",Advance Auto Parts,"Valid Drivers License and ability to meet our MVR Requirements. State of the Art Technology- laptop, CRM software, BlackBerry...."
17,Asset Protection/Loss Prevention,The Home Depot,"They utilize tools to minimize loss to the Company, including but not limited to identifying incidents of theft and fraud, reviewing CCTV and exception reports,..."
1,"General Manager - Store 2705 - Warrenton, VA",Petco,"Responsible for handling cash counting, supervision of cashiers and cash register service to maximize customer service and minimize loss of assets...."
13,Bartender / Barman / Mixologist,Ristorante Capellini,"Bartender, barman, barkeep, barmaid, and mixologist please apply. Bartenders are responsible for positive guest interaction while accurately mixing and serving..."
6,Police Officer,Virginia Association of Chiefs of Police (VACP),"Applicants must be at least 21 years old, in good physical health, possess a high school diploma or G.E.D, valid Virginia driver’s license, and be able to deal..."
16,Sales Consultant,K. Hovnanian Companies,"Successful candidate must maintain a valid driver's license. The ability to provide the highest level of customer service, including exceptional communication..."
4,Design Engineer Intern,Bohler Engineering,"Bohler Engineering is an equal opportunity employer and affords equal opportunity to all applicants and employees for all positions without regard to race,..."
19,Plumber,Los Angeles Unified School District,A Los Angeles City Journeyman Plumber License OR a Los Angeles County Certificate of Registration as a Journeyman Plumber....
6,Juvenile Probation Officer - Court,Williamson County,Constant contact with juvenile offenders and their families. Performs complex social service work in interviewing and counseling....
2,Controller/Accounting Manager,Poplar Springs Inn and Spa,Advanced Degree or CPA license preferred. Design and maintain detailed financial analysis spreadsheets/tools to measure operational performance and aid with...
8,Substitute/Floater Teacher,Children of America,"From infants to toddlers, preschoolers to kindergarteners, our highly trained teachers lead each child to reach developmental milestones, preparing the children..."
4,Field Service Engineer / PLC / Machinery / service,Randstad Engineering,"Provide technical support to customers and field technicians to install and maintain equipment. Provide telephone support for installation, troubleshooting, and..."
4,Mechanical Design Engineer,Hydra-Electric Company,Formulate conceptual design of aeronautical or aerospace products or systems to meet customer requirements. The Candidate will be responsible for product design...
8,Substitute,Bright Horizons Family Solutions,"Individual state and center requirements may apply. Bright Horizons offers an excellent benefits package including a competitive salary, career path..."
9,Head JV Boys Basketball Coach,Highland School,"A VISAA Division 2 Private High School, competing in the Delaney Athletic Conference (DAC). Lead the JV Boys Basketball Program at Highland School in Warrenton,..."
13,Crew,Dunkin' Donuts,Acknowledges all guests with a friendly smile and is highly responsive to needs and special requests. Issues a receipt with each order to provide guests with an...
12,SHERIFF - DEPUTY SHERIFF,"Hidalgo County, TX","Serve as a bailiff in county and district courts. May be assigned to patrol, narcotics, civil process, warrants, courthouse security, criminal investigation or..."
3,Intelligence Tech Specialist,Raytheon,Other responsibilities include data entry and tracking of documents. Ability to manipulate data using various formats and tools with a serious commitment to...
2,Seasonal Tax Preparer,Jackson Hewitt,"Jackson Hewitt is seeking a seasonal Tax Preparer to perform a variety of activities related to income tax preparation, sales and the delivery of excellent..."
20,"Maintenance Mechanic-Remington, Virginia",U.S. Pipe,"Directs and performs complex mechanical repair work &amp; is responsible for the more intricate repair assignments, including hydraulic and pneumatic systems...."
19,Metal Mechanic,Spencer-Ogden Energy,"Distribute insulating materials evenly into small spaces within floors, ceilings, or walls, using blowers and hose attachments or cement mortar...."
14,"Custodian Part-Time (Warrenton, VA 20187)",Children of America,"Meets state age requirement. As a Leader is child care, Children of America's commitment is to provide a safe, and sanitary environment for all Children in our..."
1,Store Manager,Stage Stores,"Work with district manager to develop and execute plans for store to improve profitability, greater productivity and efficiency...."
7,Legal Assistant,"Warrenton, Virginia Law Firm","Case management and litigation support, preparation of trial exhibits; Drafting basic legal documents, cite checking and proofreading court pleadings...."
8,Teacher- Special Education,Fauquier County Public Schools,"Plans, coordinates, attends, and chaperones field trips as appropriate. Provides an effective program of instruction to include instructional skills, knowledge..."
21,Tailor - Northrock Shopping Center,Jos. A Bank,Listen to the wants and requests of the customer and answer the customer’s questions.Communicate to the customer and/or sales executive in a professional manner...
8,Teacher- Elementary Art,Fauquier County Public Schools,Arranges opportunities for students to attend enriching field trips both during and after school hours. Motivates students to develop an interest in and an...
