job_field_id,title,company,description
16,"Rental Sales Representative- Warrenton, VA",H&E Equipment Services,A Bachelor’s degree is a plus• 2 years of business to business sales experience in Construction Equipment and/ or Construction related field is preferred•...
4,RET Engineer,Intel,"Scanning Electron Microscopy, Atomic Force Microscopy, etc.). The RET Design Engineer will deliver test masks, test patterns, sampling strategies, process..."
17,Help Desk / Support Specialist,Raytheon,Provide on-demand and scheduled training to individuals and groups in the use of Maximo and other technical support tools....
17,Administrative Associate Round Rock TX,Dell,The Administrative Sr. Coordinates office functions with other departments. We are currently seeking an Administrative Sr....
13,Line Cook/Prep Cook,Poplar Springs Inn and Spa,Looking for someone passionate about food and wants to learn or is already seasoned in the kitchen. Poplar Springs is making exciting food!!!...
13,Pizza Hut Server,Pizza Hut,"It’s about being independent and having fun, making new friends and earning extra cash. And independently-owned franchised or licensed locations may have..."
2,Earthwork Estimator/Project Manager,"Monomoy Services, Inc.",Ability to do earthwork analysis and pricing with some project management. Must have good communication and computer skills....
8,Pharmacy Technician Instructor,Lord Fairfax Community College,The Pharmacy Technician instructor will teach the LFCC Workforce Solutions Pharmacy Technician class. Instructor must have experience as a licensed Pharmacist....
16,Sales Associate,Stage Stores,"Interrupt store tasks to greet, assist, and answer questions for customers. Smile and greet each customer promptly...."
17,Medical Office Asst VA,Novant Health,Graduate of an accredited medical assistant program preferred. The team member's number one job responsibility is to deliver the most remarkable patient...
20,General Service Technician,Merchants Tire,"Valid Drivers License. Required license or certification:. Possession of a valid motor vehicle license. The General Service Technician also unloads, checks-in..."
19,Carpenter,Chicago Bridge & Iron Company,"Fits and nails sheathing on outer walls and roofs of buildings. Erects scaffolding for buildings and other structures and installs ladders, handrails, walkways,..."
3,IT Support Specialist,"Greystone & Co., Inc.",This role is responsible for answering incoming calls and monitoring incoming email for internal users in an IT help desk environment through a ticket tracking...
16,Consultative Sales- Home Improvement,Stores - Sears Hourly,"Selling and servicing customers within one or more departments including Home Improvement, Lawn and Garden, Tools, Sporting Goods;..."
12,Security Guard,Bannerman,"Bannerman is looking for professional security guards, and bouncers. Must be self disciplined with a high level of customer service and professionalism...."
22,Experienced CDL-A Company Truck Driver - Teams,Celadon Trucking Services,Must hold a valid CDL Class A license issued by the applicant’s state of residence. Team Driver Jobs are Available for Experienced Company Drivers and Owner...
2,Junior-Staff Accountant,Poplar Springs Inn and Spa,"Prepared recurring tax reports and other filings, to include sales and occupancy tax returns, personal property tax returns, business license applications..."
1,ASST STORE MGR,Dollar General,"Assist in ensuring the financial integrity of the store through strict cashier accountability, key control, and adherence to company security practices and cash..."
5,Public Health Specialist III,State of Oklahoma,"A bachelor’s degree with a major in public health, environmental health, environmental science, physical science, natural science, biological science,..."
8,Teacher- Spanish (Part-Time),Fauquier County Public Schools,"Plans, coordinates, attends, and chaperones field trips as appropriate. Motivates students to develop an interest in and an appreciation of language (French and..."
13,$10.00 Hr Dishwasher,Ruby Tuesday,As soon as you join the team you'll notice the friendly working environment and the variety of experience that comes with working at Ruby Tuesday.Apply at:....
16,Customer Service Representative,We Insure Group,Our agents have access to over 100 Top Partner Companies and one of the best service and support personnel in the business....
19,Painter/Blaster,CTR Group,"CTR is currently seeking 1st class Painters Location - Pascagoula, MS Industry - Marine Responsibilities: • Perform blasting and painting utilizing marine"
14,Residential Lawn Specialist 100889,TruGreen,As a Lawn Specialist with the #1 lawn care company you will be providing regularly scheduled landscape services within your route on a daily basis....
13,Line Cook,Longhorn Steakhouse,"Work in a team-oriented, high-volume, fast-paced, guest-centric environment to deliver Genuine Western Hospitality to our guests by:...."
10,Nursing Supervisor-FHRNC-Full Time Evenings-Mon-Fri,Fauquier Health System,Current Virginia State RN License. The Nursing Supervisor provides direction and supervision to staff to ascertain delivery of effective high quality patient...
2,Small Business Specialist II,BB&T,"Possess an understanding of major technical aspects of small business underwriting, loan structure and deposits, and have a clear understanding of credit and..."
22,Part Time Produce Clerk North Rock,Harris Teeter,"While performing the duties of this job, the associate constantly works in a cool environment with an average temperature range of 55-60 degrees Fahrenheit and..."
8,7th & 8th Grade Social Studies Long Term Substitute Teacher,Willamette Leadership Academy,"We are looking for a dynamic and passionate social studies teacher to teach two periods of 8th grade US History, 2 periods of 7th grade Intro to Western..."
16,VA Customer Service Representative,Family Dollar,"Key priorities include greeting customers, assisting them with selection of merchandise, completing transactions, and answering questions regarding the store..."
22,Hiring CDL-A Drivers for L/P,Network 1,"No commercial transportation related felony, theft or larceny conviction. LEASE OPERATORS NEEDED NOW!!*...."
16,Retail Merchandiser- Part Time,TNG Retail Services,"Or person’s looking for permanent part time work. Clients' products, developing strong relationships with store personnel, accurately reporting time worked,..."
22,Flight Attendant,Compass Airlines,Flight Attendant - LAX. One year previous flight attendant experience preferred The Flight Attendant will demonstrate the Compass Airlines' core values and…
16,Part-Time Teller - Northrock Shopping Center,Capital One,Live the company values of Excellence and Do the Right Thing - Act as a Customer Advocate - Take an active role in educating customers on other banking channel...
19,Industrial Electrician,Novelis,"Novelis Corporation, the global leader in rolled aluminum and can recycling, has an opportunity at its Fairmont, WV plant for an experienced Industrial..."
2,Business Development Representative,Insperity,"Promote entire product offerings to commercial real estate owners, owners reps, developers, architects, designers and general contractors throughout the..."
8,"Dean, Fauquier Campus",Lord Fairfax Community College,"Strategic academic program design and development, including outreach with relevant local Fauquier and Rappahannock County stakeholders to assess need and..."
13,Cook-Full-Time-Hours Evenings 12p-8p,Fauquier Health System,Ability to perform complex math calculations and verify cash handling and reporting. The Cook prepares food items needed for meal service using institutional...
3,Information Systems Security Analyst,TASC,"Must be familiar with NIST Certification &amp; Accreditation (C&amp;A) processes, NIST policies and documents, NIST Risk Management Framework, Federal Information..."
17,Retail Store Shift Supervisor,CVS Health,Ensure compliance with all company policies and procedures (such as cash management) and federal and state....
7,Senior Appellate Law Stenographer,NYS Unified Court System,"Acting as liaison with Justices, court attorneys and administrative personnel with regard to assignments; Responsible for training and supervising Appellate Law..."
3,Information Sec Spec,"Greystone & Co., Inc.","IT related college degree, technical school degree, or Microsoft certification such as MCSE, MCITP, etc...."
13,Clerk-Service (11195) Deli,Safeway,"Greet customers and take orders, in person and over telephone, in a friendly manner. Maintain area and conduct business in accordance with all federal, state..."
13,Baker/Finisher,Dunkin' Donuts,Guest Focus – deliver high quality finished products for guest satisfaction. Ensure the safety and security of team and guests through a focus on food safety...
17,Teller,The Fauquier Bank,"Accepts deposits, loan payments, credit card deposits and payments. Job requires a higher level of problem solving abilities to find solutions to difficult..."
3,Network Controller with TS + Clearance,ManTech International Corporation,"Requires Bachelor’s degree (in Computer Science, Math or Engineering) or equivalent, and zero to two years of related experience...."
22,PT Produce Associate,Food Lion,"Ability to analyze situations, identify problems and implement solutions. Ability to complete Computer Based Training (CBT) and Training Aid courses...."
11,"Dental Assistant, Warrenton","Heartland Dental, LLC","X-ray certification required in the state for which you apply. Potentially out of state. The Dental Assistant will also organize and maintain lab equipment,..."
2,Recruiter,Cascades Specialty Products Group,Additional responsibilities include developing relationships with the HR and Hiring Managers and the complete onboarding of placed candidates....
20,Heavy Equipment Shop Technician,"Carter Machinery Co., Inc.","This position is responsible for diagnosing problems, performing repairs, reconditioning and servicing heavy equipment and components in a shop environment...."
3,"Network Deployment and Operations (NDO) Lead, Google Fiber, Midwest",Google,"Familiarity with other network transmission protocols and in-home network architecture. Ensure the best local network is designed, built, and maintained with..."
12,Firefighter-2016,City of Mesquite,"Possession of or ability to obtain certification/licensing as an Arson Investigator and Peace Officer, as assigned...."
13,Crew Person,McDonalds,"This position is for a friendly,enthusiastic person who can deliver prompt and accurate service with a smile...."
16,Sales Representative - Worcester,Commonwealth of Massachusetts,Instruct Sales Agents on the use of successful marketing and sales techniques. Provide motivation to Sales Agents and recommends incentive plans intended to...
21,Plastics Mold Maker,TERMAX CORPORATION,"Craft precision tools by studying specifications, engineering blueprints, tool orders, and shop data to make, alter, or repair tools, jigs, fixtures, molds, or..."
13,Evening Server,Denny's,"Looking for an individual with a positive attitude to provide friendly, fast, accurate service to guests dining in our restaurant...."
4,Project Engineer,"Vanir Construction Management, Inc.","Or, non-degree holders must possess 4+ years of experience in a construction, engineering or architectural related position...."
16,Counter Manager,Stage Stores,"Scheduling, inviting by telephone and cards, displays at counter and throughout exchange. Maintain standards for counter cleanliness...."
8,Summer Camp Teacher,Children of America,"Must have a Drivers License. Perform all duties in compliance with State and Local licensing requirements, policies and procedures...."
16,Retail Merchandiser - Warrenton/Culpeper/Marshall - VA,The Pet Firm,"Attend training calls; Implement and reset planograms, test planograms, IRC's point of sale materials,. Our expertise in the pet industry gives our vendor..."
19,Maintenance Worker - Road Maintenance,"Collier County, FL","Performs light construction projects; Operates a variety of machinery, equipment, and tools associated with division projects, which may include a utility truck..."
13,Restaurant Manager,Ashby Inn & Restaurant,"Fauquier County high-end restaurant, seeks professional restaurant/front-of-the-house manager. The right applicant must be tactful;..."
11,Physical Therapist or Physical Therapy Assistant,Accelerated Rehabilitation Centers,Athletico is looking for a dedicated and compassionate Physical Therapist Assistant to provide a hands-on approach to rehabilitation....
15,Warrenton area CAREGiver,Home Instead Senior Care,"You must have your own vehicle and a valid driver's license as you will be responsible for driving clients to appointments, etc...."
13,Restaurant General Manager,Taco Bell,"It is not all-inclusive, and a similar job at other Brands, Franchise or License locations may be different...."
11,Physical Therapy Aide,All Star Physical Therapy,Responsibilities include: setting up treatment areas cleaning up following treatment sessions aiding physical therapist during patient sessions Job Type:
16,"Part Time Merchandiser-Warrenton, VA",American Greetings,EOE M/F/disability/vet VEVRAA Federal Contractor&quot
22,Railroad Openings- Now Hiring,JNI,*RAILROAD OPENINGS- NOW HIRING* *Trainees & Experience Welcome* *Call 205-536-7500 FOR IMMEDIATE ATTENTION* * Fireman/ Oiler – Forklift Operator…..$-23/HR *...
22,CDL-A Refriegerated OTR Company Truck Driver,J.S. Helwig & Son,Minimum age 25 years Valid commercial license Safe driving record meeting our minimum requirements One (1) year verifiable over the road experience in the past...
1,Assistant Administrative Manager,Capitol Building Supply,Bachelor’s degree in Business or related field is preferred. Develop product knowledge to assess needs and recommend solutions to customer needs....
10,Hospitalist- NP/PA,Virginia Emergency Medicine Associates,A minimum of one year of post-grad clinical experience in hospital medicine• Valid Virginia license • Current ACLS/BLS certificates through AHA• Ability to...
16,Retail Floater,The Fauquier Bank,"Accepts deposits, loan payments, TT&amp;L Payments, VISA deposits and payments. Processes requests for cash advances, gift and travel cards, and transfer of funds.*..."
22,Hiring Company Drivers & Contracting Owner Operators,Prime Inc.,We are hiring Class A CDL Company Drivers and Contracting Owner Operators. Find the Lifestyle You're Looking for as a Prime Truck Driver....
10,"Biometric Screener - Warrenton, VA",Provant,"Medical license or certification required. Provant Health Solutions hires individuals on a contract/per diem basis, provides excellent hourly wages, and further..."
12,Chief of Police,City of Andrews,"The department consists of 19 sworn peace officers, 9 full-time paramedics, an Animal Warden and Executive Assistant, with combined budgets totaling over $3M...."
1,Assistant Manager,Domino's,"Occasionally, pizza sauce weighing 30 pounds is carried from the storage room to the front of the store. If you like the thought of managing your own million..."
13,Dishwasher and Busser,Jefferson Manor Health & Rehab,This is a full time dishwasher position in a nursing home facility. Prior experience preferred but not required....
8,Substitute Instructional Aide,San Mateo Union High School District,"Assist the classroom teacher to set up materials or education lessons; Under general supervision, reinforce lessons presented by the classroom teacher by..."
14,Stocking and Merchandising for Grocery Stores,Acosta Sales & Marketing,"This IS a part time position, but permanent. This is a heavy stocking position...."
5,Environmental Specialist I,PeopleFirst Florida HR,"ENVIRONMENTAL SCIENTISTS AND SPECIALISTS, INCLUDING HEALTH. Knowledge of plant and animal living tissue, cells, organisms, and entities, including their..."
22,Bus Driver,Fauquier County Public Schools,"Performs driving functions safely and efficiently in various weather conditions; Performs general maintenance tasks necessary to keep vehicles, equipment and..."
16,Salesperson,Sheetz,"Ring accurate register transactions. The perfect fit for our Sheetz team would be someone who is people oriented, self-motivated, dependable, able to work..."
20,Service Technician (Mechanic),"Franklin Equipment, LLC","The individual will maintain and repair equipment offered by Franklin Equipment to include Construction and Agricultural (small equipment, aerial, dirt, farm,..."
17,Office/Store Support,The Home Depot,"Facilitating the maintenance and repair of certain computer system related equipment such as cash registers, scanners, scan guns, monitors, signature capture..."
23,Flight Support,U.S. Navy,"Operate and maintain hydraulic and steam catapults to launch aircraft. As an Officer, you can expect to:. Instead, she refuels fighter jets on aircraft carriers..."
7,Law Clerk,Colorado Office of the State Court Administrator,"There is an immediate opening for a law clerk in the 19th Judicial District. Judicial Branch Overview. Responsibilities of this position include legal research,..."
21,Manufacturing Assembler,Manufacturing Supplier,Ideal candidates will have some mechanical aptitude for assembling plastic or metal parts by hand. Advantage Resourcing is currently seeking Manufacturing...
6,FAMILY COURT COUNSELOR,"Dallas County, TX","Must be independently licensed in the State of Texas as a Licensed Professional Counselor (LPC), Licensed Marriage and Family Therapist (LMFT), Licensed Master..."
13,Day Baker,Panera Bread Franchise (Blue Ridge Bread),Our bakery-cafes are focused on taking care of our guests. We work diligently and with flexibility to coordinate our daily responsibilities and uphold the...
14,Custodian,Fauquier County Public Schools,"Checks play areas and around school building for trash, debris or hazards. Delivers copy paper to rooms. Empties trash receptacles and deposits collected refuse..."
17,SCHEDULING/REGISTRATION REPRESENTATIVE II,Inova Fairfax Hospital,"Medical terminology class; Bachelors Degree = 2 years). Obtains medical case information including diagnosis(es), ICD-9 and CPT codes, anesthesia type, ordering..."
6,Spiritual Counselor,UPMC,"Knowledge of spiritual effects of terminal illness, grief, and loss. The hospice spiritual counselor provides counseling and guidance to patients, families and..."
20,Auto Glass Installer,Luther Automotive,"At least 1 year of mobile auto glass experience required. Install windshields in shop and mobile, perform rock chip repairs and pull and reinstall glass for the..."
16,Customer Service Associate,Wawa,Comply with federal and state laws by requesting personal identification from customers who are purchasing tobacco and/or alcohol....
20,Crew chief,SERVPRO of Culpeper & Fauquier Counties,High School Diploma or equivalentRestoration industry experience required.IICRC certificate required and ASD certification a plus.Ability to pass a criminal...
22,CDL-A Truck Driver - Dedicated Runs,Marten Transport,"Our dedicated truck driving opportunities are open to drivers at least 22 years old with a current CDL-A, at least 1 year of recent OTR experience...."
4,ARCHITECT/ENGINEER EAS,United States Postal Service,"Knowledge of architecture, engineering, and building construction sufficient to review and inspect repair and alteration...."
20,Aquatic Scientist/Customer Service Manager,"Virginia Waters and Wetlands, Inc.",Required license or certification:. Valid driver’s license required. Commercial Herbicide Applicator License – Category 5A preferred• Arborist certificate - a...
17,Hotel Front Desk Receptionist,HOLIDAY INN EXPRESS AND SUITES,No phone calls. Processing payment from Guests. Responding to Guests request for assistance and information about the local area (i.e....
10,"Dental Hygienist, Warrenton, VA","Heartland Dental, LLC",Valid Dental Hygienist license in the state for which you apply. Potentially out of state. Applying fluorides and other cavity preventing agents to prevent...
8,Talent and Workforce Skills Trainer,Shangri-La,Ø Education and Experience. Requires a basic understanding of alpha numeric filing. 1.3.2 Utilize multiple adult learning styles for maximum information...
21,Product Manager,"Specialty Resources, Inc.","(SRI) is a global sourcing and inventory management company for precision components &amp; specialty products such as precision machined components, stampings,..."
14,Maintenance Worker II - PUBLIC WORKS,City of Port Orange,Clean grounds and remove litter. Experience in operating automotive or maintenance equipment. Provide routine and basic maintenance and repair to small...
17,LPNs and RNs Needed!,WRB Communications,Active LPN/ RN license. Our LPN/ RN Communicators will take calls from consumers and health care providers and document product complaints or adverse events...
15,Fitness Instructors,Woodlake Swim and Racquet Club,"Woodlake Swim and Racquet Club is currently looking to hire certified Water aerobics, Pilates, Meditation, Tai Chi, and Les Mills instructors...."
16,Brand Ambassador Sales Part Time,Advantage Sales and Marketing,Participate in mandatory on-line training and conference calls (paid). Field of Study/Area of Experience:....
8,Before & Aftercare Teacher,Children of America,Has experience with School Age and state credentials and MUST have the state required registry.*. This approach concentrates on allowing each child to learn...
6,Medical Social Worker - Home Health and Hospice Job,HCR ManorCare,"May require licensure or certificate as required by the state, and in good standing. The Medical Social Worker is responsible for providing patients and..."
17,"Clerk, Front Desk (Great Beginnings)",La Clinica,"As a Clerk, working in a fast pace environment, some of your typical job responsibilities will include greeting, registering patients, verifying insurance..."
13,Restaurant Team Member,RubyTuesday,"Whether its part-time or an entire career, we want to make sure you get everything you want out of your Ruby Tuesday experience...."
15,Central Baggage Agent,Virgin America,O Perform Baggage. O Following proper guiding principles in order to compensate guests for any misplaced baggage....
9,Play-by-Play Announcer,Pittsburgh Pirates,"This position is for a play-by-play announcer for the Pittsburgh Pirates. Plan, prepare, present and perform as a play-by-play announcer on Pirates television..."
11,CNA - Certified Nursing Assistant,Oak Springs of Warrenton,Seeking Licensed CNA's for all shifts. Participate in assessments and development of treatment plans. Full or Part Time shifts are available to provide direct...
10,Recreational Therapist - Full Time - Baylor Rehab - downtown Dallas,Baylor Institute for Rehabilitation,Current national certification from NCTRC as a Certified Therapeutic Recreation Specialist (CTRS). The Therapeutic Recreation Specialist/Recreational Therapist...
23,Air Defense Artillery Officer (14A),U.S. Army,Job training for an air defense artillery officer includes completion of the Air Defense Artillery Officer Basic Course....
3,Technology Support Specialist,City of Durham,"Database management experience; Maintains, administers, monitors, and supervises departmental software database and application; Monday-Friday 8 am - 4:30 pm;..."
17,"Front Office Team Member - Business Assistant, Warrenton","Heartland Dental, LLC","The Dental Business Office Assistant will maintain and organize all administrative functions in the front office, including reception tasks – receiving and..."
16,Merchandising,The Home Depot,"Must have a valid state driver s license and proof of insurance. Requires listening for customer service calls, personal pages and general information..."
16,Customer Service/Deliveries,The Home Depot,"A valid drivers license and proof of insurance is required for driving. Whether directing customers to store departments or merchandise, answering customer..."
13,PT Market Associate,Food Lion,"Provide friendly, courteous and prompt customer service. Ability to complete Computer Based Training (CBT) and Training Aid courses...."
20,Photo Lab Technician,CVS Health,Follow Federal and State laws and OSHA regulations. Actively participate in the Photo Lab Training and Certification Program by certifying in all necessary...
20,Utility Systems Repairer-Operator,Department of Defense, Operate an Energy Management and Control System (EMCS) used to monitor and control all HVAC systems within the facility....
2,Senior Staff Accountant,MFA Oil Co.,Summary of Responsibilities: Job Responsibilities include but are not limited to: Ensuring the integrity of the general ledger and financial statements
1,Assistant Restaurant Manager,Dunkin' Donuts,Holds the guest as their highest priority and role models exceptional guest service. Manages cash over/short through effective cash control procedures....
13,"Host - 7982 - West Lee Highway - Warrenton, VA (Warrenton, VA)",Applebee's,Our Hosts greet and seat all arriving guests and acknowledge all departing guests in a friendly manner and assist in maintaining the overall guest flow of the...
17,Administrative Assistant to the Provost/Vice President of Academic Affairs,East Central University,"The Administrative Assistant coordinates the Provost’s appointments and travel arrangements. East Central University invites applications for a twelve-month,..."
21,Blow Mold Machine Operator,Consolidated Container Company,"Blow Mold Machine Operators report directly to Maintenance/ Production Manager. The Blow Mold Machine Operator will operate blow-mold, grinders, trimmer..."
14,Housekeeping/Laundry Aide,Safire Care,"Description Position: Housekeeping/Laundry Aide Hours: FT, PT Available Shift: Day and Evening Shifts Sheridan Manor provides a range of services,"
