job_field_id,title,company,description
16,Sales Associate,Lands' End,"Including courteously, conversationally greeting customers, adjusting individual customer attention based on store traffic, suggesting solutions based on..."
16,Part Time Deli Bakery Clerk North Rock,Harris Teeter,"Ability to read and comprehend simple instructions, short correspondence, and memos [in English]. Ability to write simple correspondence [in English]...."
2,Account Liaison- Hospice Job,HCR ManorCare,"Bachelors degree in marketing, business, communications or related health field from an accredited institution required or RN,...."
14,Stocking and Merchandising for Grocery Stores,Acosta Sales & Marketing,"This IS a part time position, but permanent. This is a heavy stocking position...."
2,FINANCIAL QUALITY COORDINATOR,Inova Fairfax Hospital,"Bachelors Degree = 2 years. Supports Inova Health System or Physician Services, and Patient Registration department financial goals through patient financial..."
20,General Service Technician,Merchants Tire,"Valid Drivers License. Required license or certification:. Possession of a valid motor vehicle license. The General Service Technician also unloads, checks-in..."
14,"Custodian Part-Time (Warrenton, VA 20187)",Children of America,"Meets state age requirement. As a Leader is child care, Children of America's commitment is to provide a safe, and sanitary environment for all Children in our..."
11,CNA - Certified Nursing Assistant,"Blue Ridge Caregivers, Inc",Drive/operate a motor vehicle (valid driver's license required). Current Certified Nursing Assistant or Personal Care Aide Certification....
17,Asset Protection/Loss Prevention,The Home Depot,"They utilize tools to minimize loss to the Company, including but not limited to identifying incidents of theft and fraud, reviewing CCTV and exception reports,..."
11,CNA-FHRNC-Full Time-Evenings,Fauquier Health System,Certified Nursing Assistant License. The Certified Nursing Assistant assists with patient care throughout nursing areas under the direction of licensed...
