job_field_id,title,company,description
11,"Dental Assistant, Warrenton","Heartland Dental, LLC","X-ray certification required in the state for which you apply. Potentially out of state. The Dental Assistant will also organize and maintain lab equipment,..."
14,Maintenance Worker,Marsh Run MHC,"Valid driver’s license and good driving record. Required license or certification:. General knowledge of electrical, plumbing, and grounds maintenance...."
13,Restaurant General Manager,Taco Bell,"It is not all-inclusive, and a similar job at other Brands, Franchise or License locations may be different...."
8,"TUTORS - Academic Center for Excellence - Fauquier Campus, Vint Hill Site",Lord Fairfax Community College,Completed LFCC faculty recommendation form(s) for each desired course to tutor OR documented evidence of tutoring/instructional experience in an academic...
16,Warrenton - Sprint Store by Adcomm Digitel Wireless Retail Sales Associate,Sprint Store by Adcomm Digitel,Making outgoing calls to warm leads representing companies and individuals in the area. The Retail Sales Consultant will help to build business and develop....
1,Management,Panera Bread Franchise (Blue Ridge Bread),Our bakery-cafes are focused on taking care of our guests. Please apply online and a Manager may be in touch if an opportunity matching your qualifications...
2,Junior-Staff Accountant,Poplar Springs Inn and Spa,"Prepared recurring tax reports and other filings, to include sales and occupancy tax returns, personal property tax returns, business license applications..."
20,Cabling Tech/WAP Installer,Airlie,"Must have own tools. Low voltage cabling contractor needed. Experience with installation of copper voice , data cable and Wireless Access Point installs...."
7,Legal Liaison,"Maricopa County, AZ",High School diploma or GED and two (2) years of clerical experience in a legal and/or law enforcement setting with knowledge in legal preparations and legal...
17,Clinical & Secretarial Services Technician-ER-Part Time-Days,Fauquier Health System,"The Clinical &amp; Secretarial Services Technician also coordinates the activities of the department through communication, requisitioning and management of..."
9,Full Time Artist,Lisa Frank Inc,"When you were growing up, did all your school supplies HAVE to be Lisa Frank? Are you creative, energetic, and hardworking? This might be the job for you!"
16,Sales Representative,Cantium Sports,ADVERTISING SALES - Connect Golf Courses &amp Local Businesses*. NO Florida state sales tax!*. Manage ad space &amp cost to meet sales goal*.…
2,"Commercial Account Manager - Bealeton, VA",Advance Auto Parts,"Valid Drivers License and ability to meet our MVR Requirements. State of the Art Technology- laptop, CRM software, BlackBerry...."
17,Operations,The Home Depot,"Requires listening for customer service calls, personal pages and general information announcements. May have to handle merchandise and work with tools with..."
17,Retail Banker/ Teller - Center,Woodforest National Bank,"WOODFOREST NATIONAL BANK. Performs opening, closing, and other branch servicing duties such as cash and vault balancing;..."
3,Intelligence Tech Specialist,Raytheon,Other responsibilities include data entry and tracking of documents. Ability to manipulate data using various formats and tools with a serious commitment to...
22,Hiring CDL-A Drivers for L/P,Network 1,"No commercial transportation related felony, theft or larceny conviction. LEASE OPERATORS NEEDED NOW!!*...."
13,Cook - PRN - Hours vary,Fauquier Health System,"SERVE SAFE certification. Course work/completion from an accredited culinary school. In the absence of the team leader, the cook will supervise the operations..."
2,Senior Staff Accountant,MFA Oil Co.,Summary of Responsibilities: Job Responsibilities include but are not limited to: Ensuring the integrity of the general ledger and financial statements
11,Home Health and Hospice Aide Job,HCR ManorCare,"Minimum of one year experience as a Home Health or Hospice Aide, or is currently enrolled as a nursing student who has had a minimum of 6 months clinical..."
1,Marketing Science@Scale – Project Manager,Facebook,"The Marketing Science team is seeking a Project Manager who is passionate about making business operations, tools, and processes more efficient and effective...."
22,Hiring Company Drivers & Contracting Owner Operators,Prime Inc.,We are hiring Class A CDL Company Drivers and Contracting Owner Operators. Find the Lifestyle You're Looking for as a Prime Truck Driver....
5,Animal Care Supervisor,University of Colorado,"Animal Facility, implementing the animal care procedures and policies. Care for a variety of species of small laboratory animals used by scientists...."
12,Chief of Police,City of Andrews,"The department consists of 19 sworn peace officers, 9 full-time paramedics, an Animal Warden and Executive Assistant, with combined budgets totaling over $3M...."
1,General Manager - Chesapeake Energy Arena -SMG,SMG,"Manages subordinate Directors and Managers who supervise employees in the Finance, Marketing, Operations, Food &amp; Beverage Departments or other facility..."
14,Custodian,Fauquier County Public Schools,"Checks play areas and around school building for trash, debris or hazards. Delivers copy paper to rooms. Empties trash receptacles and deposits collected refuse..."
8,Substitute/Floater Teacher,Children of America,"From infants to toddlers, preschoolers to kindergarteners, our highly trained teachers lead each child to reach developmental milestones, preparing the children..."
22,CDL-A Refriegerated OTR Company Truck Driver,J.S. Helwig & Son,Minimum age 25 years Valid commercial license Safe driving record meeting our minimum requirements One (1) year verifiable over the road experience in the past...
4,Civil Engineer EI (Entry Level),Banning Engineering,"BS in Civil or Agricultural Engineering is required. Located in Plainfield, Indiana, Banning Engineering is a Civil Engineering and Surveying firm that offers a..."
3,Data Management Support w/TS/SCI w/Polygraph,"TekStream Solutions, LLC","Performs a variety of general administrative tasks, such as preparing reports and correspondence, coordinating travel and meeting arrangements, answering phones..."
2,Loan Support Residential Mortgage Processor,The Fauquier Bank,"Specialty may be in one loan field, but this position cross-trains for Consumer, Commercial, and Commercial Real Estate processing...."
3,Senior Certified Security Analyst,Kforce,"Coordinate with applicable stakeholders to develop security event remediation strategies and timelines. Engineering, Math, or Science Degree...."
16,Technology Sales Associate,Staples,"All qualified applicants will receive consideration for employment without regard to race, color, religion, sex, national origin, protected veteran status,..."
22,Traffic Flagger - Warrenton VA,Flagger Force Traffic Control Services,"No experience is required, but you must have a valid driver’s license, reliable transportation and a cell phone...."
3,SQL Application Developer - IS Analyst,NewYork-Presbyterian/Columbia University Medical Center,"Advanced proficiency in programming languages (Visual Basic, C, C++, C#, Perl, Java), Applications (Healthcare IS, Allscripts SCM, Enterprise) and/or Database..."
15,Beauty Advisor,Stage Stores,Develop relationships with customers to insure future sales. Polite and courteous to customers and co-workers....
22,CDL-A OTR Solo and Team Truck Drivers - Owner Operators,Titan Transfer,"Titan Transfer is seeking professional Class A CDL truck drivers to join our team! At Titan Transfer, responsible, motivated professional truck drivers can have..."
11,"MEDICAL ASSISTANT CLINIC- INOVA Cardiology Warrenton, VA",Inova Fairfax Hospital,Answering calls and providing pertinent information. Fulfills clerical responsibilities as assigned which may include:....
3,Jr Systems Administrator,City of Rifle,"Systems Administrator, Full-time, 4 year degree required. This position will assists the Systems Administrator in the support of services provided to the user..."
13,Line Cook,Longhorn Steakhouse,"Work in a team-oriented, high-volume, fast-paced, guest-centric environment to deliver Genuine Western Hospitality to our guests by:...."
10,Health Technician,Department of Veterans Affairs,Assists the audiologist in various procedures of the program including:. Utilizes electro-acoustical diagnostic equipment to assess the electronic functioning...
3,IT Support Specialist,"Greystone & Co., Inc.",This role is responsible for answering incoming calls and monitoring incoming email for internal users in an IT help desk environment through a ticket tracking...
20,Aquatic Scientist/Customer Service Manager,"Virginia Waters and Wetlands, Inc.",Required license or certification:. Valid driver’s license required. Commercial Herbicide Applicator License – Category 5A preferred• Arborist certificate - a...
18,Park Officer,State of Ohio,Major Worker Characteristics:. Applicants can view the status of this position by logging into their user profile on the Ohio Hiring Management System [OHMS]...
23,Field Artillery Officer (13A),U.S. Army,Job training for a field artillery officer requires completion of Basic Officer Leaders Course I &amp II and the Field Artillery Officer Basic Course.…
17,Securities&Doc Admin,"Greystone & Co., Inc.",Our Securities and Document Management department is seeking a highly motivated individual that is capable of handling multiple tasks simultaneously to issue
22,"Traffic Control Specialist - Flagger - Warrenton, VA",Area Wide Protective,Must possess a valid driver's license and maintain an acceptable driving record by complying with standards established by AWP policy....
16,Sales/Customer Service,The Home Depot,"Requires listening for customer service calls, personal pages and general information announcements. Promote services offered at the Special Services Desk, Tool..."
10,"Optometrist needed in Fauquier County, VA",ETS Vision,Licensed in VA. Beautiful region less than an hour from the DC area- lower cost of living and far less traffic hassles....
13,Food Service Worker,TrustHouse Service Group,"Such as tray line, dish room, cafeteria and storeroom. The Food Service Worker is responsible for routine food service tasks in the kitchen, cafeteria, dining..."
5,Biologist,Department Of Agriculture,"Participates as a team member, while also training, mentoring, and setting work priorities for a fluctuating team of Biological Science Technicians, students,..."
13,Cook-Full-Time-Hours Evenings 12p-8p,Fauquier Health System,Ability to perform complex math calculations and verify cash handling and reporting. The Cook prepares food items needed for meal service using institutional...
18,Animal Agriculture Management Associate 2016,Cargill,"The Animal Agriculture Management Associate role enables the individual to become familiar with the workflow of animal agriculture operations, and to develop..."
22,Parts Specialist,Auto Plus Auto Parts,"Must maintain a clean and valid driver’s license in the state of operation. The candidate will complete cash balance sheets accurately, practice option and add..."
8,Teacher- Spanish (Part-Time),Fauquier County Public Schools,"Plans, coordinates, attends, and chaperones field trips as appropriate. Motivates students to develop an interest in and an appreciation of language (French and..."
7,Legal Assistant,"Warrenton, Virginia Law Firm","Case management and litigation support, preparation of trial exhibits; Drafting basic legal documents, cite checking and proofreading court pleadings...."
7,Law Clerk,Colorado Office of the State Court Administrator,"There is an immediate opening for a law clerk in the 19th Judicial District. Judicial Branch Overview. Responsibilities of this position include legal research,..."
1,University Gallery Events Manager,Rochester Institute of Technology,"Coordinate the University Gallery space for events and exhibits including the hours of operation, maintenance of University Gallery policies, supplies, and..."
17,Banking Services Representative - Bakersfield,Rabobank,Knowledgeable regarding all bank products. Assists with reception and vault/merchant attendant duties. Ability to comprehend and interpret Bank policies and...
22,Class A CDL Flatbed Company Truck Driver,Builders Transportation Company,EXPERIENCED FLATBED COMPANY TRUCK DRIVING JOBS AT BTC. A flatbed truck driver with 2 years of experience can start off making 50 CPM or 29% Freight Revenue and...
16,Sales Associate,Petco,This role also involves completing cash register transactions as well as providing customer carry-out service....
2,Fraud Risk Agent,Best Buy,Fraud Risk Agent. The Fraud Agent will support the efforts of BestBuy.com to provide timely service to our customers while controlling risk associated with...
16,Consultative Sales- Fine Jewelry,Stores - Sears Hourly,Maintaining knowledge of products and using this knowledge to assist and educate customers on options available
15,Barber,GoodBuddyz BarberShop,Chairs available for registered and apprentice barbers at 3-chain barbershop. Build your own clientele or bring your own....
8,Assistant Teaching Professor,Worcester Polytechnic Institute,"The Mathematical Sciences Department currently has 28 tenured/tenure-track faculty members, 9 postdoctoral scholars, 5 teaching professors and features a..."
13,Dishwasher and Busser,Jefferson Manor Health & Rehab,This is a full time dishwasher position in a nursing home facility. Prior experience preferred but not required....
16,Part-Time Teller - Northrock Shopping Center,Capital One,Live the company values of Excellence and Do the Right Thing - Act as a Customer Advocate - Take an active role in educating customers on other banking channel...
22,Railroad Openings- Now Hiring,JNI,*RAILROAD OPENINGS- NOW HIRING* *Trainees & Experience Welcome* *Call 205-536-7500 FOR IMMEDIATE ATTENTION* * Fireman/ Oiler – Forklift Operator…..$-23/HR *...
6,Counselor (K-8),Grambling State University,Teach school developmental guidance curriculum to students. Plan school guidance and counseling programs to ensure that they meet identified needs....
13,Banquet Chef/Line Cook,Golf Course North Houston,"Preferred Banquet experience but not required. All kitchen staff must be able to cook high-quality balanced meals, cook from scratch and maintain proper food..."
4,Production Technician,SERVPRO of Culpeper & Fauquier Counties,A valid driver's license with a clean driving record.. Develop production expertise:. Having a cell phone that can be reached at all times to respond to...
20,MAINTENANCE MECHANIC,United States Postal Service,"United States Postal Service External Publication for Job Posting 94976393 If this job requires qualification on an examination, the number of applicants who"
21,Shop Assembly and Fabrication,Western Window Systems,*Western Window Systems* is one of the fastest growing and most successful Window Manufacturing Companies in the nation. *Overview* The Warehouse Shop
10,Rehabilitation Technician,Blue Ridge Orthopaedic & Spine Center,"Blue Ridge Orthopaedic and Spine Center in Warrenton, VA, is looking for a FT Rehabilitation Specialist/ Physical Therapy Technician in our state of the art..."
1,Assistant Manager - Commissioned - Northrock Shopping Center,Jos. A Bank,Ensure all customer complaints are resolved immediately or as soon as possible if not remedied during store visit.Handle all Company assets according to...
1,District Executive,Boy Scouts of America,Achieve net income and participation objectives for assigned camps and activities. Bachelor's degree from an accredited college or university (transcript with...
13,Starbucks Clerk (11973),Safeway,The Company is an equal opportunity employer and is committed to compliance with its obligations under all applicable state and federal laws prohibiting...
2,Account Manager / Estimator,Five Star Painting - Manassas,Be available to answer any questions regarding the job while the project is in progress. Use the proper tools to estimate the job accurately....
22,AMBULANCE DRIVER,Catholic Health Initiatives,"Job Summary: Provides transportation for patients, visitors, employees and students. Essential Duties: Picks up and delivers patients, visitors, employees"
1,Advertising Project Manager,Innocean USA,The position requires a minimum of 5 years of well-rounded project management experience in advertising or a related business....
6,LCSW Child/Family,Kaiser Permanente,"Experience working with chidlren, adolescents and their families in individual, family, and group psychotherapy...."
16,Cashier,Stores - Kmart Hourly,"Responsible for providing excellent customer service, efficiently and accurately completing sales and service transactions at the cash wraps, as well as handle..."
10,Pharmacy Technician,CVS Health,Answer telephone with appropriate greeting. The Pharmacy Technician Trainee is a training position where you can move to a Pharmacy Technician upon successful...
15,Warrenton area CAREGiver,Home Instead Senior Care,"You must have your own vehicle and a valid driver's license as you will be responsible for driving clients to appointments, etc...."
21,Sewing Machine Operator,"DI, LLC","This individual will operate machines that are either single or double needle, perform blind stitch, serge, or other specialized operations...."
11,Massage Therapist/Chiropractic Assistant,Physicians Plus Spine and Rehab Center,Chiropractic office is seeking a full time massage therapist/chiropractic assistant. This position offers great opportunity for the right person....
6,Spiritual Counselor,UPMC,"Knowledge of spiritual effects of terminal illness, grief, and loss. The hospice spiritual counselor provides counseling and guidance to patients, families and..."
12,Surveillance Officer Full Time,Harrah's Ak-Chin,"The Surveillance Officer assures the overall safety of guests, employees and the property as a whole. Conducts surveillance observation on designated areas both..."
17,"Executive Administrator, Sr. (TS/SCI w/ Polygraph) Job",CACI International Inc,"Answers large volume of incoming phone calls, often from other senior leaders and customers; Ability to generate independent decisions and has excellent..."
9,Sports Broadcaster (Basketball),The College of St. Scholastica,"To serve as play-by-play announcers, analysts, and commentators at home basketball games streamed over the Internet...."
9,Head JV Boys Basketball Coach,Highland School,"A VISAA Division 2 Private High School, competing in the Delaney Athletic Conference (DAC). Lead the JV Boys Basketball Program at Highland School in Warrenton,..."
2,Business Development Representative,Insperity,"Promote entire product offerings to commercial real estate owners, owners reps, developers, architects, designers and general contractors throughout the..."
2,Small Business Specialist II,BB&T,"Possess an understanding of major technical aspects of small business underwriting, loan structure and deposits, and have a clear understanding of credit and..."
22,Experienced CDL-A OTR Truck Driver,Specialized Transportation Services Inc,OTR truck driving jobs at STS offer high miles &amp
1,Knight Transportion - Hiring Company Truck Drivers,Knight Transportation,We also pair each truck driver with a dedicated and caring driver manager who learns about your lifestyle and needs to help you find the trucking position that...
15,Hair Stylist,Sport Clips - VA114,"We're interviewing motivated, positive, reliable, upbeat stylists to help grow and be one of our winning team members...."
19,Painter/Blaster,CTR Group,"CTR is currently seeking 1st class Painters Location - Pascagoula, MS Industry - Marine Responsibilities: • Perform blasting and painting utilizing marine"
17,STORE CLERK - TEMPORARY,Dollar General,"This temporary position will be supporting new store openings, remodels and/or relocations of Dollar General stores by setting the store merchandise, organizing..."
15,Funeral Attendant,Service Corporation International,"The Funeral Attendant will set-up and assist with viewings, funeral services, memorial services, etc. Performs a variety of tasks during funerals and..."
16,Retail Floater,The Fauquier Bank,"Accepts deposits, loan payments, TT&amp;L Payments, VISA deposits and payments. Processes requests for cash advances, gift and travel cards, and transfer of funds.*..."
13,PT Market Associate,Food Lion,"Provide friendly, courteous and prompt customer service. Ability to complete Computer Based Training (CBT) and Training Aid courses...."
8,7th & 8th Grade Social Studies Long Term Substitute Teacher,Willamette Leadership Academy,"We are looking for a dynamic and passionate social studies teacher to teach two periods of 8th grade US History, 2 periods of 7th grade Intro to Western..."
2,Portfolio Administrator,"Greystone & Co., Inc.","Transfer incoming mortgage payments to various custodial accounts in compliance with agency requirements. We are seeking a Portfolio Operations Specialist, for..."
2,Claims Auditor,Broadpath,Medical Claims Auditors perform routine and complex audits to identify inaccurate claims adjudication. Knowledge of claims and the ability to recognize patterns...
21,Manufacturing Assembler,Manufacturing Supplier,Ideal candidates will have some mechanical aptitude for assembling plastic or metal parts by hand. Advantage Resourcing is currently seeking Manufacturing...
10,"Technician, Surgical Services-PRN",Fauquier Health System,Completed a formal Surgical Technician program with certification or equivalent training. The Surgical Services Technician assists with the total care given by...
20,Auto Glass Installer,Luther Automotive,"At least 1 year of mobile auto glass experience required. Install windshields in shop and mobile, perform rock chip repairs and pull and reinstall glass for the..."
10,Registered Dietitian,Blue Ridge Orthopaedic & Spine Center,"Assessing patient’s nutritional status and provide appropriate education and information in order to promote disease or condition control/prevention, provide..."
15,Dog Trainer / Apprentice,Petco,Our Dog Trainer Apprenticeship is a comprehensive training program to prepare you for the role of Dog Trainer in your store....
2,Business Operations Associate/Sr. Associate,Lending Club,"You’re both comfortable conversing with our front-line agents to truly understand how our operations work, as well as making a convincing case to our executive..."
22,Bus Driver,Fauquier County Public Schools,"Performs driving functions safely and efficiently in various weather conditions; Performs general maintenance tasks necessary to keep vehicles, equipment and..."
2,Earthwork Estimator/Project Manager,"Monomoy Services, Inc.",Ability to do earthwork analysis and pricing with some project management. Must have good communication and computer skills....
4,Agricultural Engineer,Department Of Agriculture,"Or equivalent doctoral degree in Agricultural Engineering, Biological Engineering, or Agricultural and Biological Engineering...."
22,Delivery Driver/Garbage Truck Driver,Waste Connections,In this position you will be delivering garbage and recycling container to commercial and residential customers in and around anchorage....
6,Juvenile Probation Officer - Court,Williamson County,Constant contact with juvenile offenders and their families. Performs complex social service work in interviewing and counseling....
9,Actor/Actress,Nine30 Media,"We are looking for actors to become a member of our marketing team. Our ideal candidates would have a strong portfolio, a heavy social media presence, and a..."
15,Dog Walker/Pet Sitter,Tina Pet Services,"You have to love animals, and feel comfortable around them.:. First impressions are important, so be sure to let your personality come through in your initial..."
18,Lead Fish Technician,Hubbs-SeaWorld Research Institute,Hatchery building is a damp environment. Stay current with latest technologies related to fish rearing. Assist in all other aspects of fish husbandry as needed....
15,Assistant Salon Manager,Hair Cuttery Salon,"BASIC REQUIREMENTS - MUST HAVE A COSMETOLOGY LICENSE in the state you are applying for, eligibility to work in the United States, 6+ months experience in a..."
16,Clerk\Cashier,CVS Health,"Answer the telephone using the appropriate greeting. Operate a cash register including cash transactions, checks, charges...."
13,Pizza Hut Server,Pizza Hut,"It’s about being independent and having fun, making new friends and earning extra cash. And independently-owned franchised or licensed locations may have..."
12,Police Officer,Lord Fairfax Community College,Applicants must be able to successfully qualify with the service weapon (initially and annually) and possess a valid Virginia driver's license with an...
15,Valet Attendant: PT & FT- Lisle, Downers Grove,"HealthPark ValetEnjoy working in a social environment? A leader in parking services, HealthPark Hospitality provides its healthcare partners comprehensive parking solutions"
2,Federal Business Development Representative,Insperity,"Develop strategic account business plans and own the sales cycle from lead generation to closure. Proactively identifies, locates and qualifies new business..."
13,Restaurant Shift Leaders - Bealton,"Five Guys Enterprises, LLC",Come join the Five Guys team!Five Guys is a family owned business that really cares about the growth and success of their employees....
11,Rehab Aide,Accelerated Rehabilitation Centers,Previous Clinical Aide experience preferred. The Rehabilitation Aide will assist the Office Coordinator and clinician by performing requested administrative and...
19,Heavy Equipment Operator,,"Must operate loaders, trucks, rollers, backhoes, mowers, graders, and other. Loads and unloads sand, dirt, asphalt, rock, and other materials as needed;..."
