job_field_id,title,company,description
17,Human Resources and Payroll Clerk,Tennessee Performing Arts Center,Reconcile monthly billing. Facilitate job posting as necessary. The Tennessee Performing Arts Center is looking for a full time HR/Payroll Clerk....
17,Banking Services Representative - Bakersfield,Rabobank,Knowledgeable regarding all bank products. Assists with reception and vault/merchant attendant duties. Ability to comprehend and interpret Bank policies and...
16,Customer Service Representative,We Insure Group,Our agents have access to over 100 Top Partner Companies and one of the best service and support personnel in the business....
13,Bar Manager/Bartender,Poplar Springs Inn and Spa,"Fantastic oppurtunity to progress within the company. To oversee, maintain and elevate the bar and lounge to the high end status it is to further heights...."
16,Customer Advisor Specialist,Petco,"Knowledge of the grooming salon program certification (Petco Promise, Pet Stylist Mentor Program, Canine Heritage Breed Test, Pet First Aid.)...."
11,School Nutrition Worker,Fauquier County Public Schools,"The omission of specific duties does not exclude them from the position if the work is similar, related, or a logical assignment to the position.)...."
22,Experienced CDL-A Company Truck Driver - Teams,Celadon Trucking Services,Must hold a valid CDL Class A license issued by the applicant’s state of residence. Team Driver Jobs are Available for Experienced Company Drivers and Owner...
1,Part time shift manager,Vocelli pizza,Must available to work two days a week 11am -10 pm. Answer phone calls and take orders and check out pick up customer. Help in the kitchen with the cook....
12,SHERIFF - DEPUTY SHERIFF,"Hidalgo County, TX","Serve as a bailiff in county and district courts. May be assigned to patrol, narcotics, civil process, warrants, courthouse security, criminal investigation or..."
