job_field_id,title,company,description
3,Junior Software Tester,"FEi Systems, Inc.","FEi Systems provides extensive IT services for multiple federal agencies and state governments in the areas of Medicare management, Health Information Exchanges..."
6,School Psychologist-Full Time-Warrenton Virginia-Upcoming School Year,ProCare Therapy,"School Psychologists will need to be able to work with and provide services including, but not limited to performing assessments and evaluations...."
8,Before & Aftercare Teacher,Children of America,Has experience with School Age and state credentials and MUST have the state required registry.*. This approach concentrates on allowing each child to learn...
2,Claim Specialist,CCMSI,The Claim Representative is accountable for the quality of claim services as perceived by CCMSI clients and within our corporate claim standards....
13,Full Time Saute Cook,Claire's at the Depot Restaurant,"Must be able to execute recipes with consistency and accuracy in a busy kitchen. Claire's at the Depot, a fine dining restaurant located in Old Town Warrenton..."
22,Hiring Company Truck Drivers,Transport America,Company Truck Driver Benefits:. Transport America's fleet of company truck drivers is the best and most experienced on the road....
6,Police Officer,Virginia Association of Chiefs of Police (VACP),"Applicants must be at least 21 years old, in good physical health, possess a high school diploma or G.E.D, valid Virginia driver’s license, and be able to deal..."
22,PT Produce Associate,Food Lion,"Ability to analyze situations, identify problems and implement solutions. Ability to complete Computer Based Training (CBT) and Training Aid courses...."
7,Legal Consultant,Softpath System LLC,Understanding and researching complex international legal and/or regulatory issues. Looking for an energetic and talented professional to join the International...
13,Catering Coordinator,Panera Bread Franchise (Blue Ridge Bread),Our bakery-cafes are focused on taking care of our guests. Must Have Own Vehicle. Perfect Driving Record. Please apply online and a Manager may be in touch if...
16,Counter Manager,Stage Stores,"Scheduling, inviting by telephone and cards, displays at counter and throughout exchange. Maintain standards for counter cleanliness...."
16,Sales Representative,Verizon,Analyze customer needs and present value-added solutions Inspire and excite customers about how our solutions can impact their lives Ensure that our customers...
4,ARCHITECT/ENGINEER EAS,United States Postal Service,"Knowledge of architecture, engineering, and building construction sufficient to review and inspect repair and alteration...."
14,Exterminator,University City Housing Company,University City Housing (UCH) is a Philadelphia-based property management company with significant real estate holdings in and around the Philadelphia
7,Legal Analyst,CP Homes,"The role of the Legal Analyst is to support, manage and administer the day-to-day functions of a corporate legal department...."
22,Experienced CDL-A Regional Truck Driver,Specialized Transportation Services Inc,Regional truck driving jobs at Specialized Transportation Services offer responsible CDL professionals predictable schedules without having to forfeit great pay...
12,Animal Control Officer,"City of Springfield, MO",Animal Control collaborates with many other community groups involved in animal welfare. Springfield Animal Control Officers enforce the ordinances of the city...
8,Toddler Teacher,Children of America,Has experience with two year olds and state credentials and MUST have the state required registry.*. This approach concentrates on allowing each child to learn...
22,Regional CDL-A Company Truck Driver - Mid-Atlantic Region,Celadon Trucking Services,Celadon has a variety of regional truck driving jobs for those who want consistent miles and pay paired with frequent home time....
9,Full Time Artist,Lisa Frank Inc,"When you were growing up, did all your school supplies HAVE to be Lisa Frank? Are you creative, energetic, and hardworking? This might be the job for you!"
9,Sports Broadcaster (Basketball),The College of St. Scholastica,"To serve as play-by-play announcers, analysts, and commentators at home basketball games streamed over the Internet...."
3,Mid-Level Cyber Security Consultant ( IRS Clearance),Seneca Resources,"Level Cyber Security Consultant to support Cyber Security Program based in Reston, VA. Knowledge of security principles, best practices, conducting security..."
14,"Custodian Part-Time (Warrenton, VA 20187)",Children of America,"Meets state age requirement. As a Leader is child care, Children of America's commitment is to provide a safe, and sanitary environment for all Children in our..."
18,Wood Mill Operator 2,The AMES Companies,"The Wood Mill Operator 2 works under supervision of foreman encompassing the skills of Equalizer, Paint Line Operator, Stacker and Inspector...."
12,BORDER PATROL AGENT,Department Of Homeland Security,Border Patrol Sectors. And pass the Border Patrol Agent Entrance Examination. Being a border patrol agent makes you a valuable member of the federal Law...
10,EXERCISE PHYSIOLOGIST,Duke University and Duke University Health System,Master's degree in Exercise Physiology or Exercise Science. Clinical oversight regarding exercise for all patients at all risk levels....
5,Physical Science Technician,Department Of Agriculture,The Functional Foods Research Unit creates new processing technologies to enhance the performance of agricultural materials in existing applications and...
15,Companion Care / Personal Care - Waukesha,"FirstLight Home Care, Brookfield, WI","Companion Care/ Home Health Aide*. In addition to providing a flexible schedule, we offer potential for advancement, award programs, and opportunity for..."
10,"Biometric Screener - Warrenton, VA",Provant,"Medical license or certification required. Provant Health Solutions hires individuals on a contract/per diem basis, provides excellent hourly wages, and further..."
13,Pizza Hut Restaurant General Manager,Pizza Hut,"And, you’re at least 18 years old with a valid driver’s license, reliable transportation (not public transportation – you may need to drive to make deposits for..."
11,Health Care Assistant or Bilingual Health Care Assitant - LVN,Hanford Elementary School District,HEALTH CARE ASSISTANT. Certified Nursing Assistant (C.N.A.). See Health Care Assistant Job Description. Addendum to Health Care Assistant Job Description....
9,Freelance Production Coordinator,"JPL Integrated Communications, Inc.","You will interact with talented Project Managers, Event Producers, Production Managers, Creative Directors, Graphic Artists, Editors, and so many others!..."
13,Restaurant Team Member,RubyTuesday,"Whether its part-time or an entire career, we want to make sure you get everything you want out of your Ruby Tuesday experience...."
11,CNA Assisted Living & Memory Support-PRN-Hours vary,Fauquier Health System,VA State Certified Nursing Assistant license. The Certified Nursing Assistant at our assisted living facility assists with patient care throughout nursing areas...
15,Beauty Advisor,Stage Stores,Develop relationships with customers to insure future sales. Polite and courteous to customers and co-workers....
19,Carpenter,Chicago Bridge & Iron Company,"Fits and nails sheathing on outer walls and roofs of buildings. Erects scaffolding for buildings and other structures and installs ladders, handrails, walkways,..."
10,Phlebotomist I or II-PRN,Fauquier Health System,6 months full-time equivalent general phlebotomy experience or Clinical internship including minimum of 100 venipunctures....
6,Resident Camp Counselor,Busch Gardens Tampa,Provide guidance to campers keeping them on task and behaving appropriately. Must be at least 21 years old in order to drive camp rental vehicles....
8,Adjunct Faculty-Communications,Lord Fairfax Community College,"Certain developmental or technical courses may be taught by instructors with a Bachelor's degree, a special certification, and/or work experience...."
23,Range Operations Specialist (PD D1134000),Department of the Army,"Officer, Not to Exceed O-3/ CPT, Warrant, Enlisted. Small arms, mortars and field artillery rockets or cannons...."
13,Bartender - Toms River Chili's,Chili's,"You know how to manage the back bar. Providing an enjoyable bar experience for every Guest. A duck walks into a bar and – oh, wait...."
22,CDL-A Company Truck Drivers,Mesilla Valley Transportation East,"Mesilla Valley Transportation, a 48-state motor carrier, is now hiring company truck driving teams for OTR, Shuttle and Super Local runs...."
1,"General Manager - Store 2705 - Warrenton, VA",Petco,"Responsible for handling cash counting, supervision of cashiers and cash register service to maximize customer service and minimize loss of assets...."
19,Heavy Equipment Operator,,"Must operate loaders, trucks, rollers, backhoes, mowers, graders, and other. Loads and unloads sand, dirt, asphalt, rock, and other materials as needed;..."
22,Class-A CDL Flatbed Company Truck Drivers,E. W. Wylie,"With annual earnings of up to $65K, consistent OTR miles that offer frequent home time, a generous sign-on bonus, a pay raise every 60K miles and more,..."
13,Part Time Starbucks Clerk Northrock Shopping Center,Harris Teeter,"Must be IST or AST certified. Exposed to hot, cool, and extreme cold, moving mechanical parts, fumes or airborne particles, and toxic or caustic chemicals...."
17,Supervisor,Stage Stores,Interrupt store tasks to assist and answer questions for customers in a pleasant and courteous manner. O Key in telephone number and e-mail address when...
2,Athletics Business Manager,University of Indianapolis,"Interpersonal skills to work with internal groups (coaches, students-athletes, faculty, and staff) as well as external groups (officials, bus and rental car..."
15,Valet Attendant: PT & FT- Lisle, Downers Grove,"HealthPark ValetEnjoy working in a social environment? A leader in parking services, HealthPark Hospitality provides its healthcare partners comprehensive parking solutions"
14,Stocking and Merchandising for Grocery Stores,Acosta Sales & Marketing,"This IS a part time position, but permanent. This is a heavy stocking position...."
9,TV Line Producer,zulily,"This will include partnering with various production companies to create new scripts, select footage and music and hire freela nce voice over artists...."
22,Hiring Company Drivers & Contracting Owner Operators,Prime Inc.,We are hiring Class A CDL Company Drivers and Contracting Owner Operators. Find the Lifestyle You're Looking for as a Prime Truck Driver....
22,Flight Attendant,Compass Airlines,Flight Attendant - LAX. One year previous flight attendant experience preferred The Flight Attendant will demonstrate the Compass Airlines' core values and…
17,Medical Office Asst VA,Novant Health,Graduate of an accredited medical assistant program preferred. The team member's number one job responsibility is to deliver the most remarkable patient...
16,Brand Ambassador Sales Part Time,Advantage Sales and Marketing,Participate in mandatory on-line training and conference calls (paid). Field of Study/Area of Experience:....
8,LANGUAGE ARTS TEACHER,Academy of Hope Adult PCS,"Bachelor's degree and secondary or adult education experience required. Teach a course load of at least 2 classes per day of adult literacy, basic education,..."
7,Legal Liaison,"Maricopa County, AZ",High School diploma or GED and two (2) years of clerical experience in a legal and/or law enforcement setting with knowledge in legal preparations and legal...
21,"Machine Operator-Remington, Virginia",U.S. Pipe,Must have at least one to three years of previous fabrication or manufacturing assembly or production work experience in a fast paced manufacturing or...
8,Assistant Teaching Professor,Worcester Polytechnic Institute,"The Mathematical Sciences Department currently has 28 tenured/tenure-track faculty members, 9 postdoctoral scholars, 5 teaching professors and features a..."
22,CDL-A OTR Solo and Team Truck Drivers - Owner Operators,Titan Transfer,"Titan Transfer is seeking professional Class A CDL truck drivers to join our team! At Titan Transfer, responsible, motivated professional truck drivers can have..."
2,Small Business Specialist II,BB&T,"Possess an understanding of major technical aspects of small business underwriting, loan structure and deposits, and have a clear understanding of credit and..."
6,Elementary Counselor 846 (2016-2017),"Kansas City, MO School District","The elementary counselor is a member of the district’s guidance function, charged with providing a comprehensive guidance program for students in grades K-6...."
13,Baker/Finisher,Dunkin' Donuts,Guest Focus – deliver high quality finished products for guest satisfaction. Ensure the safety and security of team and guests through a focus on food safety...
22,CDL-A Company Truck Drivers (OTR Reefer and Dry Van),J & R Schugel,"Must have valid Class A commercial driver’s license. When you sign on for J&amp;R Schugel company truck driving opportunities, you’ll see advantages like excellent..."
20,Chrysler Certified Automotive Technician,SAFFORD AUTOMOTIVE GROUP,"The technician must understand, stays abreast of, and comply with federal, state, and local regulations such as hazardous waste disposal, OSHA Right-to-Know,..."
22,Parts Specialist,Auto Plus Auto Parts,"Must maintain a clean and valid driver’s license in the state of operation. The candidate will complete cash balance sheets accurately, practice option and add..."
4,Production Technician,SERVPRO of Culpeper & Fauquier Counties,A valid driver's license with a clean driving record.. Develop production expertise:. Having a cell phone that can be reached at all times to respond to...
20,General Service Technician,Merchants Tire,"Valid Drivers License. Required license or certification:. Possession of a valid motor vehicle license. The General Service Technician also unloads, checks-in..."
22,Regional / OTR Class A CDL Truck Driver,Marten Transport,Then now is the time for experienced Class-A CDL truck drivers who want Regional and OTR runs to join Marten!...
17,Office Manager,Titan Restoration,"Responsibilities include but are not limited to managing the day to day functions of the office, prescreening and interviewing all applicants for office..."
13,PT Frozen Food/Dairy Associate,Food Lion,Provide total customer satisfaction. Ability to complete Computer Based Training (CBT) and Training Aid courses....
17,Office/Store Support,The Home Depot,"Facilitating the maintenance and repair of certain computer system related equipment such as cash registers, scanners, scan guns, monitors, signature capture..."
8,Librarian/Archivst - Part Time,Native Hawaiian Veterans,"Native Hawaiian Veterans, LLC is a Native Hawaiian Owned, Service Disabled Veterans Owned Small Business (SDVOSB), SDB, SBA 8(a), MBE, UDBE, and EEO/W/M/Vet"
10,"Technician, Surgical Services-PRN",Fauquier Health System,Completed a formal Surgical Technician program with certification or equivalent training. The Surgical Services Technician assists with the total care given by...
15,Pet Stylist (Dog Groomer) - Apprentice,Petco,"To receive technical training from Petco’s Professional Pet Stylist Program. We’re making things better for pets, people and the planet through our Think..."
17,Shift Leader,Dunkin' Donuts,Holds the guest as their highest priority and role models exceptional guest service. Acknowledges all guests with a friendly smile and is highly responsive to...
17,Night Auditor,Poplar Springs Inn & Spa,"Night Audit, Front Desk:. Poplar Springs Inn &amp; Spa is looking for a dedicated individual to perform the tasks and duties of a Night Auditor...."
16,AP Clerk,Sheehy Auto Stores,"All applicants must have the ability to pass pre-employment testing to include background checks, MVR, drug test, and valid driver's license...."
5,Animal Care Supervisor,University of Colorado,"Animal Facility, implementing the animal care procedures and policies. Care for a variety of species of small laboratory animals used by scientists...."
17,LPNs and RNs Needed!,WRB Communications,Active LPN/ RN license. Our LPN/ RN Communicators will take calls from consumers and health care providers and document product complaints or adverse events...
17,Operations,The Home Depot,"Requires listening for customer service calls, personal pages and general information announcements. May have to handle merchandise and work with tools with..."
15,Assistant Salon Manager,Hair Cuttery Salon,"BASIC REQUIREMENTS - MUST HAVE A COSMETOLOGY LICENSE in the state you are applying for, eligibility to work in the United States, 6+ months experience in a..."
1,Shift Supervisor,Rite Aid,"Accountable for store cash and other financial assets, reconciling cash register drawers, preparing deposits, and ordering changes from the bank as directed by..."
16,LEAD SALES ASSOC-PT,Dollar General,Operate cash register and flatbed scanner to itemize and total customer's purchase
11,Massage Therapist/Chiropractic Assistant,Physicians Plus Spine and Rehab Center,Chiropractic office is seeking a full time massage therapist/chiropractic assistant. This position offers great opportunity for the right person....
19,Project Manager - Residential & Commercial Painting,Five Star Painting - Manassas,"Experience in the painting industry, construction, or building maintenance industry with knowledge of paint and material application...."
22,Freight Broker,Sunbreak Logistics,Supply Chain / Freight Brokerage:. A new logistics company is looking for a motivated and experienced freight broker to join and to grow in a great team....
3,Information Sec Spec,"Greystone & Co., Inc.","IT related college degree, technical school degree, or Microsoft certification such as MCSE, MCITP, etc...."
13,PT Market Associate,Food Lion,"Provide friendly, courteous and prompt customer service. Ability to complete Computer Based Training (CBT) and Training Aid courses...."
12,Security Guard,Bannerman,"Bannerman is looking for professional security guards, and bouncers. Must be self disciplined with a high level of customer service and professionalism...."
13,Server Assistant / Busser /Food Runner,Royal Docks Brewing Company,"It’s a place where the welcome is a little warmer, the room is a little cozier, the barkeep is a little friendlier and the crowd is somehow a wee bit more..."
13,Experienced Culinary Professionals,The Orlean Market,Local Market/Restaurant is rapidly changing! We are in search of experienced and responsible culinary professionals who want to be a part of our unique and
14,Maintenance Worker II - PUBLIC WORKS,City of Port Orange,Clean grounds and remove litter. Experience in operating automotive or maintenance equipment. Provide routine and basic maintenance and repair to small...
9,Morning Show Host,"iHeartMedia, Inc.",Radio talk show host. 3+ years of on-air radio experience required. Serves as ambassador for the radio station(s) when out in public....
4,Field Service Engineer / PLC / Machinery / service,Randstad Engineering,"Provide technical support to customers and field technicians to install and maintain equipment. Provide telephone support for installation, troubleshooting, and..."
2,Account Manager / Estimator,Five Star Painting - Manassas,Be available to answer any questions regarding the job while the project is in progress. Use the proper tools to estimate the job accurately....
2,Marketing Internship Latin America,Cosmetics of France,Provide customer service to the agent zone in terms of material &amp information needed for events trough com. Consolidate and update the Local Makeup Experts &amp
12,Firefighter-2016,City of Mesquite,"Possession of or ability to obtain certification/licensing as an Arson Investigator and Peace Officer, as assigned...."
7,Attorney Advisor (General),Department of the Air Force,"Constitutional, civil, criminal, labor law; Provides SME authoritative advisory, consultation, and collaboration in the areas of ethics, medical and physical..."
17,Front Desk Agent,Poplar Springs Inn & Spa,"Customer Service, Hotel Front Desk:. Prior hotel experience is preferred. Poplar Springs Inn &amp; Spa is looking for a dedicated individual to fill the need of a..."
11,CNA-FHRNC-Full Time-Evenings,Fauquier Health System,Certified Nursing Assistant License. The Certified Nursing Assistant assists with patient care throughout nursing areas under the direction of licensed...
13,Food Service Worker,TrustHouse Service Group,"Such as tray line, dish room, cafeteria and storeroom. The Food Service Worker is responsible for routine food service tasks in the kitchen, cafeteria, dining..."
22,School Bus Driver -aftercare program,Lake Forest Park Montessori,"Part time aftercare/ bus driver:. If CDL required for vehicle driver, driver is subject to NLCI and state/federal policies, procedures and requirements..."
20,Heavy Equipment Shop Technician,Carter Machinery Company Inc,"Excellent driving record required. Strong mechanical aptitude and troubleshooting skills. This position is responsible for diagnosing problems, performing..."
20,Diesel Mechanic/Technician III – PART TIME (PB),Penske,"A valid driver’s license is required, and, must either possess a CDL or have the ability to obtain a CDL license required...."
18,FORESTRY TECHNICIAN (TIMBER STAND IMPROVEMENT),Department Of Agriculture,USDA Forest Service. Forest Service Day Care facilities are not available. A career with the Forest Service will challenge you to manage and care for more than...
17,SCHEDULING/REGISTRATION REPRESENTATIVE II,Inova Fairfax Hospital,"Medical terminology class; Bachelors Degree = 2 years). Obtains medical case information including diagnosis(es), ICD-9 and CPT codes, anesthesia type, ordering..."
20,"Automotive Body Repairer, Fiberglass/Welder",The Logistics Company,The Repairer applies and spreads body filler manually to reestablish surface. Two years related experience. The Automobile Body Repairer mixes polyester resin...
21,eCommerce Fulfillment Associate,Stage Stores,Willingness to consult multiple resources to obtain answers. Troubleshoot and problem solve when necessary....
3,IT Support Specialist,"Greystone & Co., Inc.",This role is responsible for answering incoming calls and monitoring incoming email for internal users in an IT help desk environment through a ticket tracking...
2,Entry Level Quality Assurance Analyst,National Software Management,"*Entry Level Quality Assurance Analyst* Under direct supervision, the Quality Assurance Analyst verifies that software changes submitted by developers"
20,Master Mechanic / Technician Auto Repair,YourMechanic,Excellent customer service skills. Complete set of basic automotive tools. Earn up to $55/hr as a mobile mechanic*....
16,Sales Assistant - Northrock Shopping Center,Jos. A Bank,"Properly and accurately operate and capture customer information, including e-mail addresses, in the point-of-sale register system.Comply with all procedures..."
16,Consultative Sales- Home Improvement,Stores - Sears Hourly,"Selling and servicing customers within one or more departments including Home Improvement, Lawn and Garden, Tools, Sporting Goods;..."
20,MAINTENANCE MECHANIC,United States Postal Service,"United States Postal Service External Publication for Job Posting 94976393 If this job requires qualification on an examination, the number of applicants who"
10,Cardiologist,U.S. Navy Reserve,*Cardiologist NEEDED* for part-time in Navy Reserve! Currently *1 position* open Nationwide! Your Benefits: * $75K Sign-on Bonus * All pay and allowances of
21,Electronic Assembly,NESC Staffing Corp,Soldering may be required for some positions.• Inspects own work on electronic assemblies to insure a quality product which conforms to workmanship standards...
5,Chemistry Technician - Life Sciences,Xylem,"Xylem’s analytics businesses are leading manufacturers of premium field, portable, laboratory and online analytical instruments used in water and wastewater,..."
8,Library Para Educator,Blue Valley School District,Attachment(s): job description Hourly Rate: $10.25 (PA/Col 3/01) Hours per Day: 7.5 (Monday - Friday) Days per Year: 200 (less than 12-month position)
19,Plumber,Los Angeles Unified School District,A Los Angeles City Journeyman Plumber License OR a Los Angeles County Certificate of Registration as a Journeyman Plumber....
22,Transportation Helper,United Airlines,"Now taking off: Your career Where do you want your career to take you? Chances are you can get there with United Airlines. Our environment is open, honest,..."
3,Intelligence Analyst / Sr. Intelligence Analyst with Security Clearance,"TekStream Solutions, LLC","Bachelor’s Degree in Computer Science or a related technical discipline or military discipline, or the equivalent combination of education, professional..."
17,Bookkeeping Clerk,John Q. Hammons Hotels & Resorts,"Must have 1-2 years in accounting , customer service and/or bookkeeping experience or equivalent. Perform any combination of routine calculating, posting, and..."
16,Clerk\Cashier,CVS Health,"Answer the telephone using the appropriate greeting. Operate a cash register including cash transactions, checks, charges...."
11,Physical Therapist or Physical Therapy Assistant,Accelerated Rehabilitation Centers,Athletico is looking for a dedicated and compassionate Physical Therapist Assistant to provide a hands-on approach to rehabilitation....
16,VA Assistant Store Manager,Family Dollar,"Assists Store Manager in ordering merchandise and record keeping to include payroll, scheduling and cash register deposits and receipts...."
16,Sales Associate,Lands' End,"Including courteously, conversationally greeting customers, adjusting individual customer attention based on store traffic, suggesting solutions based on..."
